name,datetime,tempmax,tempmin,temp,feelslikemax,feelslikemin,feelslike,dew,humidity,precip,precipprob,precipcover,preciptype,snow,snowdepth,windgust,windspeed,winddir,sealevelpressure,cloudcover,visibility,solarradiation,solarenergy,uvindex,severerisk,sunrise,sunset,moonphase,conditions,description,icon,stations
Heathrow Airport,01/01/2019,10.6,5.4,8.5,10.6,3.7,6.9,4.6,77.03,0.2,,4.17,,,,,18.4,222.9,1035.7,81.6,28.6,66.3,1.7,1,,2019-01-01T08:07:23,2019-01-01T16:03:18,0.91,"Rain, Partially cloudy",Partly cloudy throughout the day with late afternoon rain.,rain,"03660099999,03672099999,03768099999,03781099999,D4121,03772099999,03770099999"
Heathrow Airport,02/01/2019,6.3,3.8,5.1,4.7,1.9,3.4,0.4,71.83,0,,0,,,,,13,246.3,1043.1,92.4,21,52.4,1.3,1,,2019-01-02T08:07:17,2019-01-02T16:04:22,0.95,Overcast,Cloudy skies throughout the day.,cloudy,"03660099999,03672099999,03768099999,03781099999,D4121,03772099999,03770099999"
Heathrow Airport,03/01/2019,5.3,3.8,4.7,4.6,2.5,3.7,-1.2,65.73,0,,0,,,,,9.4,169.6,1043.2,99.4,32.1,52.2,1.1,1,,2019-01-03T08:07:07,2019-01-03T16:05:28,0.97,Overcast,Cloudy skies throughout the day.,cloudy,"03660099999,03672099999,03768099999,03781099999,D4121,03772099999,03770099999"
Heathrow Airport,04/01/2019,4.3,1.6,3,3.5,-0.7,1.4,-1.3,74,0,,0,,,,,11.2,204.9,1042.3,63.9,13.7,75.8,2.2,1,,2019-01-04T08:06:54,2019-01-04T16:06:37,0.99,Partially cloudy,Partly cloudy throughout the day.,partly-cloudy-day,"03660099999,03672099999,03768099999,03781099999,D4121,03772099999,03770099999"
Heathrow Airport,05/01/2019,5.3,2.8,4.4,3.8,0.6,2.2,0.8,77.73,0,,0,,,,,13,292.9,1039.1,99.9,16.4,26,0.6,1,,2019-01-05T08:06:37,2019-01-05T16:07:49,1,Overcast,Cloudy skies throughout the day.,cloudy,"03660099999,03672099999,03768099999,03781099999,D4121,03772099999,03770099999"
Heathrow Airport,06/01/2019,9.8,5,7.3,8.9,2.6,5.8,4.2,80.9,0,,0,,,,,13,286.3,1036.8,97,16.1,69.7,1.8,1,,2019-01-06T08:06:17,2019-01-06T16:09:03,0,Overcast,Cloudy skies throughout the day.,cloudy,"03660099999,03672099999,03768099999,03781099999,D4121,03772099999,03770099999"
Heathrow Airport,07/01/2019,11.1,6.6,9.3,11.1,5.2,8.1,6.6,83.65,0,,0,,,,46.4,29.5,256.7,1032.3,93.2,24.6,36.1,1,1,,2019-01-07T08:05:54,2019-01-07T16:10:20,0.01,Overcast,Cloudy skies throughout the day.,cloudy,"03660099999,03672099999,03768099999,03781099999,D4121,03772099999,03770099999"
Heathrow Airport,08/01/2019,9.1,3.3,6.9,6.7,1.3,4.1,2,71.22,0,,0,,,,48.2,22.3,309.2,1028.1,11.8,16.5,85.6,2.5,2,,2019-01-08T08:05:27,2019-01-08T16:11:38,0.03,Clear,Clear conditions throughout the day.,clear-day,"03660099999,03672099999,03768099999,03781099999,D4121,03772099999,03770099999"
Heathrow Airport,09/01/2019,5.8,2.2,3.9,3.1,-0.8,0.7,0.2,76.99,0,,0,,,,,20.5,339.6,1029.7,38,21.4,63.4,1.6,1,,2019-01-09T08:04:58,2019-01-09T16:12:59,0.05,Partially cloudy,Partly cloudy throughout the day.,partly-cloudy-day,"03660099999,03672099999,03768099999,03781099999,D4121,03772099999,03770099999"
Heathrow Airport,10/01/2019,6.1,0.6,3.1,4.5,-1.6,1,1.2,87.14,0,,0,,,,,11.2,297.5,1030.6,80.3,9.3,51.1,1.5,1,,2019-01-10T08:04:25,2019-01-10T16:14:22,0.08,Partially cloudy,Partly cloudy throughout the day.,partly-cloudy-day,"03660099999,03672099999,03768099999,03781099999,D4121,03772099999,03770099999"
Heathrow Airport,11/01/2019,8.5,6.1,7.2,7.2,4.5,5.6,4.6,83.58,0.99,,12.5,,,,,14.7,305.4,1030.2,85.8,13.2,73.5,2.1,1,,2019-01-11T08:03:49,2019-01-11T16:15:47,0.12,"Rain, Partially cloudy",Partly cloudy throughout the day with a chance of rain throughout the day.,rain,"03660099999,03672099999,03768099999,03781099999,D4121,03772099999,03770099999"
Heathrow Airport,12/01/2019,10.3,6.9,8.9,10.3,4.6,6.6,5.4,78.99,0,,0,,,,50,25.9,267.9,1023.2,92.4,39.3,34.1,1,1,,2019-01-12T08:03:10,2019-01-12T16:17:14,0.16,Overcast,Cloudy skies throughout the day.,cloudy,"03660099999,03672099999,03768099999,03781099999,D4121,03772099999,03770099999"
Heathrow Airport,13/01/2019,11.6,9.5,10.4,11.6,6.4,9.6,6.4,76.66,0.2,,4.17,,,,53.6,31.7,277.9,1014.4,89.1,34.4,63.4,1.8,1,,2019-01-13T08:02:28,2019-01-13T16:18:43,0.21,"Rain, Partially cloudy",Partly cloudy throughout the day with early morning rain.,rain,"03660099999,03672099999,03768099999,03781099999,D4121,03772099999,03770099999"
Heathrow Airport,14/01/2019,9.3,4.2,7.9,6.9,1.4,5.3,2.4,68.57,0,,0,,,,48.2,25.9,292.1,1020.3,71.5,21.6,63.6,2.1,1,,2019-01-14T08:01:43,2019-01-14T16:20:13,0.26,Partially cloudy,Partly cloudy throughout the day.,partly-cloudy-day,"03660099999,03672099999,03768099999,03781099999,D4121,03772099999,03770099999"
Heathrow Airport,15/01/2019,9.3,1.9,6.8,6.9,-2.1,3.9,4,82.38,0.2,,4.17,,,,,25.9,235.5,1019.4,73.6,35,58.3,1.7,1,,2019-01-15T08:00:55,2019-01-15T16:21:45,0.31,"Rain, Partially cloudy",Partly cloudy throughout the day with late afternoon rain.,rain,"03660099999,03672099999,03768099999,03781099999,D4121,03772099999,03770099999"
Heathrow Airport,16/01/2019,9.6,3.6,7.5,6.7,0.7,4.3,6.3,92.18,5.2,,12.5,,,,61.2,27.7,225.8,1005.9,78.3,22.5,25,0.7,0,,2019-01-16T08:00:04,2019-01-16T16:23:19,0.36,"Rain, Partially cloudy",Partly cloudy throughout the day with rain.,rain,"03660099999,03672099999,03768099999,03781099999,D4121,03772099999,03770099999"
Heathrow Airport,17/01/2019,5,0.3,3.2,2.3,-2.9,0.2,-0.8,76.42,0.4,,8.33,,,,46.4,18.4,291.3,1011.3,43.3,25.7,129,3.7,3,,2019-01-17T07:59:10,2019-01-17T16:24:54,0.41,"Rain, Partially cloudy",Clearing in the afternoon with rain in the morning and afternoon.,rain,"03660099999,03672099999,03768099999,03781099999,D4121,03772099999,03770099999"
Heathrow Airport,18/01/2019,7,-1.2,2.4,3.4,-3.1,-0.5,-1.6,75.94,0,,0,,,,44.6,25.8,155.5,1016.3,84,23.4,93,3,2,,2019-01-18T07:58:13,2019-01-18T16:26:31,0.45,Partially cloudy,Partly cloudy throughout the day.,partly-cloudy-day,"03660099999,03672099999,03768099999,03781099999,D4121,03772099999,03770099999"
Heathrow Airport,19/01/2019,5.3,2.2,4,2,-1.8,0.3,1.6,84.74,0.4,,8.33,,,,,24.1,121.7,1009.8,89.5,16.6,34.7,0.9,1,,2019-01-19T07:57:14,2019-01-19T16:28:09,0.48,"Rain, Partially cloudy",Partly cloudy throughout the day with rain in the morning and afternoon.,rain,"03660099999,03672099999,03768099999,03781099999,D4121,03772099999,03770099999"
Heathrow Airport,20/01/2019,5.6,-1.2,1.9,4,-3.7,0.5,-1.2,80.49,0,,0,,,,,9.4,125,1017.9,27.5,11.8,17.7,0.2,0,,2019-01-20T07:56:11,2019-01-20T16:29:48,0.5,Partially cloudy,Clearing in the afternoon.,partly-cloudy-day,"03660099999,03672099999,03768099999,03781099999,D4121,03772099999,03770099999"
Heathrow Airport,21/01/2019,5.3,-2,2,3.4,-4.2,0,-0.3,85.6,0.2,,4.17,,,,,22.3,217.2,1021.2,79.5,10.7,80.2,2.6,3,,2019-01-21T07:55:07,2019-01-21T16:31:29,0.5,"Rain, Partially cloudy",Partly cloudy throughout the day with afternoon rain.,rain,"03660099999,03672099999,03768099999,03781099999,D4121,03772099999,03770099999"
Heathrow Airport,22/01/2019,6.1,0.1,3,3,-2.9,0.2,1.3,88.96,9.4,,16.67,,,9,,22.3,241.6,1002.1,53.4,15.3,96.2,3.1,3,,2019-01-22T07:53:59,2019-01-22T16:33:10,0.52,"Rain, Partially cloudy",Becoming cloudy in the afternoon with a chance of rain throughout the day.,rain,"03660099999,03672099999,03768099999,03781099999,D4121,03772099999,03770099999"
Heathrow Airport,23/01/2019,3.1,-1,1,0.5,-3.3,-1.2,-0.6,89.48,4.99,,12.5,,,8,,14.8,323.6,1002.7,74.9,10.3,67.7,2.2,1,,2019-01-23T07:52:49,2019-01-23T16:34:53,0.54,"Rain, Partially cloudy",Partly cloudy throughout the day with rain.,rain,"03660099999,03672099999,03768099999,03781099999,D4121,03772099999,03770099999"
Heathrow Airport,24/01/2019,4.8,-2.4,1.3,4.6,-4.5,0.3,0.2,92.38,2.02,,8.33,,,4,,9.3,243.6,1011.7,87,7.2,38,1.1,1,,2019-01-24T07:51:37,2019-01-24T16:36:36,0.58,"Rain, Partially cloudy",Partly cloudy throughout the day with rain.,rain,"03660099999,03672099999,03768099999,03781099999,D4121,03772099999,03770099999"
Heathrow Airport,25/01/2019,11.8,3.3,7.3,11.8,0.7,5.7,5.7,90.17,0.8,,8.33,,,,,22.2,243.6,1014,66.3,14.6,9,0,0,,2019-01-25T07:50:22,2019-01-25T16:38:20,0.63,"Rain, Partially cloudy",Partly cloudy throughout the day with rain in the morning and afternoon.,rain,"03660099999,03672099999,03768099999,03781099999,D4121,03772099999,03770099999"
Heathrow Airport,26/01/2019,10.3,5.7,8.3,10.3,2.9,5.4,6.2,87.01,0.8,,8.33,,,,55.2,33.4,227.5,1002.5,77.1,29.4,99.1,2.9,2,,2019-01-26T07:49:04,2019-01-26T16:40:06,0.68,"Rain, Partially cloudy",Partly cloudy throughout the day with rain.,rain,"03660099999,03672099999,03768099999,03781099999,D4121,03772099999,03770099999"
Heathrow Airport,27/01/2019,8,3.5,5.8,4.5,-1.2,1.5,1.5,74.94,6.84,,12.5,,,,64.8,38.9,287.5,991.9,67.4,17.5,80,2.6,2,,2019-01-27T07:47:45,2019-01-27T16:41:51,0.73,"Rain, Partially cloudy",Partly cloudy throughout the day with a chance of rain throughout the day.,rain,"03660099999,03672099999,03768099999,03781099999,D4121,03772099999,03770099999"
Heathrow Airport,28/01/2019,6,-0.7,2.7,2.8,-4.8,-1,-3.1,66.38,0,,0,,,,37.1,24.2,297.1,1005.9,0.5,29.6,150.5,5.4,3,,2019-01-28T07:46:23,2019-01-28T16:43:38,0.79,Clear,Clear conditions throughout the day.,clear-day,"03660099999,03672099999,03768099999,03781099999,D4121,03772099999,03770099999"
Heathrow Airport,29/01/2019,6.1,-2.6,2,3.2,-4.8,-0.5,-0.8,82.36,0.52,,4.17,,,2,,20.5,198.8,999.9,78.2,23.4,108.5,3.1,2,,2019-01-29T07:44:58,2019-01-29T16:45:25,0.84,"Rain, Partially cloudy",Partly cloudy throughout the day with late afternoon rain.,rain,"03660099999,03672099999,03768099999,03781099999,D4121,03772099999,03770099999"
Heathrow Airport,30/01/2019,5.8,-1.7,1.4,2.8,-5.6,-1,-1,85.05,6.02,,8.33,,,1,,14.7,288.3,995.7,27.5,25.9,189,5.4,3,,2019-01-30T07:43:32,2019-01-30T16:47:13,0.88,"Rain, Partially cloudy",Partly cloudy throughout the day with rain.,rain,"03660099999,03672099999,03768099999,03781099999,D4121,03772099999,03770099999"
Heathrow Airport,31/01/2019,3.8,-4.4,-0.2,0.4,-6.1,-3,-2.3,86.99,0.8,,8.33,,,2,48.2,27.7,136.4,991.4,45.9,16.5,114,3.3,3,,2019-01-31T07:42:03,2019-01-31T16:49:01,0.92,"Snow, Partially cloudy",Becoming cloudy in the afternoon with rain.,snow,"03660099999,03672099999,03768099999,03781099999,D4121,03772099999,03770099999"
Heathrow Airport,01/02/2019,2.3,0.6,1.5,-0.8,-4.7,-3.1,0.5,93.18,9.65,,16.67,,,6,50,27.7,111.3,987.8,84.1,6.9,32.4,0.8,1,,2019-02-01T07:40:33,2019-02-01T16:50:49,0.95,"Rain, Partially cloudy",Partly cloudy throughout the day with a chance of rain throughout the day.,rain,"03660099999,03672099999,03768099999,03781099999,D4121,03772099999,03770099999"
Heathrow Airport,02/02/2019,4.8,0.6,2.5,1.1,-3.2,-1.1,-0.8,78.89,10.72,,16.67,,,5,37.1,20.5,332.9,1006.9,60.8,20.3,104.7,3.4,3,,2019-02-02T07:39:00,2019-02-02T16:52:38,0.98,"Rain, Partially cloudy",Partly cloudy throughout the day with a chance of rain throughout the day.,rain,"03660099999,03672099999,03768099999,03781099999,D4121,03772099999,03770099999"
Heathrow Airport,03/02/2019,6.6,-2.7,2.2,3.7,-5.1,-0.6,-1.7,76.62,0.2,,4.17,,,4,,22.3,242.9,1023,23.1,29,172.7,6.2,4,,2019-02-03T07:37:26,2019-02-03T16:54:27,1,"Rain, Partially cloudy",Partly cloudy throughout the day with early morning rain.,rain,"03660099999,03672099999,03768099999,03781099999,D4121,03772099999,03770099999"
Heathrow Airport,04/02/2019,9.5,5.6,7.4,8,1.5,4.6,6.2,91.92,4.82,,8.33,,,2,51.8,29.5,210.1,1018.5,79.1,14.2,35,1.3,1,,2019-02-04T07:35:49,2019-02-04T16:56:16,1,"Rain, Partially cloudy",Partly cloudy throughout the day with rain in the morning and afternoon.,rain,"03660099999,03672099999,03768099999,03781099999,D4121,03772099999,03770099999"
Heathrow Airport,05/02/2019,8.3,5.1,6.7,6.2,2.1,4.4,6,95.41,1.2,,16.67,,,,,24.1,174,1023.1,98.6,9.3,40.6,1.5,1,,2019-02-05T07:34:11,2019-02-05T16:58:06,0,"Rain, Overcast",Cloudy skies throughout the day with a chance of rain throughout the day.,rain,"03660099999,03672099999,03768099999,03781099999,D4121,03772099999,03770099999"
Heathrow Airport,06/02/2019,10.7,8.1,9.2,10.7,5.2,7.6,7.7,90.38,5.41,,12.5,,,,,18.3,197.1,1016.3,76.2,13.8,94.4,3.4,2,,2019-02-06T07:32:31,2019-02-06T16:59:56,0.01,"Rain, Partially cloudy",Partly cloudy throughout the day with a chance of rain throughout the day.,rain,"03660099999,03672099999,03768099999,03781099999,D4121,03772099999,03770099999"
Heathrow Airport,07/02/2019,9.6,6.5,7.8,6.5,0.9,3.8,3.6,74.84,4.39,,8.33,,,,70.5,48.2,232.1,1006.1,60.3,29.5,148,5.3,4,,2019-02-07T07:30:49,2019-02-07T17:01:46,0.03,"Rain, Partially cloudy",Partly cloudy throughout the day with rain.,rain,"03660099999,03672099999,03768099999,03781099999,D4121,03772099999,03770099999"
Heathrow Airport,08/02/2019,10.6,7.6,9.2,10.6,3.8,6.4,7.4,88.45,7.21,,12.5,,,,70.4,40.6,207.1,999.1,73,12.1,32,1.2,1,,2019-02-08T07:29:05,2019-02-08T17:03:36,0.06,"Rain, Partially cloudy",Partly cloudy throughout the day with rain.,rain,"03660099999,03672099999,03768099999,03781099999,D4121,03772099999,03770099999"
Heathrow Airport,09/02/2019,10.1,6.6,8.2,10.1,1.7,4.8,3.4,72.16,0.82,,8.33,,,,74.1,44.6,229.2,1000.4,43.9,19.1,147.3,5.3,4,,2019-02-09T07:27:20,2019-02-09T17:05:26,0.09,"Rain, Partially cloudy",Partly cloudy throughout the day with rain.,rain,"03660099999,03672099999,03768099999,03781099999,D4121,03772099999,03770099999"
Heathrow Airport,10/02/2019,7.8,4.1,5.9,4.4,-0.1,2.6,3.5,85.05,3.2,,12.5,,,,57.6,24.1,243.8,997.8,60.4,32.1,65.5,2.4,1,,2019-02-10T07:25:33,2019-02-10T17:07:16,0.13,"Rain, Partially cloudy",Partly cloudy throughout the day with a chance of rain throughout the day.,rain,"03660099999,03672099999,03768099999,03781099999,D4121,03772099999,03770099999"
Heathrow Airport,11/02/2019,8.8,2.3,5.8,8.3,0.2,4.1,1.8,76.34,0.2,,4.17,,,,,14.8,286.3,1023.4,47.6,32.8,169.4,6.1,4,,2019-02-11T07:23:45,2019-02-11T17:09:06,0.18,"Rain, Partially cloudy",Becoming cloudy in the afternoon with afternoon rain.,rain,"03660099999,03672099999,03768099999,03781099999,D4121,03772099999,03770099999"
Heathrow Airport,12/02/2019,11.1,2.3,6.7,11.1,0.2,5.1,3.9,82.99,0,,0,,,,33.5,24.1,228.1,1033.2,62.1,23.9,158.3,5.7,4,,2019-02-12T07:21:55,2019-02-12T17:10:55,0.23,Partially cloudy,Partly cloudy throughout the day.,partly-cloudy-day,"03660099999,03672099999,03768099999,03781099999,D4121,03772099999,03770099999"
Heathrow Airport,13/02/2019,12.1,5.1,7.8,12.1,2.6,5.9,5.4,85.82,0,,0,,,,,22.3,194.2,1033.1,49.3,14.8,159.2,5.7,3,,2019-02-13T07:20:04,2019-02-13T17:12:45,0.28,Partially cloudy,Partly cloudy throughout the day.,partly-cloudy-day,"03660099999,03672099999,03768099999,03781099999,D4121,03772099999,03770099999"
Heathrow Airport,14/02/2019,13.8,1.3,6.6,13.8,0.3,5.8,2.9,79.78,0.2,,4.17,,,,,14.7,126.8,1031.9,7.2,13.6,218.2,7.9,4,,2019-02-14T07:18:11,2019-02-14T17:14:35,0.33,Rain,Clear conditions throughout the day with afternoon rain.,rain,"03660099999,03672099999,03768099999,03781099999,D4121,03772099999,03770099999"
Heathrow Airport,15/02/2019,14.3,1.6,7.1,14.3,-0.7,6.2,3.1,78.08,0.2,,4.17,,,,,16.5,164.5,1027,0.1,12.4,221.3,8,4,,2019-02-15T07:16:17,2019-02-15T17:16:24,0.38,Rain,Clear conditions throughout the day with afternoon rain.,rain,"03660099999,03672099999,03768099999,03781099999,D4121,03772099999,03770099999"
Heathrow Airport,16/02/2019,11.8,3.6,8.7,11.8,1.7,7.8,7.6,92.79,0,,0,,,,,16.5,186.7,1022.7,72.8,6.6,51.6,1.3,1,,2019-02-16T07:14:21,2019-02-16T17:18:14,0.43,Partially cloudy,Partly cloudy throughout the day.,partly-cloudy-day,"03660099999,03672099999,03768099999,03781099999,D4121,03772099999,03770099999"
Heathrow Airport,17/02/2019,14.8,4.8,9.6,14.8,2.6,8.5,6.8,84,0.2,,4.17,,,,45.6,25.9,175,1016,39.2,12.1,222.7,8,4,,2019-02-17T07:12:25,2019-02-17T17:20:03,0.47,"Rain, Partially cloudy",Becoming cloudy in the afternoon with afternoon rain.,rain,"03660099999,03672099999,03768099999,03781099999,D4121,03772099999,03770099999"
Heathrow Airport,18/02/2019,9.8,5,8,8,1.7,5.5,6.6,90.33,4.13,,12.5,,,,,18.3,198.3,1015.4,66.6,19.4,46.4,1.7,1,,2019-02-18T07:10:27,2019-02-18T17:21:52,0.49,"Rain, Partially cloudy",Partly cloudy throughout the day with rain.,rain,"03660099999,03672099999,03768099999,03781099999,D4121,03772099999,03770099999"
Heathrow Airport,19/02/2019,11.1,2.8,7,11.1,-0.1,4.9,3.9,81.63,0.6,,12.5,,,,29.5,25.8,228.4,1018.6,40,19.1,193.1,7.6,5,,2019-02-19T07:08:28,2019-02-19T17:23:41,0.5,"Rain, Partially cloudy",Becoming cloudy in the afternoon with a chance of rain throughout the day.,rain,"03660099999,03672099999,03768099999,03781099999,D4121,03772099999,03770099999"
Heathrow Airport,20/02/2019,13,6.6,8.9,13,3.8,7.2,5.6,80.73,0,,0,,,,,27.7,203.8,1020,66.2,18.5,184.1,7.3,3,,2019-02-20T07:06:27,2019-02-20T17:25:30,0.51,Partially cloudy,Partly cloudy throughout the day.,partly-cloudy-day,"03660099999,03672099999,03768099999,03781099999,D4121,03772099999,03770099999"
Heathrow Airport,21/02/2019,14.9,6.6,10.3,14.9,4.8,9.2,7.5,83.32,0.2,,4.17,,,,,20.5,216.7,1026.4,45.1,15.4,248.9,8.1,5,,2019-02-21T07:04:26,2019-02-21T17:27:18,0.53,"Rain, Partially cloudy",Partly cloudy throughout the day with afternoon rain.,rain,"03660099999,03672099999,03768099999,03781099999,D4121,03772099999,03770099999"
Heathrow Airport,22/02/2019,15.2,6.1,9.3,15.2,4.6,8.5,6.5,84.45,0.2,,4.17,,,,,14.7,165.4,1034.5,32.2,11.9,198.4,6.4,4,,2019-02-22T07:02:24,2019-02-22T17:29:06,0.56,"Rain, Partially cloudy",Clearing in the afternoon with morning rain.,rain,"03660099999,03672099999,03768099999,03781099999,D4121,03772099999,03770099999"
Heathrow Airport,23/02/2019,16.4,6.3,10.1,16.4,4.4,9.4,6.9,82.47,0.2,,4.17,,,,,16.5,123.7,1033.8,26.8,8.1,237.4,8.5,4,,2019-02-23T07:00:20,2019-02-23T17:30:54,0.6,"Rain, Partially cloudy",Clearing in the afternoon with afternoon rain.,rain,"03660099999,03672099999,03768099999,03781099999,D4121,03772099999,03770099999"
Heathrow Airport,24/02/2019,16.4,3,8.8,16.4,2.1,8.6,3.8,73.97,0,,0,,,,,12.9,104.2,1035.5,5.9,10.4,244.4,10.6,5,,2019-02-24T06:58:16,2019-02-24T17:32:41,0.65,Clear,Clear conditions throughout the day.,clear-day,"03660099999,03672099999,03768099999,03781099999,D4121,03772099999,03770099999"
Heathrow Airport,25/02/2019,19.1,1.8,9.3,19.1,1.8,9.2,1.2,62.24,0,,0,,,,5.4,16.5,79.3,1036.2,0.1,12.3,243.8,10.5,5,,2019-02-25T06:56:11,2019-02-25T17:34:29,0.7,Clear,Clear conditions throughout the day.,clear-day,"03660099999,03672099999,03768099999,03781099999,D4121,03772099999,03770099999"
Heathrow Airport,26/02/2019,20,2.6,10.4,20,2,10.1,2.9,62.45,0,,0,,,,,12.9,130.5,1032.4,0,13.9,251.3,10.9,5,,2019-02-26T06:54:05,2019-02-26T17:36:16,0.76,Clear,Clear conditions throughout the day.,clear-day,"03660099999,03672099999,03768099999,03781099999,D4121,03772099999,03770099999"
Heathrow Airport,27/02/2019,18.8,2.5,10.2,18.8,2.5,10,5,73.01,0,,0,,,,,12.9,217.4,1024.8,0.4,8.4,251.8,10.9,5,,2019-02-27T06:51:58,2019-02-27T17:38:02,0.81,Clear,Clear conditions throughout the day.,clear-day,"03660099999,03672099999,03768099999,03781099999,D4121,03772099999,03770099999"
Heathrow Airport,28/02/2019,12.1,5.3,9.3,12.1,3.7,8.4,7.5,88.9,0.8,,8.33,,,,46.4,31.6,247,1015.9,69.1,12.9,80.7,3.5,2,,2019-02-28T06:49:50,2019-02-28T17:39:49,0.85,"Rain, Partially cloudy",Partly cloudy throughout the day with rain.,rain,"03660099999,03672099999,03768099999,03781099999,D4121,03772099999,03770099999"
Heathrow Airport,01/03/2019,11.1,8,9.6,11.1,5.7,8.3,6.5,81.33,0.2,,4.17,,,,,16.5,254.2,1018.1,80.8,10.9,69.4,3,2,,2019-03-01T06:47:41,2019-03-01T17:41:35,0.89,"Rain, Partially cloudy",Partly cloudy throughout the day with early morning rain.,rain,"03660099999,03672099999,03768099999,03781099999,D4121,03772099999,03770099999"
Heathrow Airport,02/03/2019,14.3,7.8,10.7,14.3,6.1,10,8.1,84.42,0.62,,8.33,,,,53.6,37,207.9,1010.1,78.8,16.5,154.5,6.1,4,,2019-03-02T06:45:32,2019-03-02T17:43:21,0.93,"Rain, Partially cloudy",Partly cloudy throughout the day with rain in the morning and afternoon.,rain,"03660099999,03672099999,03768099999,03781099999,D4121,03772099999,03770099999"
Heathrow Airport,03/03/2019,12.6,9,10.8,12.6,5.6,10,8.6,86.47,6.71,,16.67,,,,75.9,46.3,219.2,998.3,79.6,14,41.2,1.6,1,,2019-03-03T06:43:22,2019-03-03T17:45:06,0.96,"Rain, Partially cloudy",Partly cloudy throughout the day with a chance of rain throughout the day.,rain,"03660099999,03672099999,03768099999,03781099999,D4121,03772099999,03770099999"
Heathrow Airport,04/03/2019,10.5,4.1,6.7,10.5,0,3.3,3.1,78.46,4.82,,12.5,,,,64.7,37,255,994.4,58,33.5,171.5,7.4,4,,2019-03-04T06:41:11,2019-03-04T17:46:52,0.98,"Rain, Partially cloudy",Partly cloudy throughout the day with rain.,rain,"03660099999,03672099999,03768099999,03781099999,D4121,03772099999,03770099999"
Heathrow Airport,05/03/2019,12,3.1,7.7,12,-0.3,5.6,3.8,77.29,0.51,,8.33,,,,46.4,29.5,212.1,1002.4,47.5,32.5,229.5,9.1,5,,2019-03-05T06:39:00,2019-03-05T17:48:37,1,"Rain, Partially cloudy",Partly cloudy throughout the day with rain.,rain,"03660099999,03672099999,03768099999,03781099999,D4121,03772099999,03770099999"
Heathrow Airport,06/03/2019,12.3,8.7,10.5,12.3,5.6,9.1,8.3,86.48,10,,16.67,,,,50.1,33.4,184.6,989.7,85.3,15.3,74.2,2.9,1,,2019-03-06T06:36:48,2019-03-06T17:50:21,1,"Rain, Partially cloudy",Partly cloudy throughout the day with a chance of rain throughout the day.,rain,"03660099999,03672099999,03768099999,03781099999,D4121,03772099999,03770099999"
Heathrow Airport,07/03/2019,12.3,5.8,8.2,12.3,1.5,4.9,4,75.45,1.74,,12.5,,,,88.9,53.6,253.3,992.7,65,30.7,184.4,8,4,,2019-03-07T06:34:35,2019-03-07T17:52:06,0,"Rain, Partially cloudy",Partly cloudy throughout the day with rain.,rain,"03660099999,03672099999,03768099999,03781099999,D4121,03772099999,03770099999"
Heathrow Airport,08/03/2019,10.1,3.1,7.4,10.1,-0.6,4.5,4.2,80.98,0.61,,8.33,,,,50,33.4,242.1,1009.9,43.9,22.8,139.7,6,4,,2019-03-08T06:32:22,2019-03-08T17:53:50,0.02,"Rain, Partially cloudy",Becoming cloudy in the afternoon with rain.,rain,"03660099999,03672099999,03768099999,D4121,03772099999,03770099999"
Heathrow Airport,09/03/2019,13.1,6.8,9.4,13.1,4,7.5,3.8,70.49,0.81,,4.17,,,,74.1,42.5,252.5,1012.3,70,17.1,155.3,6.7,4,,2019-03-09T06:30:09,2019-03-09T17:55:34,0.04,"Rain, Partially cloudy",Partly cloudy throughout the day with early morning rain.,rain,"03660099999,03672099999,03768099999,D4121,03772099999,03770099999"
Heathrow Airport,10/03/2019,10.5,2.2,7.3,10.5,-2.6,4.1,2.6,75.27,8.42,,16.67,,,,87.1,59.3,227.5,1009.1,60.3,26.3,225.1,8.9,5,,2019-03-10T06:27:55,2019-03-10T17:57:18,0.07,"Rain, Partially cloudy",Partly cloudy throughout the day with a chance of rain throughout the day.,rain,"03660099999,03672099999,03768099999,D4121,03772099999,03770099999"
Heathrow Airport,11/03/2019,11,3.2,6.9,11,-2.5,3.5,-0.3,61.41,3.81,,8.33,,,,57.5,31.7,261.3,1022.9,37.1,29.8,267.8,11.6,5,,2019-03-11T06:25:41,2019-03-11T17:59:01,0.1,"Rain, Partially cloudy",Partly cloudy throughout the day with rain.,rain,"03660099999,03672099999,03768099999,D4121,03781099999,03772099999,03770099999"
Heathrow Airport,12/03/2019,9.1,4,7.1,5.5,-0.2,2.8,4.8,85.5,8.41,,12.5,,,,64.8,42.4,226.3,1007,63.4,17.1,43.7,1.7,1,,2019-03-12T06:23:26,2019-03-12T18:00:44,0.14,"Rain, Partially cloudy",Partly cloudy throughout the day with rain.,rain,"03660099999,03672099999,03768099999,03781099999,D4121,03772099999,03770099999"
Heathrow Airport,13/03/2019,11.3,5.6,8.6,11.3,0.3,5.3,2.1,64.48,0.2,,4.17,,,,66.6,40.7,266.7,1008,77.8,19.5,142.2,6.1,3,,2019-03-13T06:21:11,2019-03-13T18:02:27,0.2,"Rain, Partially cloudy",Partly cloudy throughout the day with early morning rain.,rain,"03660099999,03672099999,03781099999,D4121,03772099999,03770099999"
Heathrow Airport,14/03/2019,14.3,7.1,10.2,14.3,2.9,8.6,5.5,73.99,8.03,,12.5,,,,81.7,48.2,262.9,1006.1,74.5,20.9,207.3,9,6,,2019-03-14T06:18:56,2019-03-14T18:04:10,0.25,"Rain, Partially cloudy",Partly cloudy throughout the day with rain.,rain,"03660099999,03672099999,03781099999,03768099999,D4121,03772099999,03770099999"
Heathrow Airport,15/03/2019,14.1,9.1,12.1,14.1,6.5,11.9,9,81.86,5.12,,12.5,,,,77.7,48.2,255.4,1007.2,83.3,30.5,136.6,5.9,3,,2019-03-15T06:16:40,2019-03-15T18:05:53,0.31,"Rain, Partially cloudy",Partly cloudy throughout the day with rain.,rain,"03660099999,03672099999,03768099999,03781099999,D4121,03772099999,03770099999"
Heathrow Airport,16/03/2019,12.5,8.1,10.9,12.5,4.3,10.2,7.6,80.54,1.34,,8.7,,,,83.4,49.9,228.3,1002.4,89.9,17.5,92.5,3.7,2,,2019-03-16T06:14:24,2019-03-16T18:07:35,0.36,"Rain, Partially cloudy",Partly cloudy throughout the day with rain clearing later.,rain,"03660099999,03672099999,03768099999,03781099999,D4121,03772099999,03770099999"
Heathrow Airport,17/03/2019,9.8,4,6.6,6.3,0.4,2.9,2.4,75.73,6.2,,12.5,,,,68.2,35.3,269.2,1005.3,45.8,40.5,256,11.1,6,,2019-03-17T06:12:08,2019-03-17T18:09:17,0.41,"Rain, Partially cloudy",Partly cloudy throughout the day with rain.,rain,"03660099999,03672099999,03768099999,03781099999,D4121,03772099999,03770099999"
Heathrow Airport,18/03/2019,11.1,3.8,7.3,11.1,0.7,5.3,3.2,75.75,1.35,,4.17,,,,29.5,20.5,264.6,1020.5,72.4,30.6,179.8,8.4,4,,2019-03-18T06:09:52,2019-03-18T18:10:59,0.45,"Rain, Partially cloudy",Partly cloudy throughout the day with late afternoon rain.,rain,"03660099999,03672099999,03768099999,03781099999,D4121,03772099999,03770099999"
Heathrow Airport,19/03/2019,12.4,6.6,9.4,12.4,5,8.6,7.1,85.43,1,,12.5,,,,,16.6,226.7,1027.3,86.2,19.4,135,5.8,4,,2019-03-19T06:07:35,2019-03-19T18:12:41,0.48,"Rain, Partially cloudy",Partly cloudy throughout the day with a chance of rain throughout the day.,rain,"03660099999,03672099999,03768099999,03781099999,D4121,03772099999,03770099999"
Heathrow Airport,20/03/2019,12.8,8.7,10.7,12.8,6.6,10,7.8,82.44,0,,0,,,,,20.4,247.9,1032.3,97.3,35.2,88.7,3.8,2,,2019-03-20T06:05:18,2019-03-20T18:14:22,0.5,Overcast,Cloudy skies throughout the day.,cloudy,"03660099999,03672099999,03768099999,03781099999,D4121,03772099999,03770099999"
Heathrow Airport,21/03/2019,13.8,8.9,11.5,13.8,7.2,10.9,8.3,81.03,0,,0,,,,,14.7,260.9,1033,99,26.2,114.2,4.9,2,,2019-03-21T06:03:02,2019-03-21T18:16:04,0.5,Overcast,Cloudy skies throughout the day.,cloudy,"03660099999,03672099999,03768099999,03781099999,D4121,03772099999,03770099999"
Heathrow Airport,22/03/2019,11.1,8.9,10,11.1,6.5,9.1,6.8,80.75,0,,0,,,,,20.5,213.8,1028.8,94.9,21.3,58.7,2.5,1,,2019-03-22T06:00:45,2019-03-22T18:17:45,0.52,Overcast,Cloudy skies throughout the day.,cloudy,"03660099999,03672099999,03768099999,03781099999,D4121,03772099999,03770099999"
Heathrow Airport,23/03/2019,13.3,5.1,10,13.3,2.5,9.3,4.5,70.86,0.2,,4.17,,,,,14.8,126.7,1031.4,72.1,18.1,203.8,8.8,5,,2019-03-23T05:58:28,2019-03-23T18:19:26,0.54,"Rain, Partially cloudy",Partly cloudy throughout the day with afternoon rain.,rain,"03660099999,03672099999,03768099999,03781099999,D4121,03772099999,03770099999"
Heathrow Airport,24/03/2019,14.3,3.8,8.7,14.3,3.2,8.2,1.7,64.42,0,,0,,,,,22.3,247.8,1030.6,20,23.5,322.4,16.2,7,,2019-03-24T05:56:11,2019-03-24T18:21:08,0.58,Clear,Clearing in the afternoon.,clear-day,"03660099999,03672099999,03768099999,03781099999,D4121,03772099999,03770099999"
Heathrow Airport,25/03/2019,12.8,5.3,8.9,12.8,2.2,7.4,1.1,59.28,0.2,,4.17,,,,31.7,20.6,240.5,1031.8,21.2,24.1,363.4,18.3,8,,2019-03-25T05:53:54,2019-03-25T18:22:49,0.62,"Rain, Partially cloudy",Partly cloudy throughout the day with morning rain.,rain,"03660099999,03672099999,03768099999,03781099999,D4121,03772099999,03770099999"
Heathrow Airport,26/03/2019,13.3,2,7.9,13.3,-0.3,7.2,1.8,67.48,0,,0,,,,,15.7,297.6,1034.2,24.8,22.2,292.3,14.7,7,,2019-03-26T05:51:37,2019-03-26T18:24:29,0.67,Partially cloudy,Partly cloudy throughout the day.,partly-cloudy-day,"03660099999,03672099999,03768099999,03781099999,D4121,03772099999,03770099999"
Heathrow Airport,27/03/2019,13.3,4.8,9.4,13.3,3.8,9.1,2.8,64.13,0,,0,,,,,13,259.6,1035.2,71.2,31.9,177.6,9,5,,2019-03-27T05:49:21,2019-03-27T18:26:10,0.72,Partially cloudy,Partly cloudy throughout the day.,partly-cloudy-day,"03660099999,03672099999,03768099999,03781099999,D4121,03772099999,03770099999"
Heathrow Airport,28/03/2019,16.1,7.5,10.9,16.1,6.1,10.6,4,64.03,0,,0,,,,,14.7,207.1,1035.7,67,20,225.2,11.4,5,,2019-03-28T05:47:04,2019-03-28T18:27:51,0.77,Partially cloudy,Partly cloudy throughout the day.,partly-cloudy-day,"03660099999,03672099999,03768099999,03781099999,D4121,03772099999,03770099999"
Heathrow Airport,29/03/2019,17.5,3.3,10.9,17.5,2.1,10.6,3.9,64.18,0,,0,,,,,11.2,179.3,1029,0,15.1,338.9,17.1,7,,2019-03-29T05:44:47,2019-03-29T18:29:32,0.82,Clear,Clear conditions throughout the day.,clear-day,"03660099999,03672099999,03768099999,03781099999,D4121,03772099999,03770099999"
Heathrow Airport,30/03/2019,18,4.8,12.3,18,4.8,12.2,5.6,66.27,0,,0,,,,,13,204.7,1021.3,34.1,9.7,314,15.8,6,,2019-03-30T05:42:31,2019-03-30T18:31:12,0.86,Partially cloudy,Becoming cloudy in the afternoon.,partly-cloudy-day,"03660099999,03672099999,03768099999,03781099999,D4121,03772099999,03770099999"
Heathrow Airport,31/03/2019,12.8,6.1,9.7,12.8,3.2,8.1,4.3,69.77,0.4,,4.35,,,,42.5,24.1,59.1,1024.5,51.7,19.8,196.7,9.9,5,,2019-03-31T06:40:15,2019-03-31T19:32:53,0.9,"Rain, Partially cloudy",Partly cloudy throughout the day with afternoon rain.,rain,"03660099999,03672099999,03768099999,03781099999,D4121,03772099999,03770099999"
Heathrow Airport,01/04/2019,14.1,4,8.5,14.1,0.9,6.9,2.9,69.63,0,,0,,,,37.1,18.4,68.8,1020.4,21.3,22.9,350.2,17.7,7,,2019-04-01T06:37:59,2019-04-01T19:34:33,0.94,Partially cloudy,Partly cloudy throughout the day.,partly-cloudy-day,"03660099999,03672099999,03768099999,03781099999,D4121,03772099999,03770099999"
Heathrow Airport,02/04/2019,8.8,3.5,6,5.9,2.3,4,3.7,85.83,1.99,,4.17,,,,33.5,20.5,227.3,1004.9,47.6,26,115.4,5.8,3,,2019-04-02T06:35:43,2019-04-02T19:36:14,0.97,"Rain, Partially cloudy",Partly cloudy throughout the day with afternoon rain.,rain,"03660099999,03672099999,03768099999,03781099999,D4121,03772099999,03770099999"
Heathrow Airport,03/04/2019,10.5,1.1,4.6,10.5,0.9,3.4,0.9,79.14,2.59,,8.33,,,,,20.5,260.8,999,55.3,28.4,244.7,12.3,7,,2019-04-03T06:33:28,2019-04-03T19:37:54,0.99,"Rain, Partially cloudy",Partly cloudy throughout the day with rain.,rain,"03660099999,03672099999,03768099999,03781099999,D4121,03772099999,03770099999"
Heathrow Airport,04/04/2019,8.8,1.3,5.7,5.1,-2,2.1,2.3,79.85,7.2,,12.5,,,,55.4,35.2,139.6,995,70.8,34.5,165.1,8.3,3,,2019-04-04T06:31:13,2019-04-04T19:39:34,1,"Rain, Partially cloudy",Partly cloudy throughout the day with rain.,rain,"03660099999,03672099999,03768099999,03781099999,D4121,03772099999,03770099999"
Heathrow Airport,05/04/2019,13.6,5.9,9.5,13.6,2.4,7.8,2.6,63.76,1.09,,8.33,,,,46.4,27.7,118.3,1001.6,74.1,44.6,222.6,11.2,6,,2019-04-05T06:28:58,2019-04-05T19:41:15,0,"Rain, Partially cloudy",Partly cloudy throughout the day with rain.,rain,"03660099999,03672099999,03768099999,03781099999,D4121,03772099999,03770099999"
Heathrow Airport,06/04/2019,10.8,6.6,8.7,10.8,4.4,6.9,5.5,80.74,0.2,,4.17,,,,,18.4,54.2,1005.3,80.8,13.9,116.6,5.5,3,,2019-04-06T06:26:44,2019-04-06T19:42:55,0.01,"Rain, Partially cloudy",Partly cloudy throughout the day with late afternoon rain.,rain,"03660099999,03672099999,03768099999,03781099999,D4121,03772099999,03770099999"
Heathrow Airport,07/04/2019,11.5,6.2,9,11.5,4.4,7.9,7.1,88.17,0.2,,4.17,,,,,13,31.7,1008.1,77.1,4.5,87.5,4.4,2,,2019-04-07T06:24:30,2019-04-07T19:44:35,0.02,"Rain, Partially cloudy",Partly cloudy throughout the day with late afternoon rain.,rain,"03660099999,03672099999,03768099999,03781099999,D4121,03772099999,03770099999"
Heathrow Airport,08/04/2019,12.5,7.6,9.8,12.5,6.4,9.4,7.6,87.08,2.06,,12.5,,,,,7.6,182.1,1010.9,98.6,4.2,106.4,5.4,2,,2019-04-08T06:22:17,2019-04-08T19:46:16,0.05,"Rain, Overcast",Cloudy skies throughout the day with a chance of rain throughout the day.,rain,"03660099999,03672099999,03768099999,03781099999,D4121,03772099999,03770099999"
Heathrow Airport,09/04/2019,11.5,7,9.3,11.5,4.3,7.9,7,86.27,2.01,,12.5,,,,33.5,20.5,50.8,1013.9,89.1,8.8,61.1,3.1,2,,2019-04-09T06:20:04,2019-04-09T19:47:56,0.08,"Rain, Partially cloudy",Partly cloudy throughout the day with a chance of rain throughout the day.,rain,"03660099999,03672099999,03768099999,03781099999,D4121,03772099999,03770099999"
Heathrow Airport,10/04/2019,12.6,4.6,8.5,12.6,2,6.7,1.6,63.41,0,,0,,,,0,22.3,50.4,1019.4,38.8,30,397.1,20,7,,2019-04-10T06:17:51,2019-04-10T19:49:36,0.13,Partially cloudy,Clearing in the afternoon.,partly-cloudy-day,"03660099999,03672099999,03768099999,03781099999,D4121,03772099999,03770099999"
Heathrow Airport,11/04/2019,12.3,1.3,6.6,12.3,-0.7,5.2,-0.4,62.37,0,,0,,,,0,18.3,71.8,1025.7,5.5,34.2,402,20.3,7,,2019-04-11T06:15:39,2019-04-11T19:51:16,0.18,Clear,Clear conditions throughout the day.,clear-day,"03660099999,03672099999,03768099999,03781099999,D4121,03772099999,03770099999"
Heathrow Airport,12/04/2019,10.1,1.3,6.5,10.1,-0.8,5,-0.6,61.76,0,,0,,,,,18.4,60.8,1027,57,28,202.9,10.2,5,,2019-04-12T06:13:28,2019-04-12T19:52:57,0.23,Partially cloudy,Partly cloudy throughout the day.,partly-cloudy-day,"03660099999,03672099999,03768099999,03781099999,D4121,03772099999,03770099999"
Heathrow Airport,13/04/2019,9.3,1,5.4,7.6,-1.9,2.9,-0.3,67.78,0.71,,8.33,,,,37.1,20.5,64.2,1027.3,37.1,25.5,247.4,12.5,5,,2019-04-13T06:11:17,2019-04-13T19:54:37,0.29,"Rain, Partially cloudy",Partly cloudy throughout the day with rain.,rain,"03660099999,03672099999,03768099999,03781099999,D4121,03772099999,03770099999"
Heathrow Airport,14/04/2019,10.6,0.5,5.4,10.6,-1.2,3.2,-1.1,65.05,0.2,,4.17,,,,31.7,25.9,86.6,1025.5,34.2,24.4,266.5,13.4,5,,2019-04-14T06:09:07,2019-04-14T19:56:17,0.35,"Rain, Partially cloudy",Partly cloudy throughout the day with afternoon rain.,rain,"03660099999,03672099999,03768099999,03781099999,D4121,03772099999,03770099999"
Heathrow Airport,15/04/2019,14.6,4.5,9.1,14.6,1.6,7.6,2.2,64.13,0,,0,,,,50,31.7,95,1020.3,49,10.6,367.5,18.5,7,,2019-04-15T06:06:58,2019-04-15T19:57:57,0.4,Partially cloudy,Clearing in the afternoon.,wind,"03660099999,03672099999,03768099999,03781099999,D4121,03772099999,03770099999"
Heathrow Airport,16/04/2019,16,6.8,10.9,16,5.8,10.7,6.8,76.12,4.85,,4.17,,,,,18.2,172.5,1015.1,87,5.3,152.7,8.2,3,,2019-04-16T06:04:49,2019-04-16T19:59:37,0.44,"Rain, Partially cloudy",Partly cloudy throughout the day with late afternoon rain.,rain,"03660099999,03672099999,03768099999,03781099999,D4121,03772099999,03770099999"
Heathrow Airport,17/04/2019,18.8,7,12.5,18.8,5.2,12.2,7.1,72.06,0,,0,,,,0,20.5,134.4,1019.3,28.5,6.4,313.5,16.9,6,,2019-04-17T06:02:41,2019-04-17T20:01:18,0.47,Partially cloudy,Partly cloudy throughout the day.,partly-cloudy-day,"03660099999,03672099999,03768099999,03781099999,D4121,03772099999,03770099999"
Heathrow Airport,18/04/2019,21.8,8,14.3,21.8,6.4,14,7.3,66.55,0,,0,,,,0,27.7,72.1,1023.1,21.1,9.5,334.3,18.1,7,,2019-04-18T06:00:34,2019-04-18T20:02:58,0.49,Partially cloudy,Partly cloudy throughout the day.,partly-cloudy-day,"03660099999,03672099999,03768099999,03781099999,D4121,03772099999,03770099999"
Heathrow Airport,19/04/2019,23.8,8.8,16,23.8,7.8,15.9,5.6,52.73,0,,0,,,,13,18.3,67.3,1028,0.3,17.9,385,20.8,7,,2019-04-19T05:58:28,2019-04-19T20:04:38,0.5,Clear,Clear conditions throughout the day.,clear-day,"03660099999,03672099999,03768099999,03781099999,D4121,03772099999,03770099999"
Heathrow Airport,20/04/2019,24.3,8.6,16.6,24.3,8.6,16.6,6,53.25,0,,0,,,,31.7,20.4,73.8,1029.6,0.1,19.2,405.3,21.9,8,,2019-04-20T05:56:22,2019-04-20T20:06:18,0.51,Clear,Clear conditions throughout the day.,clear-day,"03660099999,03672099999,03768099999,03781099999,D4121,03772099999,03770099999"
Heathrow Airport,21/04/2019,23.8,8,15.9,23.8,8,15.8,4.6,50.58,0,,0,,,,,22.3,126.3,1020.5,0,17.1,406.1,21.9,8,,2019-04-21T05:54:18,2019-04-21T20:07:58,0.53,Clear,Clear conditions throughout the day.,clear-day,"03660099999,03672099999,03768099999,03781099999,D4121,03772099999,03770099999"
Heathrow Airport,22/04/2019,24.6,8.6,16.5,24.6,7.5,16.4,5.2,48.82,0,,0,,,,,24.1,85.8,1006.4,40,18.4,354.2,19.1,7,,2019-04-22T05:52:14,2019-04-22T20:09:37,0.56,Partially cloudy,Partly cloudy throughout the day.,partly-cloudy-day,"03660099999,03672099999,03768099999,03781099999,D4121,03772099999,03770099999"
Heathrow Airport,23/04/2019,21.5,12.8,16.2,21.5,12.8,16.1,7.4,56.81,0,,0,,,,33.5,16.6,67.5,997.4,54.3,19.1,239.1,12.1,5,,2019-04-23T05:50:11,2019-04-23T20:11:17,0.6,Partially cloudy,Partly cloudy throughout the day.,partly-cloudy-day,"03660099999,03672099999,03768099999,03781099999,D4121,03772099999,03770099999"
Heathrow Airport,24/04/2019,17.4,9.6,13.4,17.4,9.6,13.4,8.2,71.29,0.6,,4.17,,,,48.3,31.6,131.8,994,83.2,27.2,202.6,8.8,5,,2019-04-24T05:48:10,2019-04-24T20:12:57,0.64,"Rain, Partially cloudy",Partly cloudy throughout the day with afternoon rain.,rain,"03660099999,03672099999,03768099999,03781099999,D4121,03772099999,03770099999"
Heathrow Airport,25/04/2019,16.6,8.5,12.2,16.6,7.4,12,6.5,69.58,0.5,,8.33,,,,51,31.6,160.8,999,48.4,49.3,310.9,15.7,9,,2019-04-25T05:46:09,2019-04-25T20:14:36,0.69,"Rain, Partially cloudy",Partly cloudy throughout the day with rain in the morning and afternoon.,rain,"03660099999,03672099999,03768099999,03781099999,D4121,03772099999,03770099999"
Heathrow Airport,26/04/2019,16.3,6,11,16.3,4.9,10.4,6.7,76.23,0.2,,4.17,,,,50,29.5,189.2,1008.9,46.3,33.4,211.1,11.4,5,,2019-04-26T05:44:10,2019-04-26T20:16:16,0.73,"Rain, Partially cloudy",Partly cloudy throughout the day with late afternoon rain.,rain,"03660099999,03672099999,03768099999,03781099999,D4121,03772099999,03770099999"
Heathrow Airport,27/04/2019,13,7.6,10,13,2.9,7.8,3.2,64.17,0.6,,8.33,,,,76,50,247.9,1009.5,77.4,35.1,162.8,8.8,3,,2019-04-27T05:42:11,2019-04-27T20:17:55,0.78,"Rain, Partially cloudy",Partly cloudy throughout the day with rain.,rain,"03660099999,03672099999,03768099999,03781099999,D4121,03772099999,03770099999"
Heathrow Airport,28/04/2019,14.1,7.4,10.7,14.1,3.8,9.4,3.8,62.73,0.6,,8.33,,,,49.4,24.1,270.5,1019.7,88.6,42.8,231.3,12.5,6,,2019-04-28T05:40:14,2019-04-28T20:19:34,0.83,"Rain, Partially cloudy",Partly cloudy throughout the day with rain clearing later.,rain,"03660099999,03672099999,03768099999,03781099999,D4121,03772099999,03770099999"
Heathrow Airport,29/04/2019,15.3,5.5,10.7,15.3,3.5,10.3,5.5,71.96,0,,0,,,,27.7,14.7,71.7,1025.8,80.3,24.8,235.7,12.7,5,,2019-04-29T05:38:18,2019-04-29T20:21:12,0.87,Partially cloudy,Partly cloudy throughout the day.,partly-cloudy-day,"03660099999,03672099999,03768099999,03781099999,D4121,03772099999,03770099999"
Heathrow Airport,30/04/2019,17.6,6.1,12.1,17.6,4.6,11.6,6.1,69.95,0,,0,,,,,20.4,99.2,1024.5,42.9,19.6,435.9,23.5,10,,2019-04-30T05:36:23,2019-04-30T20:22:51,0.91,Partially cloudy,Partly cloudy throughout the day.,partly-cloudy-day,"03660099999,03672099999,03768099999,03781099999,D4121,03772099999,03770099999"
Heathrow Airport,01/05/2019,18.5,6.6,12.3,18.5,6.4,11.9,6.8,71.6,0,,0,,,,27.7,16.6,247.3,1018.5,69.1,22,278.3,15,6,,2019-05-01T05:34:30,2019-05-01T20:24:29,0.95,Partially cloudy,Partly cloudy throughout the day.,partly-cloudy-day,"03660099999,03672099999,03768099999,03781099999,D4121,03772099999,03770099999"
Heathrow Airport,02/05/2019,15.8,9,12,15.8,7.8,11.8,7.3,74.64,1,,4.17,,,,0,20.5,290.7,1014.3,55.1,39,240.5,13,6,,2019-05-02T05:32:37,2019-05-02T20:26:07,0.97,"Rain, Partially cloudy",Partly cloudy throughout the day with late afternoon rain.,rain,"03660099999,03672099999,03768099999,03781099999,D4121,03772099999,03770099999"
Heathrow Airport,03/05/2019,15,7.1,9.9,15,4.2,9.2,7.1,83.94,2.05,,8.33,,,,,18.4,243.4,1014.7,74.2,24.1,157.5,8.5,4,,2019-05-03T05:30:47,2019-05-03T20:27:45,0.99,"Rain, Partially cloudy",Partly cloudy throughout the day with rain.,rain,"03660099999,03672099999,03768099999,03781099999,D4121,03772099999,03770099999"
Heathrow Airport,04/05/2019,10.6,5.3,7.7,10.6,1.7,5.6,1.2,64.65,0.61,,12.5,,,,55.1,27.7,182.5,1019.2,53.3,39,372.2,21.4,9,,2019-05-04T05:28:57,2019-05-04T20:29:22,1,"Rain, Partially cloudy",Partly cloudy throughout the day with rain.,rain,"03660099999,03672099999,03768099999,03781099999,D4121,03772099999,03770099999"
Heathrow Airport,05/05/2019,11.3,2.6,8.1,11.3,0.5,7,0.3,60.53,0.8,,4.17,,,,,14.8,301.3,1025.8,62.8,34,248.7,14.3,6,,2019-05-05T05:27:10,2019-05-05T20:30:59,0,"Rain, Partially cloudy",Partly cloudy throughout the day with early morning rain.,rain,"03660099999,03672099999,03768099999,03781099999,D4121,03772099999,03770099999"
Heathrow Airport,06/05/2019,11.6,5.8,9.5,11.6,3.8,8.8,0.8,55.5,0,,0,,,,,16.6,277.1,1022.1,92.4,53.4,203,11,4,,2019-05-06T05:25:23,2019-05-06T20:32:35,0.01,Overcast,Cloudy skies throughout the day.,cloudy,"03660099999,03672099999,03768099999,03781099999,D4121,03772099999,03770099999"
Heathrow Airport,07/05/2019,16.3,6.1,11.3,16.3,5.2,10.8,2.9,58.22,0,,0,,,,,20.5,193,1014.5,84.1,38.2,266.3,15.3,7,,2019-05-07T05:23:39,2019-05-07T20:34:11,0.04,Partially cloudy,Partly cloudy throughout the day.,partly-cloudy-day,"03660099999,03672099999,03768099999,03781099999,D4121,03772099999,03770099999"
Heathrow Airport,08/05/2019,14,8.3,10.7,14,5.3,9.9,7.9,83.98,18.38,,12.5,,,,61.1,38.8,179.1,994.8,73,14.5,163.5,8.8,6,,2019-05-08T05:21:55,2019-05-08T20:35:47,0.07,"Rain, Partially cloudy",Partly cloudy throughout the day with rain.,rain,"03660099999,03672099999,03768099999,03781099999,D4121,03772099999,03770099999"
Heathrow Airport,09/05/2019,14,6.9,10.4,14,6,10.2,8.6,89.25,7.46,,16.67,,,,0,18.4,250.2,997.1,59.3,16.8,158.9,9.2,3,,2019-05-09T05:20:14,2019-05-09T20:37:21,0.11,"Rain, Partially cloudy",Partly cloudy throughout the day with a chance of rain throughout the day.,rain,"03660099999,03672099999,03768099999,03781099999,D4121,03772099999,03770099999"
Heathrow Airport,10/05/2019,15.2,5.1,10.6,15.2,5.1,10.2,6.5,78.63,3.98,,8.33,,,,,12.9,224.3,1008.6,60.4,27.8,272.8,15.7,8,,2019-05-10T05:18:34,2019-05-10T20:38:56,0.16,"Rain, Partially cloudy",Partly cloudy throughout the day with rain.,rain,"03660099999,03672099999,03768099999,03781099999,D4121,03772099999,03770099999"
Heathrow Airport,11/05/2019,16,8.3,11.6,16,7.5,11.4,6.5,73.44,3.71,,8.33,,,,,16.6,253,1019.1,65.8,27.2,269.1,15.5,6,,2019-05-11T05:16:56,2019-05-11T20:40:29,0.22,"Rain, Partially cloudy",Partly cloudy throughout the day with rain.,rain,"03660099999,03672099999,03768099999,D4121,03772099999,03770099999"
Heathrow Airport,12/05/2019,17.3,5.1,11.4,17.3,4.1,11,4,65.1,2.19,,8.33,,,,,22.3,139.2,1035.5,18.3,42.1,343.7,19.8,6,,2019-05-12T05:15:20,2019-05-12T20:42:02,0.28,Rain,Clear conditions throughout the day with rain.,rain,"03660099999,03672099999,03768099999,D4121,03772099999,03770099999"
Heathrow Airport,13/05/2019,17.3,5.3,11.8,17.3,4.9,11.6,2.9,57.53,0,,0,,,,33.5,22.3,90.1,1039.4,0.3,50.3,459.4,26.5,8,,2019-05-13T05:13:46,2019-05-13T20:43:34,0.33,Clear,Clear conditions throughout the day.,clear-day,"03660099999,03672099999,03768099999,D4121,03772099999,03770099999"
Heathrow Airport,14/05/2019,18.3,6.8,13.2,18.3,6,12.9,3.7,55.37,0,,0,,,,35.3,24.1,70.4,1034.1,0.6,47,456,26.3,8,,2019-05-14T05:12:13,2019-05-14T20:45:05,0.39,Clear,Clear conditions throughout the day.,clear-day,"03660099999,03672099999,03768099999,D4121,03781099999,03772099999,03770099999"
Heathrow Airport,15/05/2019,20.1,7.1,13.7,20.1,5.8,13.3,5.2,59.16,0,,0,,,,0,22.3,73,1026.6,1.2,27.4,432.1,24.9,8,,2019-05-15T05:10:43,2019-05-15T20:46:36,0.43,Clear,Clear conditions throughout the day.,clear-day,"03660099999,03672099999,03768099999,03781099999,D4121,03772099999,03770099999"
Heathrow Airport,16/05/2019,18.1,7.6,13.2,18.1,6,12.7,4,57.04,0,,0,,,,46.4,22.3,63,1019.2,19.7,35.1,352.1,13.9,7,,2019-05-16T05:09:14,2019-05-16T20:48:05,0.46,Clear,Clear conditions throughout the day.,clear-day,"03660099999,03672099999,03768099999,03781099999,D4121,03772099999,03770099999"
Heathrow Airport,17/05/2019,14.6,8.6,11.8,14.6,7.4,11.4,8,78.18,0.4,,4.17,,,,,16.6,36.3,1009.4,78.7,24.3,87.2,4.7,3,,2019-05-17T05:07:48,2019-05-17T20:49:34,0.49,"Rain, Partially cloudy",Partly cloudy throughout the day with late afternoon rain.,rain,"03660099999,03672099999,03768099999,03781099999,D4121,03772099999,03770099999"
Heathrow Airport,18/05/2019,16.8,9.8,13.5,16.8,9.8,13.4,8.8,74.69,9.74,,12.5,,,,,12.9,159.3,1006.7,82,22,199.4,11.5,6,,2019-05-18T05:06:24,2019-05-18T20:51:01,0.5,"Rain, Partially cloudy",Partly cloudy throughout the day with rain.,rain,"03660099999,03672099999,03768099999,03781099999,D4121,03772099999,03770099999"
Heathrow Airport,19/05/2019,18,8.1,13.8,18,8.1,13.7,9.1,75.05,0.2,,4.17,,,,,11.2,175.4,1009.6,71.2,18.8,135.9,7.8,3,,2019-05-19T05:05:02,2019-05-19T20:52:28,0.5,"Rain, Partially cloudy",Partly cloudy throughout the day with late afternoon rain.,rain,"03660099999,03672099999,03768099999,03781099999,D4121,03772099999,03770099999"
Heathrow Airport,20/05/2019,19.8,12.5,15.8,19.8,12.5,15.8,9,65.62,3.2,,8.33,,,,0,12.9,278.8,1012.5,79.9,30.2,217.8,12.5,6,,2019-05-20T05:03:42,2019-05-20T20:53:53,0.52,"Rain, Partially cloudy",Partly cloudy throughout the day with rain.,rain,"03660099999,03672099999,03768099999,03781099999,D4121,03772099999,03770099999"
Heathrow Airport,21/05/2019,20.3,9.8,15.6,20.3,9.8,15.6,6.3,56.33,0,,0,,,,0.3,0.2,333.4,1018,12.1,43.6,420.2,25.7,8,,2019-05-21T05:02:24,2019-05-21T20:55:17,0.54,Clear,Clear conditions throughout the day.,clear-day,"03660099999,03672099999,03768099999,03781099999,D4121,03772099999,03770099999"
Heathrow Airport,22/05/2019,20.8,10.3,15.9,20.8,10.3,15.9,4.7,48.28,0,,0,,,,22.3,20.4,253.9,1019.7,52.9,58.6,325.1,19.9,7,,2019-05-22T05:01:09,2019-05-22T20:56:40,0.57,Partially cloudy,Partly cloudy throughout the day.,partly-cloudy-day,"03660099999,03672099999,03768099999,03781099999,D4121,03772099999,03770099999"
Heathrow Airport,23/05/2019,24.6,9.3,17,24.6,9.3,16.9,5.6,50.19,0,,0,,,,27.7,27.6,230.3,1016.4,51.8,58.2,398.8,23,8,,2019-05-23T04:59:56,2019-05-23T20:58:01,0.61,Partially cloudy,Partly cloudy throughout the day.,partly-cloudy-day,"03660099999,03672099999,03768099999,03781099999,D4121,03772099999,03770099999"
Heathrow Airport,24/05/2019,21.1,11,16.7,21.1,11,16.7,8.7,60.31,0,,0,,,,31.7,27.5,311.5,1017.1,43.3,47.1,301.7,18.5,8,,2019-05-24T04:58:45,2019-05-24T20:59:21,0.65,Partially cloudy,Becoming cloudy in the afternoon.,partly-cloudy-day,"03660099999,03672099999,03768099999,03781099999,D4121,03772099999,03770099999"
Heathrow Airport,25/05/2019,23.3,14.1,18.4,23.3,14.1,18.4,9.9,59.16,0.79,,4.17,,,,,18.3,295.9,1018.2,86.1,55.7,259,15.9,6,,2019-05-25T04:57:37,2019-05-25T21:00:39,0.7,"Rain, Partially cloudy",Partly cloudy throughout the day with early morning rain.,rain,"03660099999,03672099999,03768099999,03781099999,D4121,03772099999,03770099999"
Heathrow Airport,26/05/2019,20.1,14,17.4,20.1,14,17.3,12.2,71.9,0.2,,4.17,,,,48.2,31.6,260.4,1013.7,81.6,48.2,200.1,12.2,5,,2019-05-26T04:56:31,2019-05-26T21:01:56,0.75,"Rain, Partially cloudy",Partly cloudy throughout the day with late afternoon rain.,rain,"03660099999,03672099999,03768099999,03781099999,D4121,03772099999,03770099999"
Heathrow Airport,27/05/2019,18.6,9.5,14.5,18.6,7.4,14.3,7.3,64.1,0.53,,8.33,,,,46.4,31.6,268.7,1010.6,57.4,45.1,230.1,14.1,6,,2019-05-27T04:55:28,2019-05-27T21:03:12,0.79,"Rain, Partially cloudy",Partly cloudy throughout the day with rain.,rain,"03660099999,03672099999,03768099999,03781099999,D4121,03772099999,03770099999"
Heathrow Airport,28/05/2019,17.8,9.3,13.1,17.8,7.7,12.9,7,67.91,1.89,,16.67,,,,,22.3,227.9,1012.3,70.3,62.9,224.6,13.7,5,,2019-05-28T04:54:27,2019-05-28T21:04:25,0.84,"Rain, Partially cloudy",Partly cloudy throughout the day with a chance of rain throughout the day.,rain,"03660099999,03672099999,03768099999,03781099999,D4121,03772099999,03770099999"
Heathrow Airport,29/05/2019,15.3,9.3,12.5,15.3,8,12.4,9.4,82.61,3.5,,8.33,,,,,24.1,192.4,1018.6,79.5,28.5,162.6,10,4,,2019-05-29T04:53:29,2019-05-29T21:05:37,0.88,"Rain, Partially cloudy",Partly cloudy throughout the day with rain.,rain,"03660099999,03672099999,03768099999,03781099999,D4121,03772099999,03770099999"
Heathrow Airport,30/05/2019,24,14.6,18.8,24,14.6,18.8,12.9,70.32,0.2,,4.17,,,,45.6,33.4,245.4,1020.7,88.6,39.4,259.5,14.9,7,,2019-05-30T04:52:34,2019-05-30T21:06:47,0.92,"Rain, Partially cloudy",Partly cloudy throughout the day with early morning rain.,rain,"03660099999,03672099999,03768099999,03781099999,D4121,03772099999,03770099999"
Heathrow Airport,31/05/2019,19.8,14.6,17.1,19.8,14.6,17.1,11.1,68.17,0,,0,,,,,24,227.5,1023.6,70,64.6,218.9,13.4,4,,2019-05-31T04:51:42,2019-05-31T21:07:55,0.96,Partially cloudy,Partly cloudy throughout the day.,partly-cloudy-day,"03660099999,03672099999,03768099999,03781099999,D4121,03772099999,03770099999"
Heathrow Airport,01/06/2019,26.8,10.8,19.4,26.6,10.8,19.3,10.8,61.69,0,,0,,,,,20.5,190,1019.6,37.7,51.3,396.1,24.2,8,,2019-06-01T04:50:52,2019-06-01T21:09:01,0.98,Partially cloudy,Partly cloudy throughout the day.,partly-cloudy-day,"03660099999,03672099999,03768099999,03781099999,D4121,03772099999,03770099999"
Heathrow Airport,02/06/2019,26,15.2,20.1,26,15.2,20,12.5,63.93,0,,0,,,,53.6,35.2,195.4,1010.3,65,40.9,321.4,19.7,8,,2019-06-02T04:50:05,2019-06-02T21:10:05,1,Partially cloudy,Partly cloudy throughout the day.,wind,"03660099999,03672099999,03768099999,03781099999,D4121,03772099999,03770099999"
Heathrow Airport,03/06/2019,20.3,10.8,15.8,20.3,10.8,15.8,8,61.44,0,,0,,,,27.7,27.7,234.6,1012.3,43.3,38.7,253.7,15.5,7,,2019-06-03T04:49:21,2019-06-03T21:11:07,0,Partially cloudy,Partly cloudy throughout the day.,partly-cloudy-day,"03660099999,03672099999,03768099999,03781099999,D4121,03772099999,03770099999"
Heathrow Airport,04/06/2019,16.8,10.3,14.2,16.8,10.3,14.2,10.7,80.18,2.3,,8.33,,,,,24.1,146.7,1006.5,71.6,29.9,99.8,6.1,2,,2019-06-04T04:48:39,2019-06-04T21:12:07,0.01,"Rain, Partially cloudy",Partly cloudy throughout the day with rain.,rain,"03660099999,03672099999,03768099999,03781099999,D4121,03772099999,03770099999"
Heathrow Airport,05/06/2019,19,11.8,15.4,19,11.8,15.4,8.3,64.95,0,,0,,,,33.5,22.3,223.8,1005.7,71.2,49.5,258.1,14.9,5,,2019-06-05T04:48:01,2019-06-05T21:13:04,0.03,Partially cloudy,Partly cloudy throughout the day.,partly-cloudy-day,"03660099999,03672099999,03768099999,03781099999,D4121,03772099999,03770099999"
Heathrow Airport,06/06/2019,19.8,8.6,14.9,19.8,8.1,14.9,5.5,56.55,1.08,,8.33,,,,46.4,25.9,208.8,1010,38.7,56.9,350.8,21.5,7,,2019-06-06T04:47:26,2019-06-06T21:14:00,0.06,"Rain, Partially cloudy",Partly cloudy throughout the day with rain.,rain,"03660099999,03672099999,03768099999,03781099999,D4121,03772099999,03770099999"
Heathrow Airport,07/06/2019,18.3,11.6,14.2,18.3,11.6,14.2,10.1,76.82,8.01,,8.33,,,,48.2,24.1,101.3,1002.9,76.7,41.9,143.5,8.8,6,,2019-06-07T04:46:53,2019-06-07T21:14:52,0.1,"Rain, Partially cloudy",Partly cloudy throughout the day with rain.,rain,"03660099999,03672099999,03768099999,03781099999,D4121,03772099999,03770099999"
Heathrow Airport,08/06/2019,19.3,11,14.8,19.3,11,14.8,8.3,68.34,6.73,,12.5,,,,64.8,40.6,249.6,1010.5,60.3,49,305.1,17.6,8,,2019-06-08T04:46:23,2019-06-08T21:15:43,0.15,"Rain, Partially cloudy",Partly cloudy throughout the day with a chance of rain throughout the day.,rain,"03660099999,03672099999,03768099999,03781099999,D4121,03772099999,03770099999"
Heathrow Airport,09/06/2019,18.7,9.1,14,18.7,8,13.9,7.7,67.76,0.8,,8.33,,,,,20.4,221.5,1020.4,59.9,42.5,295.1,18.1,7,,2019-06-09T04:45:57,2019-06-09T21:16:31,0.21,"Rain, Partially cloudy",Partly cloudy throughout the day with rain.,rain,"03660099999,03672099999,03768099999,03781099999,D4121,03772099999,03770099999"
Heathrow Airport,10/06/2019,13.5,9.6,11.5,13.5,7.5,11.3,9.8,89.18,24.33,,16.67,,,,46.4,22.3,120.9,1015,93.6,19.8,60.3,3.3,2,,2019-06-10T04:45:33,2019-06-10T21:17:16,0.27,"Rain, Overcast",Cloudy skies throughout the day with a chance of rain throughout the day.,rain,"03660099999,03672099999,03768099999,03781099999,D4121,03772099999,03770099999"
Heathrow Airport,11/06/2019,17.3,11,13.2,17.3,11,13.2,10.6,85.08,36.37,,16.67,,,,48.2,18.4,84.5,1011.4,85.3,41.7,227.1,13.1,5,,2019-06-11T04:45:13,2019-06-11T21:17:59,0.32,"Rain, Partially cloudy",Partly cloudy throughout the day with a chance of rain throughout the day.,rain,"03660099999,03672099999,03768099999,03781099999,D4121,03772099999,03770099999"
Heathrow Airport,12/06/2019,15.8,11,12.8,15.8,11,12.7,10.2,84.94,2.43,,12.5,,,,,12.9,110,1009.9,87.4,36.1,163.6,10,6,,2019-06-12T04:44:55,2019-06-12T21:18:39,0.37,"Rain, Partially cloudy",Partly cloudy throughout the day with rain.,rain,"03660099999,03672099999,03768099999,03781099999,D4121,03772099999,03770099999"
Heathrow Airport,13/06/2019,14.1,11.5,12.6,14.1,11.5,12.6,11.1,90.75,17.92,,8.33,,,,50,29.5,212.1,1005.8,83.2,25.6,82.4,4.7,2,,2019-06-13T04:44:41,2019-06-13T21:19:16,0.42,"Rain, Partially cloudy",Partly cloudy throughout the day with rain.,rain,"03660099999,03672099999,03768099999,03781099999,D4121,03772099999,03770099999"
Heathrow Airport,14/06/2019,19.3,12.3,15.4,19.3,12.3,15.4,10.7,74.9,2.25,,12.5,,,,46.4,31.2,192.1,1010,67.8,38.8,242.5,14.8,5,,2019-06-14T04:44:30,2019-06-14T21:19:51,0.45,"Rain, Partially cloudy",Partly cloudy throughout the day with a chance of rain throughout the day.,rain,"03660099999,03672099999,03768099999,03781099999,D4121,03772099999,03770099999"
Heathrow Airport,15/06/2019,19.3,11.5,15,19.3,11.5,15,10.8,76.78,0.4,,4.17,,,,46.4,25.9,188.3,1012.7,71.2,41.3,232,14.2,7,,2019-06-15T04:44:21,2019-06-15T21:20:22,0.48,"Rain, Partially cloudy",Partly cloudy throughout the day with late afternoon rain.,rain,"03660099999,03672099999,03768099999,03781099999,D4121,03772099999,03770099999"
Heathrow Airport,16/06/2019,20.8,9.2,15.2,20.8,8,15.1,10.9,77.03,1.4,,8.33,,,,51.8,37,198.8,1016.5,60.8,39.6,273.5,16.7,7,,2019-06-16T04:44:16,2019-06-16T21:20:51,0.5,"Rain, Partially cloudy",Partly cloudy throughout the day with rain.,rain,"03660099999,03672099999,03768099999,03781099999,D4121,03772099999,03770099999"
Heathrow Airport,17/06/2019,22,11.6,16.9,22,11.6,16.8,9.6,64.33,0,,0,,,,44.6,29.4,204.2,1017.6,51.2,43.8,375,23,8,,2019-06-17T04:44:14,2019-06-17T21:21:17,0.5,Partially cloudy,Partly cloudy throughout the day.,partly-cloudy-day,"03660099999,03672099999,03768099999,03781099999,D4121,03772099999,03770099999"
Heathrow Airport,18/06/2019,18.4,11.6,15.6,18.4,11.6,15.5,11.8,79.22,2.41,,8.33,,,,,12.9,177.9,1014.2,84,27.1,156.4,9.6,4,,2019-06-18T04:44:15,2019-06-18T21:21:40,0.51,"Rain, Partially cloudy",Partly cloudy throughout the day with rain.,rain,"03660099999,03672099999,03768099999,03781099999,D4121,03772099999,03770099999"
Heathrow Airport,19/06/2019,19.1,14.3,16.6,19.1,14.3,16.6,14.1,85.25,7.54,,8.33,,,,,13,224.1,1008,87.4,19.1,144.3,8.8,4,,2019-06-19T04:44:19,2019-06-19T21:22:00,0.53,"Rain, Partially cloudy",Partly cloudy throughout the day with rain.,rain,"03660099999,03672099999,03768099999,03781099999,D4121,03772099999,03770099999"
Heathrow Airport,20/06/2019,20.3,12.4,16.3,20.3,12.4,16.2,10.4,69.84,0.6,,8.33,,,,50,25.9,253.3,1012.4,72.4,49.6,274,16.8,6,,2019-06-20T04:44:26,2019-06-20T21:22:17,0.55,"Rain, Partially cloudy",Partly cloudy throughout the day with rain.,rain,"03660099999,03672099999,03768099999,03781099999,D4121,03772099999,03770099999"
Heathrow Airport,21/06/2019,21.6,9.3,16.1,21.6,8.3,16.1,8.4,63.14,0,,0,,,,,20.5,265.1,1019.1,45.8,47.7,359.6,22,8,,2019-06-21T04:44:36,2019-06-21T21:22:31,0.59,Partially cloudy,Becoming cloudy in the afternoon.,partly-cloudy-day,"03660099999,03672099999,03768099999,03781099999,D4121,03772099999,03770099999"
Heathrow Airport,22/06/2019,23.6,10.3,17.1,23.6,10.3,17.1,8.7,60.74,0,,0,,,,,22.3,151.3,1021,17.1,52.4,316.5,13.7,8,,2019-06-22T04:44:49,2019-06-22T21:22:42,0.62,Clear,Clear conditions throughout the day.,clear-day,"03660099999,03672099999,03768099999,03781099999,D4121,03772099999,03770099999"
Heathrow Airport,23/06/2019,24.5,12.8,18.7,24.5,12.8,18.7,12.8,69.61,0,,0,,,,,24.1,68.3,1017,63.8,25.5,197.5,12.1,5,,2019-06-23T04:45:05,2019-06-23T21:22:50,0.67,Partially cloudy,Partly cloudy throughout the day.,partly-cloudy-day,"03660099999,03672099999,03768099999,03781099999,D4121,03772099999,03770099999"
Heathrow Airport,24/06/2019,24.1,17.5,21.3,24.1,17.5,21.2,16.4,74.36,0,,0,,,,,16.5,143.3,1015.4,86.5,17.4,149.4,9.1,3,,2019-06-24T04:45:24,2019-06-24T21:22:55,0.71,Partially cloudy,Partly cloudy throughout the day.,partly-cloudy-day,"03660099999,03672099999,03768099999,03781099999,D4121,03772099999,03770099999"
Heathrow Airport,25/06/2019,23.6,17.8,20,23.6,17.8,20,17.2,84.43,9.46,,12.5,,,,,13,87,1018.7,92.4,16.4,162,9.3,4,,2019-06-25T04:45:46,2019-06-25T21:22:57,0.76,"Rain, Overcast",Cloudy skies throughout the day with a chance of rain throughout the day.,rain,"03660099999,03672099999,03768099999,03781099999,D4121,03772099999,03770099999"
Heathrow Airport,26/06/2019,21.3,15.3,17.5,21.3,15.3,17.4,14.1,81.06,1,,4.17,,,,37.1,22.3,38.8,1027,94,25.6,258.1,14.9,7,,2019-06-26T04:46:10,2019-06-26T21:22:55,0.81,"Rain, Overcast",Cloudy skies throughout the day with late afternoon rain.,rain,"03660099999,03672099999,03768099999,03781099999,D4121,03772099999,03770099999"
Heathrow Airport,27/06/2019,24.1,13.1,17.9,24.1,13.1,17.9,11.1,66.17,0,,0,,,,48.2,22.3,65.4,1028.8,35.4,35.1,417.5,27.1,8,,2019-06-27T04:46:38,2019-06-27T21:22:51,0.85,Partially cloudy,Clearing in the afternoon.,partly-cloudy-day,"03660099999,03672099999,03768099999,03781099999,D4121,03772099999,03770099999"
Heathrow Airport,28/06/2019,24,13.5,18.2,24,13.5,18.1,11.8,67.9,0,,0,,,,40.7,25.9,80.8,1024.5,29.3,27.9,399.4,25.9,8,,2019-06-28T04:47:08,2019-06-28T21:22:43,0.9,Partially cloudy,Clearing in the afternoon.,partly-cloudy-day,"03660099999,03672099999,03768099999,03781099999,D4121,03772099999,03770099999"
Heathrow Airport,29/06/2019,33.8,14.6,24.5,33.1,14.6,24.4,15,61.07,0,,0,,,,,25.9,117.5,1015.4,10,25,438.8,26.9,8,,2019-06-29T04:47:41,2019-06-29T21:22:32,0.94,Clear,Clear conditions throughout the day.,clear-day,"03660099999,03672099999,03768099999,03781099999,D4121,03772099999,03770099999"
Heathrow Airport,30/06/2019,24.8,14.8,20,24.8,14.8,20,12.6,63.92,0,,0,,,,35.3,25.9,266.3,1015.8,34.9,24.5,296.5,18.1,6,,2019-06-30T04:48:17,2019-06-30T21:22:18,0.97,Partially cloudy,Partly cloudy throughout the day.,partly-cloudy-day,"03660099999,03672099999,03768099999,03781099999,D4121,03772099999,03770099999"
Heathrow Airport,01/07/2019,22.5,13.3,17.9,22.5,13.3,17.8,10.2,62.44,0,,0,,,,44.6,22.3,282.5,1020.1,42.4,35.5,275.4,17.8,9,,2019-07-01T04:48:56,2019-07-01T21:22:01,0.99,Partially cloudy,Partly cloudy throughout the day.,partly-cloudy-day,"03660099999,03672099999,03768099999,03781099999,D4121,03772099999,03770099999"
Heathrow Airport,02/07/2019,22.6,11.1,17.2,22.6,11.1,17.2,8.5,58.42,0,,0,,,,,16.6,226.3,1024.9,32.4,43.1,313.3,20.3,6,,2019-07-02T04:49:37,2019-07-02T21:21:41,1,Partially cloudy,Partly cloudy throughout the day.,partly-cloudy-day,"03660099999,03672099999,03768099999,03781099999,D4121,03772099999,03770099999"
Heathrow Airport,03/07/2019,23.6,13,18.3,23.6,13,18.2,7.8,52.53,0,,0,,,,20.5,18.3,86.8,1026.5,34.1,46.5,379.8,23.2,8,,2019-07-03T04:50:20,2019-07-03T21:21:18,0,Partially cloudy,Partly cloudy throughout the day.,partly-cloudy-day,"03660099999,03672099999,03768099999,03781099999,D4121,03772099999,03770099999"
Heathrow Airport,04/07/2019,26.3,12.5,19.8,26.3,12.5,19.8,9,52.82,0,,0,,,,,14.7,191.2,1024.9,6.9,47.7,444.2,27.2,8,,2019-07-04T04:51:06,2019-07-04T21:20:52,0.02,Clear,Clear conditions throughout the day.,clear-day,"03660099999,03672099999,03768099999,03781099999,D4121,03772099999,03770099999"
Heathrow Airport,05/07/2019,26.1,15.8,21.5,26.1,15.8,21.4,11.3,53.71,0,,0,,,,,16.5,281,1018.8,76.3,41.7,333.5,21.6,8,,2019-07-05T04:51:55,2019-07-05T21:20:23,0.05,Partially cloudy,Partly cloudy throughout the day.,partly-cloudy-day,"03660099999,03672099999,03768099999,03781099999,D4121,03772099999,03770099999"
Heathrow Airport,06/07/2019,23.1,15.3,19.6,23.1,15.3,19.6,12.2,62.63,0,,0,,,,,13,267.5,1013.7,57.4,47.4,265.6,16.3,7,,2019-07-06T04:52:46,2019-07-06T21:19:51,0.09,Partially cloudy,Partly cloudy throughout the day.,partly-cloudy-day,"03660099999,03672099999,03768099999,03781099999,D4121,03772099999,03770099999"
Heathrow Airport,07/07/2019,21.1,14.4,17.2,21.1,14.4,17.2,13.2,79.01,6.07,,12.5,,,,,14.7,151.8,1016.5,79.1,24.3,227.8,13.1,6,,2019-07-07T04:53:39,2019-07-07T21:19:15,0.14,"Rain, Partially cloudy",Partly cloudy throughout the day with a chance of rain throughout the day.,rain,"03660099999,03672099999,03768099999,03781099999,D4121,03772099999,03770099999"
Heathrow Airport,08/07/2019,23.6,12.7,18.3,23.6,12.7,18.3,9.9,60.26,1.99,,4.17,,,,,18.3,143.5,1020.6,80.8,46.1,256.3,14.8,7,,2019-07-08T04:54:35,2019-07-08T21:18:37,0.2,"Rain, Partially cloudy",Partly cloudy throughout the day with early morning rain.,rain,"03660099999,03672099999,03768099999,03781099999,D4121,03772099999,03770099999"
Heathrow Airport,09/07/2019,24.8,15.3,19.6,24.8,15.3,19.6,11,58.85,0,,0,,,,,16.5,207.1,1021,95.3,35.4,230.6,13.3,6,,2019-07-09T04:55:32,2019-07-09T21:17:56,0.25,Overcast,Cloudy skies throughout the day.,cloudy,"03660099999,03672099999,03768099999,03781099999,D4121,03772099999,03770099999"
Heathrow Airport,10/07/2019,25.3,16.8,21.2,25.3,16.8,21.2,13.1,61.01,0,,0,,,,,22.3,222.1,1018.2,85.7,32.2,247.1,15.1,6,,2019-07-10T04:56:32,2019-07-10T21:17:12,0.31,Partially cloudy,Partly cloudy throughout the day.,partly-cloudy-day,"03660099999,03672099999,03768099999,03781099999,D4121,03772099999,03770099999"
Heathrow Airport,11/07/2019,26.8,16.6,21.2,26.9,16.6,21.2,12,56.32,0,,0,,,,,20.5,260.4,1013,77.4,27.1,409.7,13.3,9,,2019-07-11T04:57:34,2019-07-11T21:16:25,0.36,Partially cloudy,Partly cloudy throughout the day.,partly-cloudy-day,"03660099999,03672099999,03768099999,03781099999,D4121,03772099999,03770099999"
Heathrow Airport,12/07/2019,24.6,17.1,20.9,24.6,17.1,20.8,12.3,59.7,0,,0,,,,40.7,22.4,300.6,1014.8,57.9,33,306.1,18.7,6,,2019-07-12T04:58:38,2019-07-12T21:15:35,0.41,Partially cloudy,Partly cloudy throughout the day.,partly-cloudy-day,"03660099999,03672099999,03768099999,03781099999,D4121,03772099999,03770099999"
Heathrow Airport,13/07/2019,23.6,14.6,19.2,23.6,14.6,19.2,12.1,64.34,0,,0,,,,,14.8,213.8,1021.5,52.5,28.3,253.2,15.5,5,,2019-07-13T04:59:44,2019-07-13T21:14:43,0.44,Partially cloudy,Partly cloudy throughout the day.,partly-cloudy-day,"03660099999,03672099999,03768099999,03781099999,D4121,03772099999,03770099999"
Heathrow Airport,14/07/2019,21.5,14.1,17.6,21.5,14.1,17.6,11.9,71.1,0.8,,8.33,,,,38.9,16.6,27.9,1023.2,52.1,30.4,215.9,12.4,5,,2019-07-14T05:00:51,2019-07-14T21:13:48,0.47,"Rain, Partially cloudy",Partly cloudy throughout the day with rain in the morning and afternoon.,rain,"03660099999,03672099999,03768099999,03781099999,D4121,03772099999,03770099999"
Heathrow Airport,15/07/2019,22.3,11.8,17.1,22.3,11.8,17.1,9.9,64.39,0,,0,,,,,13,74.6,1022.7,50.4,44.6,294.2,16.9,9,,2019-07-15T05:02:00,2019-07-15T21:12:50,0.49,Partially cloudy,Partly cloudy throughout the day.,partly-cloudy-day,"03660099999,03672099999,03768099999,03781099999,D4121,03772099999,03770099999"
Heathrow Airport,16/07/2019,27,12.1,19.8,26.5,12.1,19.7,10.3,58.52,0,,0,,,,,22.3,230.1,1019.3,5,30.6,356.1,21.8,8,,2019-07-16T05:03:11,2019-07-16T21:11:49,0.5,Clear,Clear conditions throughout the day.,clear-day,"03660099999,03672099999,03768099999,03781099999,D4121,03772099999,03770099999"
Heathrow Airport,17/07/2019,25.8,14.1,20.4,25.8,14.1,20.3,11.4,58.82,0,,0,,,,,22.3,214.3,1014.3,57.9,35.4,299.5,18.3,7,,2019-07-17T05:04:24,2019-07-17T21:10:46,0.5,Partially cloudy,Partly cloudy throughout the day.,partly-cloudy-day,"03660099999,03672099999,03768099999,03781099999,D4121,03772099999,03770099999"
Heathrow Airport,18/07/2019,23.6,15.8,19.1,23.6,15.8,19.1,12.8,69.49,2.61,,8.33,,,,29.5,25.9,238.3,1010.4,67.5,34.9,210.5,12.1,5,,2019-07-18T05:05:38,2019-07-18T21:09:40,0.52,"Rain, Partially cloudy",Partly cloudy throughout the day with rain in the morning and afternoon.,rain,"03660099999,03672099999,03768099999,03781099999,D4121,03772099999,03770099999"
Heathrow Airport,19/07/2019,19.1,13.3,16.6,19.1,13.3,16.6,13.6,82.98,8.18,,8.33,,,,37.1,25.9,197.9,1011.4,70.4,26.4,99.6,6.1,2,,2019-07-19T05:06:54,2019-07-19T21:08:32,0.53,"Rain, Partially cloudy",Partly cloudy throughout the day with rain in the morning and afternoon.,rain,"03660099999,03672099999,03768099999,03781099999,D4121,03772099999,03770099999"
Heathrow Airport,20/07/2019,24.6,16.3,19.7,24.6,16.3,19.7,14.3,73.76,10.74,,12.5,,,,46.4,29.5,227.1,1008.6,57.1,38.4,314.2,18.1,8,,2019-07-20T05:08:11,2019-07-20T21:07:21,0.56,"Rain, Partially cloudy",Partly cloudy throughout the day with a chance of rain throughout the day.,rain,"03660099999,03672099999,03768099999,03781099999,D4121,03772099999,03770099999"
Heathrow Airport,21/07/2019,23.3,13.1,18.7,23.3,13.1,18.6,12.3,68.19,0,,0,,,,33.5,22.3,227.5,1020,40.5,46.5,276.8,15.9,5,,2019-07-21T05:09:30,2019-07-21T21:06:08,0.6,Partially cloudy,Partly cloudy throughout the day.,partly-cloudy-day,"03660099999,03672099999,03768099999,03781099999,D4121,03772099999,03770099999"
Heathrow Airport,22/07/2019,27.5,16.5,21.7,28.3,16.5,21.7,16.3,72.18,0,,0,,,,0,20.5,213.3,1021.7,57.5,36,337.7,19.5,8,,2019-07-22T05:10:49,2019-07-22T21:04:52,0.64,Partially cloudy,Partly cloudy throughout the day.,partly-cloudy-day,"03660099999,03672099999,03768099999,03781099999,D4121,03772099999,03770099999"
Heathrow Airport,23/07/2019,33.3,16.3,25.4,32.6,16.3,25.2,15.8,61.29,0,,0,,,,,20.5,148.8,1017.7,3,29.6,436,25.1,8,,2019-07-23T05:12:10,2019-07-23T21:03:35,0.68,Clear,Clear conditions throughout the day.,clear-day,"03660099999,03672099999,03768099999,03781099999,D4121,03772099999,03770099999"
Heathrow Airport,24/07/2019,32.1,20.5,26.1,31.2,20.5,25.9,15.8,57.05,1.8,,8.33,,,,,22.3,230.9,1012,20.4,32.9,401,20.2,8,,2019-07-24T05:13:32,2019-07-24T21:02:14,0.73,"Rain, Partially cloudy",Partly cloudy throughout the day with rain clearing later.,rain,"03660099999,03672099999,03768099999,03781099999,D4121,03772099999,03770099999"
Heathrow Airport,25/07/2019,37.1,20.1,28.7,38.6,20.1,29,15.8,48.04,0.21,,4.17,,,,48.2,20.5,140.8,1010.4,22.1,32.3,345.8,19.9,8,,2019-07-25T05:14:56,2019-07-25T21:00:52,0.78,"Rain, Partially cloudy",Becoming cloudy in the afternoon with late afternoon rain.,rain,"03660099999,03672099999,03768099999,03781099999,D4121,03772099999,03770099999"
Heathrow Airport,26/07/2019,26.3,18.8,22.3,26.3,18.8,22.3,16.2,69.13,1.92,,8.33,,,,,20.5,242.1,1010.5,85.7,27.6,151.6,8.7,4,,2019-07-26T05:16:20,2019-07-26T20:59:27,0.83,"Rain, Partially cloudy",Partly cloudy throughout the day with rain in the morning and afternoon.,rain,"03660099999,03672099999,03768099999,03781099999,D4121,03772099999,03770099999"
Heathrow Airport,27/07/2019,19.8,16.1,17.8,19.8,16.1,17.8,16,89.31,14.82,,12.5,,,,,20.5,292.5,1007.3,87.9,18.5,80.4,4.6,2,,2019-07-27T05:17:45,2019-07-27T20:58:01,0.87,"Rain, Partially cloudy",Partly cloudy throughout the day with a chance of rain throughout the day.,rain,"03660099999,03672099999,03768099999,03781099999,D4121,03772099999,03770099999"
Heathrow Airport,28/07/2019,23.3,15.5,18.8,23.3,15.5,18.8,12.3,68.1,0,,0,,,,38.9,24.1,276.7,1005.9,78.7,44.1,220.6,12.7,6,,2019-07-28T05:19:11,2019-07-28T20:56:32,0.92,Partially cloudy,Partly cloudy throughout the day.,partly-cloudy-day,"03660099999,03672099999,03768099999,03781099999,D4121,03772099999,03770099999"
Heathrow Airport,29/07/2019,25.1,13.6,20,25.1,13.6,20,11.3,59.65,0,,0,,,,42.5,22.3,188.8,1008.8,38.7,46,402,21.7,8,,2019-07-29T05:20:38,2019-07-29T20:55:01,0.96,Partially cloudy,Partly cloudy throughout the day.,partly-cloudy-day,"03660099999,03672099999,03768099999,03781099999,D4121,03772099999,03770099999"
Heathrow Airport,30/07/2019,20.8,17.3,18.4,20.8,17.3,18.3,14.5,78.82,2,,4.17,,,,59.4,35.3,160,1005.1,58.8,25.2,118.7,6.8,3,,2019-07-30T05:22:06,2019-07-30T20:53:28,0.99,"Rain, Partially cloudy",Partly cloudy throughout the day with afternoon rain.,rain,"03660099999,03672099999,03768099999,03781099999,D4121,03772099999,03770099999"
Heathrow Airport,31/07/2019,23.6,16.3,19.4,23.6,16.3,19.4,11.5,62.94,0.2,,4.17,,,,48.2,31.7,243.3,1012,73.7,43.6,242.8,14,5,,2019-07-31T05:23:35,2019-07-31T20:51:54,1,"Rain, Partially cloudy",Partly cloudy throughout the day with early morning rain.,rain,"03660099999,03672099999,03768099999,03781099999,D4121,03772099999,03770099999"
Heathrow Airport,01/08/2019,25.1,14.9,19.8,25.1,14.9,19.8,12.8,65.76,0,,0,,,,,16.5,267.1,1017,67.9,36.7,310.9,16.8,8,,2019-08-01T05:25:04,2019-08-01T20:50:17,0,Partially cloudy,Partly cloudy throughout the day.,partly-cloudy-day,"03660099999,03672099999,03768099999,03781099999,D4121,03772099999,03770099999"
Heathrow Airport,02/08/2019,25.3,15.8,20.6,25.3,15.8,20.6,13.2,64.39,0,,0,,,,31.7,14.7,95.8,1019.1,45.9,31.2,271.2,15.6,7,,2019-08-02T05:26:34,2019-08-02T20:48:39,0.01,Partially cloudy,Partly cloudy throughout the day.,partly-cloudy-day,"03660099999,03672099999,03768099999,03781099999,D4121,03772099999,03770099999"
Heathrow Airport,03/08/2019,24.1,15.3,20.1,24.1,15.3,20.1,14,69.46,0,,0,,,,,16.5,120.8,1018.9,47.6,33.1,290.4,14.6,6,,2019-08-03T05:28:05,2019-08-03T20:46:59,0.04,Partially cloudy,Partly cloudy throughout the day.,partly-cloudy-day,"03660099999,03672099999,03768099999,03781099999,D4121,03772099999,03770099999"
Heathrow Airport,04/08/2019,27.1,15.3,20.5,27.2,15.3,20.4,14.3,69.18,0,,0,,,,,24.1,141.6,1013.6,76.5,30.6,200.8,11.6,4,,2019-08-04T05:29:36,2019-08-04T20:45:17,0.08,Partially cloudy,Partly cloudy throughout the day.,partly-cloudy-day,"03660099999,03672099999,03768099999,03781099999,D4121,03772099999,03770099999"
Heathrow Airport,05/08/2019,26.1,16.1,20,26.1,16.1,19.9,13.1,67.78,0.4,,4.17,,,,35.3,25.9,223.3,1009.8,59.6,32.3,270.3,15.6,8,,2019-08-05T05:31:07,2019-08-05T20:43:33,0.13,"Rain, Partially cloudy",Partly cloudy throughout the day with afternoon rain.,rain,"03660099999,03672099999,03768099999,03781099999,D4121,03772099999,03770099999"
Heathrow Airport,06/08/2019,23.6,15.6,19.3,23.6,15.6,19.3,13.3,69.66,0,,0,,,,50,33.4,209.6,1007.9,58.7,32.1,226.3,11.4,5,,2019-08-06T05:32:39,2019-08-06T20:41:48,0.18,Partially cloudy,Partly cloudy throughout the day.,wind,"03660099999,03672099999,03768099999,03781099999,D4121,03772099999,03770099999"
Heathrow Airport,07/08/2019,24.8,14.5,18.8,24.8,14.5,18.7,13,70.58,3.1,,12.5,,,,51.9,29.5,234.6,1006.6,58.1,36.8,237.4,13.7,5,,2019-08-07T05:34:12,2019-08-07T20:40:01,0.24,"Rain, Partially cloudy",Partly cloudy throughout the day with rain.,rain,"03660099999,03672099999,03768099999,03781099999,D4121,03772099999,03770099999"
Heathrow Airport,08/08/2019,23.8,14,19.3,23.8,14,19.2,13.3,70,0,,0,,,,,18.3,195.5,1009.7,63.3,39,266.4,15.3,6,,2019-08-08T05:35:45,2019-08-08T20:38:13,0.29,Partially cloudy,Partly cloudy throughout the day.,partly-cloudy-day,"03660099999,03672099999,03768099999,03781099999,D4121,03772099999,03770099999"
Heathrow Airport,09/08/2019,24.3,17.6,20.3,24.3,17.6,20.3,16.3,79.16,5.26,,12.5,,,,72.2,40.6,174.2,1001.2,62.5,25.1,235.6,13.6,7,,2019-08-09T05:37:18,2019-08-09T20:36:23,0.34,"Rain, Partially cloudy",Partly cloudy throughout the day with rain.,rain,"03660099999,03672099999,03768099999,03781099999,D4121,03772099999,03770099999"
Heathrow Airport,10/08/2019,22.8,16.8,19.1,22.8,16.8,19.1,13.3,70.05,6.23,,16.67,,,,77.7,51.8,216.7,1003.7,59.5,20,239.7,13.8,6,,2019-08-10T05:38:52,2019-08-10T20:34:31,0.39,"Rain, Partially cloudy",Partly cloudy throughout the day with a chance of rain throughout the day.,rain,"03660099999,03672099999,03768099999,03781099999,D4121,03772099999,03770099999"
Heathrow Airport,11/08/2019,23.1,15.1,18.6,23.1,15.1,18.6,11.6,65.1,0,,0,,,,50,31.6,222.5,1011.1,28.4,31.2,299.7,17.3,6,,2019-08-11T05:40:26,2019-08-11T20:32:39,0.43,Partially cloudy,Partly cloudy throughout the day.,wind,"03660099999,03672099999,03768099999,03781099999,D4121,03772099999,03770099999"
Heathrow Airport,12/08/2019,19,13.5,15.8,19,13.5,15.7,10.6,72.57,9.64,,12.5,,,,,16.5,281.7,1014.4,63.7,37.9,160.7,9.3,6,,2019-08-12T05:42:00,2019-08-12T20:30:45,0.46,"Rain, Partially cloudy",Partly cloudy throughout the day with rain.,rain,"03660099999,03672099999,03768099999,03781099999,D4121,03772099999,03770099999"
Heathrow Airport,13/08/2019,22.6,10.1,16.6,22.6,10.1,16.6,7.9,60.76,0,,0,,,,,22.3,259.2,1017.4,39.1,49.1,387.6,22.3,9,,2019-08-13T05:43:34,2019-08-13T20:28:49,0.48,Partially cloudy,Partly cloudy throughout the day.,partly-cloudy-day,"03660099999,03672099999,03768099999,03781099999,D4121,03772099999,03770099999"
Heathrow Airport,14/08/2019,17.3,14,15.7,17.3,14,15.7,14.1,90.32,11.02,,8.33,,,,38.9,24.1,197.1,1012.8,79.2,21.7,68.8,3.7,1,,2019-08-14T05:45:09,2019-08-14T20:26:53,0.5,"Rain, Partially cloudy",Partly cloudy throughout the day with rain.,rain,"03660099999,03672099999,03768099999,03781099999,D4121,03772099999,03770099999"
Heathrow Airport,15/08/2019,23.1,14.8,18.5,23.1,14.8,18.5,11.9,68.61,1,,8.33,,,,50,29.6,263.3,1011.9,47.1,40.3,308.1,17.7,7,,2019-08-15T05:46:43,2019-08-15T20:24:55,0.5,"Rain, Partially cloudy",Partly cloudy throughout the day with rain.,rain,"03660099999,03672099999,03768099999,03781099999,D4121,03772099999,03770099999"
Heathrow Airport,16/08/2019,18.8,12.8,16,18.8,12.8,15.9,13.5,85.6,2.21,,8.33,,,,50,29.4,198.8,1011.8,70.8,23.9,105.4,5.7,3,,2019-08-16T05:48:18,2019-08-16T20:22:56,0.51,"Rain, Partially cloudy",Partly cloudy throughout the day with rain.,rain,"03660099999,03672099999,03768099999,03781099999,D4121,03772099999,03770099999"
Heathrow Airport,17/08/2019,22.8,15.2,18.6,22.8,15.2,18.6,13.8,75.36,3.4,,8.33,,,,46.4,29.5,224.6,1004.5,53.4,30.6,322,17.4,8,,2019-08-17T05:49:53,2019-08-17T20:20:56,0.52,"Rain, Partially cloudy",Partly cloudy throughout the day with rain.,rain,"03660099999,03672099999,03768099999,03781099999,D4121,03772099999,03770099999"
Heathrow Airport,18/08/2019,22.1,14.3,17,22.1,14.3,16.9,12.4,76.03,3.19,,8.33,,,,50,27.7,227.1,1005.3,74.5,31.4,275.9,14.9,8,,2019-08-18T05:51:29,2019-08-18T20:18:54,0.54,"Rain, Partially cloudy",Partly cloudy throughout the day with rain in the morning and afternoon.,rain,"03660099999,03672099999,03768099999,03781099999,D4121,03772099999,03770099999"
Heathrow Airport,19/08/2019,21.8,12.2,16.6,21.8,12.2,16.6,10.3,68.9,7.81,,12.5,,,,51.8,33.4,240.4,1013.7,34.9,33.3,309.7,16.7,7,,2019-08-19T05:53:04,2019-08-19T20:16:52,0.57,"Rain, Partially cloudy",Partly cloudy throughout the day with rain.,rain,"03660099999,03672099999,03768099999,03781099999,D4121,03772099999,03770099999"
Heathrow Airport,20/08/2019,22.1,11.1,16.6,22.1,11.1,16.6,8.2,61.34,0.2,,4.17,,,,,24.1,250.4,1022.5,20.4,33.2,367.8,19.9,7,,2019-08-20T05:54:39,2019-08-20T20:14:48,0.61,"Rain, Partially cloudy",Partly cloudy throughout the day with morning rain.,rain,"03660099999,03672099999,03768099999,03781099999,D4121,03772099999,03770099999"
Heathrow Airport,21/08/2019,22.5,11,16.9,22.5,11,16.9,10,65.47,0,,0,,,,40.7,20.5,193.3,1026.5,22.3,28.1,341.9,13.5,8,,2019-08-21T05:56:15,2019-08-21T20:12:44,0.65,Partially cloudy,Partly cloudy throughout the day.,partly-cloudy-day,"03660099999,03672099999,03768099999,03781099999,D4121,03772099999,03770099999"
Heathrow Airport,22/08/2019,24.1,12.3,18.3,24.1,12.3,18.3,12.1,69.49,0,,0,,,,,20.5,221.6,1024.7,38.4,30.3,343.1,18.5,7,,2019-08-22T05:57:50,2019-08-22T20:10:39,0.7,Partially cloudy,Becoming cloudy in the afternoon.,partly-cloudy-day,"03660099999,03672099999,03768099999,03781099999,D4121,03772099999,03770099999"
Heathrow Airport,23/08/2019,27.1,13.8,20.4,27.3,13.8,20.4,14,69.49,0,,0,,,,0,11.1,202.3,1024.2,1.4,34.8,417.4,21,7,,2019-08-23T05:59:25,2019-08-23T20:08:32,0.75,Clear,Clear conditions throughout the day.,clear-day,"03660099999,03672099999,03768099999,03781099999,D4121,03772099999,03770099999"
Heathrow Airport,24/08/2019,29.8,13.1,21.7,28.7,13.1,21.5,12.5,60.95,0,,0,,,,0,20.4,140.8,1019.2,23.4,26.7,376.6,20.3,8,,2019-08-24T06:01:01,2019-08-24T20:06:25,0.8,Partially cloudy,Partly cloudy throughout the day.,partly-cloudy-day,"03660099999,03672099999,03768099999,03781099999,D4121,03772099999,03770099999"
Heathrow Airport,25/08/2019,33.1,16.5,24.7,31.9,16.5,24.2,12.7,51.99,0,,0,,,,5.4,16.5,123.6,1017.7,24.1,25.8,337.8,15.8,7,,2019-08-25T06:02:36,2019-08-25T20:04:17,0.85,Partially cloudy,Clearing in the afternoon.,partly-cloudy-day,"03660099999,03672099999,03768099999,03781099999,D4121,03772099999,03770099999"
Heathrow Airport,26/08/2019,32.8,17,24.8,31.8,17,24.5,13.8,53.8,0,,0,,,,5.4,20.5,161.7,1017.5,0.4,28,380.2,20.5,7,,2019-08-26T06:04:12,2019-08-26T20:02:08,0.9,Clear,Clear conditions throughout the day.,clear-day,"03660099999,03672099999,03768099999,03781099999,D4121,03772099999,03770099999"
Heathrow Airport,27/08/2019,33,16.6,24.5,32.3,16.6,24.3,14.6,57.27,0,,0,,,,,18.3,205.2,1014.2,9.6,23.2,345.5,18.7,7,,2019-08-27T06:05:47,2019-08-27T19:59:59,0.94,Clear,Clear conditions throughout the day.,clear-day,"03660099999,03672099999,03768099999,03781099999,D4121,03772099999,03770099999"
Heathrow Airport,28/08/2019,25.6,18.1,20.5,25.6,18.1,20.5,13.8,67.16,0.4,,8.33,,,,,24.1,231.7,1013.7,82.8,35.5,246.5,12.4,6,,2019-08-28T06:07:23,2019-08-28T19:57:49,0.98,"Rain, Partially cloudy",Partly cloudy throughout the day with rain in the morning and afternoon.,rain,"03660099999,03672099999,03768099999,03781099999,D4121,03772099999,03770099999"
Heathrow Airport,29/08/2019,23.3,11.2,17.8,23.3,11.2,17.7,10.9,66.83,2,,4.17,,,,29.5,22.3,246.3,1019.2,39.7,42.7,321,17.3,7,,2019-08-29T06:08:58,2019-08-29T19:55:38,1,"Rain, Partially cloudy",Partly cloudy throughout the day with early morning rain.,rain,"03660099999,03672099999,03768099999,03781099999,D4121,03772099999,03770099999"
Heathrow Airport,30/08/2019,24.1,13.3,18.2,24.1,13.3,18.2,11.8,68.66,0,,0,,,,48.2,25.9,205,1020.6,22.7,32.3,312.4,15.7,6,,2019-08-30T06:10:34,2019-08-30T19:53:26,0,Partially cloudy,Partly cloudy throughout the day.,partly-cloudy-day,"03660099999,03672099999,03768099999,03781099999,D4121,03772099999,03770099999"
Heathrow Airport,31/08/2019,24.1,12.5,17.2,24.1,12.5,17.2,11.5,70.84,0.4,,8.33,,,,59.3,29.5,230,1012.7,29.7,36.1,283.3,14.3,7,,2019-08-31T06:12:09,2019-08-31T19:51:14,0.01,"Rain, Partially cloudy",Partly cloudy throughout the day with rain.,rain,"03660099999,03672099999,03768099999,03781099999,D4121,03772099999,03770099999"
Heathrow Airport,01/09/2019,20.1,11.6,15.8,20.1,11.6,15.7,6.8,58.11,0,,0,,,,51.8,24.1,282.1,1017.7,40.4,45.2,323.7,16.3,6,,2019-09-01T06:13:45,2019-09-01T19:49:01,0.03,Partially cloudy,Partly cloudy throughout the day.,partly-cloudy-day,"03660099999,03672099999,03768099999,03781099999,D4121,03772099999,03770099999"
Heathrow Airport,02/09/2019,22.6,8.8,15.9,22.6,7.7,15.8,8,61.22,0,,0,,,,,27.7,248.5,1023.6,49.1,37.7,301.1,15.2,7,,2019-09-02T06:15:20,2019-09-02T19:46:47,0.07,Partially cloudy,Becoming cloudy in the afternoon.,partly-cloudy-day,"03660099999,03672099999,03768099999,03781099999,D4121,03772099999,03770099999"
Heathrow Airport,03/09/2019,21.5,15.3,18,21.5,15.3,17.9,11.6,66.9,0,,0,,,,38.9,27.7,237.1,1022.8,84.4,41.3,193,9.7,5,,2019-09-03T06:16:56,2019-09-03T19:44:33,0.11,Partially cloudy,Partly cloudy throughout the day.,partly-cloudy-day,"03660099999,03672099999,03768099999,03781099999,D4121,03772099999,03770099999"
Heathrow Airport,04/09/2019,20.6,14.3,17.2,20.6,14.3,17.2,10.9,69.65,8.19,,8.33,,,,55.4,33.4,244.6,1015.8,60.8,36.4,321.5,16.2,8,,2019-09-04T06:18:31,2019-09-04T19:42:19,0.16,"Rain, Partially cloudy",Partly cloudy throughout the day with rain in the morning and afternoon.,rain,"03660099999,03672099999,03768099999,03781099999,D4121,03772099999,03770099999"
Heathrow Airport,05/09/2019,18.3,12.1,15,18.3,12.1,14.9,6.2,57.36,0,,0,,,,31.7,20.5,304.2,1024.6,37.9,40.3,327.1,16.5,7,,2019-09-05T06:20:07,2019-09-05T19:40:04,0.22,Partially cloudy,Partly cloudy throughout the day.,partly-cloudy-day,"03660099999,03672099999,03768099999,03781099999,D4121,03772099999,03770099999"
Heathrow Airport,06/09/2019,18.8,9.3,13.9,18.8,8,13.8,9.9,77.34,0.78,,4.17,,,,53.6,31.6,240.4,1022.6,42.2,31.7,117.9,5.9,3,,2019-09-06T06:21:42,2019-09-06T19:37:49,0.27,"Rain, Partially cloudy",Partly cloudy throughout the day with late afternoon rain.,rain,"03660099999,03672099999,03768099999,03781099999,D4121,03772099999,03770099999"
Heathrow Airport,07/09/2019,17.3,11.6,14.4,17.3,11.6,14.3,7.7,65.63,0,,0,,,,,18.4,227.1,1023.1,71.1,37.1,182.2,9.2,4,,2019-09-07T06:23:17,2019-09-07T19:35:33,0.32,Partially cloudy,Partly cloudy throughout the day.,partly-cloudy-day,"03660099999,03672099999,03768099999,03781099999,D4121,03772099999,03770099999"
Heathrow Airport,08/09/2019,18.5,6.6,12.8,18.5,6.2,12.5,4.9,62.25,0.2,,4.17,,,,,12.9,259.8,1023.7,25.8,37.8,322.7,16.3,7,,2019-09-08T06:24:53,2019-09-08T19:33:17,0.37,"Rain, Partially cloudy",Partly cloudy throughout the day with afternoon rain.,rain,"03660099999,03672099999,03768099999,03781099999,D4121,03772099999,03770099999"
Heathrow Airport,09/09/2019,15.8,12.3,13.9,15.8,12.3,13.9,9.8,76.74,2.34,,8.33,,,,,18.3,173.8,1013.8,89.1,33.6,86.2,4.3,2,,2019-09-09T06:26:28,2019-09-09T19:31:00,0.41,"Rain, Partially cloudy",Partly cloudy throughout the day with rain in the morning and afternoon.,rain,"03660099999,03672099999,03768099999,03781099999,D4121,03772099999,03770099999"
Heathrow Airport,10/09/2019,20.1,10.6,15.5,20.1,10.6,15.4,10.3,72.8,0,,0,,,,,16.5,274.1,1018.4,56.7,30.2,238.3,12,6,,2019-09-10T06:28:03,2019-09-10T19:28:43,0.44,Partially cloudy,Partly cloudy throughout the day.,partly-cloudy-day,"03660099999,03672099999,03768099999,03781099999,D4121,03772099999,03770099999"
Heathrow Airport,11/09/2019,21.3,13.5,17.5,21.3,13.5,17.4,12.9,74.47,0.6,,8.33,,,,50,31.6,236.3,1020.1,81.6,40.4,34.3,0.4,1,,2019-09-11T06:29:39,2019-09-11T19:26:26,0.47,"Rain, Partially cloudy",Partly cloudy throughout the day with rain.,rain,"03660099999,03672099999,03768099999,03781099999,D4121,03772099999,03770099999"
Heathrow Airport,12/09/2019,24.8,12.7,18.5,24.8,12.7,18.5,14.2,77.37,0.2,,4.17,,,,,27.7,231.7,1026.7,62.9,36.5,54.5,0.4,1,,2019-09-12T06:31:14,2019-09-12T19:24:09,0.49,"Rain, Partially cloudy",Partly cloudy throughout the day with afternoon rain.,rain,"03660099999,03672099999,03768099999,03781099999,D4121,03772099999,03770099999"
Heathrow Airport,13/09/2019,22.5,13.5,17.6,22.5,13.5,17.6,8.5,58.86,0.4,,4.17,,,,,14.7,135.8,1033.6,28,38.5,357.8,18,7,,2019-09-13T06:32:50,2019-09-13T19:21:51,0.5,"Rain, Partially cloudy",Clearing in the afternoon with morning rain.,rain,"03660099999,03672099999,03768099999,03781099999,D4121,03772099999,03770099999"
Heathrow Airport,14/09/2019,23.5,9.6,16.6,23.5,9.6,16.6,7,58.67,0,,0,,,,,12.8,163,1032.4,0.2,34.1,365.4,17.1,7,,2019-09-14T06:34:25,2019-09-14T19:19:33,0.5,Clear,Clear conditions throughout the day.,clear-day,"03660099999,03672099999,03768099999,03781099999,D4121,03772099999,03770099999"
Heathrow Airport,15/09/2019,26.3,10.1,18,26.3,10.1,18,11.4,67.46,0,,0,,,,,14.7,269.3,1024.5,2.8,36.8,354.4,16.6,6,,2019-09-15T06:36:01,2019-09-15T19:17:15,0.51,Clear,Clear conditions throughout the day.,clear-day,"03660099999,03672099999,03768099999,03781099999,D4121,03772099999,03770099999"
Heathrow Airport,16/09/2019,20,15.4,17.1,20,15.4,17.1,14.2,83.64,0.6,,8.33,,,,,14.7,201.7,1022.1,88.7,19.3,90.6,4.2,2,,2019-09-16T06:37:36,2019-09-16T19:14:57,0.53,"Rain, Partially cloudy",Partly cloudy throughout the day with rain.,rain,"03660099999,03672099999,03768099999,03781099999,D4121,03772099999,03770099999"
Heathrow Airport,17/09/2019,19.8,9.6,14.9,19.8,8.7,14.8,7.2,62.29,0,,0,,,,,14.8,194.2,1025.2,15.5,33.3,359.2,16.8,7,,2019-09-17T06:39:12,2019-09-17T19:12:39,0.55,Clear,Clear conditions throughout the day.,clear-day,"03660099999,03672099999,03768099999,03781099999,D4121,03772099999,03770099999"
Heathrow Airport,18/09/2019,19.6,8,13.9,19.6,6.8,13.8,5.3,58.55,0,,0,,,,,11.2,93.7,1029.5,0,28,347.9,16.3,6,,2019-09-18T06:40:48,2019-09-18T19:10:21,0.59,Clear,Clear conditions throughout the day.,clear-day,"03660099999,03672099999,03768099999,03781099999,D4121,03772099999,03770099999"
Heathrow Airport,19/09/2019,21.8,8.3,14.8,21.8,8.3,14.8,7.8,65.47,0,,0,,,,,20.5,145.4,1030.9,0.1,30.2,334.7,15.7,6,,2019-09-19T06:42:24,2019-09-19T19:08:02,0.63,Clear,Clear conditions throughout the day.,clear-day,"03660099999,03672099999,03768099999,03781099999,D4121,03772099999,03770099999"
Heathrow Airport,20/09/2019,22,10,15.6,22,10,15.5,8.4,66.03,0,,0,,,,,24.1,74.1,1025.5,0,26,342.8,16,6,,2019-09-20T06:44:00,2019-09-20T19:05:44,0.67,Clear,Clear conditions throughout the day.,clear-day,"03660099999,03672099999,03768099999,03781099999,D4121,03772099999,03770099999"
Heathrow Airport,21/09/2019,26.3,12.3,18.2,26.3,12.3,18.2,8.4,54.85,0,,0,,,,,24.1,87.5,1012.7,0,31.3,325,14,6,,2019-09-21T06:45:36,2019-09-21T19:03:26,0.72,Clear,Clear conditions throughout the day.,clear-day,"03660099999,03672099999,03768099999,03781099999,D4121,03772099999,03770099999"
Heathrow Airport,22/09/2019,21.8,15.1,18,21.8,15.1,17.9,14.3,79.51,2.02,,12.5,,,,,22.2,155,1004.3,67.5,24.4,90.7,4.2,2,,2019-09-22T06:47:12,2019-09-22T19:01:07,0.78,"Rain, Partially cloudy",Partly cloudy throughout the day with rain.,rain,"03660099999,03672099999,03768099999,03781099999,D4121,03772099999,03770099999"
Heathrow Airport,23/09/2019,19.1,13.6,15.8,19.1,13.6,15.8,12.9,83.52,1.2,,8.33,,,,38.9,24.1,192.1,1009.7,66.7,22,162.8,7.6,4,,2019-09-23T06:48:48,2019-09-23T18:58:49,0.83,"Rain, Partially cloudy",Partly cloudy throughout the day with rain.,rain,"03660099999,03672099999,03768099999,03781099999,D4121,03772099999,03770099999"
Heathrow Airport,24/09/2019,19.8,14.8,16.9,19.8,14.8,16.8,15.3,90.67,26.45,,16.67,,,,45.5,25.9,190,1002,70.9,19.9,155.1,6.7,5,,2019-09-24T06:50:25,2019-09-24T18:56:31,0.88,"Rain, Partially cloudy",Partly cloudy throughout the day with a chance of rain throughout the day.,rain,"03660099999,03672099999,03768099999,03781099999,D4121,03772099999,03770099999"
Heathrow Airport,25/09/2019,22.1,14.8,17.2,22.1,14.8,17.1,14.2,83.44,4.2,,12.5,,,,51.8,27.7,218.8,1000.4,76.6,30.9,178.8,8.4,4,,2019-09-25T06:52:01,2019-09-25T18:54:13,0.93,"Rain, Partially cloudy",Partly cloudy throughout the day with a chance of rain throughout the day.,rain,"03660099999,03672099999,03768099999,03781099999,D4121,03772099999,03770099999"
Heathrow Airport,26/09/2019,20,14.1,16.9,20,14.1,16.8,13.9,83.44,4.35,,12.5,,,,53.6,31.6,216.5,1002.8,66.2,22,132.8,5.7,3,,2019-09-26T06:53:38,2019-09-26T18:51:55,0.97,"Rain, Partially cloudy",Partly cloudy throughout the day with a chance of rain throughout the day.,rain,"03660099999,03672099999,03768099999,03781099999,D4121,03772099999,03770099999"
Heathrow Airport,27/09/2019,18.5,13.1,15.3,18.5,13.1,15.3,11.9,80.49,8.94,,16.67,,,,59.4,33.5,213.8,1004,29.6,14.6,187.6,8.8,4,,2019-09-27T06:55:15,2019-09-27T18:49:37,0.99,"Rain, Partially cloudy",Partly cloudy throughout the day with a chance of rain throughout the day.,rain,"03660099999,03672099999,03768099999,03781099999,D4121,03772099999,03770099999"
Heathrow Airport,28/09/2019,19,12.1,15.4,19,12.1,15.4,11.2,77.12,1,,8.33,,,,53.6,38.8,221.5,1008.2,68.3,22.3,130.2,5.6,3,,2019-09-28T06:56:52,2019-09-28T18:47:20,1,"Rain, Partially cloudy",Partly cloudy throughout the day with rain.,rain,"03660099999,03672099999,03768099999,03781099999,D4121,03772099999,03770099999"
Heathrow Airport,29/09/2019,19.5,13.5,16.2,19.5,13.5,16.1,14.2,88.46,12.29,,16.67,,,,57.7,35.2,230.4,997.8,77.9,29.4,112,4.8,3,,2019-09-29T06:58:30,2019-09-29T18:45:02,0,"Rain, Partially cloudy",Partly cloudy throughout the day with a chance of rain throughout the day.,rain,"03660099999,03672099999,03768099999,03781099999,D4121,03772099999,03770099999"
Heathrow Airport,30/09/2019,17.3,10.3,14.1,17.3,10.3,14,11.8,86.82,3,,8.33,,,,29.5,20.5,211.7,1008.9,67,31.6,127.3,5.5,3,,2019-09-30T07:00:07,2019-09-30T18:42:45,0.02,"Rain, Partially cloudy",Partly cloudy throughout the day with rain.,rain,"03660099999,03672099999,03768099999,03781099999,D4121,03772099999,03770099999"
Heathrow Airport,01/10/2019,20.3,11.3,15.8,20.3,11.3,15.8,13.6,87.33,10.09,,12.5,,,,42.5,20.5,180.5,999.9,68.3,21.1,184.4,7.3,4,,2019-10-01T07:01:45,2019-10-01T18:40:28,0.05,"Rain, Partially cloudy",Partly cloudy throughout the day with rain.,rain,"03660099999,03672099999,03768099999,03781099999,D4121,03772099999,03770099999"
Heathrow Airport,02/10/2019,13.9,6.6,10.3,13.9,6.6,10.2,4.7,69.78,4.18,,8.7,,,,16.6,16.6,262.1,1017,20.8,39.3,246.3,10.6,6,,2019-10-02T07:03:23,2019-10-02T18:38:12,0.09,"Rain, Partially cloudy",Becoming cloudy in the afternoon with rain.,rain,"03660099999,03672099999,03768099999,03781099999,D4121,03772099999,03770099999"
Heathrow Airport,03/10/2019,14.3,4.3,9.3,14.3,3.5,9.1,6,81.31,0,,0,,,,38.9,24.1,174.2,1017.2,53.7,21.4,104.4,4.9,2,,2019-10-03T07:05:01,2019-10-03T18:35:56,0.14,Partially cloudy,Partly cloudy throughout the day.,partly-cloudy-day,"03660099999,03672099999,03768099999,03781099999,D4121,03772099999,03770099999"
Heathrow Airport,04/10/2019,15.3,11.6,13.4,15.3,11.6,13.4,11.3,87.47,2.12,,12.5,,,,37.1,31.6,253.8,1005.3,65.3,16.2,93.8,4.4,2,,2019-10-04T07:06:40,2019-10-04T18:33:40,0.19,"Rain, Partially cloudy",Partly cloudy throughout the day with rain.,rain,"03660099999,03672099999,03768099999,03781099999,D4121,03772099999,03770099999"
Heathrow Airport,05/10/2019,15.8,11.3,13.4,15.8,11.3,13.4,10.4,82.48,0,,0,,,,,14.8,114.2,1013.8,94.4,25.4,103.8,4.5,2,,2019-10-05T07:08:18,2019-10-05T18:31:25,0.24,Overcast,Cloudy skies throughout the day.,cloudy,"03660099999,03672099999,03768099999,03781099999,D4121,03772099999,03770099999"
Heathrow Airport,06/10/2019,16.6,11.6,14.2,16.6,11.6,14.1,10.5,80.29,19.71,,16.67,,,,57.6,27.7,243.8,1011,70.3,16.9,178.3,7.7,4,,2019-10-06T07:09:57,2019-10-06T18:29:11,0.29,"Rain, Partially cloudy",Partly cloudy throughout the day with a chance of rain throughout the day.,rain,"03660099999,03672099999,03768099999,03781099999,D4121,03772099999,03770099999"
Heathrow Airport,07/10/2019,15.1,10.3,13.1,15.1,10.3,13.1,11.4,89.49,2,,16.67,,,,35.3,22.3,177.5,1014.4,83.3,24.6,70.6,2,2,,2019-10-07T07:11:37,2019-10-07T18:26:56,0.34,"Rain, Partially cloudy",Partly cloudy throughout the day with a chance of rain throughout the day.,rain,"03660099999,03672099999,03768099999,03781099999,D4121,03772099999,03770099999"
Heathrow Airport,08/10/2019,17.5,11.3,13.9,17.5,11.3,13.8,10.9,82.68,3.61,,8.33,,,,50,31.6,234.2,1007.1,55.8,17.6,165.7,7.2,4,,2019-10-08T07:13:16,2019-10-08T18:24:43,0.38,"Rain, Partially cloudy",Partly cloudy throughout the day with rain.,rain,"03660099999,03672099999,03768099999,03781099999,D4121,03772099999,03770099999"
Heathrow Airport,09/10/2019,15.1,9.8,12.2,15.1,7.8,12.1,7.7,74.46,0.4,,8.33,,,,53.6,35.2,240.4,1005.3,68.3,28.9,224.1,9.7,4,,2019-10-09T07:14:56,2019-10-09T18:22:29,0.42,"Rain, Partially cloudy",Partly cloudy throughout the day with rain.,rain,"03660099999,03672099999,03768099999,03781099999,D4121,03772099999,03770099999"
Heathrow Airport,10/10/2019,17.3,8.6,13,17.3,5.9,12,9.1,78.71,0.2,,4.17,,,,48.2,29.5,234.2,1010.9,42.5,25.3,221.5,8.8,5,,2019-10-10T07:16:36,2019-10-10T18:20:17,0.45,"Rain, Partially cloudy",Becoming cloudy in the afternoon with early morning rain.,rain,"03660099999,03672099999,03768099999,03781099999,D4121,03772099999,03770099999"
Heathrow Airport,11/10/2019,16.8,12.6,15.5,16.8,12.6,15.4,13.4,87.45,7,,16.67,,,,55.4,35.2,220.9,1006.7,81.7,22.7,70.5,2.8,2,,2019-10-11T07:18:17,2019-10-11T18:18:05,0.47,"Rain, Partially cloudy",Partly cloudy throughout the day with a chance of rain throughout the day.,rain,"03660099999,03672099999,03768099999,03781099999,D4121,03772099999,03770099999"
Heathrow Airport,12/10/2019,12.6,10.6,11.7,12.6,10.6,11.6,10.8,94.57,14.99,,16.67,,,,,16.5,194.6,1008,89.5,13.3,60.2,2.4,1,,2019-10-12T07:19:57,2019-10-12T18:15:54,0.49,"Rain, Partially cloudy",Partly cloudy throughout the day with a chance of rain throughout the day.,rain,"03660099999,03672099999,03768099999,03781099999,D4121,03772099999,03770099999"
Heathrow Airport,13/10/2019,17.1,11,13.5,17.1,11,13.5,11.5,87.84,10.43,,12.5,,,,51.8,33.4,165,1004.4,72.1,24.5,74.9,3,2,,2019-10-13T07:21:38,2019-10-13T18:13:43,0.5,"Rain, Partially cloudy",Partly cloudy throughout the day with a chance of rain throughout the day.,rain,"03660099999,03672099999,03768099999,03781099999,D4121,03772099999,03770099999"
Heathrow Airport,14/10/2019,15.6,10.3,12.7,15.6,10.3,12.7,11.6,92.88,7.8,,12.5,,,,,20.5,108.3,1006,90,18.8,39.1,1.5,1,,2019-10-14T07:23:20,2019-10-14T18:11:33,0.5,"Rain, Partially cloudy",Partly cloudy throughout the day with rain.,rain,"03660099999,03672099999,03768099999,03781099999,D4121,03772099999,03770099999"
Heathrow Airport,15/10/2019,16.8,10.8,12.9,16.8,10.8,12.9,10.3,84.85,4.99,,12.5,,,,,25.9,217.7,1003.9,72.8,21.8,167.8,6.6,4,,2019-10-15T07:25:01,2019-10-15T18:09:24,0.52,"Rain, Partially cloudy",Partly cloudy throughout the day with rain.,rain,"03660099999,03672099999,03768099999,03781099999,D4121,03772099999,03770099999"
Heathrow Airport,16/10/2019,15.3,10.1,13.1,15.3,10.1,13.1,9.6,80.65,0.8,,8.33,,,,44.6,27.7,212.5,1003.1,64.6,22.8,140.8,5.6,3,,2019-10-16T07:26:43,2019-10-16T18:07:16,0.53,"Rain, Partially cloudy",Partly cloudy throughout the day with rain in the morning and afternoon.,rain,"03660099999,03672099999,03768099999,03781099999,D4121,03772099999,03770099999"
Heathrow Airport,17/10/2019,15.3,8.6,11.6,15.3,8,11.4,9.3,85.9,7,,12.5,,,,,22.3,177.9,1005.5,63.6,23.1,117.5,4.7,2,,2019-10-17T07:28:26,2019-10-17T18:05:09,0.56,"Rain, Partially cloudy",Partly cloudy throughout the day with rain.,rain,"03660099999,03672099999,03768099999,03781099999,D4121,03772099999,03770099999"
Heathrow Airport,18/10/2019,14.4,9.6,11.8,14.4,7.1,11.5,8.8,82.43,14.01,,16.67,,,,57.5,35.2,202.5,999.7,55,21.5,175.7,7,4,,2019-10-18T07:30:08,2019-10-18T18:03:02,0.6,"Rain, Partially cloudy",Partly cloudy throughout the day with a chance of rain throughout the day.,rain,"03660099999,03672099999,03768099999,03781099999,D4121,03772099999,03770099999"
Heathrow Airport,19/10/2019,14.4,9.3,11.4,14.4,7.3,11,8.1,80.8,1,,12.5,,,,38.9,24.1,217.5,1000.7,35,26.4,189.6,7.5,4,,2019-10-19T07:31:51,2019-10-19T18:00:57,0.65,"Rain, Partially cloudy",Becoming cloudy in the afternoon with rain.,rain,"03660099999,03672099999,03768099999,03781099999,D4121,03772099999,03770099999"
Heathrow Airport,20/10/2019,12.1,4.6,8.9,12.1,3.5,8.8,6.7,86.34,0.6,,12.5,,,,,14.8,205.3,1010.1,55.1,21.8,137.2,5.4,3,,2019-10-20T07:33:34,2019-10-20T17:58:52,0.7,"Rain, Partially cloudy",Partly cloudy throughout the day with rain.,rain,"03660099999,03672099999,03768099999,03781099999,D4121,03772099999,03770099999"
Heathrow Airport,21/10/2019,13.1,10.6,11.6,13.1,10.6,11.6,8.9,83.56,0.8,,12.5,,,,,18.4,292.1,1018.2,85.4,24.6,75.4,3,1,,2019-10-21T07:35:18,2019-10-21T17:56:48,0.75,"Rain, Partially cloudy",Partly cloudy throughout the day with a chance of rain throughout the day.,rain,"03660099999,03672099999,03768099999,03781099999,D4121,03772099999,03770099999"
Heathrow Airport,22/10/2019,15.8,6.8,10.8,15.8,6.6,10.5,6.8,78.26,0,,0,,,,,11.2,246.4,1023.3,22.1,18.3,223.1,8.8,4,,2019-10-22T07:37:02,2019-10-22T17:54:46,0.81,Partially cloudy,Partly cloudy throughout the day.,partly-cloudy-day,"03660099999,03672099999,03768099999,03781099999,D4121,03772099999,03770099999"
Heathrow Airport,23/10/2019,14.5,4.3,9.7,14.5,4.3,9.6,8,89.53,0.4,,8.33,,,,,14.7,72.4,1014.2,68.7,11.7,89.8,3.6,2,,2019-10-23T07:38:46,2019-10-23T17:52:44,0.86,"Rain, Partially cloudy",Partly cloudy throughout the day with rain in the morning and afternoon.,rain,"03660099999,03672099999,03768099999,03781099999,D4121,03772099999,03770099999"
Heathrow Airport,24/10/2019,12.8,10.6,11.9,12.8,10.6,11.9,11,94.07,6.43,,16.67,,,,,20.5,235.9,1005.3,81.6,10.4,28.5,1.1,1,,2019-10-24T07:40:30,2019-10-24T17:50:44,0.91,"Rain, Partially cloudy",Partly cloudy throughout the day with a chance of rain throughout the day.,rain,"03660099999,03672099999,03768099999,03781099999,D4121,03772099999,03770099999"
Heathrow Airport,25/10/2019,16.5,9.8,13.1,16.5,8,12.9,11.1,87.53,1.8,,16.67,,,,70.5,44.6,195,1011.4,81.2,22.8,69.5,2.8,1,,2019-10-25T07:42:15,2019-10-25T17:48:45,0.95,"Rain, Partially cloudy",Partly cloudy throughout the day with a chance of rain throughout the day.,rain,"03660099999,03672099999,03768099999,03781099999,D4121,03772099999,03770099999"
Heathrow Airport,26/10/2019,16.8,7.1,14,16.8,5.2,13.5,11.4,85.04,6.64,,12.5,,,,64.8,44.2,233.3,1008.1,92.4,15.8,36.1,1.2,1,,2019-10-26T07:43:59,2019-10-26T17:46:47,0.98,"Rain, Overcast",Cloudy skies throughout the day with rain.,rain,"03660099999,03672099999,03768099999,03781099999,D4121,03772099999,03770099999"
Heathrow Airport,27/10/2019,11.8,4.3,7.3,11.8,2.5,6.1,3.9,79.79,0.2,,4,,,,,12.9,285.2,1023.1,22.6,26.2,179.1,7.1,4,,2019-10-27T06:45:45,2019-10-27T16:44:50,1,"Rain, Partially cloudy",Partly cloudy throughout the day with early morning rain.,rain,"03660099999,03672099999,03768099999,03781099999,D4121,03772099999,03770099999"
Heathrow Airport,28/10/2019,10.6,1.1,6.4,10.6,0.3,5.6,3.8,84.51,0.2,,4.17,,,,,14.8,144.4,1024.9,52.1,16.6,154.9,3.9,4,,2019-10-28T06:47:30,2019-10-28T16:42:55,0,"Rain, Partially cloudy",Partly cloudy throughout the day with afternoon rain.,rain,"03660099999,03672099999,03768099999,03781099999,D4121,03772099999,03770099999"
Heathrow Airport,29/10/2019,11.3,6.6,8.9,11.3,3.8,7.6,4.7,74.95,0,,0,,,,37.1,16.6,53.8,1025.1,89.9,32.6,90.1,3.6,2,,2019-10-29T06:49:15,2019-10-29T16:41:01,0.01,Partially cloudy,Partly cloudy throughout the day.,partly-cloudy-day,"03660099999,03672099999,03768099999,03781099999,D4121,03772099999,03770099999"
Heathrow Airport,30/10/2019,12.1,7.3,9.1,12.1,4.8,7.8,4.5,73.56,0,,0,,,,51.8,27.7,64.6,1024,58,22.4,175.1,6.9,4,,2019-10-30T06:51:01,2019-10-30T16:39:09,0.04,Partially cloudy,Partly cloudy throughout the day.,partly-cloudy-day,"03660099999,03672099999,03768099999,03781099999,D4121,03772099999,03770099999"
Heathrow Airport,31/10/2019,11.7,6.7,8.6,11.7,4.1,7,5.6,81.91,0,,0,,,,,24.1,90,1018.8,55.1,7.9,148.8,5.9,3,,2019-10-31T06:52:47,2019-10-31T16:37:18,0.07,Partially cloudy,Partly cloudy throughout the day.,partly-cloudy-day,"03660099999,03672099999,03768099999,03781099999,D4121,03772099999,03770099999"
Heathrow Airport,01/11/2019,15.8,8.8,13.2,15.8,7.3,12.9,12.2,94.07,3.2,,8.33,,,,,24.1,162.1,999.2,92.8,18.9,56.8,1.8,1,,2019-11-01T06:54:32,2019-11-01T16:35:28,0.11,"Rain, Overcast",Cloudy skies throughout the day with rain in the morning and afternoon.,rain,"03660099999,03672099999,03768099999,03781099999,D4121,03772099999,03770099999"
Heathrow Airport,02/11/2019,14.6,10.1,11.9,14.6,10.1,11.9,9.1,83.15,9.21,,16.67,,,,75.9,42.5,212.9,980.8,67.9,22.2,55.1,2,2,,2019-11-02T06:56:18,2019-11-02T16:33:40,0.16,"Rain, Partially cloudy",Partly cloudy throughout the day with a chance of rain throughout the day.,rain,"03660099999,03672099999,03768099999,03781099999,D4121,03772099999,03770099999"
Heathrow Airport,03/11/2019,11.6,6.3,9.2,11.6,4.1,8,7.4,88.25,0.41,,8.33,,,,,18.3,216.7,981.7,48.3,20.7,93.2,3.4,3,,2019-11-03T06:58:04,2019-11-03T16:31:53,0.21,"Rain, Partially cloudy",Partly cloudy throughout the day with rain.,rain,"03660099999,03672099999,03768099999,03781099999,D4121,03772099999,03770099999"
Heathrow Airport,04/11/2019,12.1,6.8,9,12.1,5.4,8.3,7.7,91.74,3.8,,16.67,,,,,12.9,137.6,984.1,49.2,21.7,88,3.2,2,,2019-11-04T06:59:50,2019-11-04T16:30:09,0.25,"Rain, Partially cloudy",Partly cloudy throughout the day with a chance of rain throughout the day.,rain,"03660099999,03672099999,03768099999,03781099999,D4121,03772099999,03770099999"
Heathrow Airport,05/11/2019,12.3,6.7,9.6,12.3,4.8,8.8,8.4,92.18,1.02,,8.33,,,,37.1,18.4,212.5,997,83.7,15.2,56.6,1.6,1,,2019-11-05T07:01:36,2019-11-05T16:28:26,0.3,"Rain, Partially cloudy",Partly cloudy throughout the day with rain in the morning and afternoon.,rain,"03660099999,03672099999,03768099999,03781099999,D4121,03772099999,03770099999"
Heathrow Airport,06/11/2019,9.1,3.6,6.9,8.1,2.2,5.3,4.6,85.39,0.47,,8.33,,,,,14.7,216.3,1003.6,55,18,108.4,3.9,3,,2019-11-06T07:03:22,2019-11-06T16:26:44,0.35,"Rain, Partially cloudy",Partly cloudy throughout the day with rain.,rain,"03660099999,03672099999,03768099999,03781099999,D4121,03772099999,03770099999"
Heathrow Airport,07/11/2019,10.5,3.8,7.8,10.5,3.2,5.5,5.5,86.15,9,,10.53,,,,53.6,29.5,205.7,992.8,49.9,32.1,205.9,5.2,3,,2019-11-07T07:05:08,2019-11-07T16:25:05,0.39,"Rain, Partially cloudy",Clearing in the afternoon with rain clearing later.,rain,"03660099999,03672099999,03768099999,03781099999,D4121,03772099999,03770099999"
