Heathrow Airport,01/01/2020,6.8,2.9,5.4,6.3,0.3,4,3.9,90.37,0,,4.17,,,,,11.1,129,1029.3,90.3,6.3,23.3,0.7,0,,2020-01-01T08:07:25,2020-01-01T16:03:03,0.17,Overcast,3,cloudy,"03660099999,03672099999,03768099999,03781099999,D4121,03772099999,03770099999",Cloudy skies throughout the day.
Heathrow Airport,02/01/2020,10.8,6.7,8.8,10.8,3.8,7.2,7.1,89.27,0,,8.33,,,,48.2,27.7,188.3,1020.4,93.2,22,38.1,1.2,1,,2020-01-02T08:07:19,2020-01-02T16:04:06,0.22,Overcast,3,cloudy,"03660099999,03672099999,03768099999,03781099999,D4121,03772099999,03770099999",Cloudy skies throughout the day.
Heathrow Airport,03/01/2020,10.6,4.8,8.3,10.6,2,6.4,5.2,81.85,0.82,,12.5,,,,51.5,25.9,265.4,1021.4,48.9,25.4,62.6,1.8,1,,2020-01-03T08:07:10,2020-01-03T16:05:12,0.26,Rain,1,rain,"03660099999,03672099999,03768099999,03781099999,D4121,03772099999,03770099999",Partly cloudy throughout the day with a chance of rain throughout the day.
Heathrow Airport,04/01/2020,8.8,2.9,6.3,6.5,-0.5,3.6,3.2,80.82,0,,0,,,,35.3,25.9,248.8,1034.2,79.4,33.3,64.9,1.9,1,,2020-01-04T08:06:58,2020-01-04T16:06:21,0.31,Partially cloudy,2,partly-cloudy-day,"03660099999,03672099999,03768099999,03781099999,D4121,03772099999,03770099999",Partly cloudy throughout the day.
Heathrow Airport,05/01/2020,9,6.5,7.8,6.1,3.2,5.1,5,82.9,0,,0,,,,,25.9,224.6,1033.2,96.5,40.4,44.3,1.3,1,,2020-01-05T08:06:42,2020-01-05T16:07:32,0.36,Overcast,3,cloudy,"03660099999,03672099999,03768099999,03781099999,D4121,03772099999,03770099999",Cloudy skies throughout the day.
Heathrow Airport,06/01/2020,8.6,6.6,7.6,6.1,3.4,4.6,4.6,81.65,0.6,,4.17,,,,40.7,29.5,208.3,1022.2,76.2,27.5,58.9,1.7,1,,2020-01-06T08:06:23,2020-01-06T16:08:45,0.4,Rain,1,rain,"03660099999,03672099999,03768099999,03781099999,D4121,03772099999,03770099999",Partly cloudy throughout the day with late afternoon rain.
Heathrow Airport,07/01/2020,12.8,5.3,9.4,12.8,2.5,8.2,8.1,92.03,0.2,,16.67,,,,48.2,27.7,208.8,1021.8,74.9,17.7,68.1,2,2,,2020-01-07T08:06:00,2020-01-07T16:10:01,0.44,Rain,1,rain,"03660099999,03672099999,03768099999,03781099999,D4121,03772099999,03770099999",Partly cloudy throughout the day with early morning rain.
Heathrow Airport,08/01/2020,12.4,9.6,11.3,12.4,7.3,11.2,9.2,86.99,0.2,,12.5,,,,35.3,27.6,220.8,1020.6,89.1,21.1,51.6,1.5,1,,2020-01-08T08:05:35,2020-01-08T16:11:19,0.47,Rain,1,rain,"03680099999,03660099999,03672099999,03768099999,03781099999,D4121,03772099999,03770099999",Partly cloudy throughout the day with morning rain.
Heathrow Airport,09/01/2020,13.1,6.3,11,13.1,2,10.2,8.7,86.07,5.01,,16.67,,,,59.3,37,208.8,1006.8,67.4,27.5,54,1.6,1,,2020-01-09T08:05:06,2020-01-09T16:12:39,0.49,Rain,1,rain,"03680099999,03660099999,03672099999,03768099999,03781099999,D4121,03772099999,03770099999",Partly cloudy throughout the day with rain.
Heathrow Airport,10/01/2020,8.3,5.1,6.4,6.8,2,3.7,2.6,77.26,0.21,,12.5,,,,27.7,16.6,270.5,1023.1,64.5,34.3,62.6,1.8,1,,2020-01-10T08:04:34,2020-01-10T16:14:02,0.5,Rain,1,rain,"03660099999,03672099999,03768099999,03781099999,D4121,03772099999,03770099999",Partly cloudy throughout the day with rain clearing later.
Heathrow Airport,11/01/2020,10.9,5.8,9.3,10.9,2.4,7.5,6.2,81.14,0,,4.17,,,,64.7,40.6,205.5,1024.3,88,23.5,47.3,1.4,1,,2020-01-11T08:03:59,2020-01-11T16:15:26,0.51,Partially cloudy,2,wind,"03769099999,EGWU,EGLL,03672099999,03768099999,03781099999,03658099999,03772099999,03660099999,D4121,03761099999,EGLC,EGLF,03770099999",Partly cloudy throughout the day.
Heathrow Airport,12/01/2020,11.1,6,9.4,11.1,3.1,7.9,6.5,82.23,0.61,,8.33,,,,58.4,37,223.3,1018.2,48.4,33.8,75.9,2.2,2,,2020-01-12T08:03:20,2020-01-12T16:16:53,0.52,Rain,1,rain,"03769099999,03660099999,03672099999,03768099999,03781099999,D4121,03772099999,03770099999",Partly cloudy throughout the day with rain in the morning and afternoon.
Heathrow Airport,13/01/2020,11,5.1,8.3,11,2.6,5.6,6.4,88.15,0.4,,12.5,,,,68.4,42.5,188.5,1009.1,64.5,19.3,63.6,2.1,1,,2020-01-13T08:02:39,2020-01-13T16:18:21,0.55,Rain,1,rain,"EGWU,EGLL,03872099999,03672099999,03768099999,03781099999,03658099999,03772099999,03660099999,D4121,03761099999,EGLC,EGLF,03770099999",Partly cloudy throughout the day with rain in the morning and afternoon.
Heathrow Airport,14/01/2020,13,7.5,10.3,13,3.9,8.9,8.6,89.37,5.22,,12.5,,,,76,48.2,197.9,996,77.9,14.3,37.4,1.1,1,,2020-01-14T08:01:55,2020-01-14T16:19:51,0.59,Rain,1,rain,"03660099999,03672099999,03768099999,03781099999,D4121,03772099999,03770099999",Partly cloudy throughout the day with rain.
Heathrow Airport,15/01/2020,12.6,6.5,8.5,12.6,3.4,6.2,6,84.46,12.8,,12.5,,,,77.7,50,218.3,1006.7,51.7,21.2,69,2,2,,2020-01-15T08:01:07,2020-01-15T16:21:23,0.64,Rain,1,rain,"03660099999,03672099999,03768099999,03781099999,D4121,03772099999,03770099999",Partly cloudy throughout the day with a chance of rain throughout the day.
Heathrow Airport,16/01/2020,12.3,5.6,9.2,12.3,2.9,7.8,6.9,85.45,0.4,,4.17,,,,53.5,29.5,168.8,1014.4,60.1,21.4,57.9,1.9,1,,2020-01-16T08:00:17,2020-01-16T16:22:56,0.69,Rain,1,rain,"03660099999,03672099999,03768099999,03781099999,D4121,03772099999,03770099999",Partly cloudy throughout the day with late afternoon rain.
Heathrow Airport,17/01/2020,10.6,2.6,7.5,10.6,-1.5,4.6,4.9,84.26,4.06,,12.5,,,,66.6,40.7,220.4,1012.5,46.3,37.1,76.9,2.5,2,,2020-01-17T07:59:24,2020-01-17T16:24:31,0.75,Rain,1,rain,"03660099999,03672099999,03768099999,03781099999,D4121,03772099999,03770099999",Partly cloudy throughout the day with a chance of rain throughout the day.
Heathrow Airport,18/01/2020,7.8,0.8,3.5,5.6,-2.9,1.3,1,84.23,0,,4.17,,,,,14.7,284.2,1027.9,10.9,25.9,98.8,3.2,2,,2020-01-18T07:58:28,2020-01-18T16:26:08,0.81,Clear,0,clear-day,"03660099999,03672099999,03768099999,03781099999,D4121,03772099999,03770099999",Clear conditions throughout the day.
Heathrow Airport,19/01/2020,7.5,-0.7,2.4,7.5,-3.1,1.4,0,85.29,0.2,,4.17,,,,9.4,9.3,276.5,1044.3,10,19.1,92.7,3.3,2,,2020-01-19T07:57:29,2020-01-19T16:27:45,0.86,Rain,1,rain,"03660099999,03672099999,03768099999,03781099999,D4121,03772099999,03770099999",Clear conditions throughout the day with afternoon rain.
Heathrow Airport,20/01/2020,8.1,0.6,3.3,7.5,-1.8,2.3,0.9,84.54,0,,4.17,,,,,9.3,269.3,1047.7,52.1,15.7,84.4,3,2,,2020-01-20T07:56:27,2020-01-20T16:29:24,0.91,Partially cloudy,2,partly-cloudy-day,"03660099999,03672099999,03768099999,03781099999,D4121,03772099999,03770099999",Partly cloudy throughout the day.
Heathrow Airport,21/01/2020,7.8,-2,2.5,6.6,-4,1,0.8,89.16,0,,4.17,,,,,9.4,261.4,1041.9,15,9.5,102.4,3.7,2,,2020-01-21T07:55:23,2020-01-21T16:31:04,0.95,Clear,0,clear-day,"03660099999,03672099999,03768099999,03781099999,D4121,03772099999,03770099999",Clear conditions throughout the day.
Heathrow Airport,22/01/2020,8.1,1,5.5,7.6,1,4.9,4.8,95.51,0.2,,12.5,,,,,14.7,178,1037.6,96.1,7.6,33,1,1,,2020-01-22T07:54:16,2020-01-22T16:32:46,0.98,Rain,1,rain,"03660099999,03672099999,03768099999,03781099999,D4121,03772099999,03770099999",Cloudy skies throughout the day with late afternoon rain.
Heathrow Airport,23/01/2020,8,6.6,7.4,7.6,4.7,6.5,5.3,86.62,0,,4.17,,,,,12.9,156.8,1031.5,99.5,15.5,25.4,0.7,1,,2020-01-23T07:53:07,2020-01-23T16:34:28,0.99,Overcast,3,cloudy,"03660099999,03672099999,03768099999,03781099999,D4121,03772099999,03770099999",Cloudy skies throughout the day.
Heathrow Airport,24/01/2020,6.8,5.8,6.4,6.6,4.1,5.5,5.2,91.74,0,,8.33,,,,,11.1,268.1,1023.3,97.4,10.1,25.9,0.7,1,,2020-01-24T07:51:55,2020-01-24T16:36:11,1,Overcast,3,cloudy,"03660099999,03672099999,03768099999,03781099999,D4121,03772099999,03770099999",Cloudy skies throughout the day.
Heathrow Airport,25/01/2020,6.6,5.6,6,4.7,2.9,3.8,4.5,89.94,0,,4.17,,,,,14.7,161.3,1018.5,98.6,10.8,37.2,1.2,1,,2020-01-25T07:50:41,2020-01-25T16:37:55,0,Overcast,3,cloudy,"03660099999,03672099999,03768099999,03781099999,D4121,03772099999,03770099999",Cloudy skies throughout the day.
Heathrow Airport,26/01/2020,10.3,6.6,8.4,10.3,3.8,6.1,7.1,91.54,2.2,,12.5,,,,42.5,24.1,180.4,1009.6,70.9,13.5,69.5,2,1,,2020-01-26T07:49:24,2020-01-26T16:39:40,0.01,Rain,1,rain,"03660099999,03672099999,03768099999,03781099999,D4121,03772099999,03770099999",Partly cloudy throughout the day with rain.
Heathrow Airport,27/01/2020,9.1,5.5,7.3,7.4,2.2,4.6,5.7,89.93,7.4,,12.5,,,,44.6,24,203.3,999.8,67.1,27.5,53.3,1.5,1,,2020-01-27T07:48:05,2020-01-27T16:41:26,0.03,Rain,1,rain,"03660099999,03672099999,03768099999,03781099999,D4121,03772099999,03770099999",Partly cloudy throughout the day with rain.
Heathrow Airport,28/01/2020,7.3,2.3,4.4,3.2,-3,-0.2,1.5,81.89,1.99,,12.5,,,,53.6,33.4,246.3,996,32.6,39.5,106.1,3.8,3,,2020-01-28T07:46:43,2020-01-28T16:43:12,0.06,Rain,1,rain,"03660099999,03672099999,03768099999,03781099999,D4121,03772099999,03770099999",Partly cloudy throughout the day with morning rain.
Heathrow Airport,29/01/2020,9.3,2.8,5.9,5.9,-1.3,2.2,2.3,77.78,0,,0,,,,37.1,31.6,233.3,1009,27.6,24.5,162.2,5.3,3,,2020-01-29T07:45:20,2020-01-29T16:44:59,0.09,Partially cloudy,2,wind,"03660099999,03672099999,03768099999,03781099999,D4121,03772099999,03770099999",Becoming cloudy in the afternoon.
Heathrow Airport,30/01/2020,12.8,7.7,10.1,12.8,4.6,8.8,8.6,90.09,0.2,,4.17,,,,50,29.5,212.5,1004.4,91.1,34.2,31,1.1,1,,2020-01-30T07:43:54,2020-01-30T16:46:47,0.13,Rain,1,rain,"03660099999,03672099999,03768099999,03781099999,D4121,03772099999,03770099999",Cloudy skies throughout the day with afternoon rain.
Heathrow Airport,31/01/2020,12.3,8.7,10.6,12.3,5.6,9.5,9,89.41,0,,4.17,,,,53.6,31.6,222.1,1006.1,87.8,46.8,60.7,2.2,1,,2020-01-31T07:42:26,2020-01-31T16:48:35,0.18,Partially cloudy,2,wind,"03660099999,03672099999,03768099999,03781099999,D4121,03772099999,03770099999",Partly cloudy throughout the day.
Heathrow Airport,01/02/2020,12.1,7.1,9.9,12.1,4,8.6,5.6,75.5,0.99,,4.17,,,,66.5,42.4,237.5,1004.9,49.5,27.3,106.9,3.8,2,,2020-02-01T07:40:56,2020-02-01T16:50:23,0.22,Rain,1,rain,"03660099999,03672099999,03768099999,03781099999,D4121,03772099999,03770099999",Partly cloudy throughout the day with early morning rain.
Heathrow Airport,02/02/2020,13.3,6.3,10.3,13.3,3.8,9.5,7.4,82.84,8.33,,8.33,,,,57.6,38.8,214.6,1007.5,82.4,18.7,75.9,2.7,2,,2020-02-02T07:39:24,2020-02-02T16:52:12,0.27,Rain,1,rain,"03660099999,03672099999,03768099999,03781099999,D4121,03772099999,03770099999",Partly cloudy throughout the day with rain in the morning and afternoon.
Heathrow Airport,03/02/2020,11.6,5.6,9.2,11.6,2.1,6.8,4.9,75.16,0.2,,12.5,,,,53.6,35.2,257.9,1012.6,39.3,22.4,92.5,3.3,2,,2020-02-03T07:37:49,2020-02-03T16:54:01,0.32,Rain,1,rain,"03660099999,03672099999,03768099999,03781099999,D4121,03772099999,03770099999",Partly cloudy throughout the day with morning rain.
Heathrow Airport,04/02/2020,9.3,4.4,6.9,6.9,-0.7,3.6,2.3,72.75,0.2,,4.17,,,,49.2,29.5,287.1,1022.1,49.7,29.4,70.4,2.5,1,,2020-02-04T07:36:13,2020-02-04T16:55:50,0.37,Rain,1,rain,"EGWU,EGLL,03660099999,03672099999,03768099999,03781099999,D4121,EGLC,EGLF,03772099999,03770099999",Partly cloudy throughout the day with morning rain.
Heathrow Airport,05/02/2020,9.3,1.9,5.1,9.3,0.2,4.6,3.2,87.74,0,,4.17,,,,0,7.5,246.3,1036.6,32.1,9.1,114.9,4.1,3,,2020-02-05T07:34:35,2020-02-05T16:57:40,0.41,Partially cloudy,2,partly-cloudy-day,"03660099999,03672099999,03768099999,03781099999,D4121,03772099999,03770099999",Partly cloudy throughout the day.
Heathrow Airport,06/02/2020,8.9,-0.3,3.3,8.9,-0.3,2.7,1.9,91.12,0,,4.17,,,,0,11.1,175.7,1031.6,19.5,7.1,132.7,4.8,3,,2020-02-06T07:32:56,2020-02-06T16:59:29,0.45,Clear,0,clear-day,"03660099999,03672099999,03768099999,03781099999,D4121,03772099999,03770099999",Clear conditions throughout the day.
Heathrow Airport,07/02/2020,9.6,1.1,5.7,6.9,-1.8,3.1,3.4,86.11,0.2,,4.17,,,,35.3,24,117.9,1019.4,34.2,11.7,164.9,5.9,3,,2020-02-07T07:31:14,2020-02-07T17:01:19,0.48,Rain,1,rain,"03660099999,03672099999,03768099999,03781099999,D4121,03772099999,03770099999",Becoming cloudy in the afternoon with afternoon rain.
Heathrow Airport,08/02/2020,10.7,7.6,9.2,10.7,4.5,7.2,5.3,77.7,1,,4.17,,,,48.2,29.5,207.1,1014.6,66.2,20.7,141.2,5.1,3,,2020-02-08T07:29:31,2020-02-08T17:03:09,0.5,Rain,1,rain,"03660099999,03672099999,03768099999,03781099999,D4121,03772099999,03770099999",Partly cloudy throughout the day with morning rain.
Heathrow Airport,09/02/2020,12.8,8.8,10.4,12.8,4.4,8.4,7.8,84.05,9.04,,12.5,,,,94.6,61,216.7,994.4,86.6,13.2,28.6,1,1,,2020-02-09T07:27:46,2020-02-09T17:04:59,0.5,Rain,1,rain,"03660099999,03672099999,03768099999,03781099999,D4121,03772099999,03770099999",Partly cloudy throughout the day with rain.
Heathrow Airport,10/02/2020,9.6,3.6,6.7,5.6,-1.5,1.7,2.5,75.34,5.77,,12.5,,,,96.4,50,248,997.4,52,27.5,122.7,4.4,3,,2020-02-10T07:26:00,2020-02-10T17:06:49,0.52,Rain,1,rain,"03660099999,03672099999,03768099999,03781099999,D4121,03772099999,03770099999",Partly cloudy throughout the day with rain.
Heathrow Airport,11/02/2020,7.8,3.6,5.2,3.4,-1.6,0.2,-1.3,63.57,1.02,,8.33,,,,74.1,46.4,251.7,1007.9,21.6,27.9,169.5,6.1,4,,2020-02-11T07:24:12,2020-02-11T17:08:39,0.53,Rain,1,rain,"03660099999,03672099999,03768099999,03781099999,D4121,03772099999,03770099999",Becoming cloudy in the afternoon with early morning rain.
Heathrow Airport,12/02/2020,9,2.5,5.4,5.2,-2.5,1.3,1.1,74.77,0,,4.17,,,,59.3,37,230.8,1014.2,37.5,30.9,176.9,6.4,4,,2020-02-12T07:22:22,2020-02-12T17:10:29,0.57,Partially cloudy,2,wind,"03660099999,03672099999,03768099999,03781099999,D4121,03772099999,03770099999",Partly cloudy throughout the day.
Heathrow Airport,13/02/2020,9.8,5.6,7.4,7,0.6,4.1,4.8,84.33,11.38,,16.67,,,,50.1,33.5,227.1,998.8,63.7,27.1,97.4,3.5,3,,2020-02-13T07:20:31,2020-02-13T17:12:19,0.62,Rain,1,rain,"03660099999,03672099999,03768099999,03781099999,D4121,03772099999,03770099999",Partly cloudy throughout the day with rain.
Heathrow Airport,14/02/2020,11.8,2.5,7.7,11.8,0.4,6.5,5.1,84.18,0,,8.33,,,,50.2,33.4,207.1,1016.5,61.7,25.3,165.6,6,3,,2020-02-14T07:18:39,2020-02-14T17:14:09,0.67,Partially cloudy,2,wind,"03660099999,03672099999,03768099999,03781099999,D4121,03772099999,03770099999",Partly cloudy throughout the day.
Heathrow Airport,15/02/2020,12.8,9.8,11.6,12.8,7.2,11.3,10.2,91.49,7.38,,16.67,,,,79.5,46.4,196.7,1006.3,85.8,9.8,35,1.3,1,,2020-02-15T07:16:45,2020-02-15T17:15:58,0.73,Rain,1,rain,"03660099999,03672099999,03768099999,03781099999,D4121,03772099999,03770099999",Partly cloudy throughout the day with a chance of rain throughout the day.
Heathrow Airport,16/02/2020,13,5.8,9.8,13,0.5,7.7,7.7,86.93,16.24,,16.67,,,,83.5,48.2,220.4,996,68.3,20.7,33.7,1.2,1,,2020-02-16T07:14:50,2020-02-16T17:17:48,0.78,Rain,1,rain,"03660099999,03672099999,03768099999,03781099999,D4121,03772099999,03770099999",Partly cloudy throughout the day with a chance of rain throughout the day.
Heathrow Airport,17/02/2020,11.3,5.1,7.8,11.3,0.5,4.3,2.7,70.45,0.41,,8.33,,,,68.4,44.6,236.3,1009.6,38,26.3,128.1,5.1,3,,2020-02-17T07:12:54,2020-02-17T17:19:37,0.84,Rain,1,rain,"03660099999,03672099999,03768099999,03781099999,D4121,03772099999,03770099999",Partly cloudy throughout the day with rain.
Heathrow Airport,18/02/2020,11.1,4.4,6.9,11.1,0.1,4.3,3.1,77.59,1.99,,4.17,,,,68.4,38.8,239.5,1018.1,28.1,27.1,138.6,5.5,3,,2020-02-18T07:10:56,2020-02-18T17:21:26,0.88,Rain,1,rain,"03660099999,03672099999,03768099999,03781099999,D4121,03772099999,03770099999",Partly cloudy throughout the day with late afternoon rain.
Heathrow Airport,19/02/2020,9.1,2.7,6.4,6.3,-1.6,3.3,3.8,83.77,1.43,,12.5,,,,50,27.7,234,1018.7,65.8,22.2,65.3,2.6,1,,2020-02-19T07:08:57,2020-02-19T17:23:15,0.93,Rain,1,rain,"03660099999,03672099999,03768099999,03781099999,D4121,03772099999,03770099999",Partly cloudy throughout the day with rain.
Heathrow Airport,20/02/2020,10.1,4.1,7.8,10.1,-0.8,4.4,5.1,83.26,5.2,,16.67,,,,68.4,38.8,232.1,1011.9,60.4,30.5,62.1,2.5,1,,2020-02-20T07:06:57,2020-02-20T17:25:04,0.96,Rain,1,rain,"03660099999,03672099999,03768099999,03781099999,D4121,03772099999,03770099999",Partly cloudy throughout the day with rain.
Heathrow Airport,21/02/2020,10.6,3.8,7.7,10.6,-0.8,4.8,3.3,73.72,0,,0,,,,64.8,42.4,230.4,1022.4,60,21.9,112.4,4.4,2,,2020-02-21T07:04:56,2020-02-21T17:26:52,0.98,Partially cloudy,2,wind,"03660099999,03672099999,03768099999,03781099999,D4121,03772099999,03770099999",Partly cloudy throughout the day.
Heathrow Airport,22/02/2020,13.8,9.2,10.8,13.8,5.1,9.4,6,72.55,0.2,,8.33,,,,68.4,44.6,240.8,1018.3,82.9,20.5,140.3,5.1,4,,2020-02-22T07:02:54,2020-02-22T17:28:40,1,Rain,1,rain,"03660099999,03672099999,03768099999,03781099999,D4121,03772099999,03770099999",Partly cloudy throughout the day with afternoon rain.
Heathrow Airport,23/02/2020,14.1,7.8,10.9,14.1,6.1,10.1,6.6,75.77,1.01,,12.5,,,,74.1,46.4,258.7,1017,82.9,36.1,107.3,4.2,2,,2020-02-23T07:00:51,2020-02-23T17:30:28,1,Rain,1,rain,"03660099999,03672099999,03768099999,03781099999,D4121,03772099999,03770099999",Partly cloudy throughout the day with rain.
Heathrow Airport,24/02/2020,11.8,5.6,9.4,11.8,2.3,7.9,7.1,86.04,2.83,,12.5,,,,63,40.7,207.9,1010.5,79.2,29.6,42.1,1.5,1,,2020-02-24T06:58:47,2020-02-24T17:32:16,0,Rain,1,rain,"03660099999,03672099999,03768099999,03781099999,D4121,03772099999,03770099999",Partly cloudy throughout the day with rain.
Heathrow Airport,25/02/2020,8.3,2.9,5.8,4.4,-2.1,1.6,2.4,79.15,0.99,,4.17,,,,55.4,31.6,247.1,1000.4,55.3,38.1,125.2,5.4,3,,2020-02-25T06:56:42,2020-02-25T17:34:03,0.02,Rain,1,rain,"03660099999,03672099999,03768099999,03781099999,D4121,03772099999,03770099999",Partly cloudy throughout the day with late afternoon rain.
Heathrow Airport,26/02/2020,8.8,1.2,4.6,5.5,-3.5,0.6,-0.4,70.9,0.2,,8.33,,,,57.6,27.7,265,1003.9,47.9,36.8,153.4,6.6,4,,2020-02-26T06:54:36,2020-02-26T17:35:50,0.04,Rain,1,rain,"03680099999,03660099999,03672099999,03768099999,03781099999,D4121,03772099999,03770099999",Partly cloudy throughout the day with late afternoon rain.
Heathrow Airport,27/02/2020,8.1,1.8,4.4,4.8,-2.1,1.1,0.1,75.31,5.03,,8.33,,,1,53.7,33.5,236.7,1003.8,54.1,27.4,139.2,5.5,3,,2020-02-27T06:52:29,2020-02-27T17:37:37,0.06,Rain,1,rain,"03660099999,03672099999,03768099999,03781099999,D4121,03772099999,03770099999",Partly cloudy throughout the day with rain in the morning and afternoon.
Heathrow Airport,28/02/2020,11.6,0.2,6.3,11.6,-2.9,4.1,4.5,88.24,4,,8.33,,,,53.6,35.2,187,1005.6,78.7,19,35,1.5,1,,2020-02-28T06:50:21,2020-02-28T17:39:23,0.1,Rain,1,rain,"03660099999,03672099999,03768099999,03781099999,D4121,03772099999,03770099999",Partly cloudy throughout the day with rain.
Heathrow Airport,29/02/2020,11.1,4.2,7.3,11.1,-1,3.6,4,80.07,8.04,,16.67,,,,70.4,48.1,222.5,986.4,50.9,25,182.8,7.2,5,,2020-02-29T06:48:13,2020-02-29T17:41:10,0.14,Rain,1,rain,"03660099999,03672099999,03768099999,03781099999,D4121,03772099999,03770099999",Partly cloudy throughout the day with rain.
Heathrow Airport,01/03/2020,10.1,4.3,6.6,10.1,-0.3,2.7,0.9,68.08,0,,0,,,,55.5,40.6,222.9,988.8,33.8,32.5,252.3,10.9,6,,2020-03-01T06:46:04,2020-03-01T17:42:55,0.18,Partially cloudy,2,wind,"03660099999,03672099999,03768099999,03781099999,D4121,03772099999,03770099999",Partly cloudy throughout the day.
Heathrow Airport,02/03/2020,9.1,3.6,5.6,5.9,-0.1,2.8,1.7,77.99,5.39,,12.5,,,,50,25.9,223.4,990.4,48.3,30.2,188.9,7.5,4,,2020-03-02T06:43:54,2020-03-02T17:44:41,0.23,Rain,1,rain,"03660099999,03672099999,03768099999,03781099999,D4121,03772099999,03770099999",Partly cloudy throughout the day with a chance of rain throughout the day.
Heathrow Airport,03/03/2020,10.1,2.1,5.4,10.1,-1.5,2.6,1.7,77.53,0.8,,4.17,,,,33.5,24.1,247.5,1002.5,37.9,28.3,126.5,5,3,,2020-03-03T06:41:43,2020-03-03T17:46:26,0.28,Rain,1,rain,"03660099999,03672099999,03768099999,03781099999,D4121,03772099999,03770099999",Partly cloudy throughout the day with late afternoon rain.
Heathrow Airport,04/03/2020,8.1,0.8,4.7,6.1,-1.2,2.8,3.2,90.34,4.98,,8.33,,,,,14.7,138.4,1007.4,85,13.9,87.6,3.5,2,,2020-03-04T06:39:32,2020-03-04T17:48:12,0.34,Rain,1,rain,"03660099999,03672099999,03768099999,03781099999,D4121,03772099999,03770099999",Partly cloudy throughout the day with late afternoon rain.
Heathrow Airport,05/03/2020,6.1,5,5.6,3.8,1.6,2.4,4.5,92.73,10,,12.5,,,,46.7,22.4,112.1,995.1,89.1,7.1,29.5,1.2,1,,2020-03-05T06:37:21,2020-03-05T17:49:56,0.38,Rain,1,rain,"03660099999,03672099999,03768099999,03781099999,D4121,03772099999,03770099999",Partly cloudy throughout the day with rain.
Heathrow Airport,06/03/2020,9.8,2.3,5.9,8.3,-0.3,3.9,0.7,71.42,1.01,,4.17,,,,,14.8,300.4,1005.3,46.9,19.8,254.1,11,6,,2020-03-06T06:35:08,2020-03-06T17:51:41,0.43,Rain,1,rain,"03660099999,03672099999,03768099999,03781099999,D4121,03772099999,03770099999",Partly cloudy throughout the day with early morning rain.
Heathrow Airport,07/03/2020,12.7,1.8,7.9,12.7,-1.4,6.6,4.9,81.73,0,,4.17,,,,57.5,38.8,219.6,1015,76.2,17.8,130.4,5.6,3,,2020-03-07T06:32:55,2020-03-07T17:53:25,0.46,Partially cloudy,2,wind,"03660099999,03672099999,03768099999,03781099999,D4121,03772099999,03770099999",Partly cloudy throughout the day.
Heathrow Airport,08/03/2020,13.1,6.1,9.8,13.1,2.5,8.3,6.2,78.58,2.42,,12.5,,,,61.2,40.6,225.5,1006,60.4,24.4,168.5,7.3,4,,2020-03-08T06:30:42,2020-03-08T17:55:09,0.49,Rain,1,rain,"03660099999,03672099999,03768099999,03781099999,D4121,03772099999,03770099999",Partly cloudy throughout the day with rain.
Heathrow Airport,09/03/2020,10.6,4.6,7.5,10.6,0.7,4.6,4.3,81.35,1.01,,8.33,,,,50.9,31.6,235,1011.1,53.3,20.8,153.2,6.6,3,,2020-03-09T06:28:28,2020-03-09T17:56:53,0.5,Rain,1,rain,"03660099999,03672099999,03768099999,03781099999,D4121,03772099999,03770099999",Partly cloudy throughout the day with late afternoon rain.
Heathrow Airport,10/03/2020,15,10.1,12.6,15,10.1,12.5,10.2,86.15,5.03,,8.33,,,,71.8,42.8,249.2,1005,84.3,43,94.8,4.1,2,,2020-03-10T06:26:14,2020-03-10T17:58:36,0.51,Rain,1,rain,"03680099999,03660099999,03672099999,03768099999,03781099999,D4121,03772099999,03770099999",Partly cloudy throughout the day with rain.
Heathrow Airport,11/03/2020,14.6,8.4,11,14.6,6.2,10.1,7,76.96,0,,8.33,,,,66.6,38.8,236.2,1008.9,72,39.4,238.1,10.3,6,,2020-03-11T06:23:59,2020-03-11T18:00:20,0.53,Partially cloudy,2,wind,"03680099999,03660099999,03672099999,03768099999,03781099999,D4121,03772099999,03770099999",Partly cloudy throughout the day.
Heathrow Airport,12/03/2020,10.1,4.6,7.4,10.1,0.6,3.2,1.4,66.25,2.78,,16.67,,,,74.2,46.3,247.1,1010.1,40.8,26.8,241.9,10.5,6,,2020-03-12T06:21:44,2020-03-12T18:02:03,0.56,Rain,1,rain,"03660099999,03672099999,03768099999,03781099999,D4121,03772099999,03770099999",Partly cloudy throughout the day with rain.
Heathrow Airport,13/03/2020,12.8,5.7,8.4,12.8,1,5.8,2.5,67.52,0.2,,4.17,,,,50,31.6,244.5,1017.4,69.5,27.3,216.7,9.4,5,,2020-03-13T06:19:29,2020-03-13T18:03:45,0.6,Rain,1,rain,"03680099999,03660099999,03672099999,03768099999,03781099999,D4121,03772099999,03770099999",Partly cloudy throughout the day with early morning rain.
Heathrow Airport,14/03/2020,12.6,6.6,9.5,12.6,3.1,7.9,6.5,82.72,0.81,,8.33,,,,50,29.5,185,1013.6,84.5,28.2,158.5,6.8,3,,2020-03-14T06:17:13,2020-03-14T18:05:28,0.65,Rain,1,rain,"03660099999,03672099999,03768099999,03781099999,D4121,03772099999,03770099999",Partly cloudy throughout the day with afternoon rain.
Heathrow Airport,15/03/2020,11.8,6.6,9.4,11.8,5.2,8.2,6.8,84.04,2,,12.5,,,,50,29.5,226.3,1008.5,85.8,31,68.2,2.9,2,,2020-03-15T06:14:58,2020-03-15T18:07:10,0.71,Rain,1,rain,"03660099999,03672099999,03768099999,03781099999,D4121,03772099999,03770099999",Partly cloudy throughout the day with late afternoon rain.
Heathrow Airport,16/03/2020,12.7,3.5,7.7,12.7,0.8,6.4,2.6,72.86,0,,12.5,,,,,20.5,272.3,1021.1,18.4,30.1,347.2,15,7,,2020-03-16T06:12:41,2020-03-16T18:08:53,0.76,Clear,0,clear-day,"03660099999,03672099999,03768099999,03781099999,D4121,03772099999,03770099999",Clear conditions throughout the day.
Heathrow Airport,17/03/2020,13.1,4.5,9.1,13.1,1.7,7.7,6.1,81.86,0,,0,,,,37.1,27.7,210.4,1027.2,65.3,25.8,168.6,7.3,3,,2020-03-17T06:10:25,2020-03-17T18:10:35,0.81,Partially cloudy,2,partly-cloudy-day,"03660099999,03672099999,03768099999,03781099999,D4121,03772099999,03770099999",Partly cloudy throughout the day.
Heathrow Airport,18/03/2020,15,8.6,11.7,15,7.1,11.6,8.7,82.64,0,,0,,,,,25.9,211.8,1024.7,94.9,26.6,103.1,4.5,3,,2020-03-18T06:08:09,2020-03-18T18:12:17,0.86,Overcast,3,cloudy,"03660099999,03672099999,03768099999,03781099999,D4121,03772099999,03770099999",Cloudy skies throughout the day.
Heathrow Airport,19/03/2020,8.1,6,7.1,5.7,3.1,4.6,6.2,94.35,0.4,,12.5,,,,,16.6,42.9,1026.2,94.9,5.9,36.4,1.6,1,,2020-03-19T06:05:52,2020-03-19T18:13:58,0.9,Rain,1,rain,"03660099999,03672099999,03768099999,03781099999,D4121,03772099999,03770099999",Cloudy skies throughout the day with rain.
Heathrow Airport,20/03/2020,9.8,5.2,7.3,7.1,1.7,4.1,2,69.73,0.4,,4.17,,,,50.1,25.9,46.7,1028.5,82.4,29.9,193.1,8.3,4,,2020-03-20T06:03:35,2020-03-20T18:15:40,0.94,Rain,1,rain,"03660099999,03672099999,03768099999,03781099999,D4121,03772099999,03770099999",Partly cloudy throughout the day with early morning rain.
Heathrow Airport,21/03/2020,10.3,3.9,6.8,10.3,0.4,3.7,-0.6,62.91,0,,0,,,,62.9,38.8,65.4,1026.4,28.9,30.6,331.5,15.5,7,,2020-03-21T06:01:18,2020-03-21T18:17:21,0.97,Partially cloudy,2,wind,"03660099999,03672099999,03768099999,03781099999,D4121,03772099999,03770099999",Clearing in the afternoon.
Heathrow Airport,22/03/2020,10.8,3.5,6.9,10.8,0.7,4.8,0.3,63.75,0,,0,,,,51.8,25.9,65.4,1026.5,6.4,27.4,363.8,17,7,,2020-03-22T05:59:02,2020-03-22T18:19:02,0.99,Clear,0,clear-day,"03680099999,03660099999,03672099999,03768099999,03781099999,D4121,03772099999,03770099999",Clear conditions throughout the day.
Heathrow Airport,23/03/2020,13.6,2.5,7.1,13.6,-0.5,5.1,-2,54.19,0,,0,,,,,20.5,91.8,1026.6,0.1,33.7,348.6,17.6,7,,2020-03-23T05:56:45,2020-03-23T18:20:44,1,Clear,0,clear-day,"03660099999,03672099999,03768099999,03781099999,D4121,03772099999,03770099999",Clear conditions throughout the day.
Heathrow Airport,24/03/2020,15.2,0.7,8,15.2,-2.3,6.7,-1,55.33,0,,0,,,,,20.5,132,1025.7,0.1,27.3,347.6,17.5,7,,2020-03-24T05:54:28,2020-03-24T18:22:25,0,Clear,0,clear-day,"03660099999,03672099999,03768099999,03781099999,D4121,03772099999,03770099999",Clear conditions throughout the day.
Heathrow Airport,25/03/2020,13.8,0.3,7.4,13.8,0.3,6.8,-3.1,50.62,0,,0,,,,,16.6,65,1024.5,0,24.2,354.1,17.8,7,,2020-03-25T05:52:11,2020-03-25T18:24:05,0.01,Clear,0,clear-day,"03660099999,03672099999,03768099999,03781099999,D4121,03772099999,03770099999",Clear conditions throughout the day.
Heathrow Airport,26/03/2020,13.8,1.1,7.2,13.8,-1.2,6.1,-2.5,54.15,0,,0,,,,,22.3,41.5,1023.3,0.1,18.4,349.1,17.6,7,,2020-03-26T05:49:54,2020-03-26T18:25:46,0.02,Clear,0,clear-day,"03660099999,03672099999,03768099999,03781099999,D4121,03772099999,03770099999",Clear conditions throughout the day.
Heathrow Airport,27/03/2020,13.8,1.4,7.6,13.8,-1,6.2,0,61.77,0,,0,,,,40.7,24.2,42.9,1023.9,0.8,14.1,332.5,16.8,6,,2020-03-27T05:47:38,2020-03-27T18:27:27,0.04,Clear,0,clear-day,"03660099999,03672099999,03768099999,03781099999,D4121,03772099999,03770099999",Clear conditions throughout the day.
Heathrow Airport,28/03/2020,11.6,4.6,7.2,11.6,1.3,4.7,1,65.79,0,,0,,,,57.6,31.7,28.6,1029,36.2,22.3,224.7,11.3,6,,2020-03-28T05:45:21,2020-03-28T18:29:08,0.07,Partially cloudy,2,wind,"03660099999,03672099999,03768099999,03781099999,D4121,03772099999,03770099999",Becoming cloudy in the afternoon.
Heathrow Airport,29/03/2020,7.3,2.6,5.2,7,-0.5,1.5,-3.5,54.34,0,,4.35,,,,66.6,29.6,24.7,1037.6,57.7,29.2,214.9,10.8,4,,2020-03-29T06:43:05,2020-03-29T19:30:48,0.11,Partially cloudy,2,partly-cloudy-day,"03660099999,03672099999,03768099999,03781099999,D4121,03772099999,03770099999",Partly cloudy throughout the day.
Heathrow Airport,30/03/2020,10.1,2.1,5.6,10.1,-0.6,3.2,0.5,70.03,0,,4.17,,,,42.5,22.3,132.5,1034.9,72,30.5,138.4,7,3,,2020-03-30T06:40:48,2020-03-30T19:32:29,0.15,Partially cloudy,2,partly-cloudy-day,"03660099999,03672099999,03768099999,03781099999,D4121,03772099999,03770099999",Partly cloudy throughout the day.
Heathrow Airport,31/03/2020,10.1,2.6,6.3,10.1,-0.8,3.8,0.5,68.51,0,,4.17,,,,,20.6,47.5,1031.5,31.3,28.9,190.4,9.6,4,,2020-03-31T06:38:32,2020-03-31T19:34:09,0.2,Partially cloudy,2,partly-cloudy-day,"03660099999,03672099999,03768099999,03781099999,D4121,03772099999,03770099999",Becoming cloudy in the afternoon.
Heathrow Airport,01/04/2020,9.1,-0.7,5.3,8.1,-1.6,4.3,-0.7,67.03,0,,4.17,,,,,11.1,267.3,1024.4,52.5,29.9,207.8,9.7,6,,2020-04-01T06:36:17,2020-04-01T19:35:50,0.25,Partially cloudy,2,partly-cloudy-day,"03660099999,03672099999,03768099999,03781099999,D4121,03772099999,03770099999",Partly cloudy throughout the day.
Heathrow Airport,02/04/2020,13.3,5.3,9.4,13.3,2.9,8.3,3.2,66.02,0,,0,,,,38.9,25.9,273.3,1016.3,78.3,39.3,175.7,8.9,4,,2020-04-02T06:34:01,2020-04-02T19:37:30,0.31,Partially cloudy,2,partly-cloudy-day,"03660099999,03672099999,03768099999,03781099999,D4121,03772099999,03770099999",Partly cloudy throughout the day.
Heathrow Airport,03/04/2020,13.8,7.2,9.7,13.8,4.9,9.1,3.3,66.37,0,,0,,,,,14.8,262.6,1017.6,67.5,31.6,200.9,10.1,5,,2020-04-03T06:31:46,2020-04-03T19:39:11,0.36,Partially cloudy,2,partly-cloudy-day,"03660099999,03672099999,03768099999,03781099999,D4121,03772099999,03770099999",Partly cloudy throughout the day.
Heathrow Airport,04/04/2020,16.1,3.3,9.6,16.1,1.3,9,2.7,66.15,0,,0,,,,35.3,22.3,170.3,1020.1,29.2,30.4,346.6,17.5,7,,2020-04-04T06:29:31,2020-04-04T19:40:51,0.41,Partially cloudy,2,partly-cloudy-day,"03660099999,03672099999,03768099999,03781099999,D4121,03772099999,03770099999",Clearing in the afternoon.
Heathrow Airport,05/04/2020,21.1,6.6,13.9,21.1,4.1,12.9,3.3,51.63,0,,0,,,,46.4,31.6,133.3,1014,0.1,34.2,399.4,20.1,7,,2020-04-05T06:27:17,2020-04-05T19:42:31,0.45,Clear,0,wind,"03660099999,03672099999,03768099999,03781099999,D4121,03772099999,03770099999",Clear conditions throughout the day.
Heathrow Airport,06/04/2020,17.3,10.6,13.5,17.3,10.6,13.5,6.1,62.78,0.6,,8.33,,,,,24.1,229.6,1016.7,52.4,32.1,260.6,13.1,6,,2020-04-06T06:25:03,2020-04-06T19:44:12,0.48,Rain,1,rain,"03660099999,03672099999,03768099999,03781099999,D4121,03772099999,03770099999",Partly cloudy throughout the day with rain in the morning and afternoon.
Heathrow Airport,07/04/2020,19.3,4.6,12.3,19.3,3.5,12.2,4.3,60.68,0,,0,,,,,16.5,164.8,1028.4,13.9,27.2,334.1,16.8,7,,2020-04-07T06:22:50,2020-04-07T19:45:52,0.5,Clear,0,clear-day,"03680099999,03660099999,03672099999,03768099999,03781099999,D4121,03772099999,03770099999",Clear conditions throughout the day.
Heathrow Airport,08/04/2020,21.8,10,15.1,21.8,10,15.1,7.5,61.7,0,,0,,,,,14.7,77.9,1024.7,70.8,10.6,231.1,11.6,5,,2020-04-08T06:20:36,2020-04-08T19:47:32,0.5,Partially cloudy,2,partly-cloudy-day,"03680099999,EGLL,03660099999,03672099999,03768099999,03781099999,D4121,03761099999,03658099999,03772099999,03770099999",Partly cloudy throughout the day.
Heathrow Airport,09/04/2020,22.8,8.6,15.3,22.8,7.8,15.2,7.4,62.01,0,,0,,,,,25.9,83.1,1024.6,7.2,9.7,360,18.1,7,,2020-04-09T06:18:24,2020-04-09T19:49:12,0.52,Clear,0,clear-day,"03660099999,03672099999,03768099999,03781099999,D4121,03772099999,03770099999",Clear conditions throughout the day.
Heathrow Airport,10/04/2020,24.1,8.8,15.4,24.1,7.8,15.2,7.2,61.05,0,,0,,,,,24.1,81.4,1024.6,0.3,13.4,387.4,19.5,7,,2020-04-10T06:16:12,2020-04-10T19:50:53,0.54,Clear,0,clear-day,"03660099999,03672099999,03768099999,03781099999,D4121,03772099999,03770099999",Clear conditions throughout the day.
Heathrow Airport,11/04/2020,24.6,9.1,16.8,24.6,9.1,16.8,7.3,57.68,0,,0,,,,,16.5,141.3,1022.1,29.7,17,374,17.5,7,,2020-04-11T06:14:00,2020-04-11T19:52:33,0.58,Partially cloudy,2,partly-cloudy-day,"03660099999,03672099999,03768099999,03781099999,D4121,03772099999,03770099999",Clearing in the afternoon.
Heathrow Airport,12/04/2020,24,9.8,16.7,24,8.9,16.7,6.9,55.89,0.02,,4.17,,,,,16.6,174,1014.7,31,20.3,365.9,18.4,8,,2020-04-12T06:11:49,2020-04-12T19:54:13,0.63,Rain,1,rain,"03660099999,03672099999,03768099999,03781099999,D4121,03772099999,03770099999",Partly cloudy throughout the day with late afternoon rain.
Heathrow Airport,13/04/2020,12.3,5.3,9.2,12.3,2.5,7.2,1.3,59.3,0,,0,,,,53.6,27.8,44.2,1024.8,50,24.8,356.8,18,8,,2020-04-13T06:09:39,2020-04-13T19:55:53,0.68,Partially cloudy,2,partly-cloudy-day,"03660099999,03672099999,03768099999,03781099999,D4121,03772099999,03770099999",Partly cloudy throughout the day.
Heathrow Airport,14/04/2020,13.1,3.3,8,13.1,1.3,6.4,-1.1,53.44,0,,0,,,,,18.3,70.5,1028.6,22.6,30.2,427.2,21.5,8,,2020-04-14T06:07:30,2020-04-14T19:57:34,0.73,Partially cloudy,2,partly-cloudy-day,"03660099999,03672099999,03768099999,03781099999,D4121,03772099999,03770099999",Partly cloudy throughout the day.
Heathrow Airport,15/04/2020,18.6,3.1,10.5,18.6,1.8,10.1,1.4,57.16,0,,0,,,,31.7,18.3,101.9,1022.7,0.6,21.8,388.3,21,7,,2020-04-15T06:05:21,2020-04-15T19:59:14,0.78,Clear,0,clear-day,"03660099999,03672099999,03768099999,03781099999,D4121,03772099999,03770099999",Clear conditions throughout the day.
Heathrow Airport,16/04/2020,19.4,4.8,12.6,19.4,3.4,12.3,4.9,62.17,0,,0,,,,29.5,16.5,63.8,1016.2,31.4,9,250.6,13.5,5,,2020-04-16T06:03:13,2020-04-16T20:00:54,0.83,Partially cloudy,2,partly-cloudy-day,"03660099999,03672099999,03768099999,03781099999,D4121,03772099999,03770099999",Becoming cloudy in the afternoon.
Heathrow Airport,17/04/2020,14.5,8.5,11.1,14.5,6.2,10.5,5.8,70.45,2.99,,4.17,,,,48.2,27.7,67.5,1016.7,70,19.4,156.5,8.4,4,,2020-04-17T06:01:05,2020-04-17T20:02:34,0.88,Rain,1,rain,"03660099999,03672099999,03768099999,03781099999,D4121,03772099999,03770099999",Partly cloudy throughout the day with late afternoon rain.
Heathrow Airport,18/04/2020,15.6,6.5,9.9,15.6,4,8.9,6.5,80.5,13.96,,8.33,,,,,16.6,50.5,1017.7,82,14,209.2,10.5,5,,2020-04-18T05:58:59,2020-04-18T20:04:14,0.91,Rain,1,rain,"03660099999,03672099999,03768099999,03781099999,D4121,03772099999,03770099999",Partly cloudy throughout the day with rain in the morning and afternoon.
Heathrow Airport,19/04/2020,18.1,6.2,11.8,18.1,4.6,11.3,4,63.83,0,,0,,,,31.7,22.3,82.1,1020.1,26.6,24.5,433.7,21.9,8,,2020-04-19T05:56:53,2020-04-19T20:05:54,0.95,Partially cloudy,2,partly-cloudy-day,"03660099999,03672099999,03768099999,03781099999,D4121,03772099999,03770099999",Clearing in the afternoon.
Heathrow Airport,20/04/2020,18.1,5.9,12.1,18.1,3.2,11.2,2.5,55.57,0,,0,,,,53.7,31.7,50,1017.5,0,27.8,426.2,23,8,,2020-04-20T05:54:48,2020-04-20T20:07:34,0.97,Clear,0,wind,"03660099999,03672099999,03768099999,03781099999,D4121,03772099999,03770099999",Clear conditions throughout the day.
Heathrow Airport,21/04/2020,18.1,8.4,13.4,18.1,6.2,13.1,2.7,50.14,0,,0,,,,48.2,26,53.8,1016.6,2.6,28.4,427,23.1,8,,2020-04-21T05:52:44,2020-04-21T20:09:14,0.99,Clear,0,clear-day,"03660099999,03672099999,03768099999,03781099999,D4121,03772099999,03770099999",Clear conditions throughout the day.
Heathrow Airport,22/04/2020,21.1,7.1,14.2,21.1,6,13.9,3.8,53.62,0,,4.17,,,,,20.6,44.6,1019.3,0.1,23.5,427,23.1,8,,2020-04-22T05:50:41,2020-04-22T20:10:54,1,Clear,0,clear-day,"03660099999,03672099999,03768099999,03781099999,D4121,03772099999,03770099999",Clear conditions throughout the day.
Heathrow Airport,23/04/2020,23.3,6.7,15,23.3,5.8,14.7,5.2,56.35,0,,0,,,,14.8,13,73.1,1019.4,0.2,18.4,412.1,22.3,8,,2020-04-23T05:48:39,2020-04-23T20:12:33,0,Clear,0,clear-day,"03680099999,03660099999,03672099999,03768099999,03781099999,D4121,03772099999,03770099999",Clear conditions throughout the day.
Heathrow Airport,24/04/2020,21.3,7.8,14.8,21.3,7.2,14.7,4.8,53.85,0,,0,,,,,18.3,69.8,1016.1,2.7,20,413.2,22.3,8,,2020-04-24T05:46:39,2020-04-24T20:14:13,0.01,Clear,0,clear-day,"EGWU,03680099999,EGLL,03672099999,03768099999,03781099999,D4121,EGLC,EGLF,03772099999,03770099999",Clear conditions throughout the day.
Heathrow Airport,25/04/2020,16.4,7.1,11.3,16.4,5.3,10.5,5.2,67.72,0,,0,,,,0,16.6,89.2,1015.2,27.9,24,392.5,21.2,8,,2020-04-25T05:44:39,2020-04-25T20:15:52,0.03,Partially cloudy,2,partly-cloudy-day,"03680099999,03672099999,03768099999,03781099999,D4121,03772099999,03770099999",Clearing in the afternoon.
Heathrow Airport,26/04/2020,20.5,4.3,12.6,20.5,4.3,12.4,4.3,61.32,0,,0,,,,7.6,20.4,182.4,1012.2,10,30.4,430.1,23.2,8,,2020-04-26T05:42:40,2020-04-26T20:17:31,0.05,Clear,0,clear-day,"03680099999,03672099999,03768099999,03781099999,D4121,03772099999,03770099999",Clear conditions throughout the day.
Heathrow Airport,27/04/2020,17.8,7.1,12.8,17.8,5.9,12.5,6.5,66.06,0,,4.17,,,,0,16.6,184.8,1007.6,56.2,19.6,232.1,13.4,5,,2020-04-27T05:40:43,2020-04-27T20:19:10,0.09,Partially cloudy,2,partly-cloudy-day,"03680099999,03660099999,03672099999,03768099999,03781099999,D4121,03772099999,03770099999",Partly cloudy throughout the day.
Heathrow Airport,28/04/2020,11,7.4,8.6,11,4.7,6.7,6.8,89.33,11.2,,12.5,,,,42.5,22.3,57.9,1004.7,92.4,13.5,45.5,2.3,2,,2020-04-28T05:38:46,2020-04-28T20:20:49,0.13,Rain,1,rain,"03660099999,03672099999,03768099999,03781099999,D4121,03772099999,03770099999",Cloudy skies throughout the day with rain.
Heathrow Airport,29/04/2020,14.1,7.1,10.3,14.1,6.2,10,7.3,82.96,2.59,,16.67,,,,38.9,24.1,193,1001.8,78.7,20.4,184.5,10,3,,2020-04-29T05:36:51,2020-04-29T20:22:28,0.18,Rain,1,rain,"03660099999,03672099999,03768099999,03781099999,D4121,03772099999,03770099999",Partly cloudy throughout the day with rain.
Heathrow Airport,30/04/2020,12.6,6.5,9.3,12.6,4,7.6,6.4,82.65,4.43,,12.5,,,,61.1,33.4,200,995.1,52.1,32.1,204.1,11,4,,2020-04-30T05:34:57,2020-04-30T20:24:06,0.23,Rain,1,rain,"03660099999,03672099999,03768099999,03781099999,D4121,03772099999,03770099999",Partly cloudy throughout the day with rain.
Heathrow Airport,01/05/2020,14.3,7.6,10.7,14.3,4.8,9.4,5.9,73.6,0.41,,16.67,,,,55.4,31.6,249.5,999.2,60,39,289.4,16.7,6,,2020-05-01T05:33:05,2020-05-01T20:25:44,0.28,Rain,1,rain,"03660099999,03672099999,03768099999,03781099999,D4121,03772099999,03770099999",Partly cloudy throughout the day with rain.
Heathrow Airport,02/05/2020,16.6,6.1,11.7,16.6,3,10.7,4.1,62.53,0,,4.17,,,,,18.3,274.2,1010.3,28.8,48.9,429.2,24.7,8,,2020-05-02T05:31:14,2020-05-02T20:27:22,0.34,Partially cloudy,2,partly-cloudy-day,"03660099999,03672099999,03768099999,03781099999,D4121,03772099999,03770099999",Partly cloudy throughout the day.
Heathrow Airport,03/05/2020,15.1,8.8,11.9,15.1,8,11.7,6.3,70.12,0.2,,4.17,,,,,12.9,152.6,1015.8,92.8,40.3,154.7,8.4,4,,2020-05-03T05:29:24,2020-05-03T20:28:59,0.39,Rain,1,rain,"03660099999,03672099999,03768099999,03781099999,D4121,03772099999,03770099999",Cloudy skies throughout the day with afternoon rain.
Heathrow Airport,04/05/2020,17.1,9.3,13.1,17.1,6.5,12.9,6.2,64.54,0,,0,,,,42.5,25.9,76.3,1019.2,57.6,30.6,290.7,16.7,7,,2020-05-04T05:27:36,2020-05-04T20:30:36,0.44,Partially cloudy,2,partly-cloudy-day,"03660099999,03672099999,03768099999,03781099999,D4121,03772099999,03770099999",Partly cloudy throughout the day.
Heathrow Airport,05/05/2020,14.8,8,11.1,14.8,5.2,10,2.9,59.34,0,,0,,,,46.5,31.6,74.5,1021.1,20.1,35.8,427.1,24.6,8,,2020-05-05T05:25:49,2020-05-05T20:32:13,0.47,Partially cloudy,2,wind,"03660099999,03672099999,03768099999,03781099999,D4121,03772099999,03770099999",Partly cloudy throughout the day.
Heathrow Airport,06/05/2020,17.7,5.1,11.7,17.7,2.6,10.8,3.3,59.8,0,,0,,,,37.1,18.3,72.6,1025.2,0,28.1,441.9,25.5,8,,2020-05-06T05:24:04,2020-05-06T20:33:49,0.49,Clear,0,clear-day,"03660099999,03672099999,03768099999,03781099999,D4121,03772099999,03770099999",Clear conditions throughout the day.
Heathrow Airport,07/05/2020,22.3,6,14.8,22.3,5.1,14.6,6.7,62.27,0,,0,,,,27.7,18.3,144.6,1022.8,5.7,22.3,411.7,23.7,8,,2020-05-07T05:22:21,2020-05-07T20:35:24,0.5,Clear,0,clear-day,"03660099999,03672099999,03768099999,03781099999,D4121,03772099999,03770099999",Clear conditions throughout the day.
Heathrow Airport,08/05/2020,23.6,10.1,17.6,23.6,10.1,17.6,7,51.87,0,,0,,,,,12.9,218,1017.9,33.8,29.8,402.9,23.2,8,,2020-05-08T05:20:39,2020-05-08T20:36:59,0.51,Partially cloudy,2,partly-cloudy-day,"03660099999,03672099999,03768099999,03781099999,D4121,03772099999,03770099999",Partly cloudy throughout the day.
Heathrow Airport,09/05/2020,24.5,10.8,18,24.5,10.8,18,6.4,50.36,0,,0,,,,,24.1,95.3,1012.6,9.8,18.5,428.1,24.7,8,,2020-05-09T05:18:59,2020-05-09T20:38:34,0.53,Clear,0,clear-day,"03660099999,03672099999,03768099999,03781099999,D4121,03772099999,03770099999",Clear conditions throughout the day.
Heathrow Airport,10/05/2020,17.5,7.1,12.5,17.5,3.1,11.4,5.9,64.53,0,,0,,,,63,33.5,69.2,1010.6,57.9,22.3,184.7,10.6,6,,2020-05-10T05:17:20,2020-05-10T20:40:07,0.56,Partially cloudy,2,wind,"03660099999,03672099999,03768099999,03781099999,D4121,03772099999,03770099999",Partly cloudy throughout the day.
Heathrow Airport,11/05/2020,12.1,5,8.3,12.1,1.2,6,-1.7,50.36,0,,0,,,,61.2,37.1,29.6,1019.6,50.3,35.7,312.4,18,7,,2020-05-11T05:15:44,2020-05-11T20:41:40,0.61,Partially cloudy,2,wind,"03660099999,03672099999,03768099999,03781099999,D4121,03772099999,03770099999",Partly cloudy throughout the day.
Heathrow Airport,12/05/2020,15.3,2.5,9.2,15.3,1.1,8.9,-0.2,55.01,0,,0,,,,,11.2,291.8,1021,37.8,40.3,353.2,20.3,8,,2020-05-12T05:14:09,2020-05-12T20:43:13,0.65,Partially cloudy,2,partly-cloudy-day,"03660099999,03672099999,03768099999,03781099999,D4121,03772099999,03770099999",Partly cloudy throughout the day.
Heathrow Airport,13/05/2020,12.3,6.3,9.5,12.3,3.7,8.4,0.3,54.84,0,,0,,,,48.2,22.3,101.7,1017.5,67.8,36.9,264.9,15.3,5,,2020-05-13T05:12:36,2020-05-13T20:44:44,0.7,Partially cloudy,2,partly-cloudy-day,"03660099999,03672099999,03768099999,03781099999,D4121,03772099999,03770099999",Partly cloudy throughout the day.
Heathrow Airport,14/05/2020,14.1,3.1,8.9,14.1,0.6,7.8,-0.1,56.48,0,,0,,,,31.7,20.5,36.3,1022.7,20.3,43.7,402.4,23.2,8,,2020-05-14T05:11:05,2020-05-14T20:46:15,0.75,Partially cloudy,2,partly-cloudy-day,"03660099999,03672099999,03768099999,03781099999,D4121,03772099999,03770099999",Partly cloudy throughout the day.
Heathrow Airport,15/05/2020,18.3,3.5,11.3,18.3,2.3,11.1,2.5,57.71,0,,0,,,,,13,251.8,1024,13.4,35.6,437.8,25.2,10,,2020-05-15T05:09:36,2020-05-15T20:47:45,0.8,Clear,0,clear-day,"03660099999,03672099999,03768099999,03781099999,D4121,03772099999,03770099999",Clear conditions throughout the day.
Heathrow Airport,16/05/2020,18.1,8.1,12.8,18.1,7.5,12.7,3.2,53.91,0,,0,,,,,18.3,271.7,1024.4,65.8,45.3,289.4,16.7,6,,2020-05-16T05:08:09,2020-05-16T20:49:13,0.85,Partially cloudy,2,partly-cloudy-day,"03660099999,03672099999,03768099999,03781099999,D4121,03772099999,03770099999",Partly cloudy throughout the day.
Heathrow Airport,17/05/2020,20.1,8.1,14.4,20.1,6.5,14.1,5.6,57.98,0,,0,,,,,24.1,266.2,1023.9,49.2,43.3,365.9,21.1,8,,2020-05-17T05:06:44,2020-05-17T20:50:41,0.89,Partially cloudy,2,partly-cloudy-day,"03660099999,03672099999,03768099999,03781099999,D4121,03772099999,03770099999",Partly cloudy throughout the day.
Heathrow Airport,18/05/2020,23.8,10.3,16.7,23.8,10.3,16.7,6.4,54.58,0,,0,,,,40.7,27.7,257.1,1023.6,40.7,42.1,429.3,24.7,8,,2020-05-18T05:05:22,2020-05-18T20:52:08,0.93,Partially cloudy,2,partly-cloudy-day,"03660099999,03672099999,03768099999,03781099999,D4121,03772099999,03770099999",Clearing in the afternoon.
Heathrow Airport,19/05/2020,26,12.1,18.7,26,12.1,18.6,10,59.61,0,,0,,,,,16.6,261.7,1023.2,29.2,45.2,439.8,25.3,8,,2020-05-19T05:04:01,2020-05-19T20:53:33,0.96,Partially cloudy,2,partly-cloudy-day,"03660099999,03672099999,03768099999,03781099999,D4121,03772099999,03770099999",Clearing in the afternoon.
Heathrow Airport,20/05/2020,27.1,13.3,20.5,26.6,13.3,20.4,8.6,50.62,0,,0,,,,,20.5,217.3,1021.3,0.2,46.3,435.2,26.6,8,,2020-05-20T05:02:43,2020-05-20T20:54:58,0.98,Clear,0,clear-day,"03660099999,03672099999,03768099999,03781099999,D4121,03772099999,03770099999",Clear conditions throughout the day.
Heathrow Airport,21/05/2020,27.3,13.3,20.3,26.7,13.3,20.2,8.2,48.26,0,,0,,,,,20.4,201.8,1018.9,18.9,46.4,414.9,25.4,8,,2020-05-21T05:01:27,2020-05-21T20:56:21,1,Clear,0,clear-day,"03660099999,03672099999,03768099999,03781099999,D4121,03772099999,03770099999",Clear conditions throughout the day.
Heathrow Airport,22/05/2020,22.3,14.3,18.8,22.3,14.3,18.7,7.6,49.89,0,,0,,,,54.3,37,217.3,1015.1,56.7,33.3,394.4,22.7,8,,2020-05-22T05:00:13,2020-05-22T20:57:42,1,Partially cloudy,2,wind,"03660099999,03672099999,03768099999,03781099999,D4121,03772099999,03770099999",Clearing in the afternoon.
Heathrow Airport,23/05/2020,19.3,11.3,14.9,19.3,11.3,14.8,5.6,56.3,1.98,,8.33,,,,68.3,44.5,246.3,1022.2,42.4,26.5,399.9,23,9,,2020-05-23T04:59:02,2020-05-23T20:59:03,0,Rain,1,rain,"03660099999,03672099999,03768099999,03781099999,D4121,03772099999,03770099999",Partly cloudy throughout the day with late afternoon rain.
Heathrow Airport,24/05/2020,21.2,10.6,16.3,21.2,10.6,16.3,7.7,58.94,0,,0,,,,46.4,29.5,273.4,1030.1,47.8,28.9,360.8,20.8,8,,2020-05-24T04:57:53,2020-05-24T21:00:21,0.02,Partially cloudy,2,partly-cloudy-day,"03660099999,03672099999,03768099999,03781099999,D4121,03772099999,03770099999",Partly cloudy throughout the day.
Heathrow Airport,25/05/2020,25.8,10.6,18.7,25.8,10.6,18.6,7.3,52.13,0,,0,,,,,18.3,261,1034.3,0.1,34.9,438.9,26.9,9,,2020-05-25T04:56:47,2020-05-25T21:01:39,0.04,Clear,0,clear-day,"03660099999,03672099999,03768099999,03781099999,D4121,03772099999,03770099999",Clear conditions throughout the day.
Heathrow Airport,26/05/2020,25.8,12,19.8,25.8,12,19.8,8.3,51.23,0,,0,,,,,14.7,273.4,1035.3,12.8,36.3,412.9,25.3,8,,2020-05-26T04:55:43,2020-05-26T21:02:54,0.07,Clear,0,clear-day,"03660099999,03672099999,03768099999,03781099999,D4121,03772099999,03770099999",Clear conditions throughout the day.
Heathrow Airport,27/05/2020,26.3,14.1,20,26.3,14.1,20,9.4,51.68,0,,0,,,,,18.4,138,1035.1,56.2,32.7,288.2,17.6,8,,2020-05-27T04:54:42,2020-05-27T21:04:08,0.11,Partially cloudy,2,partly-cloudy-day,"03660099999,03672099999,03768099999,03781099999,D4121,03772099999,03770099999",Partly cloudy throughout the day.
Heathrow Airport,28/05/2020,22.1,11.8,16.9,22.1,11.8,16.9,5.3,50.41,0,,0,,,,37.1,25.9,77.9,1033.9,7.6,38.7,439.9,26.9,8,,2020-05-28T04:53:44,2020-05-28T21:05:21,0.16,Clear,0,clear-day,"03660099999,03672099999,03768099999,03781099999,D4121,03772099999,03770099999",Clear conditions throughout the day.
Heathrow Airport,29/05/2020,24.3,11.1,17.6,24.3,11.1,17.6,4.1,45.1,0,,0,,,,,22.3,75,1027.8,0.1,35.1,457.7,28,9,,2020-05-29T04:52:48,2020-05-29T21:06:31,0.21,Clear,0,clear-day,"03660099999,03672099999,03768099999,03781099999,D4121,03772099999,03770099999",Clear conditions throughout the day.
Heathrow Airport,30/05/2020,25.1,10,17.8,25.1,10,17.8,5.5,49.06,0,,0,,,,42.5,25.9,70.2,1023.2,7.5,32.1,444.8,27.2,8,,2020-05-30T04:51:55,2020-05-30T21:07:40,0.27,Clear,0,clear-day,"03660099999,03672099999,03768099999,03781099999,D4121,03772099999,03770099999",Clear conditions throughout the day.
Heathrow Airport,31/05/2020,24.6,12.5,18.8,24.6,12.5,18.8,5.7,44.95,0,,0,,,,48.4,31.6,66.3,1022.4,0,38.9,452.2,27.7,8,,2020-05-31T04:51:04,2020-05-31T21:08:46,0.33,Clear,0,wind,"03660099999,03672099999,03768099999,03781099999,D4121,03772099999,03770099999",Clear conditions throughout the day.
Heathrow Airport,01/06/2020,25.8,11.6,19.1,25.8,11.6,19,7.5,50.49,0,,0,,,,,18.4,55.2,1022.4,1.7,38.8,443.8,27.2,8,,2020-06-01T04:50:16,2020-06-01T21:09:51,0.38,Clear,0,clear-day,"03660099999,03672099999,03768099999,03781099999,D4121,03772099999,03770099999",Clear conditions throughout the day.
Heathrow Airport,02/06/2020,24.6,12.5,19.2,24.6,12.5,19.2,6.2,46.55,0,,0,,,,,14.7,206.3,1019,7.7,34.2,433.9,26.6,8,,2020-06-02T04:49:32,2020-06-02T21:10:53,0.43,Clear,0,clear-day,"03660099999,03672099999,03768099999,03781099999,D4121,03772099999,03770099999",Clear conditions throughout the day.
Heathrow Airport,03/06/2020,19.1,13.5,16,19.1,13.5,16,8.5,61.6,0.2,,4.17,,,,46.4,16.6,122.1,1008.8,94.9,25.8,115.6,7.1,3,,2020-06-03T04:48:49,2020-06-03T21:11:54,0.46,Rain,1,rain,"03660099999,03672099999,03768099999,03781099999,D4121,03772099999,03770099999",Cloudy skies throughout the day with late afternoon rain.
Heathrow Airport,04/06/2020,16.1,10.6,12.8,16.1,10.6,12.8,6.5,67.15,0.2,,8.33,,,,,20.5,261.5,1003.8,87.6,30.4,191.7,11,7,,2020-06-04T04:48:10,2020-06-04T21:12:52,0.49,Rain,1,rain,"EGWU,EGLL,03660099999,03672099999,03768099999,03781099999,D4121,EGLC,EGLF,03772099999,03770099999",Partly cloudy throughout the day with morning rain.
Heathrow Airport,05/06/2020,15.1,11.1,12.9,15.1,11.1,12.9,4.7,59.65,1.04,,12.5,,,,53.6,29.5,273.8,997.1,79.8,37.5,250.1,15.3,6,,2020-06-05T04:47:34,2020-06-05T21:13:47,0.5,Rain,1,rain,"03660099999,03672099999,03768099999,03781099999,D4121,03772099999,03770099999",Partly cloudy throughout the day with rain.
Heathrow Airport,06/06/2020,13.3,7.3,10.7,13.3,3.8,9.7,6,73.52,7.97,,8.33,,,,55.4,40.6,254.3,999.2,52.1,30.9,188.2,11.5,5,,2020-06-06T04:47:01,2020-06-06T21:14:41,0.51,Rain,1,rain,"03660099999,03672099999,03768099999,03781099999,D4121,03772099999,03770099999",Partly cloudy throughout the day with rain.
Heathrow Airport,07/06/2020,18.1,8.1,12.6,18.1,6.5,12.2,8.4,76.86,3.96,,12.5,,,,,16.5,205.5,1008.9,62,33.6,210.5,12.9,6,,2020-06-07T04:46:31,2020-06-07T21:15:32,0.52,Rain,1,rain,"03660099999,03672099999,03768099999,03781099999,D4121,03772099999,03770099999",Partly cloudy throughout the day with rain.
Heathrow Airport,08/06/2020,16,10.5,13.2,16,10.5,13.1,6.4,64.63,0,,0,,,,,16.6,95,1018.6,84.9,30.6,236.6,13.6,6,,2020-06-08T04:46:03,2020-06-08T21:16:20,0.54,Partially cloudy,2,partly-cloudy-day,"03660099999,03672099999,03768099999,03781099999,D4121,03772099999,03770099999",Partly cloudy throughout the day.
Heathrow Airport,09/06/2020,19.6,10.8,15.1,19.6,10.8,15.1,6,55.81,0,,0,,,,,16.5,113.3,1020.1,82,25.4,281.1,16.2,7,,2020-06-09T04:45:39,2020-06-09T21:17:06,0.58,Partially cloudy,2,partly-cloudy-day,"03660099999,03672099999,03768099999,03781099999,D4121,03772099999,03770099999",Partly cloudy throughout the day.
Heathrow Airport,10/06/2020,15.6,11.1,13.3,15.6,11.1,13.2,10.3,82.91,3.98,,12.5,,,,,20.5,178.4,1015.4,88.7,19.3,109.3,6.3,2,,2020-06-10T04:45:18,2020-06-10T21:17:50,0.63,Rain,1,rain,"03660099999,03672099999,03768099999,03781099999,D4121,03772099999,03770099999",Partly cloudy throughout the day with late afternoon rain.
Heathrow Airport,11/06/2020,20.3,11.1,14.5,20.3,11.1,14.4,10.9,80.3,1.8,,12.5,,,,50,25.9,55.4,1011.5,87.4,22.5,178.4,10.3,6,,2020-06-11T04:45:00,2020-06-11T21:18:30,0.67,Rain,1,rain,"03660099999,03672099999,03768099999,03781099999,D4121,03772099999,03770099999",Partly cloudy throughout the day with rain.
Heathrow Airport,12/06/2020,21.1,13.6,16.4,21.1,13.6,16.4,13,81.02,2,,4.17,,,,48.2,31.6,67.1,1005.6,72.5,13.6,182.8,11.2,5,,2020-06-12T04:44:44,2020-06-12T21:19:08,0.72,Rain,1,rain,"03660099999,03672099999,03768099999,03781099999,D4121,03772099999,03770099999",Partly cloudy throughout the day with late afternoon rain.
Heathrow Airport,13/06/2020,24.1,13.1,18,24.1,13.1,18,11.4,69.77,0.01,,4.17,,,,50,31.6,107.5,1008.1,42.5,35.6,340.1,20.8,8,,2020-06-13T04:44:32,2020-06-13T21:19:44,0.77,Rain,1,rain,"03660099999,03672099999,03768099999,03781099999,D4121,03772099999,03770099999",Partly cloudy throughout the day with early morning rain.
Heathrow Airport,14/06/2020,22.5,13.8,18.1,22.5,13.8,18,12.2,70.48,2.03,,8.33,,,,,20.5,151.9,1013.8,40.3,38,308.7,20,7,,2020-06-14T04:44:23,2020-06-14T21:20:16,0.81,Rain,1,rain,"03660099999,03672099999,03768099999,03781099999,D4121,03772099999,03770099999",Partly cloudy throughout the day with early morning rain.
Heathrow Airport,15/06/2020,25,12.1,17.6,25,12.1,17.5,11.9,72.25,0.62,,4.17,,,,,20.4,230.8,1016.1,34.2,33.2,353.8,21.7,10,,2020-06-15T04:44:17,2020-06-15T21:20:45,0.86,Rain,1,rain,"03660099999,03672099999,03768099999,03781099999,D4121,03772099999,03770099999",Becoming cloudy in the afternoon with late afternoon rain.
Heathrow Airport,16/06/2020,22.8,13.6,18.2,22.8,13.6,18.2,11.9,69.06,0.6,,12.5,,,,33.5,16.5,179.7,1014.2,59.9,35.7,306.2,18.7,8,,2020-06-16T04:44:14,2020-06-16T21:21:12,0.9,Rain,1,rain,"03680099999,03660099999,03672099999,03768099999,03781099999,D4121,03772099999,03770099999",Partly cloudy throughout the day with rain.
Heathrow Airport,17/06/2020,22,13,17.6,22,13,17.6,12.7,74.3,1.03,,8.33,,,,,18.4,182,1012.4,69.1,23.5,207.6,10.5,6,,2020-06-17T04:44:15,2020-06-17T21:21:36,0.94,Rain,1,rain,"03660099999,03672099999,03768099999,03781099999,D4121,03772099999,03770099999",Partly cloudy throughout the day with late afternoon rain.
Heathrow Airport,18/06/2020,18,13.8,15.6,18,13.8,15.6,13.4,87.36,17.21,,12.5,,,,,22.3,207.1,1010.3,75.8,17.6,170.1,10.4,6,,2020-06-18T04:44:18,2020-06-18T21:21:57,0.97,Rain,1,rain,"03660099999,03672099999,03768099999,03781099999,D4121,03772099999,03770099999",Partly cloudy throughout the day with a chance of rain throughout the day.
Heathrow Airport,19/06/2020,19.6,14,15.7,19.6,14,15.7,12.2,80.71,2.99,,12.5,,,,48.2,33.4,200.8,1014,78.7,28.1,182.5,11.2,5,,2020-06-19T04:44:24,2020-06-19T21:22:14,0.99,Rain,1,rain,"03660099999,03672099999,03768099999,03781099999,D4121,03772099999,03770099999",Partly cloudy throughout the day with a chance of rain throughout the day.
Heathrow Airport,20/06/2020,22.1,11.9,17,22.1,11.9,17,11.8,73.1,0.2,,8.33,,,,,24.1,196.7,1019.3,60,33.8,273.5,16.7,6,,2020-06-20T04:44:33,2020-06-20T21:22:29,1,Rain,1,rain,"03660099999,03672099999,03768099999,03781099999,D4121,03772099999,03770099999",Partly cloudy throughout the day with early morning rain.
Heathrow Airport,21/06/2020,23.1,14.2,17.8,23.1,14.2,17.8,11.3,67.94,1.2,,8.33,,,,53.9,27.7,221.1,1016.8,59.6,29.5,312.8,18,7,,2020-06-21T04:44:46,2020-06-21T21:22:41,0,Rain,1,rain,"03660099999,03672099999,03768099999,03781099999,D4121,03772099999,03770099999",Partly cloudy throughout the day with rain in the morning and afternoon.
Heathrow Airport,22/06/2020,23.6,10.5,17.3,23.6,10.5,17.3,8.8,60.31,0,,0,,,,,24.1,221.6,1024.6,0.1,25.2,458.4,28.1,9,,2020-06-22T04:45:01,2020-06-22T21:22:49,0.01,Clear,0,clear-day,"03660099999,03672099999,03768099999,03781099999,D4121,03772099999,03770099999",Clear conditions throughout the day.
Heathrow Airport,23/06/2020,28,11.9,20.8,27.5,11.9,20.8,11.6,59,0,,0,,,,,16.5,167.1,1023.5,0.1,26.3,412.4,26.7,8,,2020-06-23T04:45:19,2020-06-23T21:22:55,0.03,Clear,0,clear-day,"03660099999,03672099999,03768099999,03781099999,D4121,03772099999,03770099999",Clear conditions throughout the day.
Heathrow Airport,24/06/2020,32.5,17,24.5,31.3,17,24.2,12.9,51.15,0,,0,,,,,25.9,80.3,1020,1.7,24.8,410.3,26.6,8,,2020-06-24T04:45:40,2020-06-24T21:22:57,0.06,Clear,0,clear-day,"03680099999,03660099999,03672099999,03768099999,03781099999,D4121,03772099999,03770099999",Clear conditions throughout the day.
Heathrow Airport,25/06/2020,32.5,18.3,25.8,31.3,18.3,25.4,13.1,48.09,0,,0,,,,,24.1,79.4,1015.3,0.5,27.5,418.4,27.1,8,,2020-06-25T04:46:04,2020-06-25T21:22:57,0.1,Clear,0,clear-day,"03660099999,03672099999,03768099999,03781099999,D4121,03772099999,03770099999",Clear conditions throughout the day.
Heathrow Airport,26/06/2020,30.6,16.3,23.5,30.4,16.3,23.5,14.3,57.95,0,,4.17,,,,,25.9,176,1009,26.8,28.3,413.4,23.8,8,,2020-06-26T04:46:31,2020-06-26T21:22:53,0.14,Partially cloudy,2,partly-cloudy-day,"03660099999,03672099999,03768099999,03781099999,D4121,03772099999,03770099999",Clearing in the afternoon.
Heathrow Airport,27/06/2020,20.6,15.3,17.3,20.6,15.3,17.2,13.3,78.2,4.19,,8.33,,,,55.4,37,195.4,1005.2,72.9,21.6,184.6,11.3,4,,2020-06-27T04:47:01,2020-06-27T21:22:46,0.2,Rain,1,rain,"03660099999,03672099999,03768099999,03781099999,D4121,03772099999,03770099999",Partly cloudy throughout the day with rain in the morning and afternoon.
Heathrow Airport,28/06/2020,20.8,12.3,16.3,20.8,12.3,16.2,9.1,63.87,0.81,,12.5,,,,61.1,35.2,233.1,1009.3,59.1,24.5,295.4,18.1,6,,2020-06-28T04:47:33,2020-06-28T21:22:36,0.26,Rain,1,rain,"03660099999,03672099999,03768099999,03781099999,D4121,03772099999,03770099999",Partly cloudy throughout the day with late afternoon rain.
Heathrow Airport,29/06/2020,20.5,12.3,15.7,20.5,12.3,15.6,7.8,60.99,0.99,,4.17,,,,57.7,42.4,239.5,1009.9,81.9,23.7,191.8,12.4,5,,2020-06-29T04:48:09,2020-06-29T21:22:23,0.32,Rain,1,rain,"03660099999,03672099999,03768099999,03781099999,D4121,03772099999,03770099999",Partly cloudy throughout the day with early morning rain.
Heathrow Airport,30/06/2020,18.6,12.8,16,18.6,12.8,16,11.7,75.9,0.2,,8.33,,,,,24.1,224.2,1007.4,87.9,20.6,145.6,8.9,4,,2020-06-30T04:48:46,2020-06-30T21:22:07,0.37,Rain,1,rain,"03660099999,03672099999,03768099999,03781099999,D4121,03772099999,03770099999",Partly cloudy throughout the day with afternoon rain.
Heathrow Airport,01/07/2020,20.8,14.3,17.4,20.8,14.3,17.4,13.1,76.17,0.41,,12.5,,,,46.4,25.9,237.9,1005.6,81.2,32.5,220.5,13.5,5,,2020-07-01T04:49:27,2020-07-01T21:21:47,0.42,Rain,1,rain,"03660099999,03672099999,03768099999,03781099999,D4121,03772099999,03770099999",Partly cloudy throughout the day with rain.
Heathrow Airport,02/07/2020,21.6,12.1,16.6,21.6,12.1,16.5,11.9,75.05,2.01,,12.5,,,,,25.9,252.1,1011.1,57.4,34.5,282.3,16.3,6,,2020-07-02T04:50:10,2020-07-02T21:21:25,0.46,Rain,1,rain,"03660099999,03672099999,03768099999,03781099999,D4121,03772099999,03770099999",Partly cloudy throughout the day with afternoon rain.
Heathrow Airport,03/07/2020,22.3,12.2,16.7,22.3,12.2,16.6,11.1,72.05,0.01,,8.33,,,,53.6,33.5,234.5,1015.8,70.7,23.9,308.1,18.9,7,,2020-07-03T04:50:55,2020-07-03T21:21:00,0.48,Rain,1,rain,"03660099999,03672099999,03768099999,03781099999,D4121,03772099999,03770099999",Partly cloudy throughout the day with early morning rain.
Heathrow Airport,04/07/2020,20.5,15.1,17.8,20.5,15.1,17.8,15.1,84.31,2,,8.33,,,,50,31.6,218.6,1011.1,92.4,24.7,112.4,6.5,3,,2020-07-04T04:51:43,2020-07-04T21:20:31,0.5,Rain,1,rain,"03660099999,03672099999,03768099999,03781099999,D4121,03772099999,03770099999",Cloudy skies throughout the day with early morning rain.
Heathrow Airport,05/07/2020,22.1,14.1,18.5,22.1,14.1,18.5,10,60.75,0,,8.33,,,,63,44.6,245.8,1010.8,60.8,24.2,428.4,24.7,9,,2020-07-05T04:52:34,2020-07-05T21:20:00,0.5,Partially cloudy,2,wind,"03660099999,03672099999,03768099999,03781099999,D4121,03772099999,03770099999",Partly cloudy throughout the day.
Heathrow Airport,06/07/2020,19.3,11.6,15.9,19.3,11.6,15.8,7.6,59.39,0,,0,,,,51.8,31.6,282.5,1019,51.6,20.3,217,13.3,4,,2020-07-06T04:53:27,2020-07-06T21:19:25,0.51,Partially cloudy,2,wind,"03660099999,03672099999,03768099999,03781099999,D4121,03772099999,03770099999",Partly cloudy throughout the day.
Heathrow Airport,07/07/2020,21.1,11.3,15.9,21.1,11.3,15.9,8.7,64.75,0,,4.17,,,,31.7,25.9,239,1020.3,71.2,20.9,223.5,12.9,5,,2020-07-07T04:54:21,2020-07-07T21:18:48,0.53,Partially cloudy,2,partly-cloudy-day,"03680099999,03660099999,03672099999,03768099999,03781099999,D4121,03772099999,03770099999",Partly cloudy throughout the day.
Heathrow Airport,08/07/2020,19.3,14,16.7,19.3,14,16.6,15.5,93.33,3.43,,12.5,,,,,22.3,241.7,1014.8,80.8,17.1,131.4,7.6,3,,2020-07-08T04:55:19,2020-07-08T21:18:07,0.56,Rain,1,rain,"03660099999,03672099999,03768099999,03781099999,D4121,03772099999,03770099999",Partly cloudy throughout the day with a chance of rain throughout the day.
Heathrow Airport,09/07/2020,20.1,15.1,17.5,20.1,15.1,17.4,15.5,88.69,1.46,,16.67,,,,,24.1,236.2,1011.8,82.1,30.1,98.9,5.7,2,,2020-07-09T04:56:18,2020-07-09T21:17:24,0.6,Rain,1,rain,"03660099999,03672099999,03768099999,03781099999,D4121,03772099999,03770099999",Partly cloudy throughout the day with rain.
Heathrow Airport,10/07/2020,18.5,12.3,15.5,18.5,12.3,15.5,8.8,67.39,2,,8.33,,,,,20.5,313.3,1017.5,70.7,39.8,304.9,17.6,8,,2020-07-10T04:57:19,2020-07-10T21:16:38,0.64,Rain,1,rain,"03660099999,03672099999,03768099999,03781099999,D4121,03772099999,03770099999",Partly cloudy throughout the day with early morning rain.
Heathrow Airport,11/07/2020,20.8,8.8,15.8,20.8,7.8,15.6,6.5,56.66,0,,0,,,,,18.4,267.1,1026.3,29.9,43.2,327.3,20,7,,2020-07-11T04:58:23,2020-07-11T21:15:49,0.68,Partially cloudy,2,partly-cloudy-day,"03660099999,03672099999,03768099999,03781099999,D4121,03772099999,03770099999",Partly cloudy throughout the day.
Heathrow Airport,12/07/2020,24.5,10.1,18.1,24.5,10.1,18.1,7.4,53.43,0,,0,,,,,20.5,173,1027.8,8.6,36.3,403.1,24.7,8,,2020-07-12T04:59:28,2020-07-12T21:14:57,0.73,Clear,0,clear-day,"03660099999,03672099999,03768099999,03781099999,D4121,03772099999,03770099999",Clear conditions throughout the day.
Heathrow Airport,13/07/2020,25.6,12.8,19.2,25.6,12.8,19.1,9.1,54.99,0,,0,,,,0,27.7,252.7,1023.2,58.7,32.5,370.1,22.6,8,,2020-07-13T05:00:35,2020-07-13T21:14:02,0.78,Partially cloudy,2,partly-cloudy-day,"03660099999,03672099999,03768099999,03781099999,D4121,03772099999,03770099999",Partly cloudy throughout the day.
Heathrow Airport,14/07/2020,21.3,15.3,17.9,21.3,15.3,17.9,12.3,71.84,0.6,,8.33,,,,0,14.8,309.4,1016.5,78.7,36.8,224.3,12.9,5,,2020-07-14T05:01:44,2020-07-14T21:13:05,0.83,Rain,1,rain,"03660099999,03672099999,03768099999,03781099999,D4121,03772099999,03770099999",Partly cloudy throughout the day with early morning rain.
Heathrow Airport,15/07/2020,19.3,13.5,16.5,19.3,13.5,16.5,10.7,68.79,0,,0,,,,,18.3,286.1,1016.1,89.1,43.9,141.6,8.7,3,,2020-07-15T05:02:55,2020-07-15T21:12:05,0.87,Partially cloudy,2,partly-cloudy-day,"03660099999,03672099999,03768099999,03781099999,D4121,03772099999,03770099999",Partly cloudy throughout the day.
Heathrow Airport,16/07/2020,23.6,16,19.1,23.6,16,19.1,12.7,67.06,0,,0,,,,33.5,19.4,258.2,1019.8,86.7,45.8,186.8,10.8,5,,2020-07-16T05:04:07,2020-07-16T21:11:02,0.91,Partially cloudy,2,partly-cloudy-day,"03680099999,03660099999,03672099999,03768099999,03781099999,D4121,03772099999,03770099999",Partly cloudy throughout the day.
Heathrow Airport,17/07/2020,28.1,17.1,22.4,27.4,17.1,22.3,12.8,57.3,0,,0,,,,29.5,22.3,255.5,1020.6,51.6,40.4,396.1,22.8,8,,2020-07-17T05:05:21,2020-07-17T21:09:57,0.95,Partially cloudy,2,partly-cloudy-day,"03660099999,03672099999,03768099999,03781099999,D4121,03772099999,03770099999",Partly cloudy throughout the day.
Heathrow Airport,18/07/2020,25.1,15.1,19.9,25.1,15.1,19.8,11.7,61.45,0,,0,,,,,24.1,264.2,1018.4,60.3,42.5,390.8,22.5,8,,2020-07-18T05:06:36,2020-07-18T21:08:50,0.98,Partially cloudy,2,partly-cloudy-day,"03660099999,03672099999,03768099999,03781099999,D4121,03772099999,03770099999",Partly cloudy throughout the day.
Heathrow Airport,19/07/2020,20.8,14.2,17.6,20.8,14.2,17.6,11,67.76,0.8,,8.33,,,,,14.8,178.5,1017.8,82.8,37.2,153.1,8.8,4,,2020-07-19T05:07:53,2020-07-19T21:07:39,1,Rain,1,rain,"03660099999,03672099999,03768099999,03781099999,D4121,03772099999,03770099999",Partly cloudy throughout the day with rain in the morning and afternoon.
Heathrow Airport,20/07/2020,22.1,10.6,16.9,22.1,10.6,16.8,6,51.5,0,,0,,,,,14.8,251.1,1022.9,6.7,37.4,464.7,26.8,9,,2020-07-20T05:09:11,2020-07-20T21:06:27,1,Clear,0,clear-day,"03660099999,03672099999,03768099999,03781099999,D4121,03772099999,03770099999",Clear conditions throughout the day.
Heathrow Airport,21/07/2020,22.1,10.5,17.2,22.1,10.5,17.2,5.6,49.17,0,,0,,,,31.7,13,206.9,1025.9,15.1,37,411.8,23.7,9,,2020-07-21T05:10:30,2020-07-21T21:05:12,0,Clear,0,clear-day,"03660099999,03672099999,03768099999,03781099999,D4121,03772099999,03770099999",Clear conditions throughout the day.
Heathrow Airport,22/07/2020,26.1,14,20,26.1,14,19.9,8.4,49.74,0,,0,,,,33.5,22.3,207.5,1023.5,55.3,37.4,423,24.4,8,,2020-07-22T05:11:51,2020-07-22T21:03:55,0.02,Partially cloudy,2,partly-cloudy-day,"03660099999,03672099999,03768099999,03781099999,D4121,03772099999,03770099999",Partly cloudy throughout the day.
Heathrow Airport,23/07/2020,25.6,13.6,19.5,25.6,13.6,19.5,9.7,55.56,0,,0,,,,,25.9,224.9,1016.4,64.5,42.7,319.1,18.4,8,,2020-07-23T05:13:13,2020-07-23T21:02:35,0.05,Partially cloudy,2,partly-cloudy-day,"03660099999,03672099999,03768099999,03781099999,D4121,03772099999,03770099999",Partly cloudy throughout the day.
Heathrow Airport,24/07/2020,25.3,16.1,20.1,25.3,16.1,20.1,13.5,67.43,0,,0,,,,,24,238.3,1012.4,72.1,40.4,200.2,11.5,6,,2020-07-24T05:14:36,2020-07-24T21:01:13,0.09,Partially cloudy,2,partly-cloudy-day,"03660099999,03672099999,03768099999,03781099999,D4121,03772099999,03770099999",Partly cloudy throughout the day.
Heathrow Airport,25/07/2020,22.3,15.1,18.3,22.3,15.1,18.3,15.3,82.98,3.03,,8.33,,,,46.4,29.5,214,1007.8,80.4,33.4,105.1,5.7,3,,2020-07-25T05:16:00,2020-07-25T20:59:49,0.14,Rain,1,rain,"03660099999,03672099999,03768099999,03781099999,D4121,03772099999,03770099999",Partly cloudy throughout the day with late afternoon rain.
Heathrow Airport,26/07/2020,22.1,12.6,17,22.1,12.6,17,12.7,77.86,5.99,,12.5,,,,48.2,25.9,235.2,1010.4,51.6,31.7,257.4,14.8,8,,2020-07-26T05:17:25,2020-07-26T20:58:23,0.19,Rain,1,rain,"03660099999,03672099999,03768099999,03781099999,D4121,03772099999,03770099999",Partly cloudy throughout the day with rain.
Heathrow Airport,27/07/2020,20.8,15.6,17.5,20.8,15.6,17.5,15,85.32,1.41,,12.5,,,,51.8,31.6,197.9,1008,84.8,22.6,116,6.7,3,,2020-07-27T05:18:51,2020-07-27T20:56:55,0.25,Rain,1,rain,"EGWU,EGLL,03660099999,03672099999,03768099999,03781099999,D4121,EGLC,EGLF,03772099999,03770099999",Partly cloudy throughout the day with a chance of rain throughout the day.
Heathrow Airport,28/07/2020,20.5,12.3,16.7,20.5,12.3,16.6,8.5,61.1,0.4,,4.17,,,,46.4,25.9,276.1,1013.9,39.9,42.1,252.4,14.5,6,,2020-07-28T05:20:18,2020-07-28T20:55:24,0.31,Rain,1,rain,"03660099999,03672099999,03768099999,03781099999,D4121,03772099999,03770099999",Partly cloudy throughout the day with early morning rain.
Heathrow Airport,29/07/2020,23.5,9.5,17.5,23.5,8.2,17.4,8.3,57.3,0,,0,,,,,16.6,257.8,1020,35.9,44.1,392.2,22.6,8,,2020-07-29T05:21:45,2020-07-29T20:53:52,0.36,Partially cloudy,2,partly-cloudy-day,"03660099999,03672099999,03768099999,03781099999,D4121,03772099999,03770099999",Becoming cloudy in the afternoon.
Heathrow Airport,30/07/2020,29.1,12.8,21.6,27.7,12.8,21.2,8.6,47.9,0,,0,,,,,14.7,181.8,1018.1,14.6,43.5,439.9,25.3,8,,2020-07-30T05:23:14,2020-07-30T20:52:18,0.41,Clear,0,clear-day,"03660099999,03672099999,03768099999,03781099999,D4121,03761099999,03658099999,03772099999,03770099999",Clear conditions throughout the day.
Heathrow Airport,31/07/2020,36.8,17.3,25.9,35.6,17.3,25.4,12,46.05,0,,0,,,,55.4,33.4,136.9,1011.7,24.5,35.7,411.9,22.2,8,,2020-07-31T05:24:43,2020-07-31T20:50:42,0.45,Partially cloudy,2,wind,"03660099999,03672099999,03768099999,03781099999,D4121,03772099999,03770099999",Becoming cloudy in the afternoon.
Heathrow Airport,01/08/2020,27,15.8,21.5,26.9,15.8,21.4,13,60.56,0,,0,,,,31.7,25.9,255.4,1014.9,46.6,34.5,288.7,16.6,5,,2020-08-01T05:26:13,2020-08-01T20:49:04,0.47,Partially cloudy,2,partly-cloudy-day,"03660099999,03672099999,03768099999,03781099999,D4121,03772099999,03770099999",Becoming cloudy in the afternoon.
Heathrow Airport,02/08/2020,25.3,11.7,18.7,25.3,11.7,18.7,9.6,57.81,0,,0,,,,33.5,24.1,263,1016.4,39.6,40.3,348.7,20.1,7,,2020-08-02T05:27:43,2020-08-02T20:47:24,0.49,Partially cloudy,2,partly-cloudy-day,"03660099999,03672099999,03768099999,03781099999,D4121,03772099999,03770099999",Partly cloudy throughout the day.
Heathrow Airport,03/08/2020,22.5,13.8,18.4,22.5,13.8,18.3,7.8,52.77,0,,0,,,,,18.3,317.3,1015.8,62.3,44.2,328.2,18.9,6,,2020-08-03T05:29:14,2020-08-03T20:45:42,0.5,Partially cloudy,2,partly-cloudy-day,"03660099999,03672099999,03768099999,03781099999,D4121,03772099999,03770099999",Partly cloudy throughout the day.
Heathrow Airport,04/08/2020,24,11.1,17.8,24,11.1,17.8,8.6,57.67,0,,0,,,,31.7,27.6,233.5,1016.1,34.1,43.2,323.3,18.6,6,,2020-08-04T05:30:46,2020-08-04T20:43:59,0.51,Partially cloudy,2,partly-cloudy-day,"03660099999,03672099999,03768099999,03781099999,D4121,03772099999,03770099999",Partly cloudy throughout the day.
Heathrow Airport,05/08/2020,26,15.7,20.3,26,15.7,20.3,11.7,61.02,0,,0,,,,46.4,33.4,205,1012.9,76.5,41.2,323.4,18.6,8,,2020-08-05T05:32:18,2020-08-05T20:42:14,0.52,Partially cloudy,2,wind,"03660099999,03672099999,03768099999,03781099999,D4121,03772099999,03770099999",Partly cloudy throughout the day.
Heathrow Airport,06/08/2020,28.8,18.3,22.8,28.6,18.3,22.7,15.6,66.69,0,,4.17,,,,,18.4,199.8,1016.7,63.7,40,295.8,17,8,,2020-08-06T05:33:50,2020-08-06T20:40:28,0.54,Partially cloudy,2,partly-cloudy-day,"03660099999,03672099999,03768099999,03781099999,D4121,03772099999,03770099999",Partly cloudy throughout the day.
Heathrow Airport,07/08/2020,36.3,16,26.1,34.4,16,25.3,11.7,47.22,0,,0,,,,33.5,20.5,193.6,1017.8,27.1,35.1,369.8,21.3,8,,2020-08-07T05:35:23,2020-08-07T20:38:40,0.57,Partially cloudy,2,partly-cloudy-day,"03660099999,03672099999,03768099999,03781099999,D4121,03772099999,03770099999",Becoming cloudy in the afternoon.
Heathrow Airport,08/08/2020,32.8,20.6,25.7,32.4,20.6,25.7,15.6,55.19,0,,0,,,,,16.6,108.9,1018.8,66.6,31.6,260.9,15,7,,2020-08-08T05:36:56,2020-08-08T20:36:50,0.61,Partially cloudy,2,partly-cloudy-day,"03660099999,03672099999,03768099999,03781099999,D4121,03772099999,03770099999",Partly cloudy throughout the day.
Heathrow Airport,09/08/2020,33,17.3,24.2,32.9,17.3,24.1,15.3,61.43,0,,0,,,,,20.5,50.4,1017.8,45.4,19.8,367.6,21.2,8,,2020-08-09T05:38:30,2020-08-09T20:34:59,0.65,Partially cloudy,2,partly-cloudy-day,"03660099999,03672099999,03768099999,03781099999,D4121,03772099999,03770099999",Clearing in the afternoon.
Heathrow Airport,10/08/2020,35.5,19.1,26.7,34.8,19.1,26.7,16.1,55.87,0,,0,,,,33.5,20.5,72.9,1013.9,30.1,23.4,376,21.7,7,,2020-08-10T05:40:03,2020-08-10T20:33:07,0.7,Partially cloudy,2,partly-cloudy-day,"03660099999,03672099999,03768099999,03781099999,D4121,03772099999,03770099999",Partly cloudy throughout the day.
Heathrow Airport,11/08/2020,35.3,21.8,28.2,34.6,21.8,28.1,16,50.94,0,,0,,,,16.6,14.8,154.3,1014,42.3,24.1,354.2,19.1,8,,2020-08-11T05:41:38,2020-08-11T20:31:13,0.74,Partially cloudy,2,partly-cloudy-day,"03660099999,03672099999,03768099999,03781099999,D4121,03772099999,03770099999",Partly cloudy throughout the day.
Heathrow Airport,12/08/2020,35.3,21.8,27,35.8,21.8,27.2,17,56.28,0.43,,8.33,,,,68.4,29.4,134.7,1013,34.2,19,287.7,15.5,7,,2020-08-12T05:43:12,2020-08-12T20:29:18,0.79,Rain,1,rain,"EGWU,03680099999,EGLL,03660099999,03672099999,03768099999,03781099999,D4121,03658099999,03772099999,03876099999,03770099999",Becoming cloudy in the afternoon with rain.
Heathrow Airport,13/08/2020,27.8,19.1,22.6,28.8,19.1,22.7,17.8,74.63,1,,8.33,,,,0,18.4,70.8,1012.3,59.4,15,216.8,11.7,7,,2020-08-13T05:44:46,2020-08-13T20:27:22,0.84,Rain,1,rain,"EGWU,EGLL,03660099999,03672099999,03768099999,03781099999,D4121,EGLC,EGLF,03772099999,03770099999",Partly cloudy throughout the day with rain.
Heathrow Airport,14/08/2020,19.5,17.3,18.4,19.5,17.3,18.4,16.5,88.69,1.5,,12.5,,,,0,13,164.8,1013.8,95.7,13.2,90.1,4.5,2,,2020-08-14T05:46:21,2020-08-14T20:25:24,0.89,Rain,1,rain,"03660099999,03672099999,03768099999,03781099999,D4121,03772099999,03770099999",Cloudy skies throughout the day with rain.
Heathrow Airport,15/08/2020,19.3,16.6,18.2,19.3,16.6,18.1,16.9,92.58,0.41,,16.67,,,,,11.2,108.2,1014.6,96.6,10.3,67.8,3.4,1,,2020-08-15T05:47:56,2020-08-15T20:23:25,0.93,Rain,1,rain,"03680099999,03660099999,03672099999,03768099999,03781099999,D4121,03772099999,03770099999",Cloudy skies throughout the day with rain clearing later.
Heathrow Airport,16/08/2020,24.6,18.1,20.7,24.6,18.1,20.7,16.6,78.87,0.92,,8.33,,,,,16.5,175.9,1010.8,64.6,20.8,184.3,10,5,,2020-08-16T05:49:31,2020-08-16T20:21:26,0.96,Rain,1,rain,"03660099999,03672099999,03768099999,03781099999,D4121,03772099999,03770099999",Partly cloudy throughout the day with rain.
Heathrow Airport,17/08/2020,24.1,15.3,19,24.1,15.3,19,14.7,77.23,3.02,,8.33,,,,29.5,20.4,222.1,1007.9,45.1,31.9,225.8,13,6,,2020-08-17T05:51:06,2020-08-17T20:19:24,0.99,Rain,1,rain,"03660099999,03672099999,03768099999,03781099999,D4121,03772099999,03770099999",Partly cloudy throughout the day with rain.
Heathrow Airport,18/08/2020,24.8,16.3,19.8,24.8,16.3,19.8,14.7,73.51,3.03,,8.33,,,,50.1,25.9,206.5,1008.9,52,42.9,242.3,13.1,4,,2020-08-18T05:52:41,2020-08-18T20:17:22,1,Rain,1,rain,"03660099999,03672099999,03768099999,03781099999,D4121,03772099999,03770099999",Partly cloudy throughout the day with late afternoon rain.
Heathrow Airport,19/08/2020,20.3,14.9,18.1,20.3,14.9,18,17.2,94.56,12.99,,16.67,,,,,24.1,142.1,1003.7,67.9,14,60.1,3.2,1,,2020-08-19T05:54:17,2020-08-19T20:15:19,0,Rain,1,rain,"03660099999,03672099999,03768099999,03781099999,D4121,03772099999,03770099999",Partly cloudy throughout the day with rain.
Heathrow Airport,20/08/2020,25.1,16.3,20.6,25.1,16.3,20.6,13.2,65.4,0.4,,4.17,,,,51.8,29.5,190.8,1002.6,41.2,21.4,410.5,20.7,8,,2020-08-20T05:55:52,2020-08-20T20:13:15,0.01,Rain,1,rain,"03660099999,03672099999,03768099999,03781099999,D4121,03772099999,03770099999",Clearing in the afternoon with early morning rain.
Heathrow Airport,21/08/2020,23,17.5,20.3,23,17.5,20.3,13.3,64.94,0,,8.33,,,,75.9,48.2,201.5,1003.2,57.9,19.1,307.4,15.5,6,,2020-08-21T05:57:27,2020-08-21T20:11:10,0.04,Partially cloudy,2,wind,"03660099999,03672099999,03768099999,03781099999,D4121,03772099999,03770099999",Partly cloudy throughout the day.
Heathrow Airport,22/08/2020,23.3,16.5,19.2,23.3,16.5,19.1,11.9,64.24,0.2,,12.5,,,,61.1,38.8,228.8,1011.6,41.6,27.8,304.6,16.4,6,,2020-08-22T05:59:03,2020-08-22T20:09:04,0.08,Rain,1,rain,"03660099999,03672099999,03768099999,03781099999,D4121,03772099999,03770099999",Partly cloudy throughout the day with late afternoon rain.
Heathrow Airport,23/08/2020,21.8,14.9,18,21.8,14.9,18,11.6,67.27,0,,8.33,,,,46.4,31.6,249.6,1016.2,74,34.2,251.8,12.7,5,,2020-08-23T06:00:38,2020-08-23T20:06:57,0.13,Partially cloudy,2,wind,"03660099999,03672099999,03768099999,03781099999,D4121,03772099999,03770099999",Partly cloudy throughout the day.
Heathrow Airport,24/08/2020,23.6,13.6,17.2,23.6,13.6,17.1,12.8,76.49,2.97,,8.33,,,,,20.4,234.5,1015.4,67,34.1,219.2,11,6,,2020-08-24T06:02:14,2020-08-24T20:04:49,0.18,Rain,1,rain,"03660099999,03672099999,03768099999,03781099999,D4121,03772099999,03770099999",Partly cloudy throughout the day with late afternoon rain.
Heathrow Airport,25/08/2020,21.6,15.6,17.7,21.6,15.6,17.6,14.7,83.48,10.42,,12.5,,,,79.4,44.5,192.9,1002,79.5,21.3,145.7,7.3,3,,2020-08-25T06:03:49,2020-08-25T20:02:40,0.24,Rain,1,rain,"03660099999,03672099999,03768099999,03781099999,D4121,03772099999,03770099999",Partly cloudy throughout the day with rain in the morning and afternoon.
Heathrow Airport,26/08/2020,21.5,15.4,18.2,21.5,15.4,18.2,10.6,62.04,0,,4.17,,,,77.7,48.1,264.2,1011.5,71.2,39.4,274.7,13.8,5,,2020-08-26T06:05:25,2020-08-26T20:00:31,0.29,Partially cloudy,2,wind,"03680099999,03660099999,03672099999,03768099999,03781099999,D4121,03772099999,03770099999",Partly cloudy throughout the day.
Heathrow Airport,27/08/2020,18,13.1,15.3,18,13.1,15.2,12.2,82.53,10.02,,4.17,,,,,20.5,199.2,1011.2,77.8,21.7,126.6,6.4,3,,2020-08-27T06:07:00,2020-08-27T19:58:21,0.35,Rain,1,rain,"03680099999,03660099999,03672099999,03768099999,03781099999,D4121,03772099999,03770099999",Partly cloudy throughout the day with late afternoon rain.
Heathrow Airport,28/08/2020,18.8,11.5,14.8,18.8,11.5,14.8,12,84.43,6,,16.67,,,,46.4,24.1,266.7,1001.1,70.8,31,217.5,11.7,5,,2020-08-28T06:08:36,2020-08-28T19:56:10,0.39,Rain,1,rain,"03660099999,03672099999,03768099999,03781099999,D4121,03772099999,03770099999",Partly cloudy throughout the day with rain.
Heathrow Airport,29/08/2020,15.6,11.2,13,15.6,11.2,13,9.2,78.25,1.01,,16.67,,,,53.6,22.3,334.3,1008.4,88.7,24.8,151.1,7.6,3,,2020-08-29T06:10:11,2020-08-29T19:53:59,0.43,Rain,1,rain,"03660099999,03672099999,03768099999,03781099999,D4121,03772099999,03770099999",Partly cloudy throughout the day with early morning rain.
Heathrow Airport,30/08/2020,17.3,11.8,13.9,17.3,11.8,13.8,7.8,67.56,0.4,,8.33,,,,,20.5,212.1,1017.3,89,30,167.8,8.5,4,,2020-08-30T06:11:47,2020-08-30T19:51:46,0.46,Rain,1,rain,"03660099999,03672099999,03768099999,03781099999,D4121,03772099999,03770099999",Partly cloudy throughout the day with early morning rain.
Heathrow Airport,31/08/2020,17.8,8.6,13.6,17.8,8.6,13.6,6.4,64.41,0,,0,,,,,9.3,171.3,1021.9,70.3,29.2,239,12,6,,2020-08-31T06:13:22,2020-08-31T19:49:34,0.49,Partially cloudy,2,partly-cloudy-day,"03660099999,03672099999,03768099999,03781099999,D4121,03772099999,03770099999",Partly cloudy throughout the day.
Heathrow Airport,01/09/2020,20.1,6.8,14.1,20.1,6.8,14.1,6.2,63.48,0,,0,,,,,9.4,261.8,1020.8,12.6,29.2,332,16.7,7,,2020-09-01T06:14:58,2020-09-01T19:47:20,0.5,Clear,0,clear-day,"03660099999,03672099999,03768099999,03781099999,D4121,03772099999,03770099999",Clear conditions throughout the day.
Heathrow Airport,02/09/2020,20,9.3,14.7,20,9.3,14.7,10.1,75.39,0.8,,4.17,,,,,20.5,196.7,1019.1,48.8,29.6,215.4,10.9,6,,2020-09-02T06:16:33,2020-09-02T19:45:07,0.5,Rain,1,rain,"03660099999,03672099999,03768099999,03781099999,D4121,03772099999,03770099999",Partly cloudy throughout the day with late afternoon rain.
Heathrow Airport,03/09/2020,22.1,16,18.5,22.1,16,18.4,15.6,83.67,1.2,,12.5,,,,46.4,27.7,227.1,1015.8,87,26.6,100.6,5.1,2,,2020-09-03T06:18:09,2020-09-03T19:42:52,0.51,Rain,1,rain,"03660099999,03672099999,03768099999,03781099999,D4121,03772099999,03770099999",Partly cloudy throughout the day with rain.
Heathrow Airport,04/09/2020,20.1,12.5,16.1,20.1,12.5,16.1,10.9,72.64,0,,4.17,,,,38.9,22.3,251.7,1020.8,80.8,23.7,177.4,8.9,5,,2020-09-04T06:19:44,2020-09-04T19:40:37,0.53,Partially cloudy,2,partly-cloudy-day,"03660099999,03672099999,03768099999,03781099999,D4121,03772099999,03770099999",Partly cloudy throughout the day.
Heathrow Airport,05/09/2020,19.5,9.5,14.7,19.5,8.2,14.6,8.3,68.84,0.6,,4.17,,,,18.4,22.3,272.7,1021.1,43.3,24.8,278.4,12,6,,2020-09-05T06:21:19,2020-09-05T19:38:22,0.55,Rain,1,rain,"03660099999,03672099999,03768099999,03781099999,D4121,03772099999,03770099999",Partly cloudy throughout the day with early morning rain.
Heathrow Airport,06/09/2020,20.5,10.3,15.1,20.5,10.3,15.1,9.4,70.35,0,,0,,,,16.6,16.5,260.4,1020.9,65.3,28.8,281.8,14.2,6,,2020-09-06T06:22:55,2020-09-06T19:36:06,0.58,Partially cloudy,2,partly-cloudy-day,"03660099999,03672099999,03768099999,03781099999,D4121,03772099999,03770099999",Partly cloudy throughout the day.
Heathrow Airport,07/09/2020,21,10.6,15.9,21,10.6,15.9,11.6,77.43,0,,0,,,,33.5,25.9,250.8,1023.1,61.6,34.8,196.2,9.2,4,,2020-09-07T06:24:30,2020-09-07T19:33:50,0.62,Partially cloudy,2,partly-cloudy-day,"03660099999,03672099999,03768099999,03781099999,D4121,03772099999,03770099999",Partly cloudy throughout the day.
Heathrow Airport,08/09/2020,24.6,16.1,19.7,24.6,16.1,19.7,15.8,79.04,0,,0,,,,,18.4,250.8,1024.2,84.1,34.5,211.5,10.7,5,,2020-09-08T06:26:06,2020-09-08T19:31:34,0.66,Partially cloudy,2,partly-cloudy-day,"03660099999,03672099999,03768099999,03781099999,D4121,03772099999,03770099999",Partly cloudy throughout the day.
Heathrow Airport,09/09/2020,22,14.6,17.8,22,14.6,17.7,13.4,76.35,0,,0,,,,,18.3,253.9,1023.2,48.7,32.9,146.4,7.4,4,,2020-09-09T06:27:41,2020-09-09T19:29:17,0.71,Partially cloudy,2,partly-cloudy-day,"03660099999,03672099999,03768099999,03781099999,D4121,03772099999,03770099999",Partly cloudy throughout the day.
Heathrow Airport,10/09/2020,20,9.3,14.8,20,8.7,14.7,6.9,61.02,0,,0,,,,,9.3,178.3,1023.4,51.1,27.5,331.2,15.5,6,,2020-09-10T06:29:16,2020-09-10T19:27:00,0.76,Partially cloudy,2,partly-cloudy-day,"03660099999,03672099999,03768099999,03781099999,D4121,03772099999,03770099999",Becoming cloudy in the afternoon.
Heathrow Airport,11/09/2020,19.6,8.8,14.5,19.6,8.8,14.5,8.1,67.36,0.2,,4.17,,,,33.5,24.1,238.5,1017.4,54.9,30.9,280.5,13.1,6,,2020-09-11T06:30:52,2020-09-11T19:24:43,0.81,Rain,1,rain,"03680099999,03660099999,03672099999,03768099999,03781099999,D4121,03772099999,03770099999",Partly cloudy throughout the day with afternoon rain.
Heathrow Airport,12/09/2020,22.1,12.6,16.9,22.1,12.6,16.9,9.7,64.41,0,,0,,,,,22.3,238.8,1019.2,36.7,33.4,280.1,14.1,6,,2020-09-12T06:32:27,2020-09-12T19:22:25,0.86,Partially cloudy,2,partly-cloudy-day,"03660099999,03672099999,03768099999,03781099999,D4121,03772099999,03770099999",Clearing in the afternoon.
Heathrow Airport,13/09/2020,25.1,12.8,18.3,25.1,12.8,18.2,12.5,72.36,0,,0,,,,,18.4,213.3,1023.3,0.1,27.8,335.4,16.9,6,,2020-09-13T06:34:03,2020-09-13T19:20:07,0.9,Clear,0,clear-day,"03660099999,03672099999,03768099999,03781099999,D4121,03772099999,03770099999",Clear conditions throughout the day.
Heathrow Airport,14/09/2020,29,11.6,19.9,27.8,11.6,19.6,11.8,65.96,0,,0,,,,,14.8,127.3,1021.6,0,28.7,369.2,17.3,7,,2020-09-14T06:35:38,2020-09-14T19:17:49,0.95,Clear,0,clear-day,"03660099999,03672099999,03768099999,03781099999,D4121,03772099999,03770099999",Clear conditions throughout the day.
Heathrow Airport,15/09/2020,28.5,15.1,21.8,28.6,15.1,21.8,14.8,66.78,0,,0,,,,,16.5,164,1017.9,23,13.6,305.4,14.3,6,,2020-09-15T06:37:14,2020-09-15T19:15:31,0.98,Partially cloudy,2,partly-cloudy-day,"03660099999,03672099999,03768099999,03781099999,D4121,03772099999,03770099999",Partly cloudy throughout the day.
Heathrow Airport,16/09/2020,26.1,17.1,21.1,26.1,17.1,21.1,14,65.41,0,,0,,,,,20.6,93.9,1023.3,69.1,22.1,267.1,12.5,6,,2020-09-16T06:38:50,2020-09-16T19:13:13,1,Partially cloudy,2,partly-cloudy-day,"03680099999,03660099999,03672099999,03768099999,03781099999,D4121,03772099999,03770099999",Partly cloudy throughout the day.
Heathrow Airport,17/09/2020,22.1,12.8,16.9,22.1,12.8,16.8,9,62.1,0,,0,,,,35.3,20.6,55.4,1028.2,25.8,20.7,341.6,16,6,,2020-09-17T06:40:25,2020-09-17T19:10:55,0,Partially cloudy,2,partly-cloudy-day,"03660099999,03672099999,03768099999,03781099999,D4121,03772099999,03770099999",Partly cloudy throughout the day.
Heathrow Airport,18/09/2020,21.3,9.9,15.9,21.3,8.9,15.8,8.4,63.75,0,,0,,,,50,29.5,46.7,1022.9,0.6,27.1,336.9,15.8,6,,2020-09-18T06:42:01,2020-09-18T19:08:37,0.01,Clear,0,clear-day,"03660099999,03672099999,03768099999,03781099999,D4121,03772099999,03770099999",Clear conditions throughout the day.
Heathrow Airport,19/09/2020,25.1,12.7,18.2,25.1,12.7,18.1,9.5,60.98,0,,0,,,,38.9,22.4,44.6,1017.5,11,21.3,302.2,14.1,6,,2020-09-19T06:43:37,2020-09-19T19:06:18,0.03,Clear,0,clear-day,"03660099999,03672099999,03768099999,03781099999,D4121,03772099999,03770099999",Clear conditions throughout the day.
Heathrow Airport,20/09/2020,24.6,13.7,18.6,24.6,13.7,18.5,11.2,65.3,0,,0,,,,,16.6,37.5,1018.5,3.8,20.7,301.5,14.1,6,,2020-09-20T06:45:13,2020-09-20T19:04:00,0.07,Clear,0,clear-day,"03660099999,03672099999,03768099999,03781099999,D4121,03772099999,03770099999",Clear conditions throughout the day.
Heathrow Airport,21/09/2020,24.5,13.8,17.8,24.5,13.8,17.7,11.8,70.6,0,,0,,,,,11.1,131.4,1017.6,41.6,18.1,265.2,12.4,6,,2020-09-21T06:46:49,2020-09-21T19:01:41,0.11,Partially cloudy,2,partly-cloudy-day,"03660099999,03672099999,03768099999,03781099999,D4121,03772099999,03770099999",Clearing in the afternoon.
Heathrow Airport,22/09/2020,24.6,12.5,18,24.6,12.5,18,11.9,70.42,0,,0,,,,0,31.6,220.5,1010,26.2,24.6,302.9,14.2,6,,2020-09-22T06:48:26,2020-09-22T18:59:23,0.16,Partially cloudy,2,wind,"03660099999,03672099999,03768099999,03781099999,D4121,03772099999,03770099999",Partly cloudy throughout the day.
Heathrow Airport,23/09/2020,18.3,10.6,15.7,18.3,10.6,15.7,13.2,85.64,4.02,,12.5,,,,46.4,27.7,214.2,1000.5,72.1,28.6,111.4,5.2,3,,2020-09-23T06:50:02,2020-09-23T18:57:05,0.22,Rain,1,rain,"03660099999,03672099999,03768099999,03781099999,D4121,03772099999,03770099999",Partly cloudy throughout the day with rain.
Heathrow Airport,24/09/2020,16.1,8.3,10.7,16.1,5.9,9.8,7.4,80.96,6.97,,16.67,,,,66.5,25.9,201.7,996.3,58.6,37.6,159.4,7.5,4,,2020-09-24T06:51:39,2020-09-24T18:54:47,0.27,Rain,1,rain,"03660099999,03672099999,03768099999,03781099999,D4121,03772099999,03770099999",Partly cloudy throughout the day with rain.
Heathrow Airport,25/09/2020,14.3,6.6,10.6,14.3,4.7,9.8,4.5,68.66,0.2,,8.33,,,,61.2,37.1,307.3,1001.9,51.6,33.8,214,9.2,4,,2020-09-25T06:53:15,2020-09-25T18:52:29,0.33,Rain,1,rain,"03660099999,03672099999,03768099999,03781099999,D4121,03772099999,03770099999",Partly cloudy throughout the day with afternoon rain.
Heathrow Airport,26/09/2020,12.8,6.6,10.2,12.8,3.3,8.9,3.9,65.32,0,,4.17,,,,53.6,26,315.4,1011.3,44.1,38.4,199.3,9.3,5,,2020-09-26T06:54:52,2020-09-26T18:50:11,0.37,Partially cloudy,2,partly-cloudy-day,"03660099999,03672099999,03768099999,03781099999,D4121,03772099999,03770099999",Becoming cloudy in the afternoon.
Heathrow Airport,27/09/2020,14.5,10.6,12.1,14.5,10.6,12.1,6,66.12,0,,0,,,,50,24.2,335.5,1012.7,94.5,32.9,94.4,4.1,3,,2020-09-27T06:56:29,2020-09-27T18:47:53,0.41,Overcast,3,cloudy,"03660099999,03672099999,03768099999,03781099999,D4121,03772099999,03770099999",Cloudy skies throughout the day.
Heathrow Airport,28/09/2020,17.8,7.8,13,17.8,5.9,12.5,8,72.65,0,,0,,,,,18.3,280.8,1013.6,70.8,29.6,271.9,11.7,6,,2020-09-28T06:58:07,2020-09-28T18:45:36,0.45,Partially cloudy,2,partly-cloudy-day,"03660099999,03672099999,03768099999,03781099999,D4121,03772099999,03770099999",Partly cloudy throughout the day.
Heathrow Airport,29/09/2020,18.6,13.6,15.9,18.6,13.6,15.8,12.3,81.18,0.22,,12.5,,,,,14.7,247.6,1015,70.8,19,182.9,7.9,4,,2020-09-29T06:59:44,2020-09-29T18:43:19,0.47,Rain,1,rain,"03660099999,03672099999,03768099999,03781099999,D4121,03772099999,03770099999",Partly cloudy throughout the day with rain in the morning and afternoon.
Heathrow Airport,30/09/2020,17.3,10.3,13.8,17.3,10.3,13.8,11.7,87.8,1,,8.33,,,,46.6,25.9,179.5,1007.8,50.6,19.4,91.7,4,2,,2020-09-30T07:01:22,2020-09-30T18:41:02,0.49,Rain,1,rain,"03660099999,03672099999,03768099999,03781099999,D4121,03772099999,03770099999",Partly cloudy throughout the day with late afternoon rain.
Heathrow Airport,01/10/2020,15.8,10.1,12.6,15.8,10.1,12.5,8.4,77.6,2.03,,4.17,,,,,18.4,227.4,997.6,68.3,33.8,187,8.1,6,,2020-10-01T07:03:00,2020-10-01T18:38:46,0.5,Rain,1,rain,"03660099999,03672099999,03768099999,03781099999,D4121,03772099999,03770099999",Partly cloudy throughout the day with early morning rain.
Heathrow Airport,02/10/2020,13.5,9.9,12.1,13.5,8.3,12,10.9,92.17,9.03,,16.67,,,,68.4,37.1,63.8,988.2,82.5,17.3,39.3,1.6,1,,2020-10-02T07:04:38,2020-10-02T18:36:29,0.5,Rain,1,rain,"03660099999,03672099999,03768099999,03781099999,D4121,03772099999,03770099999",Partly cloudy throughout the day with rain.
Heathrow Airport,03/10/2020,15.1,10.6,13.7,15.1,10.6,13.6,12,89.86,33.02,,12.5,,,,51.8,20.6,126.7,986.2,80.4,19.5,84.9,3.7,3,,2020-10-03T07:06:16,2020-10-03T18:34:14,0.52,Rain,1,rain,"03660099999,03672099999,03768099999,03781099999,D4121,03772099999,03770099999",Partly cloudy throughout the day with a chance of rain throughout the day.
Heathrow Airport,04/10/2020,11.1,8.8,9.9,11.1,5.4,8.3,9,93.83,24.65,,16.67,,,,50,33.4,233.4,982.4,79.5,14.3,56.8,2.3,1,,2020-10-04T07:07:55,2020-10-04T18:31:58,0.53,Rain,1,rain,"03660099999,03672099999,03768099999,03781099999,D4121,03772099999,03770099999",Partly cloudy throughout the day with a chance of rain throughout the day.
Heathrow Airport,05/10/2020,17.6,9.4,12.8,17.6,7.4,12.2,9.8,83.27,0.4,,8.33,,,,48.2,33.4,255.8,994.6,67.1,33.1,217.9,8.6,5,,2020-10-05T07:09:34,2020-10-05T18:29:44,0.56,Rain,1,rain,"03660099999,03672099999,03768099999,03781099999,D4121,03772099999,03770099999",Partly cloudy throughout the day with afternoon rain.
Heathrow Airport,06/10/2020,17.3,11,13.2,17.3,11,13.2,9.8,80.63,3.02,,16.67,,,,55.4,35.3,241.8,998,64.9,31.2,191,8.3,5,,2020-10-06T07:11:13,2020-10-06T18:27:29,0.59,Rain,1,rain,"03660099999,03672099999,03768099999,03781099999,D4121,03772099999,03770099999",Partly cloudy throughout the day with morning rain.
Heathrow Airport,07/10/2020,16.8,8.4,12.3,16.8,5.9,11.7,8,76.47,0,,0,,,,46.4,27.7,246.8,1012.2,51.6,30.1,266,10.5,6,,2020-10-07T07:12:53,2020-10-07T18:25:15,0.63,Partially cloudy,2,partly-cloudy-day,"03660099999,03672099999,03768099999,03781099999,D4121,03772099999,03770099999",Partly cloudy throughout the day.
Heathrow Airport,08/10/2020,17.8,9.8,14.6,17.8,9.8,14.6,11.9,84.28,3.43,,8.33,,,,53.6,33.4,253.3,1011.7,74.8,27.3,108.3,4.3,2,,2020-10-08T07:14:32,2020-10-08T18:23:02,0.68,Rain,1,rain,"03680099999,03660099999,03672099999,03768099999,03781099999,D4121,03772099999,03770099999",Partly cloudy throughout the day with rain.
Heathrow Airport,09/10/2020,14.1,6.5,9.8,14.1,5.8,9.6,7.3,85.59,2,,4.17,,,,,24.1,268.6,1018.8,40.8,35.3,143.7,6.2,4,,2020-10-09T07:16:12,2020-10-09T18:20:49,0.73,Rain,1,rain,"03660099999,03672099999,03768099999,03781099999,D4121,03772099999,03770099999",Partly cloudy throughout the day with late afternoon rain.
Heathrow Airport,10/10/2020,13.3,5,9.3,13.3,5,9.3,6,80.27,0,,4.17,,,,37.1,0.2,278.9,1022.5,54.9,41.7,86.3,3.7,2,,2020-10-10T07:17:53,2020-10-10T18:18:37,0.78,Partially cloudy,2,partly-cloudy-day,"03660099999,03672099999,03768099999,03781099999,D4121,03772099999,03770099999",Partly cloudy throughout the day.
Heathrow Airport,11/10/2020,14.1,8.3,10.7,14.1,8.3,10.7,6.4,75.9,0,,4.17,,,,,0.2,325.5,1025.1,52,40.3,206.2,8.2,4,,2020-10-11T07:19:34,2020-10-11T18:16:26,0.83,Partially cloudy,2,partly-cloudy-day,"03660099999,03672099999,03768099999,03781099999,D4121,03772099999,03770099999",Partly cloudy throughout the day.
Heathrow Airport,12/10/2020,13,6.8,9.7,13,6.8,9.6,7.6,87.68,1.99,,8.33,,,,,0.1,234.2,1019.9,92.4,29.4,89.3,3.5,2,,2020-10-12T07:21:14,2020-10-12T18:14:15,0.88,Rain,1,rain,"03660099999,03672099999,03768099999,03781099999,D4121,03772099999,03770099999",Cloudy skies throughout the day with late afternoon rain.
Heathrow Airport,13/10/2020,11.6,6.2,9.4,11.6,6.2,9.3,7.5,88.21,3.01,,12.5,,,,,16.6,263.9,1010.6,67.1,22.8,100.9,4,2,,2020-10-13T07:22:56,2020-10-13T18:12:05,0.93,Rain,1,rain,"03660099999,03672099999,03768099999,03781099999,D4121,03772099999,03770099999",Partly cloudy throughout the day with rain.
Heathrow Airport,14/10/2020,14.3,8,10.7,14.3,6.3,9.7,7.6,82.15,2.6,,8.33,,,,,24.1,31.7,1020.2,57,28.1,186,7.4,4,,2020-10-14T07:24:37,2020-10-14T18:09:56,0.96,Rain,1,rain,"03660099999,03672099999,03768099999,03781099999,D4121,03772099999,03770099999",Becoming cloudy in the afternoon with rain.
Heathrow Airport,15/10/2020,12.6,7.8,9.8,12.6,5.6,8.6,6.8,81.86,1.19,,12.5,,,,,20.5,146.6,1024.5,54.6,31.9,193.4,7.7,5,,2020-10-15T07:26:19,2020-10-15T18:07:47,0.99,Rain,1,rain,"03680099999,03660099999,03672099999,03768099999,03781099999,D4121,03772099999,03770099999",Becoming cloudy in the afternoon with rain.
Heathrow Airport,16/10/2020,13.1,7.3,10.1,13.1,6,9.4,5.9,76.59,0,,4.17,,,,,14.8,99.6,1024.8,67.5,33.1,171,6.8,5,,2020-10-16T07:28:01,2020-10-16T18:05:40,1,Partially cloudy,2,partly-cloudy-day,"03660099999,03672099999,03768099999,03781099999,D4121,03772099999,03770099999",Partly cloudy throughout the day.
Heathrow Airport,17/10/2020,12.3,9.1,10.4,12.3,8.3,10,7.3,81.2,0,,4.17,,,,,9.4,124.4,1022.8,93.2,32,84.7,3.4,2,,2020-10-17T07:29:44,2020-10-17T18:03:33,0,Overcast,3,cloudy,"03660099999,03672099999,03768099999,03781099999,D4121,03772099999,03770099999",Cloudy skies throughout the day.
Heathrow Airport,18/10/2020,12.7,6.6,9.7,12.7,5.7,9.4,6.9,83.5,0,,4.17,,,,,7.5,248.3,1023.8,94,22.4,108,4.3,2,,2020-10-18T07:31:27,2020-10-18T18:01:27,0.02,Overcast,3,cloudy,"03660099999,03672099999,03768099999,03781099999,D4121,03772099999,03770099999",Cloudy skies throughout the day.
Heathrow Airport,19/10/2020,15.8,7.6,11.8,15.8,5.9,11.5,6.9,73.46,0,,0,,,,44.6,27.7,143.8,1015.6,73,27.6,180.9,7.2,4,,2020-10-19T07:33:10,2020-10-19T17:59:22,0.05,Partially cloudy,2,partly-cloudy-day,"03660099999,03672099999,03768099999,03781099999,D4121,03772099999,03770099999",Partly cloudy throughout the day.
Heathrow Airport,20/10/2020,18.6,12.1,14.8,18.6,12.1,14.8,11.5,80.82,0.34,,12.5,,,,48.2,31.6,171.3,1001.6,81.7,21.2,119.6,4.7,3,,2020-10-20T07:34:53,2020-10-20T17:57:19,0.09,Rain,1,rain,"03769099999,03680099999,03660099999,03672099999,03768099999,03781099999,D4121,03772099999,03770099999",Partly cloudy throughout the day with rain.
Heathrow Airport,21/10/2020,15.6,13.5,14.5,15.6,13.5,14.5,13.4,92.95,14.99,,12.5,,,,47.5,27.7,161.9,996.7,81.2,20.3,50.1,1.6,1,,2020-10-21T07:36:37,2020-10-21T17:55:16,0.14,Rain,1,rain,"03660099999,03672099999,03768099999,03781099999,D4121,03772099999,03770099999",Partly cloudy throughout the day with rain.
Heathrow Airport,22/10/2020,16.6,11.3,13.3,16.6,11.3,13.3,10,80.93,0,,8.33,,,,38.9,29.5,226.9,1007.7,40,27.4,141.2,5.6,4,,2020-10-22T07:38:21,2020-10-22T17:53:14,0.2,Partially cloudy,2,partly-cloudy-day,"03660099999,03672099999,03768099999,03781099999,D4121,03772099999,03770099999",Becoming cloudy in the afternoon.
Heathrow Airport,23/10/2020,15.6,8.6,12.4,15.6,6.8,12.2,9.9,85.43,0,,12.5,,,,49.1,27.7,205.8,1008.4,65.8,27.4,116.8,4.6,3,,2020-10-23T07:40:05,2020-10-23T17:51:14,0.25,Partially cloudy,2,partly-cloudy-day,"03660099999,03672099999,03768099999,03781099999,D4121,03772099999,03770099999",Partly cloudy throughout the day.
Heathrow Airport,24/10/2020,16.1,8,12.2,16.1,5.7,11.6,10,86.34,1.01,,12.5,,,,66.5,35.3,188.3,1002.5,66.7,21.3,59.8,2.4,1,,2020-10-24T07:41:50,2020-10-24T17:49:14,0.3,Rain,1,rain,"03660099999,03672099999,03768099999,03781099999,D4121,03772099999,03770099999",Partly cloudy throughout the day with late afternoon rain.
Heathrow Airport,25/10/2020,12.6,7.8,9.8,12.6,5.9,8.7,7.6,86.45,19.78,,8,,,,46.4,22.3,195.1,996.4,34.8,31.8,135.1,5.3,4,,2020-10-25T06:43:35,2020-10-25T16:47:16,0.35,Rain,1,rain,"03660099999,03672099999,03768099999,03781099999,D4121,03772099999,03770099999",Partly cloudy throughout the day with rain.
Heathrow Airport,26/10/2020,13,6.5,9.2,13,3.8,7.8,6.6,83.87,0.2,,8.33,,,,40.7,27.7,225.3,997.9,25.8,26.3,109.2,4.3,2,,2020-10-26T06:45:20,2020-10-26T16:45:19,0.39,Rain,1,rain,"03660099999,03672099999,03768099999,03781099999,D4121,03772099999,03770099999",Partly cloudy throughout the day with afternoon rain.
Heathrow Airport,27/10/2020,13.6,4.9,9.5,13.6,3.1,8.4,7.9,90.18,0.81,,8.33,,,,51.8,29.4,207,998.4,57,16.6,50.4,1.8,1,,2020-10-27T06:47:05,2020-10-27T16:43:23,0.43,Rain,1,rain,"03660099999,03672099999,03768099999,03781099999,D4121,03772099999,03770099999",Partly cloudy throughout the day with afternoon rain.
Heathrow Airport,28/10/2020,13.3,8.1,9.7,13.3,4.5,7.7,6.5,81.11,1.99,,8.33,,,,72.3,27.7,218,1002.5,47.9,25.2,123.1,4.9,3,,2020-10-28T06:48:50,2020-10-28T16:41:29,0.46,Rain,1,rain,"03660099999,03672099999,03768099999,03781099999,D4121,03772099999,03770099999",Becoming cloudy in the afternoon with late afternoon rain.
Heathrow Airport,29/10/2020,14.8,8,11.8,14.8,4.9,11.1,9.7,86.62,3.21,,8.33,,,,51.8,33.4,219.3,1011.9,82.5,17.9,42,1.7,1,,2020-10-29T06:50:36,2020-10-29T16:39:36,0.48,Rain,1,rain,"03660099999,03672099999,03768099999,03781099999,D4121,03772099999,03770099999",Partly cloudy throughout the day with rain.
Heathrow Airport,30/10/2020,16.1,14.1,15.1,16.1,14.1,15.1,12.9,86.6,0,,8.33,,,,50.5,29.4,217.8,1016.1,92.4,27.7,65.8,2.4,2,,2020-10-30T06:52:21,2020-10-30T16:37:45,0.49,Overcast,3,cloudy,"03660099999,03672099999,03768099999,03781099999,D4121,03772099999,03770099999",Cloudy skies throughout the day.
Heathrow Airport,31/10/2020,15.1,10.3,13.1,15.1,10.3,13.1,10.3,83.27,5.25,,12.5,,,,61.2,33.4,196.2,1011.6,74.6,19.5,47.5,1.9,1,,2020-10-31T06:54:07,2020-10-31T16:35:55,0.5,Rain,1,rain,"03660099999,03672099999,03768099999,03781099999,D4121,03772099999,03770099999",Partly cloudy throughout the day with rain.
Heathrow Airport,01/11/2020,16.8,10.3,14.5,16.8,10.3,14.4,11.8,84.5,0.2,,12.5,,,,57.7,38.8,201.2,1003.3,84.1,16.9,61.7,2.2,2,,2020-11-01T06:55:53,2020-11-01T16:34:06,0.51,Rain,1,rain,"03660099999,03672099999,03768099999,03781099999,D4121,03772099999,03770099999",Partly cloudy throughout the day with afternoon rain.
Heathrow Airport,02/11/2020,17.1,7.3,13.7,17.1,5,13.2,9.1,74.08,0.8,,12.5,,,,77.7,44.5,231.5,1005.1,47.1,23.1,139.2,5,4,,2020-11-02T06:57:39,2020-11-02T16:32:19,0.52,Rain,1,rain,"03660099999,03672099999,03768099999,03781099999,D4121,03772099999,03770099999",Partly cloudy throughout the day with rain in the morning and afternoon.
Heathrow Airport,03/11/2020,10.5,4.1,7.7,10.5,1.3,5.3,4.2,78.85,4.8,,8.33,,,,48.2,29.4,229.2,1018.9,47.9,24.4,104.3,4.1,2,,2020-11-03T06:59:25,2020-11-03T16:30:34,0.54,Rain,1,rain,"03660099999,03672099999,03768099999,03781099999,D4121,03772099999,03770099999",Partly cloudy throughout the day with rain in the morning and afternoon.
Heathrow Airport,04/11/2020,11.3,1.3,5.7,11.3,0.7,5.4,3,84.25,0,,8.33,,,,,7.6,284,1033.5,3.3,19,175.9,6.3,4,,2020-11-04T07:01:11,2020-11-04T16:28:51,0.57,Clear,0,clear-day,"03660099999,03672099999,03768099999,03781099999,D4121,03772099999,03770099999",Clear conditions throughout the day.
Heathrow Airport,05/11/2020,10.6,1.8,4.8,10.6,0.4,4.6,3.8,93.9,0.2,,4.17,,,,,5.4,229.8,1038.6,30.5,4.7,91.4,3.3,3,,2020-11-05T07:02:57,2020-11-05T16:27:09,0.61,Rain,1,rain,"EGWU,EGLL,03672099999,03768099999,03781099999,03658099999,03772099999,03876099999,03660099999,D4121,EGLC,EGLF,03770099999",Partly cloudy throughout the day with afternoon rain.
Heathrow Airport,06/11/2020,11.4,1.5,6.6,11.4,0.2,5.4,3.6,82.76,0.2,,8.33,,,,38.9,20.5,85.8,1029.1,59.9,12.1,102.9,3.7,2,,2020-11-06T07:04:43,2020-11-06T16:25:29,0.65,Rain,1,rain,"03660099999,03672099999,03768099999,03781099999,D4121,03772099999,03770099999",Partly cloudy throughout the day with afternoon rain.
Heathrow Airport,07/11/2020,15,4.3,9.3,15,4.3,8.9,6.9,85.54,0,,0,,,,,9.4,84.5,1020.2,18.9,10.1,127.6,4.6,2,,2020-11-07T07:06:29,2020-11-07T16:23:51,0.7,Clear,0,clear-day,"03660099999,03672099999,03768099999,03781099999,D4121,03772099999,03770099999",Clear conditions throughout the day.
Heathrow Airport,08/11/2020,14.1,9.8,12.1,14.1,9.8,12.1,11.2,94.72,0.2,,8.33,,,,,0.1,135,1018.2,89.9,4.4,69,2.2,2,,2020-11-08T07:08:14,2020-11-08T16:22:14,0.75,Rain,1,rain,"03660099999,03672099999,03768099999,03781099999,D4121,03772099999,03770099999",Partly cloudy throughout the day with morning rain.
Heathrow Airport,09/11/2020,16,10,12.8,16,10,12.8,11.9,94.62,5.99,,12.5,,,,,12.9,139.5,1019.3,82.8,10.7,84.8,2.7,2,,2020-11-09T07:10:00,2020-11-09T16:20:40,0.8,Rain,1,rain,"03660099999,03672099999,03768099999,03781099999,D4121,03772099999,03770099999",Partly cloudy throughout the day with rain.
Heathrow Airport,10/11/2020,15.3,8.6,12,15.3,8.3,11.9,10.7,92.34,2.78,,12.5,,,,,9.4,182.2,1023.1,54.1,15.7,109.6,3.5,2,,2020-11-10T07:11:45,2020-11-10T16:19:08,0.86,Rain,1,rain,"03660099999,03672099999,03768099999,03781099999,D4121,03772099999,03770099999",Partly cloudy throughout the day with morning rain.
Heathrow Airport,11/11/2020,13.1,7.8,11.4,13.1,6.6,11.1,9.8,90.53,0.2,,12.5,,,,53.6,33.5,156.1,1017.3,74.6,18.5,63.4,2.1,1,,2020-11-11T07:13:29,2020-11-11T16:17:38,0.91,Rain,1,rain,"03660099999,03672099999,03768099999,03781099999,D4121,03772099999,03770099999",Partly cloudy throughout the day with afternoon rain.
Heathrow Airport,12/11/2020,13.1,9.2,10.7,13.1,5.7,9.7,7.4,80.91,6,,4.17,,,,48.2,27.7,212,1013.4,39.6,24.3,142.4,4.6,3,,2020-11-12T07:15:14,2020-11-12T16:16:09,0.95,Rain,1,rain,"03660099999,03672099999,03768099999,03781099999,D4121,03772099999,03770099999",Partly cloudy throughout the day with early morning rain.
Heathrow Airport,13/11/2020,12.6,9.3,10.8,12.6,7.7,10.4,7.8,82.29,1,,8.33,,,,50,20.5,197.1,1012,69.2,24.2,90.2,2.9,2,,2020-11-13T07:16:58,2020-11-13T16:14:43,0.98,Rain,1,rain,"03660099999,03672099999,03768099999,03781099999,D4121,03772099999,03770099999",Partly cloudy throughout the day with afternoon rain.
Heathrow Airport,14/11/2020,13.8,8.9,12.3,13.8,7.9,12.1,10.8,90.8,7.4,,12.5,,,,61.1,29.5,175.6,1007,77.1,12.8,30,1,1,,2020-11-14T07:18:41,2020-11-14T16:13:20,1,Rain,1,rain,"03660099999,03672099999,03768099999,03781099999,D4121,03772099999,03770099999",Partly cloudy throughout the day with rain.
Heathrow Airport,15/11/2020,13.5,7.3,10.6,13.5,3.6,9.3,8.1,84.69,14.97,,16.67,,,,68.4,42.4,207.2,996.3,64.1,25.9,99.3,2.9,3,,2020-11-15T07:20:24,2020-11-15T16:11:58,0,Rain,1,rain,"03660099999,03672099999,03768099999,03781099999,D4121,03772099999,03770099999",Partly cloudy throughout the day with a chance of rain throughout the day.
Heathrow Airport,16/11/2020,13,7.8,10.7,13,4.8,10,7.5,80.94,0.38,,8.33,,,,51.8,33.4,237.3,1012,72.9,21.5,76.3,2.5,2,,2020-11-16T07:22:06,2020-11-16T16:10:39,0.01,Rain,1,rain,"EGWU,EGLL,03672099999,03768099999,03781099999,03772099999,03680099999,03660099999,D4121,03761099999,EGLC,EGLF,03770099999",Partly cloudy throughout the day with late afternoon rain.
