Heathrow Airport,01/01/2000,8.9,5.8,7.9,8.8,5.8,7.5,6.9,93.72,1.4,,12.5,,,,,9.3,218.4,1024.5,85.7,7.9,,,0,,2000-01-01T08:07:28,2000-01-01T16:02:55,0.89,Rain,1,rain,"366,009,999,903,672,000,000,000,000,000,000,000,000,000,000,000,000,000",Partly cloudy throughout the day with a chance of rain throughout the day.
Heathrow Airport,02/01/2000,10.6,6.4,8.4,10.6,6.3,7.7,6.7,89.02,0.69,,8.33,,,,,18.4,200.2,1025.3,89.9,15.6,,,0,,2000-01-02T08:07:23,2000-01-02T16:03:58,0.93,Rain,1,rain,"366,009,999,903,672,000,000,000,000,000,000,000,000,000,000,000,000,000",Partly cloudy throughout the day with early morning rain.
Heathrow Airport,03/01/2000,11.3,5,9.1,11.3,3,8.7,7.8,91.37,0.83,,12.5,,,,,27.7,223.8,1018.6,99.4,14.4,,,0,,2000-01-03T08:07:14,2000-01-03T16:05:03,0.96,Rain,1,rain,"366,009,999,903,672,000,000,000,000,000,000,000,000,000,000,000,000,000",Cloudy skies throughout the day with rain.
Heathrow Airport,04/01/2000,9.2,2.9,5.5,6.1,0.3,4,3.7,89.05,3.7,,12.5,,,,,25.3,238.8,1014.8,64.7,20.2,,,0,,2000-01-04T08:07:02,2000-01-04T16:06:11,0.98,Rain,1,rain,"366,009,999,903,672,000,000,000,000,000,000,000,000,000,000,000,000,000",Partly cloudy throughout the day with rain.
Heathrow Airport,05/01/2000,10.8,2.1,7,10.8,-0.4,5.2,4.6,84.46,0,,9.09,,,,,33.5,183.5,1014.6,65.6,20.4,,,0,,2000-01-05T08:06:46,2000-01-05T16:07:22,1,Partially cloudy,2,wind,"366,009,999,903,672,000,000,000,000,000,000,000,000,000,000,000,000,000",Partly cloudy throughout the day.
Heathrow Airport,06/01/2000,10.8,4.1,8.9,10.8,2.9,7.7,6.3,83.61,0.61,,8.7,,,,,31.3,223.5,1012.8,69.6,20.6,,,0,,2000-01-06T08:06:28,2000-01-06T16:08:35,1,Rain,1,rain,"366,009,999,903,672,000,000,000,000,000,000,000,000,000,000,000,000,000",Partly cloudy throughout the day with rain in the morning and afternoon.
Heathrow Airport,07/01/2000,10.6,3.6,7.8,10.6,1.3,6.3,4.9,82.65,0.69,,12.5,,,,,29.5,195.4,1017.2,76.8,20.1,,,0,,2000-01-07T08:06:06,2000-01-07T16:09:51,0,Rain,1,rain,"366,009,999,903,672,000,000,000,000,000,000,000,000,000,000,000,000,000",Partly cloudy throughout the day with late afternoon rain.
Heathrow Airport,08/01/2000,10.1,3.6,7.3,10.1,1.6,5.3,4.1,80.88,0.71,,12.5,,,,,27.7,226.3,1016.5,45.5,21.5,,,0,,2000-01-08T08:05:41,2000-01-08T16:11:09,0.01,Rain,1,rain,"366,009,999,903,672,000,000,000,000,000,000,000,000,000,000,000,000,000",Clearing in the afternoon with rain clearing later.
Heathrow Airport,09/01/2000,7.1,0.3,3,6.8,-1.4,2.3,0.4,83.98,0,,4.35,,,,,7.6,267.7,1027.7,4.4,21.3,,,0,,2000-01-09T08:05:12,2000-01-09T16:12:29,0.03,Clear,0,clear-day,"366,009,999,903,672,000,000,000,000,000,000,000,000,000,000,000,000,000",Clear conditions throughout the day.
Heathrow Airport,10/01/2000,7,-2.9,2.7,5,-2.9,1.7,0.6,86.65,0,,4.35,,,,,11.2,201.1,1034.7,57.6,9.1,,,0,,2000-01-10T08:04:41,2000-01-10T16:13:51,0.06,Partially cloudy,2,partly-cloudy-day,"366,009,999,903,672,000,000,000,000,000,000,000,000,000,000,000,000,000",Partly cloudy throughout the day.
Heathrow Airport,11/01/2000,10.1,6.1,8.2,10.1,3.7,5.8,5.8,85.52,0.7,,4.17,,,,,22.3,192.5,1032.4,91.3,21.4,,,0,,2000-01-11T08:04:06,2000-01-11T16:15:15,0.1,Rain,1,rain,"366,009,999,903,672,000,000,000,000,000,000,000,000,000,000,000,000,000",Cloudy skies throughout the day with afternoon rain.
Heathrow Airport,12/01/2000,8.3,5.1,7.2,5.1,1.1,3.8,4.3,81.48,1.4,,16.67,,,,,27.7,195,1023.4,93.8,15.2,,,0,,2000-01-12T08:03:28,2000-01-12T16:16:41,0.14,Rain,1,rain,"366,009,999,903,672,000,000,000,000,000,000,000,000,000,000,000,000,000",Cloudy skies throughout the day with rain.
Heathrow Airport,13/01/2000,5.6,0.3,3.9,3.2,-0.5,1.6,1.9,86.93,2.52,,12.5,,,,,20.5,269.6,1015.4,83.8,12,,,0,,2000-01-13T08:02:47,2000-01-13T16:18:09,0.19,Rain,1,rain,"366,009,999,903,672,000,000,000,000,000,000,000,000,000,000,000,000,000",Partly cloudy throughout the day with rain in the morning and afternoon.
Heathrow Airport,14/01/2000,6,-0.4,3.5,3.7,-2.3,1.3,1.5,87.05,0.8,,12.5,,,,,14.8,337.1,1023.3,78.9,13,,,0,,2000-01-14T08:02:03,2000-01-14T16:19:39,0.25,Rain,1,rain,"366,009,999,903,672,000,000,000,000,000,000,000,000,000,000,000,000,000",Partly cloudy throughout the day with rain.
Heathrow Airport,15/01/2000,6.1,2.3,4.8,4.1,0.4,2.6,2.6,85.75,0.7,,8.33,,,,,16.6,68.8,1036.4,75,15.8,,,0,,2000-01-15T08:01:16,2000-01-15T16:21:11,0.3,Rain,1,rain,"366,009,999,903,672,000,000,000,000,000,000,000,000,000,000,000,000,000",Partly cloudy throughout the day with early morning rain.
Heathrow Airport,16/01/2000,6.6,0.3,3.8,5.2,0.3,2.6,1.2,83.13,0.69,,4.17,,,,,11.2,320.8,1040.5,79.6,13.5,,,0,,2000-01-16T08:00:26,2000-01-16T16:22:44,0.36,Rain,1,rain,"366,009,999,903,672,000,000,000,000,000,000,000,000,000,000,000,000,000",Partly cloudy throughout the day with morning rain.
Heathrow Airport,17/01/2000,8.5,0.6,4.4,7,-0.8,3,3.1,91.21,0,,4.17,,,,,11.2,293.8,1037.9,61.3,6.2,,,0,,2000-01-17T07:59:34,2000-01-17T16:24:19,0.41,Partially cloudy,2,partly-cloudy-day,"366,009,999,903,672,000,000,000,000,000,000,000,000,000,000,000,000,000",Partly cloudy throughout the day.
Heathrow Airport,18/01/2000,8,1.8,5.3,6.1,0.6,3.8,3.5,88.32,0,,8.33,,,,,20.6,311.3,1035.4,80.5,11.1,,,0,,2000-01-18T07:58:38,2000-01-18T16:25:55,0.45,Partially cloudy,2,partly-cloudy-day,"366,009,999,903,672,000,000,000,000,000,000,000,000,000,000,000,000,000",Partly cloudy throughout the day.
Heathrow Airport,19/01/2000,7.1,1.6,5.7,6.3,1.6,4.4,3.1,83.53,0.8,,12.5,,,,,13,304.2,1037,79.2,16.2,,,0,,2000-01-19T07:57:40,2000-01-19T16:27:32,0.48,Rain,1,rain,"366,009,999,903,672,000,000,000,000,000,000,000,000,000,000,000,000,000",Partly cloudy throughout the day with rain in the morning and afternoon.
Heathrow Airport,20/01/2000,4.6,-1.4,2,4.3,-1.4,1.3,0.5,90.47,0.1,,4.17,,,,,7.6,278.9,1034.9,69.4,6.6,,,0,,2000-01-20T07:56:38,2000-01-20T16:29:11,0.5,Rain,1,rain,"366,009,999,903,672,000,000,000,000,000,000,000,000,000,000,000,000,000",Partly cloudy throughout the day with afternoon rain.
Heathrow Airport,21/01/2000,8.8,3.4,5.5,7.2,1.2,4.1,2.3,80.58,0.7,,4.17,,,,,13,294.2,1032.8,58.8,10,,,0,,2000-01-21T07:55:35,2000-01-21T16:30:51,0.5,Rain,1,rain,"366,009,999,903,672,000,000,000,000,000,000,000,000,000,000,000,000,000",Clearing in the afternoon with afternoon rain.
Heathrow Airport,22/01/2000,7.3,2.8,5.1,4,-0.2,1.5,1.1,75.87,1.72,,8.33,,,,,26,299.5,1020.7,65.9,29.9,,,0,,2000-01-22T07:54:28,2000-01-22T16:32:32,0.52,Rain,1,rain,"366,009,999,903,672,000,000,000,000,000,000,000,000,000,000,000,000,000",Partly cloudy throughout the day with rain in the morning and afternoon.
Heathrow Airport,23/01/2000,7.1,1.3,3.9,3.7,-0.8,1.4,-0.1,75.38,1.4,,12.5,,,,,20.5,323.4,1024.2,59.2,28.2,,,0,,2000-01-23T07:53:19,2000-01-23T16:34:14,0.54,Rain,1,rain,"366,009,999,903,672,000,000,000,000,000,000,000,000,000,000,000,000,000",Partly cloudy throughout the day with rain.
Heathrow Airport,24/01/2000,5.6,0.8,2.9,4.8,-1.6,2.2,-0.2,80.39,0,,4.17,,,,,9.4,210.8,1025.4,62.2,15.9,,,0,,2000-01-24T07:52:08,2000-01-24T16:35:57,0.57,Partially cloudy,2,partly-cloudy-day,"366,009,999,903,672,000,000,000,000,000,000,000,000,000,000,000,000,000",Partly cloudy throughout the day.
Heathrow Airport,25/01/2000,3.2,-1.9,1.1,2.7,-1.9,0.9,-0.1,91.51,0,,0,,,,,5.4,254.6,1029.4,76.8,4.8,,,0,,2000-01-25T07:50:54,2000-01-25T16:37:41,0.62,Partially cloudy,2,partly-cloudy-day,"366,009,999,903,672,000,000,000,000,000,000,000,000,000,000,000,000,000",Partly cloudy throughout the day.
Heathrow Airport,26/01/2000,6.1,0.1,2.5,5.1,-0.5,1.7,0.1,85.23,0,,4.17,,,,,9.4,235.2,1032.7,41,8.4,,,0,,2000-01-26T07:49:37,2000-01-26T16:39:26,0.66,Partially cloudy,2,partly-cloudy-day,"366,009,999,903,672,000,000,000,000,000,000,000,000,000,000,000,000,000",Clearing in the afternoon.
Heathrow Airport,27/01/2000,5.2,-2.9,0.5,3.4,-2.9,-0.2,-1.8,85.39,0,,4.17,,,,,11.2,234,1029.7,3.7,10.1,,,0,,2000-01-27T07:48:18,2000-01-27T16:41:12,0.71,Clear,0,clear-day,"366,009,999,903,672,000,000,000,000,000,000,000,000,000,000,000,000,000",Clear conditions throughout the day.
Heathrow Airport,28/01/2000,8.3,-0.9,5,4.5,-2.9,1.7,2.2,82.74,0.01,,4.17,,,,,31.3,216.3,1014.8,83.4,16.6,,,0,,2000-01-28T07:46:57,2000-01-28T16:42:58,0.76,Rain,1,rain,"366,009,999,903,672,000,000,000,000,000,000,000,000,000,000,000,000,000",Partly cloudy throughout the day with late afternoon rain.
Heathrow Airport,29/01/2000,12.7,8.3,11,12.7,4.6,10.6,7.9,81.88,2.01,,8.33,,,,,38.9,245,1000.3,90.8,27.2,,,0,,2000-01-29T07:45:34,2000-01-29T16:44:45,0.81,Rain,1,rain,"366,009,999,903,672,000,000,000,000,000,000,000,000,000,000,000,000,000",Cloudy skies throughout the day with early morning rain.
Heathrow Airport,30/01/2000,12.4,10.7,11.4,12.4,10.7,11.4,7.5,77.55,1.39,,12.5,,,,,35.3,247.1,1012.9,89.6,23.9,,,0,,2000-01-30T07:44:08,2000-01-30T16:46:32,0.86,Rain,1,rain,"366,009,999,903,672,000,000,000,000,000,000,000,000,000,000,000,000,000",Partly cloudy throughout the day with rain.
Heathrow Airport,31/01/2000,12.5,10.1,11.2,12.5,10.1,11.2,7.4,77.62,1.39,,12.5,,,,,31.4,223.8,1020.1,91.7,23.6,,,0,,2000-01-31T07:42:40,2000-01-31T16:48:20,0.9,Rain,1,rain,"366,009,999,903,672,000,000,000,000,000,000,000,000,000,000,000,000,000",Cloudy skies throughout the day with rain.
Heathrow Airport,01/02/2000,10.5,9.1,9.7,10.5,6.1,7.8,7.3,85.32,1.4,,16.67,,,,,29.5,206.3,1015.2,95.8,13.2,,,0,,2000-02-01T07:41:11,2000-02-01T16:50:08,0.93,Rain,1,rain,"366,009,999,903,672,000,000,000,000,000,000,000,000,000,000,000,000,000",Cloudy skies throughout the day with rain.
Heathrow Airport,02/02/2000,10.1,5.8,8.2,10.1,3.8,6.5,4,75.62,9.92,,8.33,,,,,22.3,277.9,1021.1,56.4,27.5,,,0,,2000-02-02T07:39:39,2000-02-02T16:51:57,0.96,Rain,1,rain,"366,009,999,903,672,000,000,000,000,000,000,000,000,000,000,000,000,000",Partly cloudy throughout the day with rain clearing later.
Heathrow Airport,03/02/2000,8.8,3.2,6.3,7.4,0.6,4.8,4,85.04,0.7,,4.17,,,,,13,219.2,1033.2,83.9,26.4,,,0,,2000-02-03T07:38:05,2000-02-03T16:53:46,0.99,Rain,1,rain,"366,009,999,903,672,000,000,000,000,000,000,000,000,000,000,000,000,000",Partly cloudy throughout the day with late afternoon rain.
Heathrow Airport,04/02/2000,10.6,7.3,9.2,10.6,4.9,7.5,7,86.33,1.4,,16.67,,,,,22.3,219.2,1031.9,91.3,16.3,,,0,,2000-02-04T07:36:29,2000-02-04T16:55:35,1,Rain,1,rain,"366,009,999,903,672,000,000,000,000,000,000,000,000,000,000,000,000,000",Cloudy skies throughout the day with rain.
Heathrow Airport,05/02/2000,11.5,7.3,8.7,11.5,4.5,6.7,5.4,80.58,0,,0,,,,,18.3,202.5,1026.3,90.7,9.8,,,0,,2000-02-05T07:34:51,2000-02-05T16:57:25,1,Overcast,3,cloudy,"366,009,999,903,672,000,000,000,000,000,000,000,000,000,000,000,000,000",Cloudy skies throughout the day.
Heathrow Airport,06/02/2000,11.6,8.1,10.2,11.6,6.2,9.5,8.4,88.73,0.69,,8.33,,,,,25.9,206.3,1015.9,95.4,11.6,,,0,,2000-02-06T07:33:12,2000-02-06T16:59:14,0,Rain,1,rain,"366,009,999,903,672,000,000,000,000,000,000,000,000,000,000,000,000,000",Cloudy skies throughout the day with afternoon rain.
Heathrow Airport,07/02/2000,10.8,5.3,7.7,10.8,1.5,4.7,4.7,81.38,4.02,,8.33,,,,,35.2,222.1,1010.4,71.4,15.8,,,0,,2000-02-07T07:31:31,2000-02-07T17:01:04,0.02,Rain,1,rain,"366,009,999,903,672,000,000,000,000,000,000,000,000,000,000,000,000,000",Partly cloudy throughout the day with rain.
Heathrow Airport,08/02/2000,13.6,5.1,9.2,13.6,1,6.9,4.4,73.27,1.72,,8.33,,,,,38.9,235.8,1006.1,68.5,20.8,,,0,,2000-02-08T07:29:48,2000-02-08T17:02:54,0.04,Rain,1,rain,"366,009,999,903,672,000,000,000,000,000,000,000,000,000,000,000,000,000",Partly cloudy throughout the day with rain in the morning and afternoon.
Heathrow Airport,09/02/2000,10.4,3.1,7.2,10.4,-0.8,4.3,1.8,68.8,0.1,,4.17,,,,,25.9,234.2,1022.2,68.1,28,,,0,,2000-02-09T07:28:03,2000-02-09T17:04:44,0.08,Rain,1,rain,"366,009,999,903,672,000,000,000,000,000,000,000,000,000,000,000,000,000",Partly cloudy throughout the day with early morning rain.
Heathrow Airport,10/02/2000,9.5,1.6,6.9,5.9,-1.3,3.5,1.9,71.46,4.8,,8.33,,,,,42.4,235.4,1015.5,59.7,25.1,,,0,,2000-02-10T07:26:17,2000-02-10T17:06:34,0.12,Rain,1,rain,"366,009,999,903,672,000,000,000,000,000,000,000,000,000,000,000,000,000",Partly cloudy throughout the day with rain.
Heathrow Airport,11/02/2000,9.8,0.2,5.3,7.2,-2.4,3.2,1.5,76.95,0.7,,4.17,,,,,20.6,218.8,1027.2,32.4,30.2,,,0,,2000-02-11T07:24:29,2000-02-11T17:08:24,0.17,Rain,1,rain,"366,009,999,903,672,000,000,000,000,000,000,000,000,000,000,000,000,000",Becoming cloudy in the afternoon with late afternoon rain.
Heathrow Airport,12/02/2000,9,5.6,7.2,5.7,2.3,3.7,3.1,75.29,5.79,,12.5,,,,,37,223.8,1017.8,74.2,34.7,,,0,,2000-02-12T07:22:40,2000-02-12T17:10:14,0.22,Rain,1,rain,"366,009,999,903,672,000,000,000,000,000,000,000,000,000,000,000,000,000",Partly cloudy throughout the day with rain.
Heathrow Airport,13/02/2000,9.5,2.3,6.8,7.4,2.3,5.1,1.2,69.19,0.69,,12.5,,,,,18.4,272.9,1020.2,38.1,34.4,,,0,,2000-02-13T07:20:49,2000-02-13T17:12:04,0.28,Rain,1,rain,"366,009,999,903,672,000,000,000,000,000,000,000,000,000,000,000,000,000",Clearing in the afternoon with early morning rain.
Heathrow Airport,14/02/2000,10,-0.7,4.9,10,-0.7,3.7,3.5,90.49,0.5,,4.17,,,,,18.5,222.3,1019.5,61.5,10.2,,,0,,2000-02-14T07:18:57,2000-02-14T17:13:53,0.34,Rain,1,rain,"366,009,999,903,672,000,000,000,000,000,000,000,000,000,000,000,000,000",Partly cloudy throughout the day with afternoon rain.
Heathrow Airport,15/02/2000,8.3,3.1,6.6,7.2,1,4.2,3.7,82.04,1.39,,12.5,,,,,22.3,230,1013.2,78.8,25.6,,,0,,2000-02-15T07:17:03,2000-02-15T17:15:43,0.39,Rain,1,rain,"366,009,999,903,672,000,000,000,000,000,000,000,000,000,000,000,000,000",Partly cloudy throughout the day with rain.
Heathrow Airport,16/02/2000,7.5,1.8,4.4,3.1,-2.7,0.2,-1.2,68.1,1.01,,8.33,,,,,33.5,255.4,1004.3,42.3,40.6,,,0,,2000-02-16T07:15:08,2000-02-16T17:17:32,0.43,Rain,1,rain,"366,009,999,903,672,000,000,000,000,000,000,000,000,000,000,000,000,000",Partly cloudy throughout the day with rain.
Heathrow Airport,17/02/2000,8.8,2.3,5.3,6.3,0.1,2.6,0.3,71.55,0.69,,8.33,,,,,22.3,259.4,1010.5,69.3,27,,,0,,2000-02-17T07:13:12,2000-02-17T17:19:22,0.47,Rain,1,rain,"366,009,999,903,672,000,000,000,000,000,000,000,000,000,000,000,000,000",Partly cloudy throughout the day with early morning rain.
Heathrow Airport,18/02/2000,10.5,6.6,8.7,10.5,4,6.3,4.8,77.22,2.71,,8.33,,,,,24.1,247.9,1002.8,80.5,21.8,,,0,,2000-02-18T07:11:14,2000-02-18T17:21:11,0.49,Rain,1,rain,"366,009,999,903,672,000,000,000,000,000,000,000,000,000,000,000,000,000",Partly cloudy throughout the day with rain.
Heathrow Airport,19/02/2000,8.3,3.3,6.4,5.7,2.8,4.2,2.1,74.66,1.39,,8.33,,,,,22.3,314.6,1015.3,63.9,33.5,,,0,,2000-02-19T07:09:16,2000-02-19T17:23:00,0.5,Rain,1,rain,"366,009,999,903,672,000,000,000,000,000,000,000,000,000,000,000,000,000",Partly cloudy throughout the day with rain.
Heathrow Airport,20/02/2000,8.3,-0.4,3.8,8.3,-0.4,3.2,-0.1,77.53,0.1,,4.17,,,,,9.4,224.3,1029.6,53.9,20.7,,,0,,2000-02-20T07:07:16,2000-02-20T17:24:48,0.51,Rain,1,rain,"366,009,999,903,672,000,000,000,000,000,000,000,000,000,000,000,000,000",Partly cloudy throughout the day with afternoon rain.
Heathrow Airport,21/02/2000,9.3,2.8,6,7.5,0.4,4.3,1.8,76.13,0.61,,13.04,,,,,18.3,246.1,1026.6,75.4,23.9,,,0,,2000-02-21T07:05:15,2000-02-21T17:26:37,0.53,Rain,1,rain,"366,009,999,903,672,000,000,000,000,000,000,000,000,000,000,000,000,000",Partly cloudy throughout the day with rain in the morning and afternoon.
Heathrow Airport,22/02/2000,8.7,0,4.7,6.8,0,3.8,1,78.35,0,,0,,,,,14.7,171.2,1023.8,72.6,18.6,,,0,,2000-02-22T07:03:13,2000-02-22T17:28:25,0.55,Partially cloudy,2,partly-cloudy-day,"366,009,999,903,672,000,000,000,000,000,000,000,000,000,000,000,000,000",Partly cloudy throughout the day.
Heathrow Airport,23/02/2000,11.5,6.2,9.3,11.5,6,8.8,7.5,88.78,1.4,,13.04,,,,,18.3,182.7,1020.6,98.2,9,,,0,,2000-02-23T07:01:10,2000-02-23T17:30:13,0.59,Rain,1,rain,"366,009,999,903,672,000,000,000,000,000,000,000,000,000,000,000,000,000",Cloudy skies throughout the day with a chance of rain throughout the day.
Heathrow Airport,24/02/2000,11.6,6.5,9.5,11.6,3.4,8.8,5.8,79.24,1.7,,12.5,,,,,18.4,232.1,1020.4,95.4,26,,,0,,2000-02-24T06:59:06,2000-02-24T17:32:00,0.63,Rain,1,rain,"366,009,999,903,672,000,000,000,000,000,000,000,000,000,000,000,000,000",Cloudy skies throughout the day with rain.
Heathrow Airport,25/02/2000,9.8,3,5.9,7.8,0.5,4.5,1.4,75.1,15.99,,12.5,,,,,14.8,266.3,1027.5,25.7,32.4,,,0,,2000-02-25T06:57:01,2000-02-25T17:33:48,0.68,Rain,1,rain,"366,009,999,903,672,000,000,000,000,000,000,000,000,000,000,000,000,000",Partly cloudy throughout the day with rain clearing later.
Heathrow Airport,26/02/2000,9.8,-1.7,5.7,7.3,-1.7,4.3,1.3,74.46,0.69,,8.33,,,,,20.5,185.9,1028.7,72.4,23,,,0,,2000-02-26T06:54:55,2000-02-26T17:35:35,0.72,Rain,1,rain,"366,009,999,903,672,000,000,000,000,000,000,000,000,000,000,000,000,000",Partly cloudy throughout the day with late afternoon rain.
Heathrow Airport,27/02/2000,12.5,8.5,10.5,12.5,6.4,9.5,7.3,80.5,1.4,,16.67,,,,,44.2,200,1015.6,99.5,11.1,,,0,,2000-02-27T06:52:49,2000-02-27T17:37:21,0.77,Rain,1,rain,"366,009,999,903,672,000,000,000,000,000,000,000,000,000,000,000,000,000",Cloudy skies throughout the day with a chance of rain throughout the day.
Heathrow Airport,28/02/2000,10.4,5.8,8,10.4,2.3,5.6,3.6,75.5,5.61,,16.67,,,,,37,228.3,1009.8,60.9,31.7,,,0,,2000-02-28T06:50:41,2000-02-28T17:39:08,0.82,Rain,1,rain,"366,009,999,903,672,000,000,000,000,000,000,000,000,000,000,000,000,000",Partly cloudy throughout the day with a chance of rain throughout the day.
Heathrow Airport,29/02/2000,9.6,4.9,7.6,6.9,0.9,4.3,5.3,85.42,7.91,,8.33,,,,,37.1,220.3,1000.8,81.5,20.6,,,0,,2000-02-29T06:48:33,2000-02-29T17:40:54,0.86,Rain,1,rain,"366,009,999,903,768,000,000,000,000,000,000,000,000,000,000,000,000,000",Partly cloudy throughout the day with rain in the morning and afternoon.
Heathrow Airport,01/03/2000,9.1,2.1,5.7,6.1,-0.7,2.7,0.4,69.56,1.43,,21.74,,,,,26,292.7,1009.4,39.5,34.4,,,0,,2000-03-01T06:46:24,2000-03-01T17:42:40,0.9,Rain,1,rain,"366,009,999,903,672,000,000,000,000,000,000,000,000,000,000,000,000,000",Partly cloudy throughout the day with a chance of rain throughout the day.
Heathrow Airport,02/03/2000,10.3,0.7,6.5,10.3,-2.3,4.2,3.1,79.03,0.11,,4.17,,,,,29.6,227.2,1016,86.3,32.7,,,0,,2000-03-02T06:44:14,2000-03-02T17:44:26,0.94,Rain,1,rain,"366,009,999,903,672,000,000,000,000,000,000,000,000,000,000,000,000,000",Partly cloudy throughout the day with afternoon rain.
Heathrow Airport,03/03/2000,11,4,8.5,11,0.8,6.7,3.3,71.57,6.79,,12.5,,,,,33.5,278.8,1007.3,69.8,23.4,,,0,,2000-03-03T06:42:03,2000-03-03T17:46:11,0.97,Rain,1,rain,"366,009,999,903,672,000,000,000,000,000,000,000,000,000,000,000,000,000",Partly cloudy throughout the day with rain.
Heathrow Airport,04/03/2000,7.3,0.8,4,5.1,-1.5,2,-3.1,61.05,0.7,,4.17,,,,,18.4,293.3,1027,36.1,42.6,,,0,,2000-03-04T06:39:52,2000-03-04T17:47:56,0.99,Rain,1,rain,"366,009,999,903,672,000,000,000,000,000,000,000,000,000,000,000,000,000",Partly cloudy throughout the day with late afternoon rain.
Heathrow Airport,05/03/2000,9.3,0,5.1,7.2,-2.4,3.3,-0.1,69.84,0.01,,4.17,,,,,16.6,238.5,1032.1,74.2,30.9,,,0,,2000-03-05T06:37:41,2000-03-05T17:49:41,1,Rain,1,rain,"366,009,999,903,672,000,000,000,000,000,000,000,000,000,000,000,000,000",Partly cloudy throughout the day with late afternoon rain.
Heathrow Airport,06/03/2000,11.5,5.8,8.8,11.5,2.8,7.2,5.6,80.88,0.7,,4.17,,,,,22.3,216.3,1026.6,95.9,24.2,,,0,,2000-03-06T06:35:28,2000-03-06T17:51:25,0,Rain,1,rain,"366,009,999,903,672,000,000,000,000,000,000,000,000,000,000,000,000,000",Cloudy skies throughout the day with afternoon rain.
Heathrow Airport,07/03/2000,13.6,8.7,11.3,13.6,6.5,10.7,7.7,79.54,1.4,,8.33,,,,,25.9,241.8,1023.6,88.8,22.1,,,0,,2000-03-07T06:33:16,2000-03-07T17:53:10,0.01,Rain,1,rain,"366,009,999,903,672,000,000,000,000,000,000,000,000,000,000,000,000,000",Partly cloudy throughout the day with rain.
Heathrow Airport,08/03/2000,14.6,11.1,12.6,14.6,11.1,12.6,9.5,81.25,1.39,,8.7,,,,,27.8,244.3,1022.5,94.5,30.5,,,0,,2000-03-08T06:31:02,2000-03-08T17:54:54,0.03,Rain,1,rain,"366,009,999,903,672,000,000,000,000,000,000,000,000,000,000,000,000,000",Cloudy skies throughout the day with rain.
Heathrow Airport,09/03/2000,16.1,11.3,13.1,16.1,11.3,13.1,8.2,73.38,0.69,,4.17,,,,,25.9,266.3,1025.4,89.7,32.7,,,0,,2000-03-09T06:28:48,2000-03-09T17:56:37,0.06,Rain,1,rain,"366,009,999,903,672,000,000,000,000,000,000,000,000,000,000,000,000,000",Partly cloudy throughout the day with early morning rain.
Heathrow Airport,10/03/2000,13.8,7.9,11.3,13.8,4.3,10.7,7.4,77.82,0.7,,8.33,,,,,24.1,244.2,1026.4,93.4,17.4,,,0,,2000-03-10T06:26:34,2000-03-10T17:58:21,0.1,Rain,1,rain,"366,009,999,903,672,000,000,000,000,000,000,000,000,000,000,000,000,000",Cloudy skies throughout the day with rain.
Heathrow Airport,11/03/2000,13.5,7.1,10.3,13.5,4.7,9.7,4.6,69.3,0,,0,,,,,24.1,295,1022.4,88.2,23.6,,,0,,2000-03-11T06:24:20,2000-03-11T18:00:04,0.15,Partially cloudy,2,partly-cloudy-day,"366,009,999,903,672,000,000,000,000,000,000,000,000,000,000,000,000,000",Partly cloudy throughout the day.
Heathrow Airport,12/03/2000,14.3,3.3,8.7,14.3,3.3,8.7,3.8,72.65,0,,0,,,,,14.8,265.4,1026.4,63.7,15.6,,,0,,2000-03-12T06:22:05,2000-03-12T18:01:47,0.2,Partially cloudy,2,partly-cloudy-day,"366,009,999,903,672,000,000,000,000,000,000,000,000,000,000,000,000,000",Partly cloudy throughout the day.
Heathrow Airport,13/03/2000,14.6,5.1,10.2,14.6,5.1,10.2,6.7,79.51,0.7,,4.17,,,,,14.8,242.9,1026.3,73.5,11.7,,,0,,2000-03-13T06:19:49,2000-03-13T18:03:30,0.26,Rain,1,rain,"366,009,999,903,672,000,000,000,000,000,000,000,000,000,000,000,000,000",Partly cloudy throughout the day with late afternoon rain.
Heathrow Airport,14/03/2000,12.3,6,9.9,12.3,2.6,8.8,4.2,68.57,0.7,,4.17,,,,,27.8,285.4,1024.8,84.7,29.5,,,0,,2000-03-14T06:17:34,2000-03-14T18:05:12,0.32,Rain,1,rain,"366,009,999,903,672,000,000,000,000,000,000,000,000,000,000,000,000,000",Partly cloudy throughout the day with afternoon rain.
Heathrow Airport,15/03/2000,12.5,3.1,7.8,12.5,1.3,6.6,1.4,65.64,0,,0,,,,,16.6,298.8,1034,22.8,30,,,0,,2000-03-15T06:15:18,2000-03-15T18:06:55,0.37,Partially cloudy,2,partly-cloudy-day,"366,009,999,903,672,000,000,000,000,000,000,000,000,000,000,000,000,000",Partly cloudy throughout the day.
Heathrow Airport,16/03/2000,12,4.2,8.8,12,3,8.3,4.1,72.63,0,,0,,,,,14.8,294.6,1034.4,80.9,23.5,,,0,,2000-03-16T06:13:02,2000-03-16T18:08:37,0.42,Partially cloudy,2,partly-cloudy-day,"366,009,999,903,672,000,000,000,000,000,000,000,000,000,000,000,000,000",Partly cloudy throughout the day.
Heathrow Airport,17/03/2000,10.3,8.6,9.5,10.3,7.4,8.9,4.1,68.96,0,,0,,,,,13,329.2,1034.2,99.1,18.3,,,0,,2000-03-17T06:10:46,2000-03-17T18:10:19,0.46,Overcast,3,cloudy,"366,009,999,903,672,000,000,000,000,000,000,000,000,000,000,000,000,000",Cloudy skies throughout the day.
Heathrow Airport,18/03/2000,10.5,5.3,8.4,10.5,4.3,6.8,2.6,67.25,0.7,,4.35,,,,,20.5,245.2,1035.9,63.1,19.8,,,0,,2000-03-18T06:08:29,2000-03-18T18:12:01,0.48,Rain,1,rain,"366,009,999,903,672,000,000,000,000,000,000,000,000,000,000,000,000,000",Partly cloudy throughout the day with afternoon rain.
Heathrow Airport,19/03/2000,12.3,2.7,7.2,12.3,0.7,6.3,2.5,73.22,0,,0,,,,,13,160,1036.2,49,17.1,,,0,,2000-03-19T06:06:12,2000-03-19T18:13:42,0.5,Partially cloudy,2,partly-cloudy-day,"366,009,999,903,672,000,000,000,000,000,000,000,000,000,000,000,000,000",Partly cloudy throughout the day.
Heathrow Airport,20/03/2000,13.3,2.1,7.6,13.3,2.1,7.3,4.1,79.24,0,,8.7,,,,,16.5,201,1030.2,77.5,8.8,,,0,,2000-03-20T06:03:56,2000-03-20T18:15:24,0.5,Partially cloudy,2,partly-cloudy-day,"366,009,999,903,672,000,000,000,000,000,000,000,000,000,000,000,000,000",Partly cloudy throughout the day.
Heathrow Airport,21/03/2000,14.1,4,8.3,14.1,4,7.9,4.4,78.66,0.01,,4.17,,,,,18.3,123.1,1022.2,66.3,6.4,,,0,,2000-03-21T06:01:39,2000-03-21T18:17:05,0.51,Rain,1,rain,"366,009,999,903,672,000,000,000,000,000,000,000,000,000,000,000,000,000",Partly cloudy throughout the day with afternoon rain.
Heathrow Airport,22/03/2000,15.1,4,9.2,15.1,4,9.1,3.7,72.93,0,,4.17,,,,,7.5,165.4,1016.4,70.2,5.5,,,0,,2000-03-22T05:59:22,2000-03-22T18:18:47,0.53,Partially cloudy,2,partly-cloudy-day,"366,009,999,903,672,000,000,000,000,000,000,000,000,000,000,000,000,000",Partly cloudy throughout the day.
Heathrow Airport,23/03/2000,14.6,8,10.7,14.6,5.9,10.4,5.4,70.78,0.7,,8.33,,,,,24.1,100.3,1010.3,95.4,5.8,,,0,,2000-03-23T05:57:05,2000-03-23T18:20:28,0.56,Rain,1,rain,"366,009,999,903,672,000,000,000,000,000,000,000,000,000,000,000,000,000",Cloudy skies throughout the day with rain.
Heathrow Airport,24/03/2000,13.7,7.6,10.3,13.7,5.3,9.7,6.2,77.28,1.71,,12.5,,,,,24.1,206.7,1006.4,80.1,18.3,,,0,,2000-03-24T05:54:48,2000-03-24T18:22:09,0.6,Rain,1,rain,"366,009,999,903,672,000,000,000,000,000,000,000,000,000,000,000,000,000",Partly cloudy throughout the day with rain.
Heathrow Airport,25/03/2000,10.6,3.9,7.5,10.6,1.5,5.7,3.7,78.19,3.08,,12.5,,,,,29.4,203.3,1009.6,51.9,31.7,,,0,,2000-03-25T05:52:31,2000-03-25T18:23:49,0.64,Rain,1,rain,"366,009,999,903,672,000,000,000,000,000,000,000,000,000,000,000,000,000",Partly cloudy throughout the day with rain.
Heathrow Airport,26/03/2000,10.1,2,6.3,10.1,1.8,5.9,1.6,73.75,0.69,,13.04,,,,,11.1,248.2,1007.5,47.6,25.9,,,0,,2000-03-26T06:50:14,2000-03-26T19:25:30,0.69,Rain,1,rain,"366,009,999,903,672,000,000,000,000,000,000,000,000,000,000,000,000,000",Partly cloudy throughout the day with late afternoon rain.
Heathrow Airport,27/03/2000,9.1,4.3,6.1,6.5,1,3.1,2.4,77.35,0.64,,16.67,,,,,27.7,138.7,1014.1,74.6,19.7,,,0,,2000-03-27T06:47:58,2000-03-27T19:27:11,0.73,Rain,1,rain,"366,009,999,903,672,000,000,000,000,000,000,000,000,000,000,000,000,000",Partly cloudy throughout the day with rain.
Heathrow Airport,28/03/2000,7.6,4.3,5.5,4.2,0.6,1.8,0.7,71.79,1.69,,12.5,,,,,25.9,77.1,1020.9,92.9,28.1,,,0,,2000-03-28T06:45:41,2000-03-28T19:28:52,0.78,Rain,1,rain,"366,009,999,903,672,000,000,000,000,000,000,000,000,000,000,000,000,000",Cloudy skies throughout the day with rain.
Heathrow Airport,29/03/2000,7.1,3.8,5.6,4.2,-0.2,1.9,3.5,87.03,0.8,,12.5,,,,,24.2,22.9,1017.8,99.6,6.5,,,0,,2000-03-29T06:43:25,2000-03-29T19:30:32,0.82,Rain,1,rain,"366,009,999,903,672,000,000,000,000,000,000,000,000,000,000,000,000,000",Cloudy skies throughout the day with a chance of rain throughout the day.
Heathrow Airport,30/03/2000,8,5.1,6.4,6.3,1.7,3.9,3.3,80.6,1.4,,12.5,,,,,18.4,74.2,1014.9,99.6,9.5,,,0,,2000-03-30T06:41:08,2000-03-30T19:32:13,0.87,Rain,1,rain,"366,009,999,903,672,000,000,000,000,000,000,000,000,000,000,000,000,000",Cloudy skies throughout the day with a chance of rain throughout the day.
Heathrow Airport,31/03/2000,9.6,5.1,7,9.6,4.4,6.8,1.8,71.45,0.01,,4.17,,,,,7.5,264.2,1007.8,90.4,12.2,,,0,,2000-03-31T06:38:52,2000-03-31T19:33:53,0.91,Rain,1,rain,"366,009,999,903,672,000,000,000,000,000,000,000,000,000,000,000,000,000",Cloudy skies throughout the day with late afternoon rain.
Heathrow Airport,01/04/2000,10.6,2.3,6.8,10.6,0.6,5.4,3.7,81.79,0.8,,8.33,,,,,20.5,165.4,1001.1,83.4,13.8,,,0,,2000-04-01T06:36:37,2000-04-01T19:35:33,0.95,Rain,1,rain,"366,009,999,903,672,000,000,000,000,000,000,000,000,000,000,000,000,000",Partly cloudy throughout the day with rain.
Heathrow Airport,02/04/2000,13.1,8,10.1,13.1,6.1,9.2,6,77.41,0.51,,4.17,,,,,24,137.1,997.3,98.8,16.8,,,0,,2000-04-02T06:34:21,2000-04-02T19:37:14,0.98,Rain,1,rain,"36,600,999,990,367,200,000,000,000,000,000",Cloudy skies throughout the day with early morning rain.
Heathrow Airport,03/04/2000,9.1,3.1,7.3,7.4,-2.1,4.5,6.2,92.26,19.79,,16.67,,,,,27.8,140,989.5,99.6,6.4,,,0,,2000-04-03T06:32:06,2000-04-03T19:38:54,1,Rain,1,rain,"366,009,999,903,672,000,000,000,000,000,000,000,000,000,000,000,000,000",Cloudy skies throughout the day with a chance of rain throughout the day.
Heathrow Airport,04/04/2000,4.1,2,3.2,0.1,-3.2,-1.5,0.5,83.5,14.93,,16.67,,,,,31.4,256.3,998,97.9,11.9,,,0,,2000-04-04T06:29:51,2000-04-04T19:40:34,1,Rain,1,rain,"366,009,999,903,672,000,000,000,000,000,000,000,000,000,000,000,000,000",Cloudy skies throughout the day with a chance of rain throughout the day.
Heathrow Airport,05/04/2000,9.8,2.8,5.7,7.5,-1.7,2.5,-0.4,65.16,1.4,,8.33,,,,,22.3,156.3,1016.2,78.8,30.8,,,0,,2000-04-05T06:27:37,2000-04-05T19:42:15,0,Rain,1,rain,"366,009,999,903,672,000,000,000,000,000,000,000,000,000,000,000,000,000",Partly cloudy throughout the day with rain.
Heathrow Airport,06/04/2000,10.3,0.8,5.5,10.3,0.8,4,-0.6,66.28,0,,4.17,,,,,20.5,68.2,1030,14.1,33.2,,,0,,2000-04-06T06:25:22,2000-04-06T19:43:55,0.02,Clear,0,clear-day,"366,009,999,903,672,000,000,000,000,000,000,000,000,000,000,000,000,000",Clear conditions throughout the day.
Heathrow Airport,07/04/2000,14.6,2.5,8.1,14.6,1.7,7.2,2.6,71.1,0,,4.17,,,,,22.3,84.5,1032.8,19.5,13.7,,,0,,2000-04-07T06:23:09,2000-04-07T19:45:35,0.05,Clear,0,clear-day,"366,009,999,903,672,000,000,000,000,000,000,000,000,000,000,000,000,000",Clear conditions throughout the day.
Heathrow Airport,08/04/2000,16.1,2.5,9.7,16.1,2.5,9.5,1.5,62.17,0,,4.17,,,,,18.4,224.4,1023.9,54.3,7.1,,,0,,2000-04-08T06:20:56,2000-04-08T19:47:15,0.09,Partially cloudy,2,partly-cloudy-day,"366,009,999,903,672,000,000,000,000,000,000,000,000,000,000,000,000,000",Becoming cloudy in the afternoon.
Heathrow Airport,09/04/2000,14.3,6.5,9.9,14.3,3.7,8.5,4,68.63,4.79,,8.33,,,,,27.7,35,1014.2,61.3,9.9,,,0,,2000-04-09T06:18:43,2000-04-09T19:48:55,0.14,Rain,1,rain,"366,009,999,903,672,000,000,000,000,000,000,000,000,000,000,000,000,000",Partly cloudy throughout the day with rain in the morning and afternoon.
Heathrow Airport,10/04/2000,12,3.6,7.8,12,0.1,6.1,0.5,62.26,0,,0,,,,,20.6,50,1014.4,20.8,24.3,,,0,,2000-04-10T06:16:31,2000-04-10T19:50:36,0.19,Partially cloudy,2,partly-cloudy-day,"366,009,999,903,672,000,000,000,000,000,000,000,000,000,000,000,000,000",Partly cloudy throughout the day.
Heathrow Airport,11/04/2000,6.8,3.5,5.2,6.1,2.4,3.9,2.4,82.1,6.8,,12.5,,,,,14.7,203.8,994.2,89.6,13.8,,,0,,2000-04-11T06:14:19,2000-04-11T19:52:16,0.25,Rain,1,rain,"366,009,999,903,672,000,000,000,000,000,000,000,000,000,000,000,000,000",Partly cloudy throughout the day with rain.
Heathrow Airport,12/04/2000,6.3,2,3.8,4.1,-1.4,1.1,2.5,91.04,4.23,,12.5,,,,,18.3,234.2,984,98.3,11.6,,,0,,2000-04-12T06:12:08,2000-04-12T19:53:56,0.3,Rain,1,rain,"366,009,999,903,672,000,000,000,000,000,000,000,000,000,000,000,000,000",Cloudy skies throughout the day with rain.
Heathrow Airport,13/04/2000,7.9,3.8,5.4,5.6,-0.1,3.3,3.3,86.36,2.5,,12.5,,,,,20.5,269.2,990.4,92.1,15.5,,,0,,2000-04-13T06:09:58,2000-04-13T19:55:36,0.36,Rain,1,rain,"366,009,999,903,672,000,000,000,000,000,000,000,000,000,000,000,000,000",Cloudy skies throughout the day with rain.
Heathrow Airport,14/04/2000,9.5,4.1,6.7,8.2,2.9,5.1,3,78.09,0.01,,13.04,,,,,16.6,156.5,999.1,88.7,14.7,,,0,,2000-04-14T06:07:48,2000-04-14T19:57:16,0.4,Rain,1,rain,"366,009,999,903,672,000,000,000,000,000,000,000,000,000,000,000,000,000",Partly cloudy throughout the day with late afternoon rain.
Heathrow Airport,15/04/2000,5.8,3.3,4.5,2.8,-1,1,2.7,88.43,12.21,,16.67,,,,,22.3,144.6,994.5,97,16.3,,,0,,2000-04-15T06:05:39,2000-04-15T19:58:56,0.44,Rain,1,rain,"366,009,999,903,672,000,000,000,000,000,000,000,000,000,000,000,000,000",Cloudy skies throughout the day with a chance of rain throughout the day.
Heathrow Airport,16/04/2000,12.4,0.9,6.6,12.4,0.9,5.9,2.4,77.41,0.69,,8.33,,,,,29.5,132.3,996,62.9,24,,,0,,2000-04-16T06:03:31,2000-04-16T20:00:37,0.47,Rain,1,rain,"366,009,999,903,672,000,000,000,000,000,000,000,000,000,000,000,000,000",Partly cloudy throughout the day with early morning rain.
Heathrow Airport,17/04/2000,11.3,6.3,8.3,11.3,2.8,5.6,4.6,78.14,4.05,,12.5,,,,,42.4,192.1,992.9,69.3,21.2,,,0,,2000-04-17T06:01:23,2000-04-17T20:02:17,0.49,Rain,1,rain,"366,009,999,903,672,000,000,000,000,000,000,000,000,000,000,000,000,000",Partly cloudy throughout the day with rain.
Heathrow Airport,18/04/2000,12,5.8,9.3,12,3.9,8,6.8,84.75,1.87,,16.67,,,,,24.1,175,1001.4,79,18.7,,,0,,2000-04-18T05:59:17,2000-04-18T20:03:57,0.5,Rain,1,rain,"366,009,999,903,672,000,000,000,000,000,000,000,000,000,000,000,000,000",Partly cloudy throughout the day with a chance of rain throughout the day.
Heathrow Airport,19/04/2000,15.8,6.8,11.2,15.8,4.7,10.8,5.9,72.52,0.5,,8.33,,,,,24.1,198.8,1006.3,81.2,32.9,,,0,,2000-04-19T05:57:11,2000-04-19T20:05:37,0.51,Rain,1,rain,"366,009,999,903,672,000,000,000,000,000,000,000,000,000,000,000,000,000",Partly cloudy throughout the day with early morning rain.
Heathrow Airport,20/04/2000,13.8,10.3,12.3,13.8,10.3,12.3,10.8,90.28,1.71,,16.67,,,,,29.5,181.3,1005.6,96.6,12.1,,,0,,2000-04-20T05:55:06,2000-04-20T20:07:16,0.52,Rain,1,rain,"366,009,999,903,672,000,000,000,000,000,000,000,000,000,000,000,000,000",Cloudy skies throughout the day with a chance of rain throughout the day.
Heathrow Airport,21/04/2000,15,8.3,11.8,15,5.7,11.3,7.1,73.79,1.2,,13.04,,,,,35.2,189.6,1009.6,74.8,30.4,,,0,,2000-04-21T05:53:02,2000-04-21T20:08:56,0.54,Rain,1,rain,"366,009,999,903,672,000,000,000,000,000,000,000,000,000,000,000,000,000",Partly cloudy throughout the day with rain in the morning and afternoon.
Heathrow Airport,22/04/2000,14.9,7.4,11.7,14.9,6,11.3,7.6,77.14,1.2,,13.04,,,,,24.1,161.7,1007.9,68.4,32.7,,,0,,2000-04-22T05:50:59,2000-04-22T20:10:36,0.57,Rain,1,rain,"366,009,999,903,672,000,000,000,000,000,000,000,000,000,000,000,000,000",Partly cloudy throughout the day with rain.
Heathrow Airport,23/04/2000,13.9,6.3,9.8,13.9,5.4,9.7,7,83.45,0.11,,8.33,,,,,11.1,223,1010.4,74.2,20.5,,,0,,2000-04-23T05:48:56,2000-04-23T20:12:16,0.61,Rain,1,rain,"366,009,999,903,672,000,000,000,000,000,000,000,000,000,000,000,000,000",Partly cloudy throughout the day with late afternoon rain.
Heathrow Airport,24/04/2000,14,6.6,10.3,14,5.2,10,6.1,77.15,1.39,,9.09,,,,,24.1,164,1010.8,65.1,24.7,,,0,,2000-04-24T05:46:55,2000-04-24T20:13:55,0.65,Rain,1,rain,"366,009,999,903,672,000,000,000,000,000,000,000,000,000,000,000,000,000",Partly cloudy throughout the day with rain.
Heathrow Airport,25/04/2000,14.8,10,12.1,14.8,10,12,9.2,82.94,5.81,,12.5,,,,,29.5,164.2,1005.3,93.7,26.1,,,0,,2000-04-25T05:44:55,2000-04-25T20:15:34,0.69,Rain,1,rain,"366,009,999,903,672,000,000,000,000,000,000,000,000,000,000,000,000,000",Cloudy skies throughout the day with a chance of rain throughout the day.
Heathrow Airport,26/04/2000,14.7,9.5,11.4,14.7,8.6,11.4,8.7,83.94,4.01,,12.5,,,,,25.9,157.3,1005.1,89.2,23.2,,,0,,2000-04-26T05:42:56,2000-04-26T20:17:14,0.74,Rain,1,rain,"366,009,999,903,672,000,000,000,000,000,000,000,000,000,000,000,000,000",Partly cloudy throughout the day with a chance of rain throughout the day.
Heathrow Airport,27/04/2000,15.9,7.4,11.7,15.9,6.6,11.3,7.1,75.03,0.01,,4.17,,,,,18.3,151.3,1009.2,74.3,33.9,,,0,,2000-04-27T05:40:59,2000-04-27T20:18:53,0.79,Rain,1,rain,"366,009,999,903,672,000,000,000,000,000,000,000,000,000,000,000,000,000",Partly cloudy throughout the day with early morning rain.
Heathrow Airport,28/04/2000,13.1,10.1,11.6,13.1,10.1,11.6,9.5,86.86,1.4,,12.5,,,,,16.6,157.5,1007.8,97.3,9.7,,,0,,2000-04-28T05:39:02,2000-04-28T20:20:31,0.84,Rain,1,rain,"366,009,999,903,672,000,000,000,000,000,000,000,000,000,000,000,000,000",Cloudy skies throughout the day with rain.
Heathrow Airport,29/04/2000,18.1,9.5,13.6,18.1,7.4,13.2,7.5,69.96,4.13,,8.33,,,,,18.3,187.1,1014.3,46.4,29.7,,,0,,2000-04-29T05:37:07,2000-04-29T20:22:10,0.88,Rain,1,rain,"366,009,999,903,672,000,000,000,000,000,000,000,000,000,000,000,000,000",Clearing in the afternoon with rain clearing later.
Heathrow Airport,30/04/2000,16.3,6.3,11.8,16.3,6.3,11.7,7.2,74.63,0.01,,4.17,,,,,22.3,151.3,1022.1,73.1,30.1,,,0,,2000-04-30T05:35:13,2000-04-30T20:23:48,0.92,Rain,1,rain,"366,009,999,903,672,000,000,000,000,000,000,000,000,000,000,000,000,000",Partly cloudy throughout the day with afternoon rain.
Heathrow Airport,01/05/2000,16.3,8,12.2,16.3,6.4,11.9,7.4,74.43,0,,0,,,,,18.4,27.1,1024.1,57.7,18.1,,,0,,2000-05-01T05:33:20,2000-05-01T20:25:26,0.96,Partially cloudy,2,partly-cloudy-day,"366,009,999,903,672,000,000,000,000,000,000,000,000,000,000,000,000,000",Partly cloudy throughout the day.
Heathrow Airport,02/05/2000,14.1,8.6,11,14.1,6.1,10.1,6.3,73.2,0,,0,,,,,18.4,26.3,1025.7,75.5,21.1,,,0,,2000-05-02T05:31:29,2000-05-02T20:27:04,0.99,Partially cloudy,2,partly-cloudy-day,"366,009,999,903,672,000,000,000,000,000,000,000,000,000,000,000,000,000",Partly cloudy throughout the day.
Heathrow Airport,03/05/2000,10.8,8.5,9.5,10.8,5.7,8,6.9,83.94,0.8,,8.33,,,,,20.5,33.8,1024.4,99.6,19.4,,,0,,2000-05-03T05:29:39,2000-05-03T20:28:41,1,Rain,1,rain,"366,009,999,903,672,000,000,000,000,000,000,000,000,000,000,000,000,000",Cloudy skies throughout the day with rain in the morning and afternoon.
Heathrow Airport,04/05/2000,12.1,8.1,9.9,12.1,5.7,8.5,6.5,80.27,1.4,,8.33,,,,,20.6,26.7,1022.6,89.6,17,,,0,,2000-05-04T05:27:50,2000-05-04T20:30:18,0,Rain,1,rain,"366,009,999,903,672,000,000,000,000,000,000,000,000,000,000,000,000,000",Partly cloudy throughout the day with rain.
Heathrow Airport,05/05/2000,20.1,7.3,12.9,20.1,4.7,12.1,8.3,74.36,0,,0,,,,,22.3,27.5,1016.8,76.8,13,,,0,,2000-05-05T05:26:03,2000-05-05T20:31:55,0.01,Partially cloudy,2,partly-cloudy-day,"366,009,999,903,672,000,000,000,000,000,000,000,000,000,000,000,000,000",Partly cloudy throughout the day.
Heathrow Airport,06/05/2000,24.1,8.6,16.1,24.1,7.5,15.8,10.5,71.69,0,,0,,,,,24.1,97.1,1012.5,59.9,8.2,,,0,,2000-05-06T05:24:18,2000-05-06T20:33:31,0.04,Partially cloudy,2,partly-cloudy-day,"366,009,999,903,672,000,000,000,000,000,000,000,000,000,000,000,000,000",Partly cloudy throughout the day.
Heathrow Airport,07/05/2000,23,13.1,18.3,23,13.1,18.2,13,72.34,0.69,,4.17,,,,,18.3,101.3,1014.4,81.2,8.7,,,0,,2000-05-07T05:22:34,2000-05-07T20:35:07,0.08,Rain,1,rain,"366,009,999,903,672,000,000,000,000,000,000,000,000,000,000,000,000,000",Partly cloudy throughout the day with early morning rain.
Heathrow Airport,08/05/2000,18.3,10.6,14.6,18.3,10.6,14.5,11.7,83.44,0.8,,16.67,,,,,11.2,158.3,1017.3,82.2,5.5,,,0,,2000-05-08T05:20:52,2000-05-08T20:36:42,0.12,Rain,1,rain,"366,009,999,903,672,000,000,000,000,000,000,000,000,000,000,000,000,000",Partly cloudy throughout the day with rain.
Heathrow Airport,09/05/2000,22.8,12.3,17,22.8,12.3,16.9,13.8,83.09,0,,4.17,,,,,16.5,91.3,1017.8,66.8,4,,,0,,2000-05-09T05:19:12,2000-05-09T20:38:16,0.18,Partially cloudy,2,partly-cloudy-day,"366,009,999,903,672,000,000,000,000,000,000,000,000,000,000,000,000,000",Partly cloudy throughout the day.
Heathrow Airport,10/05/2000,17,13.1,15,17,13.1,15,12.4,84.16,0.69,,8.33,,,,,18.4,37.9,1017.8,85.1,5,,,0,,2000-05-10T05:17:33,2000-05-10T20:39:50,0.23,Rain,1,rain,"366,009,999,903,672,000,000,000,000,000,000,000,000,000,000,000,000,000",Partly cloudy throughout the day with afternoon rain.
Heathrow Airport,11/05/2000,17.3,10.9,13.5,17.3,10.9,13.5,9.3,76.93,7.08,,12.5,,,,,29.5,38.8,1018.3,85.1,13.4,,,0,,2000-05-11T05:15:56,2000-05-11T20:41:23,0.28,Rain,1,rain,"366,009,999,903,672,000,000,000,000,000,000,000,000,000,000,000,000,000",Partly cloudy throughout the day with a chance of rain throughout the day.
Heathrow Airport,12/05/2000,19,8.6,14.1,19,6.8,13.7,9.9,76.48,1.39,,8.33,,,,,16.6,44.6,1020.6,84.3,13,,,0,,2000-05-12T05:14:21,2000-05-12T20:42:55,0.34,Rain,1,rain,"366,009,999,903,672,000,000,000,000,000,000,000,000,000,000,000,000,000",Partly cloudy throughout the day with rain.
Heathrow Airport,13/05/2000,24.3,13.1,18.1,24.3,13.1,18,13.5,76.19,0.11,,4.17,,,,,18.3,212.9,1021.4,71.2,7,,,0,,2000-05-13T05:12:47,2000-05-13T20:44:27,0.39,Rain,1,rain,"366,009,999,903,672,000,000,000,000,000,000,000,000,000,000,000,000,000",Partly cloudy throughout the day with late afternoon rain.
Heathrow Airport,14/05/2000,24.6,12.6,19.6,24.6,12.6,19.6,14.1,72.31,0.7,,8.33,,,,,16.5,182.1,1022.5,66.8,10.1,,,0,,2000-05-14T05:11:16,2000-05-14T20:45:58,0.43,Rain,1,rain,"366,009,999,903,672,000,000,000,000,000,000,000,000,000,000,000,000,000",Partly cloudy throughout the day with early morning rain.
Heathrow Airport,15/05/2000,26.3,15.8,20.9,26.3,15.8,20.9,13.9,67.48,0.13,,8.33,,,,,22.3,166.3,1017.6,78.4,17.8,,,0,,2000-05-15T05:09:47,2000-05-15T20:47:27,0.46,Rain,1,rain,"366,009,999,903,672,000,000,000,000,000,000,000,000,000,000,000,000,000",Partly cloudy throughout the day with rain clearing later.
Heathrow Airport,16/05/2000,22.1,12.1,17.9,22.1,12.1,17.8,11.1,66.64,0,,0,,,,,29.5,208.3,1010.7,50.6,22.5,,,0,,2000-05-16T05:08:20,2000-05-16T20:48:56,0.48,Partially cloudy,2,partly-cloudy-day,"366,009,999,903,672,000,000,000,000,000,000,000,000,000,000,000,000,000",Clearing in the afternoon.
Heathrow Airport,17/05/2000,15.6,10.6,12.5,15.6,10.6,12.5,5.7,64.03,1.39,,12.5,,,,,27.8,225.4,1009.2,83.8,39.6,,,0,,2000-05-17T05:06:54,2000-05-17T20:50:24,0.5,Rain,1,rain,"366,009,999,903,672,000,000,000,000,000,000,000,000,000,000,000,000,000",Partly cloudy throughout the day with rain in the morning and afternoon.
Heathrow Airport,18/05/2000,14.3,7.5,11,14.3,5.2,10.3,7.1,77.06,9.14,,16.67,,,,,24.1,262.1,1006.8,64.7,27.4,,,0,,2000-05-18T05:05:31,2000-05-18T20:51:51,0.5,Rain,1,rain,"366,009,999,903,672,000,000,000,000,000,000,000,000,000,000,000,000,000",Partly cloudy throughout the day with a chance of rain throughout the day.
Heathrow Airport,19/05/2000,14.1,9.8,11.4,14.1,8.3,11.2,6.2,71.43,1.43,,12.5,,,,,24.2,270.8,1008.4,74.7,37.3,,,0,,2000-05-19T05:04:11,2000-05-19T20:53:17,0.51,Rain,1,rain,"366,009,999,903,672,000,000,000,000,000,000,000,000,000,000,000,000,000",Partly cloudy throughout the day with rain.
Heathrow Airport,20/05/2000,15.6,5.3,11.2,15.6,5.3,11.2,5.3,69.15,0.69,,4.17,,,,,16.6,231.7,1012.3,57.6,37.7,,,0,,2000-05-20T05:02:52,2000-05-20T20:54:41,0.53,Rain,1,rain,"366,009,999,903,672,000,000,000,000,000,000,000,000,000,000,000,000,000",Partly cloudy throughout the day with late afternoon rain.
Heathrow Airport,21/05/2000,15.3,8.3,11.6,15.3,7.4,11.4,7.6,78.18,12.9,,12.5,,,,,24.2,262.9,1007.7,91.7,24.5,,,0,,2000-05-21T05:01:36,2000-05-21T20:56:04,0.55,Rain,1,rain,"366,009,999,903,672,000,000,000,000,000,000,000,000,000,000,000,000,000",Cloudy skies throughout the day with a chance of rain throughout the day.
Heathrow Airport,22/05/2000,17.7,8,13.7,17.7,6.4,13.5,8.3,71.25,0.69,,8.33,,,,,22.3,233.8,1014.7,59.7,25.8,,,0,,2000-05-22T05:00:22,2000-05-22T20:57:26,0.58,Rain,1,rain,"366,009,999,903,672,000,000,000,000,000,000,000,000,000,000,000,000,000",Partly cloudy throughout the day with early morning rain.
Heathrow Airport,23/05/2000,14.1,11.6,13.1,14.1,11.6,13,10.5,84.59,0.83,,13.04,,,,,31.3,200.3,1013.3,92.7,21.1,,,0,,2000-05-23T04:59:10,2000-05-23T20:58:47,0.62,Rain,1,rain,"366,009,999,903,672,000,000,000,000,000,000,000,000,000,000,000,000,000",Cloudy skies throughout the day with rain.
Heathrow Airport,24/05/2000,16.1,9.2,12.2,16.1,8.4,12,8.4,79.33,1.71,,8.33,,,,,16.5,194.6,1012.1,91.7,15.9,,,0,,2000-05-24T04:58:01,2000-05-24T21:00:06,0.66,Rain,1,rain,"366,009,999,903,672,000,000,000,000,000,000,000,000,000,000,000,000,000",Cloudy skies throughout the day with rain.
Heathrow Airport,25/05/2000,15.8,9.3,12.3,15.8,7.4,12,6,68.42,7.2,,12.5,,,,,31.4,262.5,1010.6,53.1,31.6,,,0,,2000-05-25T04:56:54,2000-05-25T21:01:23,0.71,Rain,1,rain,"366,009,999,903,672,000,000,000,000,000,000,000,000,000,000,000,000,000",Partly cloudy throughout the day with rain.
Heathrow Airport,26/05/2000,12.8,9.3,11.2,12.8,6.3,11,8.7,85.2,15.69,,12.5,,,,,22.4,158,1008.7,97.9,17.3,,,0,,2000-05-26T04:55:50,2000-05-26T21:02:39,0.75,Rain,1,rain,"366,009,999,903,672,000,000,000,000,000,000,000,000,000,000,000,000,000",Cloudy skies throughout the day with rain.
Heathrow Airport,27/05/2000,13.6,7.1,10.3,13.6,3.4,9.1,5.6,73.66,4.79,,8.33,,,,,42.4,217.9,1005.7,68.7,36.2,,,0,,2000-05-27T04:54:48,2000-05-27T21:03:53,0.8,Rain,1,rain,"366,009,999,903,672,000,000,000,000,000,000,000,000,000,000,000,000,000",Partly cloudy throughout the day with rain.
Heathrow Airport,28/05/2000,14.8,5.9,10.1,14.8,1.4,8.8,6,77.39,17.04,,16.67,,,,,27.8,246.2,1001.4,88.3,19.6,,,0,,2000-05-28T04:53:49,2000-05-28T21:05:06,0.85,Rain,1,rain,"366,009,999,903,672,000,000,000,000,000,000,000,000,000,000,000,000,000",Partly cloudy throughout the day with a chance of rain throughout the day.
Heathrow Airport,29/05/2000,16.6,6.8,11.6,16.6,4.7,10.9,5.4,68.35,3.68,,12.5,,,,,24.1,257.5,1012.9,50.5,46.2,,,0,,2000-05-29T04:52:53,2000-05-29T21:06:17,0.9,Rain,1,rain,"366,009,999,903,672,000,000,000,000,000,000,000,000,000,000,000,000,000",Partly cloudy throughout the day with rain.
Heathrow Airport,30/05/2000,15.1,9.6,12.3,15.1,9.2,12.2,5.9,66.75,1.39,,12.5,,,,,11.1,193.2,1013.3,81.8,42.8,,,0,,2000-05-30T04:51:59,2000-05-30T21:07:26,0.94,Rain,1,rain,"366,009,999,903,672,000,000,000,000,000,000,000,000,000,000,000,000,000",Partly cloudy throughout the day with rain in the morning and afternoon.
Heathrow Airport,31/05/2000,18.6,6.3,13,18.6,6.3,13,6.1,66.52,0,,8.33,,,,,22.3,214.1,1018.2,65.2,29.9,,,0,,2000-05-31T04:51:08,2000-05-31T21:08:32,0.98,Partially cloudy,2,partly-cloudy-day,"366,009,999,903,672,000,000,000,000,000,000,000,000,000,000,000,000,000",Partly cloudy throughout the day.
Heathrow Airport,01/06/2000,16.4,12.3,14.1,16.4,12.3,14.1,11.5,84.34,1.5,,12.5,,,,,29.5,202.1,1016.3,94.6,18.6,,,0,,2000-06-01T04:50:20,2000-06-01T21:09:37,1,Rain,1,rain,"366,009,999,903,672,000,000,000,000,000,000,000,000,000,000,000,000,000",Cloudy skies throughout the day with rain.
Heathrow Airport,02/06/2000,18.1,12.8,15.4,18.1,12.8,15.4,11.3,76.74,0.69,,4.17,,,,,16.6,210.4,1017.7,92.1,34.7,,,0,,2000-06-02T04:49:35,2000-06-02T21:10:40,1,Rain,1,rain,"366,009,999,903,672,000,000,000,000,000,000,000,000,000,000,000,000,000",Cloudy skies throughout the day with early morning rain.
Heathrow Airport,03/06/2000,22.5,12.3,17.2,22.5,12.3,17.2,12,72.9,0,,0,,,,,11.2,199.8,1016.8,86.6,28.6,,,0,,2000-06-03T04:48:52,2000-06-03T21:11:41,0.01,Partially cloudy,2,partly-cloudy-day,"366,009,999,903,672,000,000,000,000,000,000,000,000,000,000,000,000,000",Partly cloudy throughout the day.
Heathrow Airport,04/06/2000,17.7,11.6,15.5,17.7,11.6,15.4,9.6,69.16,0.69,,4.17,,,,,11.2,233.8,1016.8,68.8,36.9,,,0,,2000-06-04T04:48:12,2000-06-04T21:12:39,0.03,Rain,1,rain,"366,009,999,903,672,000,000,000,000,000,000,000,000,000,000,000,000,000",Partly cloudy throughout the day with morning rain.
Heathrow Airport,05/06/2000,15.8,10.6,13.4,15.8,10.6,13.4,10.2,81.42,0,,0,,,,,13,218.5,1019,88,14,,,0,,2000-06-05T04:47:36,2000-06-05T21:13:35,0.06,Partially cloudy,2,partly-cloudy-day,"366,009,999,903,672,000,000,000,000,000,000,000,000,000,000,000,000,000",Partly cloudy throughout the day.
Heathrow Airport,06/06/2000,18,10.1,14.2,18,10.1,14.1,8.8,72.69,0.71,,12.5,,,,,27.7,255,1020.1,57.3,22.1,,,0,,2000-06-06T04:47:02,2000-06-06T21:14:29,0.11,Rain,1,rain,"366,009,999,903,672,000,000,000,000,000,000,000,000,000,000,000,000,000",Partly cloudy throughout the day with rain.
Heathrow Airport,07/06/2000,19.6,8.8,14.6,19.6,7.4,14.3,6.3,59.78,0,,0,,,,,22.3,229.7,1023.8,63.9,42.4,,,0,,2000-06-07T04:46:31,2000-06-07T21:15:20,0.16,Partially cloudy,2,partly-cloudy-day,"366,009,999,903,672,000,000,000,000,000,000,000,000,000,000,000,000,000",Partly cloudy throughout the day.
Heathrow Airport,08/06/2000,22,12.6,17.6,22,12.6,17.6,7.9,54.31,0,,0,,,,,31.3,144.2,1014.8,63.5,44.2,,,0,,2000-06-08T04:46:03,2000-06-08T21:16:09,0.22,Partially cloudy,2,wind,"366,009,999,903,672,000,000,000,000,000,000,000,000,000,000,000,000,000",Partly cloudy throughout the day.
Heathrow Airport,09/06/2000,18.3,13.5,16.4,18.3,13.5,16.4,12.4,77.78,4.1,,4.17,,,,,24.1,155.9,1008.7,66,20.7,,,0,,2000-06-09T04:45:38,2000-06-09T21:16:56,0.27,Rain,1,rain,"366,009,999,903,672,000,000,000,000,000,000,000,000,000,000,000,000,000",Partly cloudy throughout the day with afternoon rain.
Heathrow Airport,10/06/2000,19.6,9.1,14.4,19.6,8.7,14.3,6.9,63.47,0,,4.17,,,,,24.1,241.7,1016.7,61.8,45.3,,,0,,2000-06-10T04:45:17,2000-06-10T21:17:39,0.32,Partially cloudy,2,partly-cloudy-day,"366,009,999,903,672,000,000,000,000,000,000,000,000,000,000,000,000,000",Partly cloudy throughout the day.
Heathrow Airport,11/06/2000,18.6,11.3,15.2,18.6,11.3,15.1,7.8,63.02,0.69,,4.17,,,,,22.4,243.3,1018.2,77.5,38,,,0,,2000-06-11T04:44:58,2000-06-11T21:18:21,0.37,Rain,1,rain,"3,660,099,999,036,720,000,000,000,000,000,000,000,000,000",Partly cloudy throughout the day with morning rain.
Heathrow Airport,12/06/2000,25,12.3,18.3,25,12.3,18.2,12.4,69.82,0,,0,,,,,24.1,220,1023.6,62.2,32.8,,,0,,2000-06-12T04:44:42,2000-06-12T21:18:59,0.41,Partially cloudy,2,partly-cloudy-day,"366,009,999,903,672,000,000,000,000,000,000,000,000,000,000,000,000,000",Partly cloudy throughout the day.
Heathrow Airport,13/06/2000,21.8,14.6,18,21.8,14.6,18,13.1,73.61,0.01,,8.33,,,,,22.4,236.7,1024.5,86,34.5,,,0,,2000-06-13T04:44:30,2000-06-13T21:19:35,0.45,Rain,1,rain,"366,009,999,903,672,000,000,000,000,000,000,000,000,000,000,000,000,000",Partly cloudy throughout the day with rain in the morning and afternoon.
Heathrow Airport,14/06/2000,22.3,15.3,17.9,22.3,15.3,17.8,13.7,77.21,0.69,,4.17,,,,,24.2,225.9,1023.5,94.6,25.2,,,0,,2000-06-14T04:44:20,2000-06-14T21:20:07,0.47,Rain,1,rain,"366,009,999,903,672,000,000,000,000,000,000,000,000,000,000,000,000,000",Cloudy skies throughout the day with morning rain.
Heathrow Airport,15/06/2000,20.2,15.3,17.5,20.2,15.3,17.5,12.7,74.05,0.7,,12.5,,,,,14.7,261,1025.4,88.4,24.5,,,0,,2000-06-15T04:44:14,2000-06-15T21:20:37,0.49,Rain,1,rain,"366,009,999,903,672,000,000,000,000,000,000,000,000,000,000,000,000,000",Partly cloudy throughout the day with rain.
Heathrow Airport,16/06/2000,21.8,14.3,18.2,21.8,14.3,18.2,14,77.24,0,,0,,,,,18.3,135.1,1026.9,80.1,12.3,,,0,,2000-06-16T04:44:10,2000-06-16T21:21:05,0.5,Partially cloudy,2,partly-cloudy-day,"366,009,999,903,672,000,000,000,000,000,000,000,000,000,000,000,000,000",Partly cloudy throughout the day.
Heathrow Airport,17/06/2000,25.4,13.3,20.2,25.4,13.3,20.2,11.5,59.45,0,,0,,,,,25.9,143.9,1026.4,27.7,20.6,,,0,,2000-06-17T04:44:10,2000-06-17T21:21:29,0.5,Partially cloudy,2,partly-cloudy-day,"366,009,999,903,672,000,000,000,000,000,000,000,000,000,000,000,000,000",Partly cloudy throughout the day.
Heathrow Airport,18/06/2000,30.1,15.8,23.3,28.3,15.8,22.8,9,45.81,0,,0,,,,,29.5,172,1022,14.9,37.9,,,0,,2000-06-18T04:44:13,2000-06-18T21:21:50,0.52,Clear,0,clear-day,"366,009,999,903,672,000,000,000,000,000,000,000,000,000,000,000,000,000",Clear conditions throughout the day.
Heathrow Airport,19/06/2000,31,19.5,24.5,29.8,19.5,24.3,13,50.3,0,,0,,,,,22.3,180,1014.7,35.7,25.3,,,0,,2000-06-19T04:44:18,2000-06-19T21:22:08,0.53,Partially cloudy,2,partly-cloudy-day,"366,009,999,903,672,000,000,000,000,000,000,000,000,000,000,000,000,000",Partly cloudy throughout the day.
Heathrow Airport,20/06/2000,21.1,15.5,18.1,21.1,15.5,18.1,14.9,81.51,4.09,,4.17,,,,,20.5,203.8,1012.5,90.5,9,,,0,,2000-06-20T04:44:27,2000-06-20T21:22:24,0.55,Rain,1,rain,"366,009,999,903,672,000,000,000,000,000,000,000,000,000,000,000,000,000",Cloudy skies throughout the day with afternoon rain.
Heathrow Airport,21/06/2000,18.9,14.3,16.9,18.9,14.3,16.9,11.4,71.07,1.4,,12.5,,,,,33.5,197.9,1009.4,73.9,26.8,,,0,,2000-06-21T04:44:39,2000-06-21T21:22:36,0.59,Rain,1,rain,"366,009,999,903,672,000,000,000,000,000,000,000,000,000,000,000,000,000",Partly cloudy throughout the day with rain.
Heathrow Airport,22/06/2000,18.3,13.5,15.4,18.3,13.5,15.3,10.4,73.16,0.8,,12.5,,,,,35.3,209.6,1010.6,83,22.1,,,0,,2000-06-22T04:44:54,2000-06-22T21:22:45,0.63,Rain,1,rain,"366,009,999,903,672,000,000,000,000,000,000,000,000,000,000,000,000,000",Partly cloudy throughout the day with rain in the morning and afternoon.
Heathrow Airport,23/06/2000,18.5,12.8,15.2,18.5,12.8,15.2,9.7,70.97,2.68,,8.33,,,,,20.6,254.2,1015.8,80.9,33.6,,,0,,2000-06-23T04:45:11,2000-06-23T21:22:51,0.68,Rain,1,rain,"366,009,999,903,672,000,000,000,000,000,000,000,000,000,000,000,000,000",Partly cloudy throughout the day with rain.
Heathrow Airport,24/06/2000,15.6,8.7,12.2,15.6,7.2,12,7.2,71.82,0.7,,4.17,,,,,18.3,280.8,1018.3,80.9,40.3,,,0,,2000-06-24T04:45:32,2000-06-24T21:22:54,0.73,Rain,1,rain,"366,009,999,903,672,000,000,000,000,000,000,000,000,000,000,000,000,000",Partly cloudy throughout the day with afternoon rain.
Heathrow Airport,25/06/2000,16.8,10.1,14.2,16.8,10.1,14.2,8.3,68.34,0.7,,12.5,,,,,11.2,231.3,1021.7,82.2,29.2,,,0,,2000-06-25T04:45:55,2000-06-25T21:22:54,0.78,Rain,1,rain,"366,009,999,903,672,000,000,000,000,000,000,000,000,000,000,000,000,000",Partly cloudy throughout the day with rain.
Heathrow Airport,26/06/2000,19.1,12.8,15.7,19.1,12.8,15.7,9.8,68.83,1.39,,12.5,,,,,13,142.1,1024.9,83.4,18.8,,,0,,2000-06-26T04:46:22,2000-06-26T21:22:50,0.83,Rain,1,rain,"366,009,999,903,672,000,000,000,000,000,000,000,000,000,000,000,000,000",Partly cloudy throughout the day with rain.
Heathrow Airport,27/06/2000,21.4,11.3,16.9,21.4,11.3,16.9,9.4,62.98,0,,0,,,,,12.9,173.4,1023.3,70.2,19.9,,,0,,2000-06-27T04:46:51,2000-06-27T21:22:44,0.88,Partially cloudy,2,partly-cloudy-day,"366,009,999,903,672,000,000,000,000,000,000,000,000,000,000,000,000,000",Partly cloudy throughout the day.
Heathrow Airport,28/06/2000,20.5,13.3,16.8,20.5,13.3,16.7,10.1,65.44,0.7,,8.33,,,,,16.5,184,1020.7,93.7,13,,,0,,2000-06-28T04:47:23,2000-06-28T21:22:35,0.93,Rain,1,rain,"366,009,999,903,672,000,000,000,000,000,000,000,000,000,000,000,000,000",Cloudy skies throughout the day with rain.
Heathrow Airport,29/06/2000,20,14.6,16.9,20,14.6,16.9,11.3,70,0.7,,8.33,,,,,16.5,170.5,1020.2,92.9,7.3,,,0,,2000-06-29T04:47:58,2000-06-29T21:22:22,0.97,Rain,1,rain,"366,009,999,903,672,000,000,000,000,000,000,000,000,000,000,000,000,000",Cloudy skies throughout the day with afternoon rain.
Heathrow Airport,30/06/2000,19.8,13.7,15.8,19.8,13.7,15.9,13.4,85.9,8.1,,12.5,,,,,22.3,103.8,1015,94.1,5,,,0,,2000-06-30T04:48:35,2000-06-30T21:22:06,0.99,Rain,1,rain,"366,009,999,903,672,000,000,000,000,000,000,000,000,000,000,000,000,000",Cloudy skies throughout the day with rain.
Heathrow Airport,01/07/2000,20.2,14.6,17.1,20.2,14.6,17.1,13.5,80.08,0.62,,16.67,,,,,12.9,170.7,1009.4,82.5,12.3,,,0,,2000-07-01T04:49:15,2000-07-01T21:21:47,1,Rain,1,rain,"366,009,999,903,672,000,000,000,000,000,000,000,000,000,000,000,000,000",Partly cloudy throughout the day with rain.
Heathrow Airport,02/07/2000,21.6,13.3,17.4,21.6,13.3,17.4,13,77.33,1.39,,12.5,,,,,12.9,226.3,1010.1,77.6,19.2,,,0,,2000-07-02T04:49:58,2000-07-02T21:21:26,0,Rain,1,rain,"366,009,999,903,672,000,000,000,000,000,000,000,000,000,000,000,000,000",Partly cloudy throughout the day with rain in the morning and afternoon.
Heathrow Airport,03/07/2000,22.7,14.3,18.5,22.7,14.3,18.5,13,72.49,0.8,,16.67,,,,,14.7,200.7,1009.5,83.8,27,,,0,,2000-07-03T04:50:43,2000-07-03T21:21:01,0.02,Rain,1,rain,"366,009,999,903,672,000,000,000,000,000,000,000,000,000,000,000,000,000",Partly cloudy throughout the day with rain.
Heathrow Airport,04/07/2000,18.1,15.1,16.4,18.1,15.1,16.4,13.9,85.48,0.01,,4.35,,,,,13,131.6,1007.4,97,6.8,,,0,,2000-07-04T04:51:31,2000-07-04T21:20:33,0.05,Rain,1,rain,"366,009,999,903,672,000,000,000,000,000,000,000,000,000,000,000,000,000",Cloudy skies throughout the day with afternoon rain.
Heathrow Airport,05/07/2000,17,13.6,15.2,17,13.6,15.2,13.1,87.83,16.98,,12.5,,,,,9.4,245.4,1012.9,97.5,10.1,,,0,,2000-07-05T04:52:21,2000-07-05T21:20:02,0.09,Rain,1,rain,"366,009,999,903,672,000,000,000,000,000,000,000,000,000,000,000,000,000",Cloudy skies throughout the day with a chance of rain throughout the day.
Heathrow Airport,06/07/2000,22.1,12.6,16.9,22.1,12.6,16.9,12.9,79.04,0,,8.33,,,,,22.3,162.1,1018.1,83.8,16.1,,,0,,2000-07-06T04:53:13,2000-07-06T21:19:28,0.14,Partially cloudy,2,partly-cloudy-day,"366,009,999,903,672,000,000,000,000,000,000,000,000,000,000,000,000,000",Partly cloudy throughout the day.
Heathrow Airport,07/07/2000,17.3,13.6,15.4,17.3,13.6,15.4,9.9,70.68,0.71,,8.33,,,,,18.4,132.1,1018.6,75.1,30.6,,,0,,2000-07-07T04:54:07,2000-07-07T21:18:51,0.2,Rain,1,rain,"366,009,999,903,672,000,000,000,000,000,000,000,000,000,000,000,000,000",Partly cloudy throughout the day with rain.
Heathrow Airport,08/07/2000,17.8,11.6,14.6,17.8,11.6,14.5,9.9,73.84,0.79,,8.33,,,,,20.5,258.4,1017.1,87,29.1,,,0,,2000-07-08T04:55:04,2000-07-08T21:18:11,0.25,Rain,1,rain,"366,009,999,903,672,000,000,000,000,000,000,000,000,000,000,000,000,000",Partly cloudy throughout the day with rain in the morning and afternoon.
Heathrow Airport,09/07/2000,18.3,13.8,15.5,18.3,13.8,15.5,12.7,83.75,9.56,,16.67,,,,,22.3,233.7,999,95.4,27.1,,,0,,2000-07-09T04:56:03,2000-07-09T21:17:28,0.3,Rain,1,rain,"366,009,999,903,672,000,000,000,000,000,000,000,000,000,000,000,000,000",Cloudy skies throughout the day with rain.
Heathrow Airport,10/07/2000,15.2,12.1,13.3,15.2,12.1,13.3,10.8,85.23,10.41,,12.5,,,,,22.4,274.6,993.1,91.7,32.4,,,0,,2000-07-10T04:57:04,2000-07-10T21:16:42,0.35,Rain,1,rain,"366,009,999,903,672,000,000,000,000,000,000,000,000,000,000,000,000,000",Cloudy skies throughout the day with rain.
Heathrow Airport,11/07/2000,15.3,9.8,12.8,15.3,8.6,12.7,6.8,68.02,0.8,,8.33,,,,,18.4,303.4,1006.1,67.6,38.8,,,0,,2000-07-11T04:58:07,2000-07-11T21:15:54,0.39,Rain,1,rain,"366,009,999,903,672,000,000,000,000,000,000,000,000,000,000,000,000,000",Partly cloudy throughout the day with rain.
Heathrow Airport,12/07/2000,18.5,7.8,13.5,18.5,7,13.4,9.1,75.58,0.7,,4.17,,,,,20.5,243.3,1014.6,86.3,33.2,,,0,,2000-07-12T04:59:12,2000-07-12T21:15:02,0.43,Rain,1,rain,"366,009,999,903,672,000,000,000,000,000,000,000,000,000,000,000,000,000",Partly cloudy throughout the day with late afternoon rain.
Heathrow Airport,13/07/2000,20.6,14,16.1,20.6,14,16.1,12.9,82.47,4.01,,12.5,,,,,20.6,260.4,1011.4,93.8,24.5,,,0,,2000-07-13T05:00:19,2000-07-13T21:14:08,0.46,Rain,1,rain,"366,009,999,903,672,000,000,000,000,000,000,000,000,000,000,000,000,000",Cloudy skies throughout the day with a chance of rain throughout the day.
Heathrow Airport,14/07/2000,16.5,13.1,14.5,16.5,13.1,14.5,9.6,73.02,3.7,,8.33,,,,,24.2,295,1011.8,85.9,40.4,,,0,,2000-07-14T05:01:28,2000-07-14T21:13:11,0.48,Rain,1,rain,"366,009,999,903,672,000,000,000,000,000,000,000,000,000,000,000,000,000",Partly cloudy throughout the day with rain in the morning and afternoon.
Heathrow Airport,15/07/2000,18.1,9.4,14,18.1,8.4,13.9,7.9,68.15,0.7,,9.09,,,,,25.9,289.5,1015.6,59.8,38,,,0,,2000-07-15T05:02:38,2000-07-15T21:12:12,0.49,Rain,1,rain,"366,009,999,903,672,000,000,000,000,000,000,000,000,000,000,000,000,000",Partly cloudy throughout the day with rain.
Heathrow Airport,16/07/2000,17.8,10.1,13.8,17.8,10.1,13.8,6,60.82,0,,0,,,,,18.4,272.6,1019.5,77,40.1,,,0,,2000-07-16T05:03:50,2000-07-16T21:11:10,0.5,Partially cloudy,2,partly-cloudy-day,"366,009,999,903,672,000,000,000,000,000,000,000,000,000,000,000,000,000",Partly cloudy throughout the day.
Heathrow Airport,17/07/2000,22,9.8,16.4,22,9.8,16.4,7.1,57.14,0,,0,,,,,9.4,242,1019.9,56.9,19.5,,,0,,2000-07-17T05:05:04,2000-07-17T21:10:05,0.51,Partially cloudy,2,partly-cloudy-day,"366,009,999,903,672,000,000,000,000,000,000,000,000,000,000,000,000,000",Partly cloudy throughout the day.
Heathrow Airport,18/07/2000,24.5,10.8,18,24.5,10.8,18,10.2,63.39,0,,0,,,,,20.4,236,1020.6,45.6,18.4,,,0,,2000-07-18T05:06:19,2000-07-18T21:08:58,0.52,Partially cloudy,2,partly-cloudy-day,"366,009,999,903,672,000,000,000,000,000,000,000,000,000,000,000,000,000",Partly cloudy throughout the day.
Heathrow Airport,19/07/2000,25.1,13,19.2,25.1,13,19.1,10.9,61.75,0,,0,,,,,18.4,264.9,1021,22.8,19.7,,,0,,2000-07-19T05:07:35,2000-07-19T21:07:48,0.54,Partially cloudy,2,partly-cloudy-day,"366,009,999,903,672,000,000,000,000,000,000,000,000,000,000,000,000,000",Partly cloudy throughout the day.
Heathrow Airport,20/07/2000,24.5,15.1,20.3,24.5,15.1,20.3,11.1,56.89,0,,0,,,,,11.2,262.4,1022.8,46.4,29.8,,,0,,2000-07-20T05:08:53,2000-07-20T21:06:36,0.57,Partially cloudy,2,partly-cloudy-day,"366,009,999,903,672,000,000,000,000,000,000,000,000,000,000,000,000,000",Partly cloudy throughout the day.
Heathrow Airport,21/07/2000,25.6,14.5,19.7,25.6,14.5,19.7,12.6,65.45,0,,0,,,,,22.3,150.7,1025.1,12,19.7,,,0,,2000-07-21T05:10:12,2000-07-21T21:05:21,0.61,Clear,0,clear-day,"366,009,999,903,672,000,000,000,000,000,000,000,000,000,000,000,000,000",Clear conditions throughout the day.
Heathrow Airport,22/07/2000,21.5,13,16.6,21.5,13,16.6,10.7,68.97,0,,0,,,,,22.3,45,1022.3,65.5,21.6,,,0,,2000-07-22T05:11:33,2000-07-22T21:04:04,0.65,Partially cloudy,2,partly-cloudy-day,"3,660,099,999,036,720,000,000,000,000,000,000,000,000,000",Partly cloudy throughout the day.
Heathrow Airport,23/07/2000,18.6,12.8,15.8,18.6,12.8,15.7,11.5,76.31,1.4,,8.33,,,,,22.3,46.3,1016.2,95.1,20.5,,,0,,2000-07-23T05:12:55,2000-07-23T21:02:45,0.7,Rain,1,rain,"36,600,999,990,367,200,000,000,000,000,000",Cloudy skies throughout the day with rain in the morning and afternoon.
Heathrow Airport,24/07/2000,16.8,13,14.6,16.8,13,14.5,10.9,78.94,1.4,,8.33,,,,,18.4,65,1010.4,97.5,22.4,,,0,,2000-07-24T05:14:17,2000-07-24T21:01:23,0.76,Rain,1,rain,"366,009,999,903,672,000,000,000,000,000,000,000,000,000,000,000,000,000",Cloudy skies throughout the day with rain in the morning and afternoon.
Heathrow Airport,25/07/2000,18.6,12.8,15.7,18.6,12.8,15.6,9.9,69.71,0.69,,8.33,,,,,7.5,254.3,1008.3,91.3,22.3,,,0,,2000-07-25T05:15:41,2000-07-25T21:00:00,0.81,Rain,1,rain,"366,009,999,903,672,000,000,000,000,000,000,000,000,000,000,000,000,000",Cloudy skies throughout the day with early morning rain.
Heathrow Airport,26/07/2000,22.8,14,18.4,22.8,14,18.3,10.8,63.32,0,,0,,,,,14.7,216.7,1009.9,74.2,13.8,,,0,,2000-07-26T05:17:06,2000-07-26T20:58:34,0.86,Partially cloudy,2,partly-cloudy-day,"366,009,999,903,672,000,000,000,000,000,000,000,000,000,000,000,000,000",Partly cloudy throughout the day.
Heathrow Airport,27/07/2000,23.8,15.3,19.1,23.8,15.3,19.1,11.4,62.39,0,,0,,,,,16.5,207.5,1012.9,75.5,15.4,,,0,,2000-07-27T05:18:32,2000-07-27T20:57:06,0.91,Partially cloudy,2,partly-cloudy-day,"366,009,999,903,672,000,000,000,000,000,000,000,000,000,000,000,000,000",Partly cloudy throughout the day.
Heathrow Airport,28/07/2000,20.6,14.5,17.4,20.6,14.5,17.4,13.9,80.55,5.78,,16.67,,,,,16.5,228.3,1013.9,83.4,13.2,,,0,,2000-07-28T05:19:59,2000-07-28T20:55:36,0.96,Rain,1,rain,"366,009,999,903,672,000,000,000,000,000,000,000,000,000,000,000,000,000",Partly cloudy throughout the day with a chance of rain throughout the day.
Heathrow Airport,29/07/2000,24.4,13.4,18.4,24.4,13.4,18.4,12.8,73.01,0.8,,4.17,,,,,20.5,253.3,1016.8,62.9,24.3,,,0,,2000-07-29T05:21:26,2000-07-29T20:54:04,0.99,Rain,1,rain,"366,009,999,903,672,000,000,000,000,000,000,000,000,000,000,000,000,000",Partly cloudy throughout the day with early morning rain.
Heathrow Airport,30/07/2000,23.9,14,19.2,23.9,14,19.2,13.1,70.14,0.1,,4.17,,,,,13,239.3,1021.7,51.5,28.6,,,0,,2000-07-30T05:22:55,2000-07-30T20:52:30,1,Rain,1,rain,"36,600,999,990,367,200,000,000,000,000,000",Partly cloudy throughout the day with early morning rain.
Heathrow Airport,31/07/2000,24.6,16.1,20.5,24.6,16.1,20.5,12.3,60.64,0,,0,,,,,22.3,212.5,1021.7,71.8,42.8,,,0,,2000-07-31T05:24:24,2000-07-31T20:50:54,0,Partially cloudy,2,partly-cloudy-day,"366,009,999,903,672,000,000,000,000,000,000,000,000,000,000,000,000,000",Partly cloudy throughout the day.
Heathrow Airport,01/08/2000,23.8,14.1,19.2,23.8,14.1,19.2,12.5,66.72,0,,0,,,,,22.3,218,1017.2,59.8,38.7,,,0,,2000-08-01T05:25:53,2000-08-01T20:49:17,0.01,Partially cloudy,2,partly-cloudy-day,"366,009,999,903,672,000,000,000,000,000,000,000,000,000,000,000,000,000",Partly cloudy throughout the day.
Heathrow Airport,02/08/2000,22.6,13.3,17.3,22.6,13.3,17.2,12.8,76.13,3.01,,8.33,,,,,31.3,208.8,1014,52.3,28.8,,,0,,2000-08-02T05:27:24,2000-08-02T20:47:37,0.04,Rain,1,rain,"366,009,999,903,672,000,000,000,000,000,000,000,000,000,000,000,000,000",Partly cloudy throughout the day with rain.
Heathrow Airport,03/08/2000,19,14.8,16.2,19,14.8,16.1,13.4,83.72,6.18,,16.67,,,,,18.3,250.5,1014.2,84.7,18.7,,,0,,2000-08-03T05:28:55,2000-08-03T20:45:56,0.08,Rain,1,rain,"366,009,999,903,672,000,000,000,000,000,000,000,000,000,000,000,000,000",Partly cloudy throughout the day with rain.
Heathrow Airport,04/08/2000,22.1,14.6,17.6,22.1,14.6,17.6,12,71.53,0.5,,12.5,,,,,14.8,320.5,1022.6,74.2,17.4,,,0,,2000-08-04T05:30:26,2000-08-04T20:44:13,0.12,Rain,1,rain,"366,009,999,903,672,000,000,000,000,000,000,000,000,000,000,000,000,000",Partly cloudy throughout the day with early morning rain.
Heathrow Airport,05/08/2000,24.1,12.6,18.2,24.1,12.6,18.2,11.5,67.3,0,,0,,,,,12.9,284.6,1024.9,59.7,26.6,,,0,,2000-08-05T05:31:58,2000-08-05T20:42:28,0.17,Partially cloudy,2,partly-cloudy-day,"3,660,099,999,036,720,000,000,000,000,000,000,000,000,000",Partly cloudy throughout the day.
Heathrow Airport,06/08/2000,24.2,16,20.3,24.2,16,20.2,14.8,71.67,0.7,,8.33,,,,,18.4,302.5,1024.5,64.7,39.9,,,0,,2000-08-06T05:33:31,2000-08-06T20:40:42,0.22,Rain,1,rain,"3,660,099,999,036,720,000,000,000,000,000,000,000,000,000",Partly cloudy throughout the day with rain in the morning and afternoon.
Heathrow Airport,07/08/2000,22.3,17.5,20,22.3,17.5,20,15.2,73.98,0.7,,8.33,,,,,14.7,305,1024.3,86.4,36.2,,,0,,2000-08-07T05:35:03,2000-08-07T20:38:55,0.27,Rain,1,rain,"366,009,999,903,672,000,000,000,000,000,000,000,000,000,000,000,000,000",Partly cloudy throughout the day with rain in the morning and afternoon.
Heathrow Airport,08/08/2000,22.3,16.3,19.3,22.3,16.3,19.3,15.2,77.91,6.74,,12.5,,,,,13,246.3,1021.3,76.8,26.5,,,0,,2000-08-08T05:36:36,2000-08-08T20:37:05,0.32,Rain,1,rain,"366,009,999,903,672,000,000,000,000,000,000,000,000,000,000,000,000,000",Partly cloudy throughout the day with rain.
Heathrow Airport,09/08/2000,22.9,14.6,18.5,22.9,14.6,18.5,14.6,79.03,0,,8.33,,,,,24.1,200.4,1018.8,71.8,28.9,,,0,,2000-08-09T05:38:10,2000-08-09T20:35:15,0.37,Partially cloudy,2,partly-cloudy-day,"366,009,999,903,672,000,000,000,000,000,000,000,000,000,000,000,000,000",Partly cloudy throughout the day.
Heathrow Airport,10/08/2000,25,17.1,20,25,17.1,19.9,14,69.99,0.69,,4.17,,,,,16.6,249.5,1016,71.1,34.9,,,0,,2000-08-10T05:39:44,2000-08-10T20:33:22,0.41,Rain,1,rain,"366,009,999,903,672,000,000,000,000,000,000,000,000,000,000,000,000,000",Partly cloudy throughout the day with afternoon rain.
Heathrow Airport,11/08/2000,24.7,15.3,19.8,24.7,15.3,19.8,12.3,64.55,0,,0,,,,,9.3,238.1,1015.7,63.2,24.2,,,0,,2000-08-11T05:41:18,2000-08-11T20:31:29,0.44,Partially cloudy,2,partly-cloudy-day,"366,009,999,903,672,000,000,000,000,000,000,000,000,000,000,000,000,000",Partly cloudy throughout the day.
Heathrow Airport,12/08/2000,26.7,12.6,20.1,26.7,12.6,20.1,12.6,64.89,0,,0,,,,,18.4,200.2,1013.9,29.8,26.8,,,0,,2000-08-12T05:42:52,2000-08-12T20:29:34,0.47,Partially cloudy,2,partly-cloudy-day,"3,660,099,999,036,720,000,000,000,000,000,000,000,000,000",Partly cloudy throughout the day.
Heathrow Airport,13/08/2000,23.3,15.1,18.8,23.3,15.1,18.8,14.7,77.86,0.7,,8.33,,,,,20.5,192.5,1015.2,90.9,25.8,,,0,,2000-08-13T05:44:27,2000-08-13T20:27:38,0.49,Rain,1,rain,"36,600,999,990,367,200,000,000,000,000,000",Cloudy skies throughout the day with afternoon rain.
Heathrow Airport,14/08/2000,22.8,17.8,19.8,22.8,17.8,19.7,16.1,80,1.8,,12.5,,,,,29.5,199.1,1015.4,78,23,,,0,,2000-08-14T05:46:01,2000-08-14T20:25:40,0.5,Rain,1,rain,"366,009,999,903,672,000,000,000,000,000,000,000,000,000,000,000,000,000",Partly cloudy throughout the day with rain.
Heathrow Airport,15/08/2000,23.3,14.4,18.5,23.3,14.4,18.4,11.5,66.97,0.01,,4.17,,,,,24.1,236.6,1018.7,60.2,36.2,,,0,,2000-08-15T05:47:36,2000-08-15T20:23:42,0.5,Rain,1,rain,"366,009,999,903,672,000,000,000,000,000,000,000,000,000,000,000,000,000",Partly cloudy throughout the day with morning rain.
Heathrow Airport,16/08/2000,23,14.8,18.4,23,14.8,18.4,12.4,69.83,1.44,,16.67,,,,,24.1,213,1013.8,71.9,37.7,,,0,,2000-08-16T05:49:11,2000-08-16T20:21:42,0.51,Rain,1,rain,"366,009,999,903,672,000,000,000,000,000,000,000,000,000,000,000,000,000",Partly cloudy throughout the day with rain.
Heathrow Airport,17/08/2000,22.3,14.2,17.2,22.3,14.2,17.2,11.5,71.41,0.78,,12.5,,,,,20.6,216.4,1011.5,65,35.2,,,0,,2000-08-17T05:50:47,2000-08-17T20:19:41,0.53,Rain,1,rain,"366,009,999,903,672,000,000,000,000,000,000,000,000,000,000,000,000,000",Becoming cloudy in the afternoon with rain in the morning and afternoon.
Heathrow Airport,18/08/2000,19.6,13.8,16.7,19.6,13.8,16.7,12.9,79.34,1.5,,16.67,,,,,16.6,183.3,1011.7,78.5,25.3,,,0,,2000-08-18T05:52:22,2000-08-18T20:17:39,0.55,Rain,1,rain,"366,009,999,903,672,000,000,000,000,000,000,000,000,000,000,000,000,000",Partly cloudy throughout the day with rain.
Heathrow Airport,19/08/2000,22.6,14.1,18.3,22.6,14.1,18.3,10.9,66.23,1.2,,12.5,,,,,22.3,220.8,1010.2,71.2,37.5,,,0,,2000-08-19T05:53:57,2000-08-19T20:15:36,0.59,Rain,1,rain,"366,009,999,903,672,000,000,000,000,000,000,000,000,000,000,000,000,000",Partly cloudy throughout the day with rain.
Heathrow Airport,20/08/2000,21.2,12.5,17.4,21.2,12.5,17.4,9,59.55,0,,0,,,,,12.9,237.4,1012.9,71.2,32.9,,,0,,2000-08-20T05:55:33,2000-08-20T20:13:32,0.63,Partially cloudy,2,partly-cloudy-day,"366,009,999,903,672,000,000,000,000,000,000,000,000,000,000,000,000,000",Partly cloudy throughout the day.
Heathrow Airport,21/08/2000,21.6,10.3,16,21.6,10.3,16,8.3,63.34,0,,8.33,,,,,20.5,246.8,1014.2,28.8,26.1,,,0,,2000-08-21T05:57:08,2000-08-21T20:11:27,0.68,Partially cloudy,2,partly-cloudy-day,"366,009,999,903,672,000,000,000,000,000,000,000,000,000,000,000,000,000",Partly cloudy throughout the day.
Heathrow Airport,22/08/2000,22.5,11.1,16.7,22.5,11.1,16.7,9.7,66.06,0,,4.17,,,,,18.3,162.1,1019.1,68.5,37.8,,,0,,2000-08-22T05:58:44,2000-08-22T20:09:21,0.74,Partially cloudy,2,partly-cloudy-day,"366,009,999,903,672,000,000,000,000,000,000,000,000,000,000,000,000,000",Partly cloudy throughout the day.
Heathrow Airport,23/08/2000,23.1,13.3,18.2,23.1,13.3,18.2,10.2,62.16,0,,0,,,,,29.5,56.3,1023.1,13.7,25.7,,,0,,2000-08-23T06:00:19,2000-08-23T20:07:15,0.79,Clear,0,clear-day,"366,009,999,903,672,000,000,000,000,000,000,000,000,000,000,000,000,000",Clear conditions throughout the day.
Heathrow Airport,24/08/2000,27,12.8,19.7,26.7,12.8,19.7,10.9,61.52,0,,4.17,,,,,22.2,60.8,1023.4,8.3,12.4,,,0,,2000-08-24T06:01:55,2000-08-24T20:05:07,0.85,Clear,0,clear-day,"366,009,999,903,672,000,000,000,000,000,000,000,000,000,000,000,000,000",Clear conditions throughout the day.
Heathrow Airport,25/08/2000,25.3,15.1,20.1,25.3,15.1,20.1,11.3,59.59,0,,0,,,,,33.4,72.5,1019.2,38.7,22.6,,,0,,2000-08-25T06:03:30,2000-08-25T20:02:58,0.9,Partially cloudy,2,wind,"366,009,999,903,672,000,000,000,000,000,000,000,000,000,000,000,000,000",Partly cloudy throughout the day.
Heathrow Airport,26/08/2000,20.3,17.1,18.7,20.3,17.1,18.7,15.9,84.14,3.99,,12.5,,,,,25.9,174.5,1009.9,83.3,7.4,,,0,,2000-08-26T06:05:06,2000-08-26T20:00:49,0.94,Rain,1,rain,"366,009,999,903,672,000,000,000,000,000,000,000,000,000,000,000,000,000",Partly cloudy throughout the day with rain.
Heathrow Airport,27/08/2000,21.2,13.6,16.3,21.2,13.6,16.3,12.6,80.36,4.08,,8.33,,,,,22.3,223.4,1014.4,63.9,15.9,,,0,,2000-08-27T06:06:41,2000-08-27T19:58:39,0.98,Rain,1,rain,"3,660,099,999,036,720,000,000,000,000,000,000,000,000,000",Partly cloudy throughout the day with late afternoon rain.
Heathrow Airport,28/08/2000,19.3,12,15.9,19.3,12,15.9,10.9,73.17,1.69,,12.5,,,,,18.3,229.1,1017.7,68.9,34.9,,,0,,2000-08-28T06:08:17,2000-08-28T19:56:29,1,Rain,1,rain,"3,660,099,999,036,720,000,000,000,000,000,000,000,000,000",Partly cloudy throughout the day with rain.
Heathrow Airport,29/08/2000,21.3,10.8,16.2,21.3,10.8,16.2,9.7,67.93,0,,0,,,,,11.1,233,1019.6,64.3,27.4,,,0,,2000-08-29T06:09:53,2000-08-29T19:54:17,0,Partially cloudy,2,partly-cloudy-day,"366,009,999,903,672,000,000,000,000,000,000,000,000,000,000,000,000,000",Partly cloudy throughout the day.
Heathrow Airport,30/08/2000,21.6,13.1,16.8,21.6,13.1,16.8,9.3,63.93,0,,0,,,,,20.4,64.2,1019.2,58.1,30.6,,,0,,2000-08-30T06:11:28,2000-08-30T19:52:05,0.01,Partially cloudy,2,partly-cloudy-day,"366,009,999,903,672,000,000,000,000,000,000,000,000,000,000,000,000,000",Clearing in the afternoon.
Heathrow Airport,31/08/2000,21.4,10.8,15.9,21.4,10.8,15.9,10.5,72.79,0.7,,8.33,,,,,25.8,164.8,1011.3,66.5,20.6,,,0,,2000-08-31T06:13:04,2000-08-31T19:49:53,0.03,Rain,1,rain,"366,009,999,903,672,000,000,000,000,000,000,000,000,000,000,000,000,000",Partly cloudy throughout the day with late afternoon rain.
Heathrow Airport,01/09/2000,17.6,13.1,15,17.6,13.1,14.9,12.4,84.93,7.09,,12.5,,,,,20.5,220.4,1001.4,76.9,19.7,,,0,,2000-09-01T06:14:39,2000-09-01T19:47:39,0.06,Rain,1,rain,"366,009,999,903,672,000,000,000,000,000,000,000,000,000,000,000,000,000",Partly cloudy throughout the day with rain.
Heathrow Airport,02/09/2000,19.5,12.1,15.3,19.5,12.1,15.3,11.3,78.12,1.53,,12.5,,,,,18.4,300.8,1007,74.2,21.4,,,0,,2000-09-02T06:16:15,2000-09-02T19:45:26,0.1,Rain,1,rain,"366,009,999,903,672,000,000,000,000,000,000,000,000,000,000,000,000,000",Partly cloudy throughout the day with rain.
Heathrow Airport,03/09/2000,17.6,9.6,14,17.6,8.3,13.8,6.8,64.36,0,,4.17,,,,,16.6,298.3,1019.4,47.3,34.9,,,0,,2000-09-03T06:17:50,2000-09-03T19:43:11,0.14,Partially cloudy,2,partly-cloudy-day,"366,009,999,903,672,000,000,000,000,000,000,000,000,000,000,000,000,000",Partly cloudy throughout the day.
Heathrow Airport,04/09/2000,20.3,7.3,13.9,20.3,7.3,13.9,7.3,67.62,0,,4.17,,,,,12.9,262.5,1023.7,49.5,28,,,0,,2000-09-04T06:19:25,2000-09-04T19:40:57,0.19,Partially cloudy,2,partly-cloudy-day,"366,009,999,903,672,000,000,000,000,000,000,000,000,000,000,000,000,000",Partly cloudy throughout the day.
Heathrow Airport,05/09/2000,20.1,10.7,15.3,20.1,10.7,15.3,11.5,78.98,0.7,,8.33,,,,,22.3,199,1020.6,80.1,23.2,,,0,,2000-09-05T06:21:01,2000-09-05T19:38:41,0.24,Rain,1,rain,"366,009,999,903,672,000,000,000,000,000,000,000,000,000,000,000,000,000",Partly cloudy throughout the day with rain.
Heathrow Airport,06/09/2000,20.6,13.8,16.6,20.6,13.8,16.5,10.5,70.22,0.9,,12.5,,,,,25.9,243.8,1011.4,82.6,33.3,,,0,,2000-09-06T06:22:36,2000-09-06T19:36:26,0.28,Rain,1,rain,"366,009,999,903,672,000,000,000,000,000,000,000,000,000,000,000,000,000",Partly cloudy throughout the day with rain.
Heathrow Airport,07/09/2000,18.8,8.8,15,18.8,7.4,14.8,10.6,75.39,0.7,,4.17,,,,,24.1,217,1015.2,84.3,28.2,,,0,,2000-09-07T06:24:12,2000-09-07T19:34:10,0.34,Rain,1,rain,"366,009,999,903,672,000,000,000,000,000,000,000,000,000,000,000,000,000",Partly cloudy throughout the day with afternoon rain.
Heathrow Airport,08/09/2000,20.1,16.4,18.3,20.1,16.4,18.3,16.6,89.96,3,,12.5,,,,,18.3,249.3,1017.8,91.7,14.4,,,0,,2000-09-08T06:25:47,2000-09-08T19:31:53,0.38,Rain,1,rain,"366,009,999,903,672,000,000,000,000,000,000,000,000,000,000,000,000,000",Cloudy skies throughout the day with rain.
Heathrow Airport,09/09/2000,21.3,15.6,18.4,21.3,15.6,18.4,15.7,84.62,0.91,,12.5,,,,,11.2,243.5,1022.8,92.5,11.8,,,0,,2000-09-09T06:27:23,2000-09-09T19:29:37,0.42,Rain,1,rain,"366,009,999,903,672,000,000,000,000,000,000,000,000,000,000,000,000,000",Cloudy skies throughout the day with rain.
Heathrow Airport,10/09/2000,25.4,15.1,20.4,25.4,15.1,20.4,15.6,75.95,0,,4.17,,,,,9.3,188.4,1022.1,41.1,18,,,0,,2000-09-10T06:28:58,2000-09-10T19:27:20,0.45,Partially cloudy,2,partly-cloudy-day,"366,009,999,903,672,000,000,000,000,000,000,000,000,000,000,000,000,000",Partly cloudy throughout the day.
Heathrow Airport,11/09/2000,27,15.8,21.5,27.5,15.8,21.5,15.5,70.02,0,,0,,,,,20.5,125.5,1014.8,44.1,18.6,,,0,,2000-09-11T06:30:34,2000-09-11T19:25:02,0.47,Partially cloudy,2,partly-cloudy-day,"366,009,999,903,672,000,000,000,000,000,000,000,000,000,000,000,000,000",Becoming cloudy in the afternoon.
Heathrow Airport,12/09/2000,23.1,16.1,19.1,23.1,16.1,19,12.8,68.4,0,,0,,,,,18.4,253.3,1010.9,66.4,25.8,,,0,,2000-09-12T06:32:09,2000-09-12T19:22:45,0.49,Partially cloudy,2,partly-cloudy-day,"366,009,999,903,672,000,000,000,000,000,000,000,000,000,000,000,000,000",Partly cloudy throughout the day.
Heathrow Airport,13/09/2000,20.5,13.3,17,20.5,13.3,17,12.2,74.87,0,,0,,,,,16.5,238.8,1013.4,80.2,22.8,,,0,,2000-09-13T06:33:45,2000-09-13T19:20:27,0.5,Partially cloudy,2,partly-cloudy-day,"366,009,999,903,672,000,000,000,000,000,000,000,000,000,000,000,000,000",Partly cloudy throughout the day.
Heathrow Airport,14/09/2000,21.1,11.7,16.8,21.1,11.7,16.7,12.6,77.53,0.01,,8.33,,,,,20.5,194,1013.7,83,28.9,,,0,,2000-09-14T06:35:20,2000-09-14T19:18:09,0.51,Rain,1,rain,"366,009,999,903,672,000,000,000,000,000,000,000,000,000,000,000,000,000",Partly cloudy throughout the day with rain.
Heathrow Airport,15/09/2000,17.6,14.1,16.3,17.6,14.1,16.3,14.7,90.15,25.53,,16.67,,,,,16.6,210.7,1007.1,90,10.3,,,0,,2000-09-15T06:36:56,2000-09-15T19:15:51,0.52,Rain,1,rain,"366,009,999,903,672,000,000,000,000,000,000,000,000,000,000,000,000,000",Partly cloudy throughout the day with rain.
Heathrow Airport,16/09/2000,18,13.3,15.3,18,13.3,15.2,10.2,72.26,5.77,,8.33,,,,,25.9,288.8,1011,90.4,34.5,,,0,,2000-09-16T06:38:32,2000-09-16T19:13:33,0.54,Rain,1,rain,"366,009,999,903,672,000,000,000,000,000,000,000,000,000,000,000,000,000",Cloudy skies throughout the day with rain.
Heathrow Airport,17/09/2000,20,12.1,15.4,20,12.1,15.4,11.5,77.89,0.01,,8.33,,,,,22.3,217.9,1011.5,81.3,34.8,,,0,,2000-09-17T06:40:07,2000-09-17T19:11:15,0.57,Rain,1,rain,"366,009,999,903,672,000,000,000,000,000,000,000,000,000,000,000,000,000",Partly cloudy throughout the day with afternoon rain.
Heathrow Airport,18/09/2000,15.8,12.5,14.4,15.8,12.5,14.3,12.1,86.43,7.09,,12.5,,,,,31.2,182.1,1001.8,93.3,19.1,,,0,,2000-09-18T06:41:43,2000-09-18T19:08:56,0.62,Rain,1,rain,"366,009,999,903,672,000,000,000,000,000,000,000,000,000,000,000,000,000",Cloudy skies throughout the day with rain.
Heathrow Airport,19/09/2000,15.3,12.1,13.6,15.3,12.1,13.6,12.7,94.28,18,,16.67,,,,,22.3,137.5,996.6,99.6,6.1,,,0,,2000-09-19T06:43:19,2000-09-19T19:06:38,0.67,Rain,1,rain,"366,009,999,903,672,000,000,000,000,000,000,000,000,000,000,000,000,000",Cloudy skies throughout the day with a chance of rain throughout the day.
Heathrow Airport,20/09/2000,16.1,10.8,13.5,16.1,10.8,13.5,10.2,81.38,5.18,,8.33,,,,,18.4,170.8,1001.8,61,26.6,,,0,,2000-09-20T06:44:55,2000-09-20T19:04:20,0.72,Rain,1,rain,"366,009,999,903,672,000,000,000,000,000,000,000,000,000,000,000,000,000",Partly cloudy throughout the day with rain.
Heathrow Airport,21/09/2000,17.3,8,13.3,17.3,8,13.3,10.8,85.48,0.71,,16.67,,,,,29.5,147.9,1012.4,54.6,27.1,,,0,,2000-09-21T06:46:32,2000-09-21T19:02:01,0.78,Rain,1,rain,"366,009,999,903,672,000,000,000,000,000,000,000,000,000,000,000,000,000",Partly cloudy throughout the day with rain.
Heathrow Airport,22/09/2000,21.5,14.8,18.1,21.5,14.8,18.1,13,74.06,0.8,,12.5,,,,,24.1,188.8,1017.2,85.1,25.8,,,0,,2000-09-22T06:48:08,2000-09-22T18:59:43,0.84,Rain,1,rain,"366,009,999,903,672,000,000,000,000,000,000,000,000,000,000,000,000,000",Partly cloudy throughout the day with rain in the morning and afternoon.
Heathrow Airport,23/09/2000,24.5,14.2,19,24.5,14.2,19,13.9,74.17,0.69,,8.33,,,,,31.3,122.5,1017.9,48.9,23.9,,,0,,2000-09-23T06:49:44,2000-09-23T18:57:25,0.89,Rain,1,rain,"366,009,999,903,672,000,000,000,000,000,000,000,000,000,000,000,000,000",Partly cloudy throughout the day with early morning rain.
Heathrow Airport,24/09/2000,16.7,13.1,14.9,16.7,13.1,14.9,12.7,86.7,10.87,,8.33,,,,,16.5,156.3,1014,58.2,18.2,,,0,,2000-09-24T06:51:21,2000-09-24T18:55:07,0.93,Rain,1,rain,"3,660,099,999,036,720,000,000,000,000,000,000,000,000,000",Partly cloudy throughout the day with rain.
Heathrow Airport,25/09/2000,17.7,10.6,13.5,17.7,10.6,13.4,10.9,85.1,5.09,,12.5,,,,,20.5,179.6,1018.8,60.6,28.1,,,0,,2000-09-25T06:52:58,2000-09-25T18:52:49,0.97,Rain,1,rain,"366,009,999,903,672,000,000,000,000,000,000,000,000,000,000,000,000,000",Partly cloudy throughout the day with late afternoon rain.
Heathrow Airport,26/09/2000,20.1,14.6,17.3,20.1,14.6,17.2,14.6,84.56,2.5,,8.7,,,,,24.1,178.3,1014,74.1,16.4,,,0,,2000-09-26T06:54:35,2000-09-26T18:50:31,0.99,Rain,1,rain,"366,009,999,903,672,000,000,000,000,000,000,000,000,000,000,000,000,000",Partly cloudy throughout the day with rain.
Heathrow Airport,27/09/2000,17.7,11.8,14.6,17.7,11.8,14.6,11,79.74,0.8,,8.33,,,,,35.2,196.3,1010.2,59.8,25.3,,,0,,2000-09-27T06:56:12,2000-09-27T18:48:13,1,Rain,1,rain,"366,009,999,903,672,000,000,000,000,000,000,000,000,000,000,000,000,000",Partly cloudy throughout the day with late afternoon rain.
Heathrow Airport,28/09/2000,18.3,12.1,15.1,18.3,12.1,15,11.2,79.03,5.99,,12.5,,,,,29.5,186.3,998.6,74.3,26.9,,,0,,2000-09-28T06:57:49,2000-09-28T18:45:56,0,Rain,1,rain,"366,009,999,903,672,000,000,000,000,000,000,000,000,000,000,000,000,000",Partly cloudy throughout the day with rain.
Heathrow Airport,29/09/2000,18.3,12,15.2,18.3,12,15.2,11.7,80.53,1.2,,8.33,,,,,27.6,132.1,998.4,86.7,21.4,,,0,,2000-09-29T06:59:27,2000-09-29T18:43:39,0.02,Rain,1,rain,"366,009,999,903,672,000,000,000,000,000,000,000,000,000,000,000,000,000",Partly cloudy throughout the day with rain.
Heathrow Airport,30/09/2000,17.6,11.8,14.7,17.6,11.8,14.7,12,84.58,5.14,,12.5,,,,,20.4,143.8,1003.7,55.5,24.4,,,0,,2000-09-30T07:01:04,2000-09-30T18:41:22,0.04,Rain,1,rain,"366,009,999,903,672,000,000,000,000,000,000,000,000,000,000,000,000,000",Partly cloudy throughout the day with rain.
Heathrow Airport,01/10/2000,18.3,8.1,12.9,18.3,8.1,12.9,10,84.2,0.8,,12.5,,,,,24.1,206,1004.7,63.2,19.2,,,0,,2000-10-01T07:02:42,2000-10-01T18:39:05,0.08,Rain,1,rain,"366,009,999,903,672,000,000,000,000,000,000,000,000,000,000,000,000,000",Partly cloudy throughout the day with rain.
Heathrow Airport,02/10/2000,14.9,9.3,12.5,14.9,7.7,12.4,8.4,77.43,9.99,,16.67,,,,,24.1,245.8,1006,80.5,32.1,,,0,,2000-10-02T07:04:21,2000-10-02T18:36:49,0.12,Rain,1,rain,"366,009,999,903,672,000,000,000,000,000,000,000,000,000,000,000,000,000",Partly cloudy throughout the day with a chance of rain throughout the day.
Heathrow Airport,03/10/2000,16.3,8.8,13.4,16.3,8.3,13.2,10.7,84.06,0.7,,12.5,,,,,25.9,182.9,1016.9,94.6,15.7,,,0,,2000-10-03T07:05:59,2000-10-03T18:34:33,0.16,Rain,1,rain,"366,009,999,903,672,000,000,000,000,000,000,000,000,000,000,000,000,000",Cloudy skies throughout the day with afternoon rain.
Heathrow Airport,04/10/2000,16.1,12.6,13.9,16.1,12.6,13.8,7.9,67.73,0.8,,4.17,,,,,24.1,225.4,1017.7,90,28.8,,,0,,2000-10-04T07:07:38,2000-10-04T18:32:18,0.21,Rain,1,rain,"366,009,999,903,672,000,000,000,000,000,000,000,000,000,000,000,000,000",Partly cloudy throughout the day with early morning rain.
Heathrow Airport,05/10/2000,14.6,8.6,11.7,14.6,6.8,11.4,6.3,70.2,0.8,,12.5,,,,,24,237.9,1017,58.1,28.3,,,0,,2000-10-05T07:09:17,2000-10-05T18:30:03,0.25,Rain,1,rain,"366,009,999,903,672,000,000,000,000,000,000,000,000,000,000,000,000,000",Partly cloudy throughout the day with rain in the morning and afternoon.
Heathrow Airport,06/10/2000,14.5,5.6,10.4,14.5,4,9.7,5.1,71.33,0,,4.17,,,,,16.6,289.2,1025.6,41.5,41.6,,,0,,2000-10-06T07:10:56,2000-10-06T18:27:49,0.3,Partially cloudy,2,partly-cloudy-day,"366,009,999,903,672,000,000,000,000,000,000,000,000,000,000,000,000,000",Becoming cloudy in the afternoon.
Heathrow Airport,07/10/2000,13.1,9.1,10.8,13.1,7.8,10.2,9.2,90.13,10.65,,16.67,,,,,14.7,178.3,1021.1,99.1,15.5,,,0,,2000-10-07T07:12:36,2000-10-07T18:25:35,0.34,Rain,1,rain,"366,009,999,903,672,000,000,000,000,000,000,000,000,000,000,000,000,000",Cloudy skies throughout the day with a chance of rain throughout the day.
Heathrow Airport,08/10/2000,14.5,8,12.5,14.5,6.4,12.3,8.5,78.51,0.71,,8.33,,,,,14.7,257.9,1014.4,80.8,20.6,,,0,,2000-10-08T07:14:15,2000-10-08T18:23:21,0.39,Rain,1,rain,"3,660,099,999,036,720,000,000,000,000,000,000,000,000,000",Partly cloudy throughout the day with rain clearing later.
Heathrow Airport,09/10/2000,12.1,6,9.4,12.1,5.6,9.1,7.9,90.59,19.08,,12.5,,,,,35.2,191.3,1002.3,76.1,19.9,,,0,,2000-10-09T07:15:55,2000-10-09T18:21:08,0.42,Rain,1,rain,"3,660,099,999,036,720,000,000,000,000,000,000,000,000,000",Partly cloudy throughout the day with rain.
Heathrow Airport,10/10/2000,13,6.5,9.3,13,3.5,7.6,5.2,76.82,5.22,,8.33,,,,,27.8,215.4,983.9,79.7,33.9,,,0,,2000-10-10T07:17:36,2000-10-10T18:18:56,0.46,Rain,1,rain,"366,009,999,903,672,000,000,000,000,000,000,000,000,000,000,000,000,000",Partly cloudy throughout the day with rain.
Heathrow Airport,11/10/2000,13.8,6.6,9.7,13.8,2.7,8,6.1,79.52,9.02,,12.5,,,,,27.8,210,971.8,75.5,28.6,,,0,,2000-10-11T07:19:17,2000-10-11T18:16:45,0.48,Rain,1,rain,"366,009,999,903,672,000,000,000,000,000,000,000,000,000,000,000,000,000",Partly cloudy throughout the day with rain.
Heathrow Airport,12/10/2000,13.4,9.8,10.9,13.4,8.3,10.6,9.3,89.94,6.09,,12.5,,,,,11.2,200,987.5,76.3,22,,,0,,2000-10-12T07:20:58,2000-10-12T18:14:34,0.5,Rain,1,rain,"366,009,999,903,672,000,000,000,000,000,000,000,000,000,000,000,000,000",Partly cloudy throughout the day with rain.
Heathrow Airport,13/10/2000,15.8,6.3,10.9,15.8,6.3,10.9,8.4,85.54,0,,12.5,,,,,9.4,244.6,1007.1,63.9,13.8,,,0,,2000-10-13T07:22:39,2000-10-13T18:12:24,0.5,Partially cloudy,2,partly-cloudy-day,"366,009,999,903,672,000,000,000,000,000,000,000,000,000,000,000,000,000",Partly cloudy throughout the day.
Heathrow Airport,14/10/2000,13.6,8.3,11.2,13.6,7.5,11,8.7,84.94,1.39,,16.67,,,,,16.6,190.8,1015.3,90,23.8,,,0,,2000-10-14T07:24:20,2000-10-14T18:10:14,0.51,Rain,1,rain,"366,009,999,903,672,000,000,000,000,000,000,000,000,000,000,000,000,000",Partly cloudy throughout the day with rain in the morning and afternoon.
Heathrow Airport,15/10/2000,15.5,8.5,12.2,15.5,7.4,12.1,8.8,80.06,0,,8.33,,,,,14.6,230,1013.1,92.5,28.2,,,0,,2000-10-15T07:26:02,2000-10-15T18:08:06,0.53,Overcast,3,cloudy,"3,660,099,999,036,720,000,000,000,000,000,000,000,000,000",Cloudy skies throughout the day.
Heathrow Airport,16/10/2000,13.5,8.4,11.6,13.5,6.2,11.4,9.5,87.19,4.79,,12.5,,,,,20.8,265,1006.4,85.6,16.2,,,0,,2000-10-16T07:27:45,2000-10-16T18:05:58,0.56,Rain,1,rain,"366,009,999,903,672,000,000,000,000,000,000,000,000,000,000,000,000,000",Partly cloudy throughout the day with rain.
Heathrow Airport,17/10/2000,14.6,5.4,10.2,14.6,3.8,9.7,5.7,75.5,0.7,,8.33,,,,,22.3,214.6,1020.6,42.4,36.5,,,0,,2000-10-17T07:29:27,2000-10-17T18:03:51,0.6,Rain,1,rain,"366,009,999,903,672,000,000,000,000,000,000,000,000,000,000,000,000,000",Becoming cloudy in the afternoon with early morning rain.
Heathrow Airport,18/10/2000,16.1,11.8,13.7,16.1,11.8,13.7,11.4,86.21,5.21,,12.5,,,,,24.1,190.8,1014.9,95,16.2,,,0,,2000-10-18T07:31:10,2000-10-18T18:01:45,0.65,Rain,1,rain,"366,009,999,903,672,000,000,000,000,000,000,000,000,000,000,000,000,000",Cloudy skies throughout the day with a chance of rain throughout the day.
Heathrow Airport,19/10/2000,14.7,7.8,11.3,14.7,6.5,11,7.7,80.29,0.11,,12.5,,,,,18.3,213.7,1017.6,32.7,24.1,,,0,,2000-10-19T07:32:53,2000-10-19T17:59:40,0.71,Rain,1,rain,"366,009,999,903,672,000,000,000,000,000,000,000,000,000,000,000,000,000",Partly cloudy throughout the day with early morning rain.
Heathrow Airport,20/10/2000,14.1,7.3,10.8,14.1,6,10.5,9.6,92.72,2,,8.33,,,,,14.7,124.6,1013.8,74.4,15.2,,,0,,2000-10-20T07:34:37,2000-10-20T17:57:36,0.76,Rain,1,rain,"366,009,999,903,672,000,000,000,000,000,000,000,000,000,000,000,000,000",Partly cloudy throughout the day with late afternoon rain.
Heathrow Airport,21/10/2000,11.5,10.3,10.9,11.5,10.3,10.8,9.7,92.27,16.51,,16.67,,,,,16.5,289.2,1016.5,98.7,10.8,,,0,,2000-10-21T07:36:20,2000-10-21T17:55:33,0.82,Rain,1,rain,"366,009,999,903,672,000,000,000,000,000,000,000,000,000,000,000,000,000",Cloudy skies throughout the day with rain.
Heathrow Airport,22/10/2000,13.6,9.8,11.3,13.6,9.5,11.3,10.1,92.02,0.8,,8.33,,,,,11.1,127.9,1022.7,75.5,7.7,,,0,,2000-10-22T07:38:04,2000-10-22T17:53:32,0.87,Rain,1,rain,"3,660,099,999,036,720,000,000,000,000,000,000,000,000,000",Partly cloudy throughout the day with rain in the morning and afternoon.
Heathrow Airport,23/10/2000,15.5,9.8,13.2,15.5,8.6,13.1,10.4,83.6,0.8,,16.67,,,,,24.2,194.2,1015.4,63.5,21.2,,,0,,2000-10-23T07:39:49,2000-10-23T17:51:31,0.92,Rain,1,rain,"366,009,999,903,672,000,000,000,000,000,000,000,000,000,000,000,000,000",Partly cloudy throughout the day with rain in the morning and afternoon.
Heathrow Airport,24/10/2000,12.8,9.9,11.5,12.8,8,11.4,8,79.25,1.39,,16.67,,,,,25.9,214.2,1017.1,87.5,31.2,,,0,,2000-10-24T07:41:33,2000-10-24T17:49:31,0.96,Rain,1,rain,"366,009,999,903,672,000,000,000,000,000,000,000,000,000,000,000,000,000",Partly cloudy throughout the day with rain.
Heathrow Airport,25/10/2000,15.1,10.6,12.8,15.1,10.6,12.8,7.8,72.29,0.8,,12.5,,,,,31.4,227.9,1007.4,88.8,29.2,,,0,,2000-10-25T07:43:18,2000-10-25T17:47:33,0.99,Rain,1,rain,"366,009,999,903,672,000,000,000,000,000,000,000,000,000,000,000,000,000",Partly cloudy throughout the day with rain.
Heathrow Airport,26/10/2000,14.1,7.3,10.3,14.1,4.7,9.4,5.9,75.42,0.69,,4.17,,,,,24.2,237.1,1014.1,51,33,,,0,,2000-10-26T07:45:03,2000-10-26T17:45:36,1,Rain,1,rain,"366,009,999,903,672,000,000,000,000,000,000,000,000,000,000,000,000,000",Becoming cloudy in the afternoon with early morning rain.
Heathrow Airport,27/10/2000,15.3,9.6,12.8,15.3,7.8,12.5,10.9,88.12,0.83,,12.5,,,,,31.3,211.7,1011.9,97.1,18,,,0,,2000-10-27T07:46:48,2000-10-27T17:43:40,0,Rain,1,rain,"366,009,999,903,672,000,000,000,000,000,000,000,000,000,000,000,000,000",Cloudy skies throughout the day with a chance of rain throughout the day.
Heathrow Airport,28/10/2000,15.8,9.6,13.2,15.8,6.6,13.1,11,86.74,15.73,,16.67,,,,,42.4,185.4,1004.2,86.6,16.6,,,0,,2000-10-28T07:48:34,2000-10-28T17:41:45,0.01,Rain,1,rain,"366,009,999,903,672,000,000,000,000,000,000,000,000,000,000,000,000,000",Partly cloudy throughout the day with rain.
Heathrow Airport,29/10/2000,13.1,7.8,10.4,13.1,4.4,9,5.7,73.83,1.42,,16,,,,,48.2,215,999.3,65.3,28.3,,,0,,2000-10-29T06:50:19,2000-10-29T16:39:52,0.02,Rain,1,rain,"366,009,999,903,672,000,000,000,000,000,000,000,000,000,000,000,000,000",Partly cloudy throughout the day with rain.
Heathrow Airport,30/10/2000,13.3,6.6,10.6,13.3,2.4,9,6.4,75.83,34.02,,12.5,,,,,55.4,215.4,981.3,69.7,24.3,,,0,,2000-10-30T06:52:05,2000-10-30T16:38:01,0.05,Rain,1,rain,"366,009,999,903,672,000,000,000,000,000,000,000,000,000,000,000,000,000",Partly cloudy throughout the day with a chance of rain throughout the day.
Heathrow Airport,31/10/2000,13.1,8.8,10.1,13.1,5.9,8.5,5.7,74.77,1.4,,16.67,,,,,29.5,227.9,989.7,71.8,35.2,,,0,,2000-10-31T06:53:51,2000-10-31T16:36:11,0.08,Rain,1,rain,"366,009,999,903,672,000,000,000,000,000,000,000,000,000,000,000,000,000",Partly cloudy throughout the day with a chance of rain throughout the day.
Heathrow Airport,01/11/2000,10.8,7.1,9,10.8,3.6,6.8,3.5,68.61,1.4,,12.5,,,,,27.8,217.9,994.4,56.9,33.7,,,0,,2000-11-01T06:55:37,2000-11-01T16:34:22,0.12,Rain,1,rain,"366,009,999,903,672,000,000,000,000,000,000,000,000,000,000,000,000,000",Partly cloudy throughout the day with rain in the morning and afternoon.
Heathrow Airport,02/11/2000,10.3,4.4,7.9,10.3,2.4,5.3,4.1,77.81,10.63,,8.33,,,,,31.3,177.9,987.5,57.3,25,,,0,,2000-11-02T06:57:23,2000-11-02T16:32:35,0.17,Rain,1,rain,"366,009,999,903,672,000,000,000,000,000,000,000,000,000,000,000,000,000",Partly cloudy throughout the day with rain in the morning and afternoon.
Heathrow Airport,03/11/2000,10.8,5,7.6,10.8,3,5.9,3.2,74.4,0.69,,4.17,,,,,22.3,232.1,993.5,36.6,34.6,,,0,,2000-11-03T06:59:09,2000-11-03T16:30:49,0.21,Rain,1,rain,"366,009,999,903,672,000,000,000,000,000,000,000,000,000,000,000,000,000",Partly cloudy throughout the day with afternoon rain.
Heathrow Airport,04/11/2000,11.3,3.1,6.7,11.3,1.5,5.9,4,83.22,0.1,,4.17,,,,,14.7,220,1006.3,34.4,23.2,,,0,,2000-11-04T07:00:55,2000-11-04T16:29:06,0.26,Rain,1,rain,"366,009,999,903,672,000,000,000,000,000,000,000,000,000,000,000,000,000",Partly cloudy throughout the day with morning rain.
Heathrow Airport,05/11/2000,10.8,2.8,7.4,10.8,2.8,5.7,5.6,88.87,1.41,,12.5,,,,,38.8,126.7,997.6,90.4,10.3,,,0,,2000-11-05T07:02:41,2000-11-05T16:27:24,0.31,Rain,1,rain,"366,009,999,903,672,000,000,000,000,000,000,000,000,000,000,000,000,000",Cloudy skies throughout the day with rain.
Heathrow Airport,06/11/2000,10.8,7.1,9.2,10.8,4.9,7.9,8.1,92.49,26.22,,16.67,,,,,25.9,90.9,971.5,89.6,12.9,,,0,,2000-11-06T07:04:27,2000-11-06T16:25:43,0.35,Rain,1,rain,"366,009,999,903,672,000,000,000,000,000,000,000,000,000,000,000,000,000",Partly cloudy throughout the day with a chance of rain throughout the day.
Heathrow Airport,07/11/2000,10.5,7.5,8.6,10.5,5.4,7.3,6.4,86.18,2.52,,17.39,,,,,16.6,260.4,976.6,83.5,17.4,,,0,,2000-11-07T07:06:13,2000-11-07T16:24:05,0.4,Rain,1,rain,"366,009,999,903,672,000,000,000,000,000,000,000,000,000,000,000,000,000",Partly cloudy throughout the day with rain.
Heathrow Airport,08/11/2000,9,6.5,7.8,6.8,4.3,5.5,4.8,81.55,0.51,,8.7,,,,,18.4,257.8,988.7,78.8,27.5,,,0,,2000-11-08T07:07:59,2000-11-08T16:22:28,0.43,Rain,1,rain,"366,009,999,903,672,000,000,000,000,000,000,000,000,000,000,000,000,000",Partly cloudy throughout the day with morning rain.
Heathrow Airport,09/11/2000,10.1,6.1,7.8,10.1,3.5,5.4,4.4,79.09,1.4,,12.5,,,1,,18.4,245,1002.9,83.4,31.9,,,0,,2000-11-09T07:09:44,2000-11-09T16:20:54,0.47,Rain,1,rain,"366,009,999,903,672,000,000,000,000,000,000,000,000,000,000,000,000,000",Partly cloudy throughout the day with rain in the morning and afternoon.
Heathrow Airport,10/11/2000,9.8,3.8,7.3,7.6,1.8,5.1,3.3,76.75,0,,4.17,,,,,16.6,220.8,1013.7,68.4,33.7,,,0,,2000-11-10T07:11:29,2000-11-10T16:19:21,0.49,Partially cloudy,2,partly-cloudy-day,"366,009,999,903,672,000,000,000,000,000,000,000,000,000,000,000,000,000",Partly cloudy throughout the day.
Heathrow Airport,11/11/2000,12.6,9.3,10.9,12.6,6,10.4,8.8,87.32,4.21,,16.67,,,,,33.5,196.7,1006.4,98.6,14.1,,,0,,2000-11-11T07:13:14,2000-11-11T16:17:51,0.5,Rain,1,rain,"366,009,999,903,672,000,000,000,000,000,000,000,000,000,000,000,000,000",Cloudy skies throughout the day with rain.
Heathrow Airport,12/11/2000,10.6,5.5,8.6,10.6,3.1,6.7,4.9,78,5.1,,8.33,,,,,18.3,202.1,995.6,48.5,26.4,,,0,,2000-11-12T07:14:59,2000-11-12T16:16:22,0.5,Rain,1,rain,"366,009,999,903,672,000,000,000,000,000,000,000,000,000,000,000,000,000",Partly cloudy throughout the day with early morning rain.
Heathrow Airport,13/11/2000,10.5,2.8,5.9,10.5,1.5,5.2,3,82.59,0.04,,13.04,,,,,11.2,212,997.4,13.8,26,,,0,,2000-11-13T07:16:43,2000-11-13T16:14:56,0.52,Rain,1,rain,"366,009,999,903,672,000,000,000,000,000,000,000,000,000,000,000,000,000",Clear conditions throughout the day with afternoon rain.
Heathrow Airport,14/11/2000,8.5,1.1,4.4,8.5,1.1,4.4,2.8,90.1,0.1,,12.5,,,,,3.7,193.9,1002.6,53,6.3,,,0,,2000-11-14T07:18:26,2000-11-14T16:13:32,0.54,Rain,1,rain,"366,009,999,903,672,000,000,000,000,000,000,000,000,000,000,000,000,000",Partly cloudy throughout the day with morning rain.
Heathrow Airport,15/11/2000,8.1,-1.2,3.3,6.1,-1.2,2.4,2.4,93.9,0,,8.33,,,,,13,216.1,1007.7,73.8,3.6,,,0,,2000-11-15T07:20:09,2000-11-15T16:12:10,0.59,Partially cloudy,2,partly-cloudy-day,"366,009,999,903,672,000,000,000,000,000,000,000,000,000,000,000,000,000",Partly cloudy throughout the day.
Heathrow Airport,16/11/2000,10.1,3.1,8,10.1,1.7,5.8,5.3,83.68,5.01,,12.5,,,,,24.1,220,1002.9,56,26.2,,,0,,2000-11-16T07:21:52,2000-11-16T16:10:50,0.64,Rain,1,rain,"366,009,999,903,672,000,000,000,000,000,000,000,000,000,000,000,000,000",Partly cloudy throughout the day with a chance of rain throughout the day.
Heathrow Airport,17/11/2000,9.3,0.7,4.9,7.4,-1.2,3.1,2.1,83.29,0.81,,16.67,,,,,18.4,242.9,1011,55.6,23.1,,,0,,2000-11-17T07:23:33,2000-11-17T16:09:33,0.69,Rain,1,rain,"366,009,999,903,672,000,000,000,000,000,000,000,000,000,000,000,000,000",Partly cloudy throughout the day with rain.
Heathrow Airport,18/11/2000,11.8,2.7,8.2,11.8,0.5,7.3,6.6,89.84,0.7,,12.5,,,,,20.5,211.7,1006.4,89.9,16.5,,,0,,2000-11-18T07:25:14,2000-11-18T16:08:19,0.75,Rain,1,rain,"366,009,999,903,672,000,000,000,000,000,000,000,000,000,000,000,000,000",Partly cloudy throughout the day with afternoon rain.
Heathrow Airport,19/11/2000,11,3.7,8.3,11,0.8,6.7,6.2,86.96,1.73,,12.5,,,,,22.3,241.3,995.3,85,24.5,,,0,,2000-11-19T07:26:55,2000-11-19T16:07:06,0.8,Rain,1,rain,"366,009,999,903,672,000,000,000,000,000,000,000,000,000,000,000,000,000",Partly cloudy throughout the day with rain.
Heathrow Airport,20/11/2000,6.3,2.7,4.8,6.3,0.5,3.8,2.8,86.91,0.01,,8.33,,,,,12.9,195,995.7,66.8,22.5,,,0,,2000-11-20T07:28:34,2000-11-20T16:05:57,0.86,Rain,1,rain,"366,009,999,903,672,000,000,000,000,000,000,000,000,000,000,000,000,000",Partly cloudy throughout the day with afternoon rain.
Heathrow Airport,21/11/2000,10,4.2,6,10,2.3,4.2,4.4,89.42,4.8,,16.67,,,,,29.5,175.8,993.6,86.8,11.3,,,0,,2000-11-21T07:30:12,2000-11-21T16:04:50,0.9,Rain,1,rain,"366,009,999,903,672,000,000,000,000,000,000,000,000,000,000,000,000,000",Partly cloudy throughout the day with rain.
Heathrow Airport,22/11/2000,10.8,7.1,8.8,10.8,3.4,6.1,4.2,72.73,1.1,,8.33,,,,,35.3,201.3,994.2,42,28.9,,,0,,2000-11-22T07:31:50,2000-11-22T16:03:45,0.94,Rain,1,rain,"366,009,999,903,672,000,000,000,000,000,000,000,000,000,000,000,000,000",Partly cloudy throughout the day with rain.
Heathrow Airport,23/11/2000,8.3,3.7,6.9,8.3,1.7,5.8,5.8,92.85,4.1,,12.5,,,,,13,194,998.2,78,10.8,,,0,,2000-11-23T07:33:26,2000-11-23T16:02:44,0.97,Rain,1,rain,"366,009,999,903,672,000,000,000,000,000,000,000,000,000,000,000,000,000",Partly cloudy throughout the day with afternoon rain.
Heathrow Airport,24/11/2000,9.3,3.4,6.7,7.7,1.3,4.7,4.9,88.64,1.19,,12.5,,,,,18.3,197.1,1004.1,64.4,16.4,,,0,,2000-11-24T07:35:01,2000-11-24T16:01:45,0.99,Rain,1,rain,"366,009,999,903,672,000,000,000,000,000,000,000,000,000,000,000,000,000",Partly cloudy throughout the day with rain.
Heathrow Airport,25/11/2000,11.3,8.6,10,11.3,5.3,8.8,7.6,85.67,8.1,,13.04,,,,,37,180.9,994.9,72.2,16.6,,,0,,2000-11-25T07:36:34,2000-11-25T16:00:48,1,Rain,1,rain,"366,009,999,903,672,000,000,000,000,000,000,000,000,000,000,000,000,000",Partly cloudy throughout the day with rain.
Heathrow Airport,26/11/2000,10.2,5.8,8.4,10.2,2.7,5.5,3.5,71.49,1.39,,12.5,,,,,38.8,226.3,995.5,59.3,33.7,,,0,,2000-11-26T07:38:07,2000-11-26T15:59:55,0,Rain,1,rain,"366,009,999,903,672,000,000,000,000,000,000,000,000,000,000,000,000,000",Partly cloudy throughout the day with rain.
Heathrow Airport,27/11/2000,12.8,4.5,8.6,12.8,2.3,7.7,6.8,88.38,0.7,,8.33,,,,,20.5,171.7,1008.2,74.4,16.8,,,0,,2000-11-27T07:39:38,2000-11-27T15:59:05,0.01,Rain,1,rain,"366,009,999,903,672,000,000,000,000,000,000,000,000,000,000,000,000,000",Partly cloudy throughout the day with afternoon rain.
Heathrow Airport,28/11/2000,15.4,13.1,14.1,15.4,13.1,14,11,81.94,9.62,,8.33,,,,,31.2,194.2,1006.2,92.1,20.2,,,0,,2000-11-28T07:41:07,2000-11-28T15:58:17,0.03,Rain,1,rain,"366,009,999,903,672,000,000,000,000,000,000,000,000,000,000,000,000,000",Cloudy skies throughout the day with rain.
Heathrow Airport,29/11/2000,14.1,10,12.3,14.1,10,12.3,9.4,82.6,2.72,,12.5,,,,,25.9,179.2,1002.4,77.3,20.1,,,0,,2000-11-29T07:42:35,2000-11-29T15:57:33,0.06,Rain,1,rain,"366,009,999,903,672,000,000,000,000,000,000,000,000,000,000,000,000,000",Partly cloudy throughout the day with rain.
Heathrow Airport,30/11/2000,12,6.6,9.8,12,5.8,9.1,7.6,86.92,0.1,,13.04,,,,,25.9,161.3,1009.1,66.7,16.5,,,0,,2000-11-30T07:44:01,2000-11-30T15:56:52,0.09,Rain,1,rain,"366,009,999,903,672,000,000,000,000,000,000,000,000,000,000,000,000,000",Partly cloudy throughout the day with early morning rain.
Heathrow Airport,01/12/2000,13.3,9.8,11.8,13.3,8,11.7,10,88.44,7.12,,16.67,,,,,29.5,176.3,1001.9,88.9,12.6,,,0,,2000-12-01T07:45:25,2000-12-01T15:56:13,0.13,Rain,1,rain,"366,009,999,903,672,000,000,000,000,000,000,000,000,000,000,000,000,000",Partly cloudy throughout the day with a chance of rain throughout the day.
Heathrow Airport,02/12/2000,12.6,7.1,10.3,12.6,7,9.9,7.5,83,0.5,,4.17,,,,,24,182.9,1008.7,51,16.8,,,0,,2000-12-02T07:46:47,2000-12-02T15:55:38,0.17,Rain,1,rain,"366,009,999,903,672,000,000,000,000,000,000,000,000,000,000,000,000,000",Partly cloudy throughout the day with early morning rain.
Heathrow Airport,03/12/2000,11.1,3.9,8.1,11.1,3.6,7.3,5.8,86.26,0.1,,12.5,,,,,24.1,193.8,1013,47.2,18.9,,,0,,2000-12-03T07:48:08,2000-12-03T15:55:06,0.22,Rain,1,rain,"366,009,999,903,672,000,000,000,000,000,000,000,000,000,000,000,000,000",Becoming cloudy in the afternoon with morning rain.
